headlines,terms,dates
gore selects lieberman as running mate,gore,2000-08-07
mini-bounce leaves bush in danger,bush,2000-08-07
gore goes for safety,gore,2000-08-08
gore allies himself to integrity,gore,2000-08-08
gore ditches clinton legacy,gore,2000-08-08
one big leap for us jews,bush,2000-08-08
gore's ratings surge on liebermania,gore,2000-08-09
gore's man talks of miracle,gore,2000-08-09
bush to decide on execution today of man with iq of 70,bush,2000-08-09
clinton flies in as 11 states go up in flames,gore,2000-08-09
bush allows execution for murderer with low iq,bush,2000-08-10
us furious at venezuelan leader's visit to saddam,bush,2000-08-10
us election costs,bush,2000-08-11
missile warning to us,bush,2000-08-11
clintons steal gore's show,gore,2000-08-11
gore caught in row between cash cows,gore,2000-08-12
how bouncing bush has cornered gore,bush,2000-08-13
how bouncing bush has cornered gore,gore,2000-08-13
time for gore to become human,gore,2000-08-13
gore struggles to emerge from clinton shadow,gore,2000-08-14
"gore and bush might not be a class act, but the us is",gore,2000-08-14
"gore and bush might not be a class act, but the us is",bush,2000-08-14
"gore and bush might not be a class act, but the us is",bush,2000-08-14
gore identifies new rogue state,gore,2000-08-15
gore gets ready to fight dirty,gore,2000-08-16
bush breaks $100m barrier,bush,2000-08-16
lieberman could be gore's ticket to the white house,gore,2000-08-17
gore goes back to basics,gore,2000-08-17
a vote for nader is a vote for bush,bush,2000-08-17
gore makes the grade on his big night,gore,2000-08-18
family and stars warm up gore crowd,gore,2000-08-18
gore gives america a stark choice,gore,2000-08-19
the electric chair gore should fear,gore,2000-08-19
east timor massacres may go unpunished,gore,2000-08-19
gore bets on substance,gore,2000-08-19
latest poll shows bush trailing,bush,2000-08-19
gore wins over the doubters,gore,2000-08-19
relief for gore at convention boost,gore,2000-08-20
revealed: plot to kill lloyd george,george,2000-08-24
canada and us fend off mexican call for an open border,bush,2000-08-26
us wades into colombia's dirty war,bush,2000-08-29
chelsea clinton 'hopes to go to oxford',gore,2000-08-29
bush brings out the attack ads to halt gore advance as gore draws level,bush,2000-09-01
bush brings out the attack ads to halt gore advance as gore draws level,gore,2000-09-01
bush brings out the attack ads to halt gore advance as gore draws level,gore,2000-09-01
"it's president gore, agree statisticians",gore,2000-09-01
support for gore surges as final countdown begins,gore,2000-09-04
strong sense of purpose hides george jr's lack of policy,george,2000-09-04
bush gets rattled,bush,2000-09-04
gore: his vision for america,gore,2000-09-04
bush makes major league gaffe,bush,2000-09-05
bush proposals for tv debates would limit audiences,bush,2000-09-05
bush signs deal with striking actors,bush,2000-09-07
gore aims to deliver knockout punch,gore,2000-09-07
jolted bush plays the underdog,bush,2000-09-08
gore woos women voters,gore,2000-09-10
bush campaign gaffe forces ad withdrawal,bush,2000-09-12
dirty rats leave gore a subliminal message,gore,2000-09-13
tokyo defiant after us threat on whales,bush,2000-09-15
gore wins battle for tv debates,gore,2000-09-16
poor old george,george,2000-09-18
flagging bush sets sights on middle class vote,bush,2000-09-19
flagging bush sets sights on middle class vote,bush,2000-09-19
us troops abused civilians in kosovo,bush,2000-09-19
bush turns to drink in ordeal by oprah,bush,2000-09-20
vote-hunting bush chases the florida key,bush,2000-09-22
gore joins oil protests,gore,2000-09-22
bush puts star wars ll on hold,bush,2000-09-22
bush and gore in trial by chat show,bush,2000-09-24
bush and gore in trial by chat show,gore,2000-09-24
it's good to talk for bush,bush,2000-09-26
gore turns to health as bush comes back,gore,2000-09-26
gore turns to health as bush comes back,bush,2000-09-26
freeserve signs up with bush internet and onnet,bush,2000-09-28
gore's chance of fairytale ending lies in fact not fiction,gore,2000-09-28
outrage at diy abortion pill blasts us election wide open,bush,2000-10-01
us and uk divided on e-political lines,bush,2000-10-02
gore and bush braced for tv clash,gore,2000-10-03
gore and bush braced for tv clash,bush,2000-10-03
new us battlefield for the rights of the unborn child,bush,2000-10-03
'al gore and george w bush are more deadlocked than ever',gore,2000-10-04
'al gore and george w bush are more deadlocked than ever',george,2000-10-04
'al gore and george w bush are more deadlocked than ever',bush,2000-10-04
gore-bush debate could decide how the us votes,bush,2000-10-04
gore-bush debate could decide how the us votes,gore,2000-10-04
gore-bush debate could decide how the us votes,bush,2000-10-04
"gore takes round one, but not by a knockout",gore,2000-10-05
dark angel and west wing lead out us season,bush,2000-10-06
spotlight on gore the 'fabulist',gore,2000-10-06
george v meddled in war decisions,george,2000-10-08
what happens when hague and bush lose?,bush,2000-10-09
how big money buys big votes in us race,bush,2000-10-10
bush retakes lead as voters question gore's character,bush,2000-10-12
bush retakes lead as voters question gore's character,gore,2000-10-12
bush pulls ahead after tarring gore as lover of big government,bush,2000-10-13
bush pulls ahead after tarring gore as lover of big government,gore,2000-10-13
miller gives lukewarm backing to gore,gore,2000-10-13
how rude! george downsizes jar jar,george,2000-10-13
gore and bush tiptoe through nice-guy debate,gore,2000-10-13
gore and bush tiptoe through nice-guy debate,bush,2000-10-13
how gore lost his head,gore,2000-10-16
"missing boy, 3, found under bush",bush,2000-10-16
bush's ideal day: 9 to 5 and a two-hour lunch,bush,2000-10-17
florida's condo commandos take aim at bush,bush,2000-10-17
the gore-bush debates should be a lesson to us all,bush,2000-10-19
the gore-bush debates should be a lesson to us all,gore,2000-10-19
the gore-bush debates should be a lesson to us all,bush,2000-10-19
"how bush is turning into reagan, and why americans love it",bush,2000-10-19
al gore fights for his life,gore,2000-10-19
sir george young,george,2000-10-20
i lost my heart in... the  australian bush,bush,2000-10-21
cautious gore at pains to muffle his master's voice,gore,2000-10-21
faustian pact that could scupper gore,gore,2000-10-22
gore told to unleash clinton,gore,2000-10-22
bush camp works hard to pull out california plum,bush,2000-10-23
by george,george,2000-10-24
george warns against devaluing pound,george,2000-10-24
this unbrave new world would be bad news for us,bush,2000-10-24
beleaguered gore faces battles on three fronts,gore,2000-10-24
14 days to go,gore,2000-10-24
13 days to go,gore,2000-10-25
no hedging - markets bet it's bush,bush,2000-10-25
jobs go as george defends pound,gore,2000-10-25
jobs go as george defends pound,george,2000-10-25
eyes left as gore tries to limit green appeal,gore,2000-10-25
gore has to battle for the home ground,gore,2000-10-26
12 days to go,gore,2000-10-26
laid-back bush leaves it to tv ads,bush,2000-10-26
gore finally acknowledges the clinton factor,gore,2000-10-27
experts finger bush as the big spender,bush,2000-10-27
11 days to go,gore,2000-10-27
the us and europe haven't managed our world too well,bush,2000-10-27
gore for president,gore,2000-10-28
gore: your country needs you more than it thinks,gore,2000-10-28
bush sweeps into huge lead,bush,2000-10-28
10 days to go,gore,2000-10-28
gore and clinton stay just in front,gore,2000-10-30
prince of satire: why jon stewart's daily show is setting the agenda in the us election,bush,2000-10-30
nader v gore,gore,2000-10-30
gore wary as clinton rallies black vote,gore,2000-10-30
eight days to go,gore,2000-10-30
students go by the board,gore,2000-10-31
press review: texas plumps for bush,bush,2000-10-31
7 days to go,gore,2000-10-31
bush turns fire on california,bush,2000-10-31
gore will keep the good times rolling,gore,2000-10-31
bush will restore honour and integrity,bush,2000-10-31
six days to go,gore,2000-11-01
heston shoots down al gore,gore,2000-11-01
would he do to us what he did to texas?,bush,2000-11-01
"george armstrong, wing wizard, dies at 56",george,2000-11-02
nader defies gore to fight to the finish,gore,2000-11-02
george armstrong,george,2000-11-02
5 days to go,gore,2000-11-02
it mustn't be bush or gore,bush,2000-11-02
it mustn't be bush or gore,gore,2000-11-02
the net election: gore misses a trick,gore,2000-11-03
bush admits to drink driving charge,bush,2000-11-03
nader threatens to produce gore's nadir,gore,2000-11-03
bush springs to history's attention,bush,2000-11-03
bush drink-drive charge sends his team into crisis mode,bush,2000-11-03
clinton stretches out to help gore,gore,2000-11-04
bush hit by drink-driving revelation,bush,2000-11-04
3 days to go,gore,2000-11-04
why it needs to be gore,gore,2000-11-04
letter: george armstrong,george,2000-11-04
"bush, in his own words",bush,2000-11-04
george still spurred on,george,2000-11-05
gore gains from bush drink-drive revelation,gore,2000-11-05
gore gains from bush drink-drive revelation,bush,2000-11-05
us presidential race too close to call,bush,2000-11-06
gore and bush charge for the line,gore,2000-11-06
gore and bush charge for the line,bush,2000-11-06
one day to go,gore,2000-11-06
gore's last plea to the great undecided,gore,2000-11-06
"it's politainment, with george 'n' al",george,2000-11-06
presidential bush goes on defensive,bush,2000-11-06
republican website hacked as us voters go to polls,bush,2000-11-07
republican website hacked as us voters go to polls,gore,2000-11-07
gore closes the gap,gore,2000-11-07
out to gore the bullish bush,gore,2000-11-07
out to gore the bullish bush,bush,2000-11-07
key poll puts gore ahead,gore,2000-11-07
the brains behind bush,bush,2000-11-07
bush struts across his rival's home patch,bush,2000-11-07
on hold for brown and bush,bush,2000-11-07
