headlines,terms,dates,scores
eriksson should steel himself even when england win,green,2004-08-02,2
terror warning pushes up oil prices,warming,2004-08-02,2
deal on global trade holds out hope for poor nations,deal,2004-08-02,1
deal on global trade holds out hope for poor nations,global,2004-08-02,1
green light for degradable bread bags,green,2004-08-02,0
ft strikes australian content deal,deal,2004-08-02,2
nottingham threatened with global lecturer boycott,global,2004-08-03,2
a touch of the body beautiful,fuel,2004-08-04,3
green goddesses on fire strike standby,green,2004-08-04,2
£3bn airbus buy signals virgin's challenge to ba,global,2004-08-05,2
father on bail over son's death,global,2004-08-05,2
global insults,global,2004-08-05,1
rivals team for global tv ratings venture,global,2004-08-05,2
murder charge father out on bail,global,2004-08-05,2
talktime: al franken,global,2004-08-05,2
talktime: al franken,deal,2004-08-05,2
talktime: al franken,coal,2004-08-05,2
oil and us jitters prompt fears of global slowdown,global,2004-08-07,2
caring for carers,warming,2004-08-07,2
kkr joins battle for grey global,global,2004-08-07,2
jobs data hits bush election prospects,job,2004-08-07,2
"without a war on poverty, we will never defeat terror",warming,2004-08-08,1
the bashful over-achiever,fuel,2004-08-08,2
warning over five-in-one vaccine,warming,2004-08-09,2
'be truthful - and funny will come',fuel,2004-08-09,3
hollywood fantasy? tidal wave disaster is just waiting to happen,deal,2004-08-10,2
"honours, degree",green,2004-08-10,2
vaccination for hay fever now possible,fossil,2004-08-11,2
coral takes global warming heat,global,2004-08-11,2
coral takes global warming heat,warming,2004-08-11,2
"uk jobless total rises by 27,000",job,2004-08-11,1
builder revealed as dream job for kids,job,2004-08-12,2
green light for stem cell clones,green,2004-08-12,2
blunkett to extend long arm of the law,warming,2004-08-12,2
"a missed test, a road crash: games open amid scandal and rumour",deal,2004-08-14,1
increase in ministers and officials barred from taking advantage of former jobs,job,2004-08-15,2
greeks expel drugs scandal pair,deal,2004-08-15,2
securing a global reach,global,2004-08-17,2
my big fat green wedding,green,2004-08-17,2
no flood warning issued for boscastle,warming,2004-08-17,1
model schools for a niche market,deal,2004-08-17,2
big pong as china's rejects extend global dominance,global,2004-08-18,2
boscastle's warning,warming,2004-08-18,2
spielberg's war could be most costly film ever,warming,2004-08-18,2
tressell v thoreau,environment,2004-08-18,2
gates joins uk in global vaccination project,global,2004-08-19,2
us press hit by new circulation figures scandal,deal,2004-08-20,2
a delicate degree of separation,green,2004-08-21,3
wpp's sorrell argues the case for grey global deal,global,2004-08-21,2
wpp's sorrell argues the case for grey global deal,deal,2004-08-21,2
worthy and wonderful ways to fill the gap ...,fuel,2004-08-22,3
do be careful near the water,fuel,2004-08-22,2
wpp may mount £500m rights to buy grey global,global,2004-08-22,2
give up the day job,job,2004-08-22,2
ad men turning us into a coffee nation,environment,2004-08-22,2
dr martens kicks off global ad campaign,global,2004-08-23,2
digital revolution threatens ilford jobs,job,2004-08-24,2
global warming goes off deep end,global,2004-08-25,2
global warming goes off deep end,warming,2004-08-25,2
busy hemscott in £7.3m share deal,deal,2004-08-25,2
a degree in bullying and self-interest? no thanks,green,2004-08-25,2
salad oil may fuel hydrogen car of future,fuel,2004-08-26,2
vivendi tax deal stymies vodafone's plans for sfr,deal,2004-08-27,3
un tells north korea to protect its environment,environment,2004-08-28,2
"prisoner 'a': no charge, no trial, no conviction and no release date. welcome to britain's war on terror",warming,2004-08-29,1
ba heads to roll after delays chaos,global,2004-08-29,2
israel's kibbutzim swap socialist ideals for personal profit in struggle to survive,deal,2004-08-31,2
david dickinson; and ron jeremy,environment,2004-08-31,2
president admits war on terror cannot be won,warming,2004-08-31,1
green light in sight for physics pool,green,2004-08-31,2
high tide: news from a warming world by mark lynas,warming,2004-09-01,2
daring to dream,warming,2004-09-01,3
local government briefing: september 2 2004,coal,2004-09-02,2
green denies rumours of sainsbury's offer,green,2004-09-03,2
wpp to make £600m bid for grey global,global,2004-09-03,2
beslan's warnings to the west,warming,2004-09-06,2
green lights,green,2004-09-07,2
greenspan suffers fed-up feeling,green,2004-09-08,1
ideological outrider to the blairite project,coal,2004-09-08,2
johnson takes pensions job,job,2004-09-08,2
local government briefing: september 9 2004,coal,2004-09-09,2
genesis scientists hopeful of salvaging solar atoms,fuel,2004-09-10,2
amazon in running for m&s web deal,deal,2004-09-10,2
careful whispers,fuel,2004-09-10,2
brown fires warning over eurozone growth,warming,2004-09-10,2
"rise in gambling addiction is a safe bet, says gaming expert",warming,2004-09-10,2
film deal for hawaii five-o,deal,2004-09-10,2
hydrogen seen as car fuel of the future,fuel,2004-09-10,2
a war zone no more,warming,2004-09-11,2
green light,green,2004-09-11,2
so you think your job is bad ...,job,2004-09-11,1
devastation linked to global warming,global,2004-09-12,2
devastation linked to global warming,warming,2004-09-12,2
the war for minds... but not hearts,warming,2004-09-12,2
ma vie en rose,green,2004-09-12,2
ma vie en rose,environment,2004-09-12,2
wpp on brink of securing $1bn deal for grey global,deal,2004-09-12,2
wpp on brink of securing $1bn deal for grey global,global,2004-09-12,2
bush faces assault on war record,warming,2004-09-12,1
campaigners slam world bank 'sham' on environment,environment,2004-09-12,2
football radio rights deal 'open and fair',deal,2004-09-13,2
full text: michael howard on the environment,environment,2004-09-13,2
sorrell fuels speculation on havas move,fuel,2004-09-13,2
sorrell snatches grey global prize,global,2004-09-13,2
mcdonald's on the ball in pr battle,global,2004-09-13,1
lula continues to play a beautiful game for brazil,fuel,2004-09-13,3
'grey deal no threat to independents',deal,2004-09-14,1
price war will hurt no-frills airlines,warming,2004-09-14,1
coalition to fight poverty sees blair as its big hope,coal,2004-09-14,1
"global financial system is shock-proof, says imf",global,2004-09-15,2
blair's global warning,global,2004-09-15,2
blair's global warning,warming,2004-09-15,2
global demand drives corus's first profit,global,2004-09-16,1
are all these severe hurricanes due to global warming?,global,2004-09-16,1
are all these severe hurricanes due to global warming?,warming,2004-09-16,1
marks & spencer to 'end' beckham deal,deal,2004-09-16,2
"how communities keep in touch, or a needless blot on the environment?",environment,2004-09-17,2
'readers care and want to read about the environment',environment,2004-09-17,2
channel 4 signs 80m euro deal in scramble for digital capacity,deal,2004-09-17,2
virtually identical,coal,2004-09-17,2
blair: uk involved in new iraq war,warming,2004-09-19,2
"like it or not, the fossils aren't dead yet",fossil,2004-09-19,1
british company strikes first deal for oil prospecting in north korea,deal,2004-09-19,2
cable warns of 'inevitable' job cuts,job,2004-09-20,2
blair's missing the point on financing renewables: fossil volatility costs more,fossil,2004-09-20,2
the spoils of another war,warming,2004-09-21,2
storm warning,warming,2004-09-21,2
green dollars,green,2004-09-21,2
it could be a green spring,green,2004-09-22,2
job fears as deutsche culls chiefs,job,2004-09-22,2
global initiative aims to protect war zone journalists,global,2004-09-22,2
global initiative aims to protect war zone journalists,warming,2004-09-22,2
crime gangs fuel explosion in fly-tipping,fuel,2004-09-22,2
warning on flu pandemic,warming,2004-09-23,2
commission backs £5bn british energy deal,deal,2004-09-23,2
forest run short of cloughie green 'uns,green,2004-09-24,1
daily mail gatecrashes radio deal,deal,2004-09-25,2
cadbury's wet weather warning,warming,2004-09-25,2
brown to bail out world's poorest,global,2004-09-25,2
sorrowful blair urges unity in face of iraq terror threat,fuel,2004-09-26,1
met office adds to global warming,global,2004-09-26,2
met office adds to global warming,warming,2004-09-26,2
the dilution of idealism,deal,2004-09-27,2
talksport cries foul over bbc rights deal,deal,2004-09-27,1
harmful levels of bacteria in thames increase calls for sewer renewal,fuel,2004-09-27,2
deliver a radical third term by building on our record,coal,2004-09-27,2
a hostile environment,environment,2004-09-27,2
cis to launch ethical debate,coal,2004-09-28,2
greenpeace steps up 'forest friendly' campaign,green,2004-09-28,1
oil price surge 'threatens global growth',global,2004-09-28,2
a bitter political pill,coal,2004-09-28,1
fuel for thought,fuel,2004-09-28,2
nigeria warning pushes oil past $50,warming,2004-09-29,2
thomson favourite to buy itv's moving picture co,coal,2004-09-29,3
union pickets hsbc over plan to move jobs abroad,job,2004-09-29,2
brown's global message,global,2004-09-29,2
chelsea's village team fit for global power,global,2004-09-30,2
iraq insurgency outpaces coalition attempts to restore peace,coal,2004-09-30,2
global breast cancer campaign aims to increase survival rates,global,2004-09-30,1
russian cabinet backs kyoto protocol,coal,2004-09-30,2
grey global loses mars account,global,2004-09-30,1
thomson to cut 800 jobs,job,2004-09-30,2
warning of big fall in house prices,warming,2004-09-30,2
how opera can stop war,warming,2004-10-01,2
ganging up on the global policeman,global,2004-10-01,2
axe threatens local lines in rail reshuffle,coal,2004-10-02,2
ba needs to lose weight,global,2004-10-02,2
al-qaida no 2 urges global fight as 25 die in mosque blast,global,2004-10-02,1
global growth leaves f&c floundering,global,2004-10-03,3
private medical school to turn graduates into doctors,coal,2004-10-04,2
ebay boss named most powerful businesswoman in us,fuel,2004-10-05,2
rise in uk call centre jobs,job,2004-10-05,2
kodak's digital focus costs 600 jobs,job,2004-10-05,2
m&s seals deal for per una clothing range,deal,2004-10-05,2
arsenal-emirates deal worth £100m,deal,2004-10-05,3
arsenal scores £3m from emirates stadium deal,deal,2004-10-05,2
green science,green,2004-10-05,2
"westland jobs in jeopardy, warns finmeccanica",job,2004-10-06,2
uk coal leader follows miners out of the door,coal,2004-10-06,1
unions angered by kodak plan to cut 600 jobs,job,2004-10-06,2
green is the new black,green,2004-10-07,2
key players in the parmalat scandal,deal,2004-10-07,1
music labels wage war on bootleggers,warming,2004-10-07,2
'global peril' of fire and fertilisers,global,2004-10-08,2
call for global jihad puts jittery afghanistan on high alert,global,2004-10-08,2
olympic gaming,warming,2004-10-08,2
'she thinks globally and acts locally',global,2004-10-08,2
the war against terror continues,warming,2004-10-09,2
green light,green,2004-10-09,2
the musical is the message,coal,2004-10-09,2
océ and global document solutions open digital newspaper print site in usa,global,2004-10-11,3
experts call for global crackdown on spam,global,2004-10-11,2
"royal & sun moves 1,100 jobs to india",job,2004-10-11,2
sainsbury's issues new profits warning,warming,2004-10-11,2
profit warnings raise fears,warming,2004-10-11,2
global crossing collapse,global,2004-10-12,1
"rsa exports 1,200 jobs to india",job,2004-10-12,2
celador airs 'football oscars' idea,deal,2004-10-13,2
gm europe to cut one in five jobs,job,2004-10-14,2
falling sales and price war hit dutch supermarket chain,warming,2004-10-14,1
a mature society condemns the war,warming,2004-10-14,3
"general motors to cut 12,000 european jobs",job,2004-10-14,2
local government briefing: october 14 2004,coal,2004-10-14,2
bt goes green,green,2004-10-14,2
the weekend warriors go to war,warming,2004-10-14,2
girls follow lads to war of weeklies,warming,2004-10-16,2
of god and greenbacks,green,2004-10-16,2
greenspan warns on oil price rise,green,2004-10-16,2
forum for global issues,global,2004-10-16,2
local hero,coal,2004-10-17,3
sellafield's £600m nuclear fuel factory faces closure before opening,fuel,2004-10-18,2
row over working hours delays eu jobs report,job,2004-10-18,2
guardian unlimited reveals september 04 global audience breakdown,global,2004-10-20,2
bob the builder fixes £18m us cable deal,deal,2004-10-20,2
global warming a bigger threat to poor,global,2004-10-20,1
global warming a bigger threat to poor,warming,2004-10-20,1
global quest for 'mr green' ends just down the road,global,2004-10-20,1
global quest for 'mr green' ends just down the road,green,2004-10-20,1
a global education,global,2004-10-20,2
citigroup purge costs britain's great survivor his job,job,2004-10-21,2
inquiry into greenfield homes plan,green,2004-10-21,2
hit fires chief who pulled off us deal,deal,2004-10-21,2
sri lanka go green before rescue,green,2004-10-21,2
britain to vote against global cloning ban,global,2004-10-22,2
union backs new nhs pay deal,deal,2004-10-22,2
kerry seeks a shot in the arm from gun lobby,warming,2004-10-22,2
green gains £460m in arcadia,green,2004-10-22,2
quince among men,environment,2004-10-23,2
dire warnings from global warming report,warming,2004-10-24,2
dire warnings from global warming report,global,2004-10-24,2
dire warnings from global warming report,warming,2004-10-24,2
£6m ad alert on global warming,global,2004-10-24,2
£6m ad alert on global warming,warming,2004-10-24,2
bma issues warning on chemical weapons,warming,2004-10-25,2
north easterners warming to assembly referendum,warming,2004-10-26,2
"manchester united v arsenal, part two",environment,2004-10-26,2
thousands raped in congo war,warming,2004-10-27,2
new iron curtain divides europe over bush,environment,2004-10-27,2
leighton quits three boardroom jobs,job,2004-10-27,2
local vote campaign kicks off,coal,2004-10-27,3
defence firms cash in on war on terror,warming,2004-10-28,2
stuck in a moment,environment,2004-10-28,2
where the cold war never died,warming,2004-10-28,1
global villagers,global,2004-10-29,2
apple q3 global market share falls to 1.8%,global,2004-10-30,2
it's definitely not the job for lots of people,job,2004-10-30,1
a music box city to warm the coldest heart,warming,2004-10-31,3
of dice and men,environment,2004-10-31,2
the coming war,warming,2004-10-31,2
greenback heading for a fall,green,2004-10-31,2
"uganda's war involves 20,000 children",warming,2004-11-01,2
queen backs fight on global warming,global,2004-11-01,2
queen backs fight on global warming,warming,2004-11-01,2
united get green light from brown,green,2004-11-02,2
companies' ethical reports branded ineffective,coal,2004-11-02,1
