headlines,terms,dates,scores
uk supports call for independent un human rights mission to yemen,gun,2016-09-26,2
uk supports call for independent un human rights mission to yemen,background,2016-09-26,2
lester holt: presidential debate moderator and proven fact-checker,check,2016-09-26,2
deal-making and dirty tricks: inside the race for un secretary general,gun,2016-09-26,1
deal-making and dirty tricks: inside the race for un secretary general,background,2016-09-26,1
labour conference: tom watson says capitalism is not the enemy - as it happened,automatic,2016-09-27,1
"tristan und isolde review – musical marvel in a grim, cynical cloak",background,2016-09-27,3
"mining in malawi brings forced evictions and ruined crops, report says",law,2016-09-27,1
annabel abbs: 'ulysses and finnegans wake followed me round the house like hungry dogs',background,2016-09-27,2
disabled air travellers warned of long distances from check-in to gate,check,2016-09-27,2
presidential debate fact-check: trump and clinton's claims reviewed,check,2016-09-27,1
"don dale detainee 'unfairly punished' with teargas for actions of others, court told",legislation,2016-09-27,2
trump camp struggles for post-debate footing,shooting,2016-09-28,2
concrete jungle: why brutalist architecture is back in style,background,2016-09-28,2
don’t tell dad i’m voting for hillary: young women on sexism in the family,shooting,2016-09-28,2
"rising number of guns being smuggled into uk, metropolitan police say",gun,2016-09-28,3
joe biden to appear on law & order: svu to talk rape kit backlog,law,2016-09-28,2
'vr isn't a thing you do it's a place you visit': readers review oculus rift,shooting,2016-09-28,1
woman wins right to review of northern ireland sex work law,law,2016-09-28,3
new mit app: check if your car meets climate targets,check,2016-09-28,2
the new politics isn’t just protest – it’s about change from the ground up,background,2016-09-28,2
the guardian view on low pay: rogue employers should face the law,law,2016-09-28,1
yosemite chief resigns as national parks embroiled in sexual harassment scandal,semi,2016-09-29,2
slaves: take control review – tunbridge wells' ironic punks lose their appeal,control,2016-09-29,2
wisconsin lawmakers urge investigation of scott walker after 'john doe' papers,law,2016-09-29,2
"suspected us drone strike targeting isis killed civilians in afghanistan, un says",gun,2016-09-29,2
"suspected us drone strike targeting isis killed civilians in afghanistan, un says",background,2016-09-29,2
snp mp chris law held over alleged financial irregularities,law,2016-09-29,1
bha gives up control of disciplinary panels under quinlan reforms,control,2016-09-29,2
the secret smartphone war over the struggle for control of the user,control,2016-09-29,1
shambolic child abuse inquiry is failing in its most important role,control,2016-09-29,3
fa unsteady and unprepared for role as guardian of the game’s standards,control,2016-09-29,1
suspension of child abuse inquiry lawyer a 'devastating blow',law,2016-09-29,1
"not on the high street co-founder: ‘i got an e in a-level business studies, ironically’",legislation,2016-09-29,3
"not on the high street co-founder: ‘i got an e in a-level business studies, ironically’",check,2016-09-29,3
"not on the high street co-founder: ‘i got an e in a-level business studies, ironically’",semi,2016-09-29,3
corbyn urges labour mps to end 'trench warfare' and back socialist vision for uk,background,2016-09-29,1
officer in fatal california shooting of black man sued for sexual harassment,shooting,2016-09-29,1
eu and us trade negotiators seek to get ttip talks back on track,background,2016-09-30,2
the paddleboarding powerhouse goes back on patrol,background,2016-09-30,3
unbalanced reporting on africa holds back progress,background,2016-09-30,1
mooncop by tom gauld review – graphic novel of a forgotten utopia,automatic,2016-09-30,1
‘we don’t have a choice’: young latinos on why they're voting for clinton,shooting,2016-09-30,2
more than 80% of un aid convoys in syria blocked or delayed,gun,2016-09-30,2
more than 80% of un aid convoys in syria blocked or delayed,background,2016-09-30,2
"met commissioner must have police background, federation says",background,2016-09-30,2
"a warning to corbyn: the centre ground hasn’t disappeared, it is being reshaped",background,2016-09-30,2
former new zealand pm helen clark expected to battle on for un top job,gun,2016-09-30,2
former new zealand pm helen clark expected to battle on for un top job,background,2016-09-30,2
how can we put the taste back into british food?,background,2016-10-01,2
eddie jones eyes maro itoje for no7 role in england’s autumn internationals,control,2016-10-01,2
video released of police fatally shooting unarmed alfred olango in san diego,shooting,2016-10-01,2
the observer view on russia’s actions in syria and the failure of international law,legislation,2016-10-01,1
the observer view on russia’s actions in syria and the failure of international law,law,2016-10-01,1
lead contamination in la housing project said to put 300 kids at risk,law,2016-10-01,2
lead contamination in la housing project said to put 300 kids at risk,legislation,2016-10-01,2
momentum co-founder warns against challenge to tom watson,automatic,2016-10-01,2
kenneth clark by james stourton review – mary beard on civilisation without women,legislation,2016-10-01,2
do a financial health check and midlife needn’t mean a crisis,check,2016-10-01,1
independent schools chief hits back at threat to charitable status,background,2016-10-02,2
rory stewart: global order out of control as russia 'swaggers',control,2016-10-02,2
"william h macy: 'it was 104 degrees and i had on thermals, shirt, hoodie, jacket and muffler'",check,2016-10-02,3
"william h macy: 'it was 104 degrees and i had on thermals, shirt, hoodie, jacket and muffler'",shooting,2016-10-02,3
david davis went to seminar that drew up hard brexit blueprint,semi,2016-10-02,1
'the happening': 10 years after the amish shooting,shooting,2016-10-02,2
darling days by io tillett wright review – the pains of a new york youth,legislation,2016-10-02,2
"officers tried to run over man before shooting him 14 times, video shows",shooting,2016-10-03,1
"rule of law declines for 70% of africans over past decade, warns ibrahim index",law,2016-10-03,2
women to go on strike in poland in protest at planned abortion law,law,2016-10-03,2
iphone 7 plus review: 2014 called – it wants its phablet back,background,2016-10-03,2
us to give up control of the internet's 'address book' after years of debate,control,2016-10-04,3
theresa may has shot herself in the foot with the brexit starting gun,gun,2016-10-04,2
tony abbott appointed director of new thinktank to promote western civilisation,legislation,2016-10-04,2
'no bling in the hood ...' does berlin's anti-gentrification law really work?,law,2016-10-04,1
kim kardashian gunpoint robbery sparks manhunt in paris,gun,2016-10-04,2
"school with guns, knives and fire on the timetable – and ofsted loves it",gun,2016-10-04,4
the guardian view on theresa may’s conference speech: actions not words will decide,legislation,2016-10-05,2
news corp faces lawsuits from 20 ‘fake sheikh’ targets in wake of conviction,law,2016-10-05,2
pm's speech to tory conference: 'we will take centre ground' - as it happened,background,2016-10-05,2
"healthcare in afghanistan: ‘doctors are threatened at gunpoint, even by civilians’",gun,2016-10-05,2
poland 'unlikely' to back donald tusk for second eu term,background,2016-10-05,2
‘we are building our way to hell’: tales of gentrification around the world,background,2016-10-05,1
new acland coalmine expansion: activists' lawyers stress water risk in final arguments,law,2016-10-05,2
kid cudi checks into rehab for 'depression and suicidal urges',check,2016-10-05,2
hollywood lawyer who fought gawker goes to bat for melania trump,law,2016-10-05,2
diane james resigns as ukip leader after only 18 days in  role,control,2016-10-05,2
vp debate fact-check: mike pence and tim kaine's claims reviewed,check,2016-10-05,2
joe cinque's consolation: toxic relationships and the mysteries around his killing,background,2016-10-05,2
future of 4chan uncertain as controversial site faces financial woes,control,2016-10-05,2
"police refused indigenous interpreter for witnesses to shooting, says legal service",shooting,2016-10-05,2
"the new cool: how kamasi, kendrick and co gave jazz a new groove",control,2016-10-06,3
"eastern aleppo could be destroyed by christmas, warns un syria envoy",gun,2016-10-06,2
"eastern aleppo could be destroyed by christmas, warns un syria envoy",background,2016-10-06,2
scotland bans controversial gas extraction technique,control,2016-10-06,2
"whistleblower refers email to watchdog, alleging unlawful approval of gas plants",law,2016-10-06,2
charity takes legal action against home office over child refugees,legislation,2016-10-07,1
south carolina to host march madness games relocated over anti-lgbt law,law,2016-10-07,2
trump website touts bipartisan support for gun policy he opposes,gun,2016-10-07,2
member's view:  'i wanted to ask what we can do about gun crime',gun,2016-10-07,2
saudi male-guardianship laws treat women as second-class citizens,law,2016-10-07,2
anti-rape activists hold silent vigil outside birth of a nation screenings,legislation,2016-10-07,2
un tells nauru to take urgent action to investigate abuse of refugee children,gun,2016-10-07,2
un tells nauru to take urgent action to investigate abuse of refugee children,background,2016-10-07,2
un tells nauru to take urgent action to investigate abuse of refugee children,legislation,2016-10-07,2
clinton gaining ground as obama's approval ratings go up  – as it happened,background,2016-10-07,3
"airstrikes on yemen funeral kill at least 140 people, un official says",gun,2016-10-08,1
"airstrikes on yemen funeral kill at least 140 people, un official says",background,2016-10-08,1
letters: political action is central to addressing mental health crisis,legislation,2016-10-08,2
gareth southgate baffled by england fans’ booing of wayne rooney,shooting,2016-10-08,2
the agenda: tiger woods returns to golf and sir chris hoy at le mans,legislation,2016-10-08,2
india grants divorce to man whose wife refused to live with in-laws,law,2016-10-08,2
"sexting between children not automatically a crime, says cps",automatic,2016-10-09,1
expat voting rights are useless if we lose our rights to live and work abroad,shooting,2016-10-09,1
britain to push post-brexit uk immigration controls back to irish border,control,2016-10-09,2
britain to push post-brexit uk immigration controls back to irish border,background,2016-10-09,2
post-brexit world could see ireland carrying out britain’s passport checks,check,2016-10-09,2
"tpp trade deal: plain packaging challenge triggered 'hysteria', lawyer tells mps",law,2016-10-09,1
two police officers dead and one injured in palm springs shooting,shooting,2016-10-09,1
two israelis dead after drive-by shooting at jerusalem tram stop,shooting,2016-10-09,1
tesla fights back as michigan goes to new lengths to shut company out,background,2016-10-09,2
thousands rally against lockout laws in sydney,law,2016-10-09,2
beware the pitfalls that could ground your airbnb rental plans,background,2016-10-09,3
discrimination law changes would entrench second-tier status for same-sex weddings,law,2016-10-10,1
ireland confirms talks under way over post-brexit border controls,control,2016-10-10,2
"desert trip review - mccartney, stones and co give oldchella a hint of rebellion",control,2016-10-10,2
controversial snooping technology 'used by at least seven police forces',control,2016-10-10,2
pound hovers around $1.240 as businesses fear 'hard brexit' – as it happened,background,2016-10-10,1
nobel economics prize winners' work unlocks issues around executive pay,background,2016-10-10,2
debate fact-check: hillary clinton and donald trump's claims reviewed,check,2016-10-10,2
rugby union: talking points from the premiership and pro12 action,legislation,2016-10-10,2
"after the army, i had post-traumatic stress disorder. now i run a cafe",automatic,2016-10-10,2
public humiliation: chechen leader's simple strategy to control social media,control,2016-10-10,2
eu citizens living in uk lobby for post-brexit residency law,law,2016-10-10,2
"marriage advice and bullet holes: lessons from my mother, the divorce lawyer",law,2016-10-10,1
gunmen kill 14 people in attack on shia muslim shrine in kabul,gun,2016-10-11,2
"british women, please rally to support decriminalisation of abortion",legislation,2016-10-11,2
ex-minister francis maude takes brexit advisory job at law firm,law,2016-10-11,2
un sets out position on israeli settlement football clubs in letter to fifa,gun,2016-10-11,2
un sets out position on israeli settlement football clubs in letter to fifa,background,2016-10-11,2
reading group: beryl bainbridge's the bottle factory outing is our october choice,shooting,2016-10-11,2
one nation senator calls for new abc channel for patriotic broadcasting – as it happened,legislation,2016-10-11,2
take back control? our border force is in no fit state to do its job,background,2016-10-11,2
take back control? our border force is in no fit state to do its job,control,2016-10-11,2
preserving historical buildings: the most sustainable thing is not to build new stuff,shooting,2016-10-12,3
pound falls back as davis says government cannot outline brexit aims in detail  – as it happened,background,2016-10-12,1
reality check: are us-led airstrikes on syrians as bad as russia's?,check,2016-10-12,1
ground down by savagery – the agony of aleppo,background,2016-10-12,1
"will you become a citizen of asgardia, the first nation state in space?",legislation,2016-10-12,2
xenophon calls for subcontractor protections and may back abcc,background,2016-10-12,2
google news introduces fact check feature – just in time for us election,check,2016-10-13,2
us denies seeking wider role in yemen war a day after firing missiles,control,2016-10-13,1
black films matter – how african american cinema fought back against hollywood,background,2016-10-13,2
mind-controlled robot arm gives back sense of touch to paralysed man,control,2016-10-13,2
mind-controlled robot arm gives back sense of touch to paralysed man,background,2016-10-13,2
falling water review – dream-controlling sci-fi thriller will send you to sleep,control,2016-10-13,1
man who rejected mi5 convicted of terror charge after semi-secret trial,semi,2016-10-13,2
annie mac: 'radio definitely isn't a thing of the past',shooting,2016-10-13,1
lawmakers join elizabeth warren's call for us to 'step in' on illegal airbnb hotels,law,2016-10-13,2
'no one in fashion really cares about a diverse world' – r j hernández,control,2016-10-13,2
'no one in fashion really cares about a diverse world' – r j hernández,background,2016-10-13,2
japanese woman forced to use married name at work under 19th century law,law,2016-10-13,2
"sandy hook families cannot hold gun company liable in massacre, judge rules",gun,2016-10-14,1
jermaine baker shooting: ipcc 'failed to hold met to account',shooting,2016-10-14,1
the guardian view on international law: we need enforcement and example,law,2016-10-14,2
haters back off review – youtube star makes hilarious transfer to netflix,background,2016-10-14,3
mark carney: bank of england will tolerate higher inflation – as it happened,legislation,2016-10-14,2
virginia makes progress in push to restore voting rights for ex-convicts,shooting,2016-10-14,2
"sky revolt, bbc hits back at mail, eamonn holmes",background,2016-10-14,2
clock turned back on rights for people with a learning disability,background,2016-10-14,2
top nt police officer to head government's new domestic violence arm,control,2016-10-14,2
after ched evans let’s lay down the law on casual sex,law,2016-10-15,2
offshore secrets of brexit backer arron banks revealed in panama papers,background,2016-10-15,2
real betis 1-6 real madrid: la liga – as it happened,law,2016-10-15,2
real betis 1-6 real madrid: la liga – as it happened,legislation,2016-10-15,2
trump looms large for pennsylvania republican tip-toeing around him,background,2016-10-15,2
margaret atwood: ‘all dystopias are telling you is to make sure you’ve got a lot of canned goods and a gun’,gun,2016-10-15,1
"a letter to … my brother-in-law’s ‘perfect’ wife, of whom i am jealous",law,2016-10-15,1
pauline hanson’s one nation triples support since election: newspoll,legislation,2016-10-16,2
josé mourinho: i am not to blame for confusion over wayne rooney’s role,control,2016-10-16,1
bha spot checks of trainers’ bags ruffles feathers on racing’s biggest day,check,2016-10-16,3
brexit will force britain and ireland to consider border controls,control,2016-10-16,3
10 tiny churches around the uk,background,2016-10-16,2
why all this monkeying around with my lost parcel?,background,2016-10-16,1
"yemen to start 72-hour ceasefire, says un special envoy",gun,2016-10-17,2
"yemen to start 72-hour ceasefire, says un special envoy",background,2016-10-17,2
head of police chief group regrets law enforcement's role in black oppression,law,2016-10-17,2
head of police chief group regrets law enforcement's role in black oppression,control,2016-10-17,2
cabinet tensions grow as ministers back hammond's warning over hard brexit,background,2016-10-17,2
the guardian view on ched evans: reconsider the law,law,2016-10-17,2
"theresa may 'obsessed' with immigration control, says vince cable",control,2016-10-17,1
fighting for every yard: on the ground with kurdish troops pushing into mosul,background,2016-10-17,2
hundreds of uk lawyers register in ireland in brexit insurance move,law,2016-10-17,2
"five myths about studying law, debunked",law,2016-10-17,2
"uk security agencies unlawfully collected data for 17 years, court rules",law,2016-10-17,2
european rugby champions cup: talking points from the weekend’s action,legislation,2016-10-17,2
"xenophon shoots down abbott's proposal on 18c with 'no, no and no' – as it happened",shooting,2016-10-17,1
get debate night reactions and fact-checks straight to your phone,check,2016-10-18,2
'toddlers kill': video speaks to absurdity of gun debate as it highlights a real issue,gun,2016-10-18,1
adler shotgun: new south wales deputy premier backs lifting ban on imports,gun,2016-10-18,2
melania trump was recruited to do donald's damage control. bad plan,control,2016-10-18,1
report calls on irish government to tackle denis o'brien's media control,control,2016-10-18,1
norway faces climate lawsuit over arctic oil exploration plans,law,2016-10-18,2
'it was a real gateway': readers defend a-level classical civilisation,legislation,2016-10-18,3
rising inflation is just the start: uk living standards will be squeezed,legislation,2016-10-18,3
why a porn star is fighting california's condom law: 'it's a women's rights issue',law,2016-10-18,2
senate negotiations: abbott and labor put gun control pressure on turnbull,gun,2016-10-18,2
senate negotiations: abbott and labor put gun control pressure on turnbull,control,2016-10-18,2
malcolm turnbull says there is 'no chance' of coalition watering down gun laws – politics live,gun,2016-10-18,2
malcolm turnbull says there is 'no chance' of coalition watering down gun laws – politics live,law,2016-10-18,2
"australia should urgently improve whistleblower protection, un expert says",gun,2016-10-18,3
"australia should urgently improve whistleblower protection, un expert says",background,2016-10-18,3
"parliament will adopt electronic voting in lower house, says coalition",shooting,2016-10-18,2
controversial republican mike roman to run donald trump's 'election protection',control,2016-10-18,2
tony abbott 'disturbed' by reports turnbull trading off adler gun laws for abcc vote,gun,2016-10-18,1
tony abbott 'disturbed' by reports turnbull trading off adler gun laws for abcc vote,law,2016-10-18,1
labor opens new front on constitutionality of proposed terrorism laws,law,2016-10-18,2
posthumous pardons law may see oscar wilde exonerated,law,2016-10-19,2
help the guardian keep reporting on gun violence in america,gun,2016-10-19,1
david leyonhjelm says onus is on government to justify adler gun ban,gun,2016-10-19,2
"samsung exploding phone issue extends past note 7, lawsuit says",law,2016-10-19,2
snowden: 'politics of fear' keep trudeau from repealing canada anti-terror law,law,2016-10-19,1
aclu takes on fisa court over secret decisions on surveillance laws,law,2016-10-19,2
the great british bake off 2016 semi-final – as it happened,semi,2016-10-19,3
"early voting lines are so long, people are fainting. that harms democracy",shooting,2016-10-19,1
"new push from nsw to change gun laws is a risk to community, port arthur charity says",gun,2016-10-19,2
"new push from nsw to change gun laws is a risk to community, port arthur charity says",law,2016-10-19,2
australia will not support negotiations to outlaw nuclear weapons,law,2016-10-19,1
as a nation would we ever sink so low as to check refugees’ teeth?,legislation,2016-10-19,1
as a nation would we ever sink so low as to check refugees’ teeth?,check,2016-10-19,1
nypd admits 'we failed' in police shooting of mentally ill bronx woman,shooting,2016-10-19,2
home office rules out 'unethical' dental checks for calais refugees,check,2016-10-19,2
bookies defend stringent identity checks over paying out winning punters,check,2016-10-19,3
back to the future: were newspaper publishers wrong to go digital?,background,2016-10-19,1
law may be needed to preserve the rights of irish in uk after brexit,law,2016-10-19,2
tony abbott: australia has avoided a massacre because it's hard to get guns,gun,2016-10-19,2
wa premier colin barnett does not support adler gun coming into his state – as it happened,gun,2016-10-19,1
ordinary lies review – can planting spy-cams around your house ever end well?,background,2016-10-19,2
may defends grammars and plans for universities' role in state schools,control,2016-10-19,3
hong kong lawmakers walk out to block swearing-in of democracy activists,law,2016-10-19,1
"'i am young, i am gay, i am black,' says chansey paech to nt parliament",control,2016-10-19,1
adler shotgun explainer: what's the big deal about lever-action firearms?,gun,2016-10-19,2
coalition splits over adler shotgun ban as one nation calls for 'softening' of firearm control,gun,2016-10-19,2
coalition splits over adler shotgun ban as one nation calls for 'softening' of firearm control,legislation,2016-10-19,2
coalition splits over adler shotgun ban as one nation calls for 'softening' of firearm control,control,2016-10-19,2
the gun control debate shows the coalition still hasn't worked out how to negotiate,gun,2016-10-19,1
the gun control debate shows the coalition still hasn't worked out how to negotiate,control,2016-10-19,1
we’ve reached the fork in the road on gun laws. which way will we go?,gun,2016-10-20,2
we’ve reached the fork in the road on gun laws. which way will we go?,law,2016-10-20,2
conservative mp backs tony abbott's account of adler shotgun deal row,gun,2016-10-20,2
man dies after shooting in west belfast,shooting,2016-10-20,2
eu seeks swift action on african migration deals to ease pressure on italy,legislation,2016-10-20,2
colorado poll workers trained to respond to mass shooting,shooting,2016-10-20,2
debate fact-check: hillary clinton and donald trump's claims reviewed,check,2016-10-20,2
gunslinger tony abbott tries another ambush but shoots himself in the foot,gun,2016-10-20,2
gunslinger tony abbott tries another ambush but shoots himself in the foot,shooting,2016-10-20,2
states to push for some restrictions on lever-action shotguns,gun,2016-10-20,2
"turnbull, dutton and keenan contradict abbott over gun deal with leyonhjelm",gun,2016-10-20,3
eu leaders at loggerheads over nature laws review,law,2016-10-20,2
turnbull and abbott trade barbs on guns-for-votes issue – as it happened,gun,2016-10-20,2
here's why gun control advocates want to restrict the adler shotgun,gun,2016-10-20,1
here's why gun control advocates want to restrict the adler shotgun,control,2016-10-20,1
here's why gun control advocates want to restrict the adler shotgun,gun,2016-10-20,1
lewis hamilton fastest in practice but nico rosberg stays in control,control,2016-10-21,2
conservative mp admits dental checks for refugees was not existing policy,check,2016-10-21,1
"heathrow expansion, nuclear fusion and tasmanian devils – green news roundup",background,2016-10-21,2
conservative minister obstructs progression of gay pardon law,law,2016-10-21,2
too much action: how kids' comic action drowned in its own ultraviolence,legislation,2016-10-21,1
too much action: how kids' comic action drowned in its own ultraviolence,legislation,2016-10-21,1
law to cut sex-selective abortions in armenia 'putting lives at risk',law,2016-10-21,2
the best recent thrillers – review roundup,background,2016-10-21,2
adler ban to remain after ministers fail to reach agreement on reclassifying shotgun,gun,2016-10-21,1
australia joins bid to outlaw large-scale commercial and 'scientific' whaling,law,2016-10-21,2
"britain must not abandon its role fighting terrorism in europe, says nick clegg",control,2016-10-22,1
malcolm roberts reveals one nation intends to support coalition's abcc bill,legislation,2016-10-22,2
national guard soldiers told to pay back bonuses years after enlisting,background,2016-10-22,2
attack on kirkuk and chemical fire push troops back from mosul frontline,background,2016-10-22,2
steven gerrard suggests he's finished with la galaxy,law,2016-10-22,2
steven gerrard suggests he's finished with la galaxy,legislation,2016-10-22,2
‘my sofa's named after anna chancellor’: theatre designer tom scutt’s london home,automatic,2016-10-22,2
beware the small print that could hike one-bed flat’s ground rent to £8m-a-year,background,2016-10-22,1
