headlines,terms,dates,scores
bill leak’s lawyers say triggs 'playing politics' with children’s welfare,law,2016-10-22,2
shark attack near byron bay leaves surfer with minor leg injuries,legislation,2016-10-23,1
irish women need british help to change our abortion laws,law,2016-10-23,2
"isis could refocus energy on west if it loses ground in mosul, warns minister",background,2016-10-23,3
rangers 0-1 celtic: scottish league cup semi-final – as it happened,semi,2016-10-23,2
tom ford: ‘i wore a suit on set. it's a uniform… i feel weak in trainers’,automatic,2016-10-23,2
gardens: so you think coffee grounds are good for plants,background,2016-10-23,3
"christopher pyne attacks gillian triggs' judgment, saying she has 'politicised' role",control,2016-10-23,2
letter signed by gun control advocates calls for 'unbiased' review of laws,gun,2016-10-24,1
letter signed by gun control advocates calls for 'unbiased' review of laws,control,2016-10-24,1
letter signed by gun control advocates calls for 'unbiased' review of laws,law,2016-10-24,1
michael keenan criticised for holding 'one-sided' meetings with gun lobby,gun,2016-10-24,2
met inspector prevented from retiring to avoid disciplinary action,legislation,2016-10-24,1
arsenal’s olivier giroud and reading’s yann kermorgant get an unlikely reunion,background,2016-10-24,2
la esperanza de la generación: las chicas desafiando la misoginia en el centro rural de paraguay,law,2016-10-24,2
la esperanza de la generación: las chicas desafiando la misoginia en el centro rural de paraguay,legislation,2016-10-24,2
la esperanza de la generación: las chicas desafiando la misoginia en el centro rural de paraguay,law,2016-10-24,2
la esperanza de la generación: las chicas desafiando la misoginia en el centro rural de paraguay,legislation,2016-10-24,2
la esperanza de la generación: las chicas desafiando la misoginia en el centro rural de paraguay,law,2016-10-24,2
la esperanza de la generación: las chicas desafiando la misoginia en el centro rural de paraguay,legislation,2016-10-24,2
la esperanza de la generación: las chicas desafiando la misoginia en el centro rural de paraguay,control,2016-10-24,2
¿qué tiene que ver con el medio ambiente la paz en colombia?,control,2016-10-24,2
¿qué tiene que ver con el medio ambiente la paz en colombia?,law,2016-10-24,2
¿qué tiene que ver con el medio ambiente la paz en colombia?,legislation,2016-10-24,2
from the us army to al-shabaab: the man who wanted to live under sharia law,law,2016-10-24,2
"coalition can bring back green 'lawfare' bill if senate supports it, says turnbull",background,2016-10-24,2
"coalition can bring back green 'lawfare' bill if senate supports it, says turnbull",law,2016-10-24,2
petrol cars allowed to exceed pollution limits by 50% under draft eu laws,law,2016-10-24,2
early voting looking strong for clinton,shooting,2016-10-25,3
england should look at nathan hughes to take over maro itoje’s role,control,2016-10-25,2
justin timberlake could face jail time over voting booth selfie,shooting,2016-10-25,2
documents show at&t secretly sells customer data to law enforcement,law,2016-10-25,2
controversy over alleged fake financial document leaves watford frustrated,control,2016-10-25,1
un's own expert calls its actions over haiti cholera outbreak 'a disgrace',legislation,2016-10-25,1
scotland to pardon gay men convicted under outdated laws,law,2016-10-25,2
hammond says highly skilled will not face eu immigration controls,control,2016-10-25,3
the decision to back a third runway at heathrow is a grotesque folly,background,2016-10-25,1
"puffing pontiff: the young pope's oscar-winning director on jude law, sex and cigarettes",law,2016-10-25,2
child kept in isolation for whole term at ‘lunch row’ school,legislation,2016-10-25,2
"tighten up political system to stem birther controversies, aec veteran says",control,2016-10-25,2
use of restraint chairs on nt youths to be banned amid wider justice review,control,2016-10-25,2
us abstains from un vote to condemn cuba embargo for the first time,gun,2016-10-26,2
us abstains from un vote to condemn cuba embargo for the first time,background,2016-10-26,2
hillary clinton makes push for latino vote with univision appearance,legislation,2016-10-26,2
why gun rights advocates don't trust clinton on the second amendment,gun,2016-10-26,2
our society has lost control of housing – here's how to get it back,control,2016-10-26,2
our society has lost control of housing – here's how to get it back,background,2016-10-26,2
what to do in the garden when the clocks go back,background,2016-10-26,2
unesco adopts controversial resolution on jerusalem holy sites,control,2016-10-26,2
selling yoga back to its teachers is pure neocolonialism,background,2016-10-26,2
air of discontent around cerrejón mine deepens as colombians cry foul,background,2016-10-26,1
eu drops law to limit cancer-linked chemical in food after industry complaint,law,2016-10-26,0
canada urged to quell discrimination against women after fall in un ranking,gun,2016-10-26,2
canada urged to quell discrimination against women after fall in un ranking,background,2016-10-26,2
south africa: the art of a nation review – from the dawn of man to the violence of apartheid,legislation,2016-10-26,1
john clancy: brexit offers uk cities a bigger role on the world stage,control,2016-10-26,3
will the closure of india's sterilisation camps end botched operations?,legislation,2016-10-26,1
lawyers' alliance backs labor's call for george brandis to resign,law,2016-10-26,2
"pokies designed to deceive people, lawsuit against crown and aristocrat alleges",law,2016-10-26,1
labor opposed to turnbull's controversial 'green lawfare' changes,control,2016-10-26,2
labor opposed to turnbull's controversial 'green lawfare' changes,law,2016-10-26,2
pauline hanson tells government to back broadband cable for norfolk island,background,2016-10-27,2
jenny tonge quits lib dems after suspension for alleged antisemitic comments,semi,2016-10-27,2
"the rule of law must apply equally, even to terrorists",law,2016-10-27,2
press freedom danger if mps vote in section 40 by the back door,background,2016-10-27,2
battle for florida: trump and clinton home in on crucial state as voting begins,shooting,2016-10-27,3
law concerning use of sexual history in rape trials 'could be reformed',law,2016-10-27,2
how do we make care personalisation cost-efficient?,legislation,2016-10-27,3
poland's abortion laws: activists blame grip of 'hardline' church,law,2016-10-27,2
"less talk, more action: why victoria is the progress state",legislation,2016-10-28,1
virginia police shootings: ‘we missed an opportunity to stop him',shooting,2016-10-28,2
liberal democrat peer to attend controversial conference in syria,control,2016-10-28,2
"mass extinction, whaling and a new marine park – green news roundup",background,2016-10-28,1
islamic state using hostages as human shields in mosul - un,gun,2016-10-28,2
islamic state using hostages as human shields in mosul - un,background,2016-10-28,2
ba owner 'doubts' heathrow can build runway within budget,background,2016-10-28,1
north dakota pipeline: 141 arrests as protesters pushed back from site,background,2016-10-28,1
latest ukip leadership candidate can't help shooting from the hip,shooting,2016-10-28,1
the labour rebels who didn’t back the yemen vote have blood on their hands,background,2016-10-28,2
sandy hook film-makers join cinemark boycott over aurora shooting,shooting,2016-10-28,2
time is money: here's how to save some when the clocks go back this weekend,background,2016-10-28,2
the best recent science fiction and fantasy novels – reviews roundup,background,2016-10-28,3
guardian briefing: the key questions around aid in syria,background,2016-10-28,2
un hires assad's friends and relatives for syria relief operation,gun,2016-10-28,3
un hires assad's friends and relatives for syria relief operation,background,2016-10-28,3
denis o’brien wants us legal expert to give evidence on irish law,law,2016-10-28,3
ba owner cuts profit forecast after bumpy ride in third quarter,background,2016-10-28,2
malcolm turnbull puts family violence talks with states back on agenda,background,2016-10-28,1
grouse shooting estates shored up by millions in subsidies,shooting,2016-10-28,2
protesters pushed back after mass arrests at north dakota pipeline site – as it happened,background,2016-10-28,1
roberto firmino rounds off liverpool’s goal rush at crystal palace,background,2016-10-29,2
olivier giroud and alexis sánchez at the double as arsenal ease past sunderland,background,2016-10-29,3
"new asylum laws pave the way for third-country resettlement, peter dutton says",law,2016-10-30,2
andrew robb takes role with chinese company that operates darwin port,control,2016-10-30,2
the guardian view on the fbi’s clinton probe: exactly the wrong thing to do,shooting,2016-10-30,2
fired-up over grouse shooting and moorlands,shooting,2016-10-30,2
james comey: hillary clinton email inquiry is fbi chief's latest controversy,control,2016-10-30,2
how molenbeek fought back against isis – with football,background,2016-10-30,2
"‘a noun, a verb and donald trump’: rubio seeks to seize on murphy’s flaw",law,2016-10-30,1
"facebook fact-check: all the fake news, from the obamas to miracle cannabis",check,2016-10-30,3
password not accepted: are biometric checks the answer?,check,2016-10-30,2
dakota access pipeline protests: un group investigates human rights abuses,gun,2016-10-31,2
dakota access pipeline protests: un group investigates human rights abuses,background,2016-10-31,2
"jihadis planning paris-style gun attacks on british streets, police say",gun,2016-10-31,2
john oliver on the us election's latest low: 'please let this thing be over soon',shooting,2016-10-31,2
westworld recap: episode five – hold on to your hats! it's dolores the lawless,law,2016-10-31,2
the rspb is wrong not to back a ban on driven grouse shooting,background,2016-10-31,1
the rspb is wrong not to back a ban on driven grouse shooting,shooting,2016-10-31,1
clinton emails: fbi gets warrant as comey told he may have broken law,law,2016-10-31,2
"abcc must enshrine union members' rights,  says one nation senator",legislation,2016-10-31,2
andrew robb did not tell  prime minister about role with chinese company,control,2016-10-31,2
"tom wood: i did not have a tantrum, eddie jones just says it how it is",automatic,2016-11-01,1
manchester city manage the impossible and keep lionel messi in check,check,2016-11-01,2
"un failed to protect civilians in south sudan, report finds",gun,2016-11-01,1
"un failed to protect civilians in south sudan, report finds",background,2016-11-01,1
"hinkley point c will not cost taxpayers extra, says edf energy boss",control,2016-11-01,1
"hinkley point c will not cost taxpayers extra, says edf energy boss",background,2016-11-01,1
"hinkley point c will not cost taxpayers extra, says edf energy boss",check,2016-11-01,1
"hinkley point c will not cost taxpayers extra, says edf energy boss",automatic,2016-11-01,1
eagles' josh huff reportedly found with gun and marijuana after speeding arrest,gun,2016-11-01,2
the hillary clinton email controversy explained: what we know so far,control,2016-11-01,2
billy corgan loses lawsuit against tna wrestling,law,2016-11-01,2
dark angel review – grimy crimes are laid on thick in this halloween hoot,shooting,2016-11-01,3
a million people 'check in' at standing rock on facebook to support dakota pipeline protesters,check,2016-11-01,2
un official criticises australia's plan for lifetime ban on refugees who travel by sea,gun,2016-11-01,2
un official criticises australia's plan for lifetime ban on refugees who travel by sea,background,2016-11-01,2
cory bernardi warns one nation will rise if migration not halved,legislation,2016-11-02,2
lawyer rebuked for gloating at 'win' over parents seeking special needs support,law,2016-11-02,2
des moines police shooting: killed officers named after 'ambush',shooting,2016-11-02,2
sod it: californians turn back to grass lawns as drought shaming ebbs,background,2016-11-02,2
sod it: californians turn back to grass lawns as drought shaming ebbs,law,2016-11-02,2
uae launches new law to 'make reading a daily habit',law,2016-11-02,2
i hate the internet by jarett kobek review – the best ‘bad novel’ around,background,2016-11-02,1
mh370: data suggests plane was out of control as it plummeted into ocean,control,2016-11-02,2
northern ireland woman takes nhs to court over abortion law,law,2016-11-02,2
government challenges election of one nation senator rod culleton,legislation,2016-11-02,2
ba accused of downplaying health risks of 'fume events' on flights,background,2016-11-03,2
jews driven back to germany by brexit,background,2016-11-03,2
bank of england warns households to expect sharp rise in inflation next year,legislation,2016-11-03,2
uk households face squeeze as bank of england hikes inflation forecasts –as it happened,legislation,2016-11-03,2
never look back,background,2016-11-03,2
thank martin luther for exposing the church’s great salvation sell-off,legislation,2016-11-03,2
"only in america! uk tv's fascination with the us's gun-toting, conspiracy-loving side",gun,2016-11-03,2
dakota pipeline protesters say activist accused of shooting at police is a pacifist,shooting,2016-11-03,1
how to make the perfect cacio e pepe,legislation,2016-11-03,3
how to make the perfect cacio e pepe,check,2016-11-03,3
how to make the perfect cacio e pepe,semi,2016-11-03,3
thursday’s best tv: peter york’s hipster handbook; the gun shop; paranoid,gun,2016-11-03,3
rodney culleton to ask for advice about whether he can keep voting in senate,shooting,2016-11-03,2
"bring tony abbott back into cabinet to stop ‘circular firing squad’, shorten tells turnbull",background,2016-11-03,2
catholic church apologises for role in 'forced adoptions' over 30-year period,control,2016-11-03,2
"wearing lifejackets on trawlers should be law, marine investigators say",law,2016-11-03,2
#savepepe: cartoon frog's creator tries to take meme back from alt-right,background,2016-11-04,2
"wetherspoon boss tim martin: ‘the eu became a quasi-religion, and universities are the modern-day seminaries’",semi,2016-11-04,2
judges' actions around the world show they are no enemy of the people,legislation,2016-11-04,2
judges' actions around the world show they are no enemy of the people,background,2016-11-04,2
the best recent crime novels – review roundup,background,2016-11-04,2
'anti-white' graffiti in gentrifying la  neighborhood sparks hate crime debate,law,2016-11-04,1
'anti-white' graffiti in gentrifying la  neighborhood sparks hate crime debate,legislation,2016-11-04,1
south africa fight back on day two of the perth test – as it happened,background,2016-11-04,1
keep it in the ground: the paris climate agreement is now official,background,2016-11-04,3
"man secretly deported to nauru from melbourne detention centre, say lawyers",law,2016-11-04,1
we need to get back to basics in this election. who is the biggest fascist: hillary or donald?,background,2016-11-04,2
qut computer lab racial discrimination lawsuit thrown out,law,2016-11-04,2
"baby adoption practices of past demand inquiry, say law firms",law,2016-11-04,2
china could ban lawmakers from hong kong parliament as crisis escalates,law,2016-11-04,2
higher inflation and rising debt threaten millions in uk,legislation,2016-11-05,3
merstham 0-5 oxford united: fa cup first round – as it happened,background,2016-11-05,2
moroccan activists plan protests to coincide with un climate summit,gun,2016-11-05,2
moroccan activists plan protests to coincide with un climate summit,background,2016-11-05,2
the ground rent scandal that is engulfing new home buyers,background,2016-11-05,1
port macquarie police shooting: man had sent threatening messages to woman he stabbed,shooting,2016-11-05,2
senator al franken accuses donald trump of launching antisemitic tv ad,semi,2016-11-06,2
sevilla 1-2 barcelona: la liga – as it happened,law,2016-11-06,3
sevilla 1-2 barcelona: la liga – as it happened,legislation,2016-11-06,3
jack wilshere back in england squad to face scotland and spain,background,2016-11-06,2
donald trump jr's gun rights coalition includes olympian and beauty queen,gun,2016-11-06,2
invasion of the troll armies: from russian trump supporters to turkish state stooges,control,2016-11-06,2
nocturnal animals review – tom ford’s seductive cautionary tale,automatic,2016-11-06,2
brexit: lawyers confront liz truss over ‘dangerous’ abuse of judges,law,2016-11-06,1
riot of colour in a 1960s semi,semi,2016-11-06,2
"the rule of law, the power of parliament, and the will of the people",law,2016-11-07,2
how does donald trump lie? a fact checker's final guide,check,2016-11-07,2
premier league: 10 talking points from the weekend’s action,legislation,2016-11-07,2
lazarus review – michael c hall is a loving alien in spectacular bowie fantasy,control,2016-11-08,3
lazarus review – michael c hall is a loving alien in spectacular bowie fantasy,background,2016-11-08,3
lazarus review – michael c hall is a loving alien in spectacular bowie fantasy,check,2016-11-08,3
lazarus review – michael c hall is a loving alien in spectacular bowie fantasy,automatic,2016-11-08,3
man admits sending 'cowardly' shooting tweet about leanne wood,shooting,2016-11-08,2
"brexit may be final straw for some couples, say divorce lawyers",law,2016-11-08,2
theresa struggles to take back control – from her own maybot,background,2016-11-08,1
theresa struggles to take back control – from her own maybot,control,2016-11-08,1
who controls whom? the monarchy v the media,control,2016-11-08,2
hillary clinton and donald trump cast their ballots after record early voting,shooting,2016-11-08,3
voting day: america finally goes the polls,shooting,2016-11-08,2
damian green dismisses 'offensive' un report on uk disability rights,gun,2016-11-08,2
damian green dismisses 'offensive' un report on uk disability rights,background,2016-11-08,2
china passes law to ensure films 'serve the people and socialism',law,2016-11-08,2
hillary clinton buoyed by high latino turnout in final hours of election,legislation,2016-11-08,2
hong kong: lawyers and activists march against beijing 'meddling',law,2016-11-08,2
andrew lloyd webber almost quit tories after voting for osborne's cuts,shooting,2016-11-08,2
hong kong lawyers prepare protest march after china inflames political crisis,law,2016-11-08,2
"building regulator blocking deal on spurious 'productivity' grounds, union says",background,2016-11-08,2
