headlines,terms,dates,scores
fact-checking donald trump’s speech on his economic plan,check,2016-08-08,2
naacp president arrested after staging voting rights sit-in at lawmaker's office,shooting,2016-08-08,2
naacp president arrested after staging voting rights sit-in at lawmaker's office,law,2016-08-08,2
"gunning for corbyn, not the conservatives, is labour’s tragedy",gun,2016-08-08,1
suicide squad makes con air look inspired. it's time for a blockbuster face-lift,control,2016-08-08,1
oakland gun violence spurs young men's call for action: 'we come together',gun,2016-08-08,1
oakland gun violence spurs young men's call for action: 'we come together',legislation,2016-08-08,1
"using terror laws on alleged rightwing extremist a federal first, says minister",law,2016-08-08,1
"a short history of nauru, australia’s dumping ground for refugees",background,2016-08-09,2
theresa may should stick to her guns on executive pay and low pay alike,gun,2016-08-09,2
‘i want to hug him but also shout at him’: tom watson on jeremy corbyn and labour rifts,automatic,2016-08-09,2
canary islands fire ravages 7% of la palma,law,2016-08-09,2
canary islands fire ravages 7% of la palma,legislation,2016-08-09,2
boy hit by stray shotgun pellet in shooting that leaves man critically ill,gun,2016-08-09,2
boy hit by stray shotgun pellet in shooting that leaves man critically ill,shooting,2016-08-09,2
helen mirren to star as gun heiress in supernatural drama winchester,gun,2016-08-09,2
nobody can buy the silence of a climate spinning out of control,control,2016-08-09,2
"back to school bill: pencil case, pens, rubber … and a £785 ipad",background,2016-08-09,2
"census controversy shows abs 'needs to do better', says statistical society",control,2016-08-09,2
hillary clinton hits back at trump's economic proposals – as it happened,background,2016-08-09,2
dressed to thrill: charlotte dujardin begins her quest for the perfect round,background,2016-08-10,3
tom watson sends corbyn 'proof of trotskyist labour infiltration',automatic,2016-08-10,2
sky news defends report on gun running amid claims of faked meeting,gun,2016-08-10,1
birdman of alcatraz's personal bird atlas to go to auction,legislation,2016-08-10,2
tom watson – a piggy caught in several middles as labour battles on,automatic,2016-08-10,2
nauru files: widespread condemnation of australian government by un and others,gun,2016-08-10,2
nauru files: widespread condemnation of australian government by un and others,background,2016-08-10,2
israeli mp floats law to protect netanyahu from criminal inquiries,law,2016-08-10,2
donald trump hints at assassination of hillary clinton by gun rights supporters,gun,2016-08-10,2
parents who feed children vegan diet face prosecution under proposed italian law,law,2016-08-10,2
gunshots in ferguson after car hits protester on michael brown anniversary,gun,2016-08-10,2
election fraud report calls for stringent id checks,check,2016-08-11,2
facebook v adblock: the anti-ad empire strikes back,background,2016-08-11,2
"un has set dangerous precedent, says libya's oil boss",gun,2016-08-11,2
"un has set dangerous precedent, says libya's oil boss",background,2016-08-11,2
law firm investigating vw emissions scandal hired to examine bhs,law,2016-08-11,1
trump golf resort in scotland admits breach of data protection law,law,2016-08-11,2
from molenbeek to hollywood – why belgian thriller black is the new la haine,law,2016-08-11,2
from molenbeek to hollywood – why belgian thriller black is the new la haine,legislation,2016-08-11,2
clinton hits back over trump's 'violent' innuendo,background,2016-08-11,2
balkan wildlife faces extinction threat from border fence to control migrants,control,2016-08-11,3
how open data helps citizens to know the law,law,2016-08-11,2
nauru security guard ‘grabbed boy by throat and banged head against ground’,background,2016-08-11,2
the birth of a nation director nate parker talks about being accused of rape,legislation,2016-08-12,2
"kim rhode: shooting for history, country and donald trump",shooting,2016-08-12,1
amber hill fires tokyo warning after missing medal in skeet shooting,shooting,2016-08-12,2
the guardian view on thailand: the military is in control – but for how long?,control,2016-08-12,2
tata steel uk rescue deal closer after trustees back pension changes,background,2016-08-12,2
six-year-old boy critically injured in crossfire of philadelphia 'gun battle',gun,2016-08-12,1
growth review – funny and truthful look at one man's reality check,check,2016-08-12,3
"a 400-year-old shark, fracking 'bribes' and hinkley c – green news roundup",control,2016-08-12,1
"a 400-year-old shark, fracking 'bribes' and hinkley c – green news roundup",background,2016-08-12,1
"a 400-year-old shark, fracking 'bribes' and hinkley c – green news roundup",check,2016-08-12,1
"a 400-year-old shark, fracking 'bribes' and hinkley c – green news roundup",automatic,2016-08-12,1
"a 400-year-old shark, fracking 'bribes' and hinkley c – green news roundup",background,2016-08-12,1
"grouse shooting's rich, influential backers join forces to fire on critics",shooting,2016-08-12,3
cadbury owner buys back licence for biscuit business,background,2016-08-12,2
"chris packham using bbc role to push grouse-shooting ban, ian botham says",control,2016-08-12,1
"chris packham using bbc role to push grouse-shooting ban, ian botham says",shooting,2016-08-12,1
fact check: immigration minister peter dutton's claims against nauru files,check,2016-08-12,2
chris mitchell's clangers and shouting at the sky while googling twitter,shooting,2016-08-12,2
how we let the phoneys take control and debase the language of politics,control,2016-08-13,2
role of uk police in training bahrain’s forces ‘ignores abuses’,control,2016-08-13,2
police to hire law firms to tackle cyber criminals in radical pilot project,law,2016-08-14,2
tom watson claims proof of far-left planning to infiltrate labour,automatic,2016-08-14,1
housing act is deeply damaging legislation,legislation,2016-08-14,3
ryan lochte reveals details of gunpoint robbery by rio gang posing as police,gun,2016-08-14,2
"workers rally around wages, race and plans to protest presidential debates",background,2016-08-14,2
"i was shot at. what saved me was not a gun of my own, but running fast",gun,2016-08-14,2
liam fox tried to wrest control of foreign office duties from boris johnson,control,2016-08-14,2
"he gets knocked down ... but mo farah gets back up again to win 10,000m gold",background,2016-08-14,3
great britain’s women hockey team beat spain to progress into semi-finals,semi,2016-08-15,3
milwaukee mayor declares curfew to help ease unrest after police shooting,shooting,2016-08-15,2
news of the world legal chief cleared over surveillance of lawyers,law,2016-08-15,2
sports direct warehouse workers to receive back pay,background,2016-08-15,2
"sports direct should be landed with a hefty fine, despite its back pay offer",background,2016-08-15,3
dalian atkinson: former footballer dies after police shoot him with taser,shooting,2016-08-15,2
i was held after reading a book on a plane – we need to rethink our terror laws,law,2016-08-15,2
"law firm at centre of al-sweady inquiry to close down, say reports",law,2016-08-15,1
gays against guns: civil disobedience campaign to target gun companies,gun,2016-08-15,2
gays against guns: civil disobedience campaign to target gun companies,gun,2016-08-15,2
"the tragic background of david wolfe, chair of the prp",background,2016-08-15,2
jfk given all-clear after unfounded reports of shooting cause chaos,shooting,2016-08-15,2
"lawyers use victim-blaming language in domestic violence cases, says report",law,2016-08-15,1
can the law come to the rescue of abused asylum seekers and refugees?,law,2016-08-15,2
univision buys bankrupt gawker media at auction for a reported $135m,legislation,2016-08-16,1
labour pledges to bring back maintenance grants for poorest students,background,2016-08-16,2
greener alternatives to hinkley point c,control,2016-08-16,2
greener alternatives to hinkley point c,background,2016-08-16,2
greener alternatives to hinkley point c,check,2016-08-16,2
greener alternatives to hinkley point c,automatic,2016-08-16,2
timeline of taser controversies in the uk,control,2016-08-16,2
racial tensions flare in saskatchewan after shooting of indigenous man,shooting,2016-08-16,2
how to tell a shining knight of a lawyer from an ambulance chaser?,law,2016-08-16,2
gays against guns activists begin campaign with 'die-in' at blackrock hq,gun,2016-08-16,2
olympic marriage proposals continue with tom bosworth popping question to boyfriend,automatic,2016-08-16,2
hundreds gather to remember muslim cleric as suspect charged in shooting,shooting,2016-08-16,2
dairy crisis: law could force milk processors to change contracts with farmers,law,2016-08-17,2
british airways cabin crew vote for industrial action but no strike,legislation,2016-08-17,1
the birth of a nation posters defaced after nate parker rape trial controversy,legislation,2016-08-17,1
the birth of a nation posters defaced after nate parker rape trial controversy,control,2016-08-17,1
two g4s police control room staff fired over 999 'test calls',control,2016-08-17,2
owen smith suggests islamic state needs to 'get round the table' – as it happened,background,2016-08-17,2
un under pressure over 'failure to act' during south sudan rampage,gun,2016-08-17,1
un under pressure over 'failure to act' during south sudan rampage,background,2016-08-17,1
the coral die-off crisis is a climate crime and exxon fired the gun,gun,2016-08-17,1
"anjem choudary case raises questions about terror laws, says watchdog",law,2016-08-17,2
new york rap duo 4 wheel city turn shooting tragedies into a positive mission,shooting,2016-08-17,3
nigeria relaunches controversial 'war on indiscipline' brigade,control,2016-08-17,1
building better mental health in cities from the ground up,background,2016-08-17,2
brexit trade deals: the gruelling challenge of taking back control,background,2016-08-17,2
brexit trade deals: the gruelling challenge of taking back control,control,2016-08-17,2
police investigate claims schoolgirls across australia targeted by site hosting explicit images,shooting,2016-08-17,2
"on corporate human rights, australia's actions speak louder than words",legislation,2016-08-17,2
olympic women's basketball semi-final: france 67-86 usa – as it happened,semi,2016-08-18,2
hull coast past catalans dragons to secure place in super 8 semi-finals,semi,2016-08-18,2
top boxing executive ‘reassigned’ after olympic judging controversy,control,2016-08-18,2
snowden the movie: ewen macaskill watches the nsa super-leak come back to life,background,2016-08-18,2
california's blue cut fire: climate change dismissed as 'excuse' on the ground,background,2016-08-18,2
'not becoming of a woman': lawyers may finally get recourse for harassment,law,2016-08-18,2
queensland land-clearing controls face defeat with former labor mp voting no,control,2016-08-18,1
queensland land-clearing controls face defeat with former labor mp voting no,shooting,2016-08-18,1
human rights watchdog calls for urgent action on britain's 'deep-rooted' inequality,legislation,2016-08-18,2
excessive force and prolonged isolation alleged at queensland youth detention centre,legislation,2016-08-18,1
collective action via social media brings hope to gig economy workers,legislation,2016-08-19,1
why osborne’s ‘rambo’ outing is not the way to go after brexit blow,shooting,2016-08-19,1
"as louisiana floods rage, republicans are blocking modest climate action",legislation,2016-08-19,2
low crowds and chaotic la liga fixture list cannot deter from guarantee of drama,law,2016-08-19,1
low crowds and chaotic la liga fixture list cannot deter from guarantee of drama,legislation,2016-08-19,1
was george osborne's machine gun fun in vietnam in poor taste?,gun,2016-08-19,2
"land-clearing laws' failure jeopardises climate change targets, says minister",law,2016-08-19,1
pc music's danny l harle teams up with carly rae jepsen – watch their video here,control,2016-08-19,2
pc music's danny l harle teams up with carly rae jepsen – watch their video here,law,2016-08-19,2
pc music's danny l harle teams up with carly rae jepsen – watch their video here,legislation,2016-08-19,2
george osborne spotted firing machine gun on holiday in vietnam,gun,2016-08-19,2
olympics 2016 daily briefing: doubles all round for usain bolt and jade jones,background,2016-08-19,2
frog bikes bring manufacturing back home to beat the business cycle,background,2016-08-19,2
cambodia proves fertile ground for foreign surrogacy after thailand ban,background,2016-08-19,3
cherie blair and miriam gonzález: why companies must act on slavery law,law,2016-08-19,2
labor accuses coalition of changing stance on racial discrimination law,law,2016-08-19,2
uber v drivers: judge rejects 'unfair' settlement in us class action lawsuit,legislation,2016-08-19,3
uber v drivers: judge rejects 'unfair' settlement in us class action lawsuit,law,2016-08-19,3
nate parker: director with a back story,background,2016-08-20,2
"before you check in, check out if your hotel is playing fair",check,2016-08-20,2
"before you check in, check out if your hotel is playing fair",check,2016-08-20,2
"ryan lochte shouted at guards during gas station incident, says gunnar bentz",legislation,2016-08-20,2
"ryan lochte shouted at guards during gas station incident, says gunnar bentz",gun,2016-08-20,2
real sociedad 0-3 real madrid: la liga – as it happened,law,2016-08-21,2
real sociedad 0-3 real madrid: la liga – as it happened,legislation,2016-08-21,2
emotional ryan lochte sorry for 'stupid mistake' and 'shenanigans' at gas station,legislation,2016-08-21,1
latino immigrants are unnoticed casualties of us 'war on terror' – study,legislation,2016-08-21,2
"'if you fight fire with fire, everyone burns': how to catch a troll like trump",control,2016-08-21,1
knight of cups; the pearl button; arabian nights; the jungle book; jane got a gun; miles ahead; the get down – review,gun,2016-08-21,1
australia attempts to derail un plan to ban nuclear weapons,gun,2016-08-21,1
australia attempts to derail un plan to ban nuclear weapons,background,2016-08-21,1
the guardian view on the eu: struggling with the vision thing,shooting,2016-08-22,1
france began isolating islamic extremists in jails after paris attacks,legislation,2016-08-22,2
mail on sunday removes photo of reporter posing with gun in iraq,gun,2016-08-22,2
smith and corbyn pledge to hand power back to party members,background,2016-08-22,2
mail on sunday wrong to use picture of a gun-toting journalist in iraq,gun,2016-08-22,1
premier league: 10 talking points from the weekend’s action,legislation,2016-08-22,2
"turnbull's cfa laws unveiled, but expert questions constitutionality",law,2016-08-22,3
judge throws cold water on lawsuit over starbucks' ice-to-coffee ratio,law,2016-08-23,1
celtic in champions league qualifier plus efl cup action: clockwatch – as it happened,legislation,2016-08-23,2
michy batshuayi leads chelsea past bristol rovers and into third round,background,2016-08-23,2
"what's missing from the anti-trans ruling? law, facts and compassion",law,2016-08-23,2
universal reportedly outlaws streaming 'exclusives' after frank ocean release,law,2016-08-23,2
puerto rico officials struggle to translate zika virus fears into action,legislation,2016-08-23,2
soldier killed during live shooting exercise in northumberland,shooting,2016-08-23,2
michael grade defends expanded bbc role for former labour minister,control,2016-08-23,2
"briton admits fatal fight with bali police officer, his lawyer says",law,2016-08-23,1
nt government did secret coal deal a day before going into caretaker mode,control,2016-08-23,1
virgin trains controversy 'has helped jeremy corbyn's leadership bid',control,2016-08-24,2
on the receiving end of barbra streisand’s control freakery,control,2016-08-24,2
ukraine marks 25 years of independence a riven nation despite the flags,legislation,2016-08-24,2
proxima b will be our prime laboratory in the search for extraterrestrial life,background,2016-08-24,2
jimmy feigen on gas station incident: 'i'm so sorry for the drama this has caused',legislation,2016-08-24,1
touchscreen chip flaw renders some iphone 6 and 6 plus devices useless,law,2016-08-24,1
rio 2016: usa's latino medal winners showcased the best of america,legislation,2016-08-24,3
greater transparency around the arms trade would save countless lives,background,2016-08-24,2
mexican journalist wounded in mystery shooting by masked man,shooting,2016-08-24,1
investors controlling $13tn call on g20 leaders to ratify paris climate agreement,control,2016-08-24,2
greens say they won't back 'watered-down' superannuation changes,background,2016-08-25,1
war dogs review – gun runners jonah hill and miles teller off target,gun,2016-08-25,3
orlando shooting survivors won't have to pay for medical care,shooting,2016-08-25,1
three men seek answers after being arrested at gunpoint by kent police,gun,2016-08-25,2
cocks not glocks: texas students carry dildos on campus to protest gun law,gun,2016-08-25,1
cocks not glocks: texas students carry dildos on campus to protest gun law,law,2016-08-25,1
apple co-founder: ditching iphone 7 headphone jack would tick people off,automatic,2016-08-25,2
"pharrell williams, robin thicke and ti launch appeal against blurred lines verdict",legislation,2016-08-25,3
"pharrell williams, robin thicke and ti launch appeal against blurred lines verdict",shooting,2016-08-25,3
"pharrell williams, robin thicke and ti launch appeal against blurred lines verdict",automatic,2016-08-25,3
turnbull says arguments against race hate speech law 'strong' but no plans to change,law,2016-08-25,1
lack of uk law requiring lifeguards on all beaches means 'varied presence',law,2016-08-26,1
"politicians fuelled rise in hate crimes after brexit vote, says un body",gun,2016-08-26,2
"politicians fuelled rise in hate crimes after brexit vote, says un body",background,2016-08-26,2
"traingate, divorce laws and dodgy bakes – guardian social as it happened",law,2016-08-26,2
back to sleep: the doctor who helped stem a cot death epidemic,background,2016-08-26,1
pro-corbyn union leader threatens legal action over labour suspension,legislation,2016-08-26,2
trump campaign chief may have violated election law,law,2016-08-26,2
virtual reality gets starring role at venice film festival,control,2016-08-27,2
a clear strategy on tall buildings is the only way to control developers,control,2016-08-27,3
"chicago police shootings: data reveals 92 deaths and 2,623 bullets fired",shooting,2016-08-27,2
northern territory election: michael gunner claims victory for labor – as it happened,gun,2016-08-27,2
"tighter background checks for guns favored by trump backers, survey finds",background,2016-08-27,2
"tighter background checks for guns favored by trump backers, survey finds",check,2016-08-27,2
"tighter background checks for guns favored by trump backers, survey finds",gun,2016-08-27,2
northern territory election: adam giles and michael gunner make final pitches to voters,gun,2016-08-27,2
johanna konta keeps emotions in check before tough start to us open,check,2016-08-28,3
athletic bilbao 0-1 barcelona: la liga – as it happened!,law,2016-08-28,2
athletic bilbao 0-1 barcelona: la liga – as it happened!,legislation,2016-08-28,2
coalition rejects labor's call for media ownership review before changing laws,law,2016-08-28,2
medical professionals who back owen smith for the labour party leadership,background,2016-08-28,2
"fsa: 4,000 major breaches of animal welfare laws at uk abattoirs in two years",law,2016-08-28,2
"britain's biggest shooting lobby riven by infighting, leak reveals",shooting,2016-08-28,2
sallie krawcheck on her wall street ascent – and how to 'attack the boys' club',check,2016-08-28,2
airline passengers have had too much of a good thing over delay payouts,shooting,2016-08-28,2
queensland aims to change bikie laws to ban logos from being worn in public,law,2016-08-28,2
northern territory: michael gunner seeks urgent briefing on juvenile detention,gun,2016-08-28,2
turnbull contradicts abbott's claim coalition isn't in control of budget repair,control,2016-08-28,1
nate parker on rape controversy: 'i never thought about consent as a definition',control,2016-08-29,1
kyle edmund stuns richard gasquet in straight sets in us open first round,background,2016-08-29,3
noisy neighbours leganés give atlético blues to take back corner of madrid,background,2016-08-29,2
un pays tens of millions to assad regime under syria aid programme,gun,2016-08-29,3
un pays tens of millions to assad regime under syria aid programme,background,2016-08-29,3
how assad regime controls un aid intended for syria's children,control,2016-08-29,2
how assad regime controls un aid intended for syria's children,gun,2016-08-29,2
how assad regime controls un aid intended for syria's children,background,2016-08-29,2
timor-leste urges australia 'not to turn its back on law' over maritime boundary,background,2016-08-29,2
timor-leste urges australia 'not to turn its back on law' over maritime boundary,law,2016-08-29,2
"new band of the week: pavo pavo (no 117) wistful, retro pop harks back to the 70s",background,2016-08-29,1
gunner's artillery: the new faces behind labor's landslide in the northern territory,gun,2016-08-29,2
victoria review – jenna coleman goes back in time to become a future queen,background,2016-08-29,2
corbyn ally calls for mps' expenses to be paid automatically,automatic,2016-08-30,2
police push to fire officers involved in fatal shooting of laquan mcdonald,shooting,2016-08-30,2
'nightlife is still alive and well': do critics have it wrong on sydney's lockout laws?,law,2016-08-30,3
the guardian view on the un aid mission in syria: access at a high price,gun,2016-08-30,2
the guardian view on the un aid mission in syria: access at a high price,background,2016-08-30,2
un must act over chemical weapons in syria,gun,2016-08-30,2
un must act over chemical weapons in syria,background,2016-08-30,2
apple to shareholders: order to pay back $14.5bn in taxes ‘will be overturned’,background,2016-08-30,2
dressing while female: a semi-definitive guide to exercising sartorial safety,semi,2016-08-30,2
apple ordered to pay €13bn after eu rules ireland broke state aid laws,law,2016-08-30,2
un under pressure to set up inquiry into syria aid programme,gun,2016-08-30,2
un under pressure to set up inquiry into syria aid programme,background,2016-08-30,2
unpaid eu back taxes cost apple billions,background,2016-08-30,2
sounds of summer: readers' festival experiences from around the world,background,2016-08-30,2
why my company is handing homecare contracts back to councils,background,2016-08-30,2
north korea executes officials with anti-aircraft gun in new purge – report,gun,2016-08-30,2
australian-sponsored counter-terrorism guide says military action partly to blame,legislation,2016-08-30,2
website hosting explicit images of australian schoolgirls back online,shooting,2016-08-30,2
website hosting explicit images of australian schoolgirls back online,background,2016-08-30,2
johanna konta collapses in heat but recovers to reach us open third round,background,2016-08-31,1
shooting deaths of sea otters in california prompt investigation,shooting,2016-08-31,1
predictive policing practices labeled as 'flawed' by civil rights coalition,law,2016-08-31,2
man dies after speedboat spotted ‘out of control’ off welsh coast,control,2016-08-31,2
weak eurozone inflation raises prospect of ecb action - as it happened,legislation,2016-08-31,1
weak eurozone inflation raises prospect of ecb action - as it happened,legislation,2016-08-31,1
cabinet signals controlling migration to take precedence over single market access in brexit talks - politics live,control,2016-08-31,1
police failing to use new law against coercive domestic abuse,law,2016-08-31,1
samsung delays shipments of galaxy note 7 for quality control testing,control,2016-08-31,3
de la soul – 10 of the best,law,2016-08-31,3
de la soul – 10 of the best,legislation,2016-08-31,3
wildfires beware: boeing patents giant bullet to shoot down blazes,shooting,2016-08-31,2
"amy schumer review – sex, neuroses and gun control from a sure-footed star",gun,2016-08-31,1
"amy schumer review – sex, neuroses and gun control from a sure-footed star",control,2016-08-31,1
la la land review: ryan gosling and emma stone shine in a sun-drenched musical masterpiece,law,2016-08-31,3
la la land review: ryan gosling and emma stone shine in a sun-drenched musical masterpiece,legislation,2016-08-31,3
la la land review: ryan gosling and emma stone shine in a sun-drenched musical masterpiece,law,2016-08-31,3
la la land review: ryan gosling and emma stone shine in a sun-drenched musical masterpiece,legislation,2016-08-31,3
"no staying in the eu by the back door, says theresa may",background,2016-08-31,1
andy murray beats lukáš rosol: us open first round – as it happened,background,2016-08-31,3
nick kyrgios beats aljaz bedene: us open tennis first round – as it happened,background,2016-08-31,2
police investigate antisemitic and homophobic online abuse targeting mp,semi,2016-09-01,2
smith & wesson profits jumped almost 50% after orlando and dallas shootings,shooting,2016-09-01,2
james vince scores 60 for hampshire but champions yorkshire take control,control,2016-09-01,3
mps back plan to force global firms to publicly disclose income and tax,background,2016-09-01,2
"trump echoes mexican president, says lax us gun laws help arm drug cartels",gun,2016-09-01,2
"trump echoes mexican president, says lax us gun laws help arm drug cartels",law,2016-09-01,2
the un is impartial in syria as it is elsewhere,gun,2016-09-01,1
the un is impartial in syria as it is elsewhere,background,2016-09-01,1
