headlines,terms,dates,scores
self-control by stig saeterbakken – review,control,2012-10-20,2
pay drivers take a back seat in f1's race for financial supremacy,background,2012-10-20,2
gaddafi's last moments: 'i saw the hand holding the gun and i saw it fire',gun,2012-10-20,2
guidance on abuse set to be cut back,background,2012-10-21,2
wisconsin police seek gunman as multiple injuries reported at spa,gun,2012-10-21,2
bani walid protesters storm libyan parliament grounds,background,2012-10-21,2
"uk risks undermining human rights legislation, europe's top judge warns",legislation,2012-10-21,1
sarah silverman and me: fact-checking us politics – the fun way,check,2012-10-22,2
daily crises hint at deeper flaws inside david cameron's machine,law,2012-10-22,2
"it's location, location, location for david cameron's rehabilitation nation",legislation,2012-10-22,2
donald trump lawyers tried to stop bbc showing scottish bullying film,law,2012-10-22,2
malawi oil: a blessing or a curse?,law,2012-10-22,2
it's not just energy prices – private markets are failing all around us,background,2012-10-22,1
how to use social media to win new business - q&a roundup,background,2012-10-22,1
"boot up: android apps' ssl flaw, gangnam hitler, bezos's advice, rim v nokia and more",law,2012-10-22,1
tories bow to european court of human rights over prisoner voting rights,shooting,2012-10-23,1
syria crisis: un mulls peacekeepers but ceasefire hopes fade - tuesday 23 october 2012,gun,2012-10-23,1
syria crisis: un mulls peacekeepers but ceasefire hopes fade - tuesday 23 october 2012,background,2012-10-23,1
can law firms with offices in saudi arabia take women's rights seriously?,law,2012-10-23,2
north east's first asbo man back in court for 116th conviction,background,2012-10-23,2
mark duggan shooting: police watchdog's report delayed further,shooting,2012-10-23,1
obama v romney: around the world in 90 minutes,background,2012-10-23,2
bob schieffer's muted moderator role in final us presidential debate,control,2012-10-23,1
sofyen belamouadden killing: final conviction over victoria station death,legislation,2012-10-24,1
le francais adore ... la france? minister flies flag and says buy french,legislation,2012-10-24,2
le francais adore ... la france? minister flies flag and says buy french,law,2012-10-24,2
le francais adore ... la france? minister flies flag and says buy french,legislation,2012-10-24,2
united action is needed to protect the european science budget,legislation,2012-10-24,2
uk urges iran to release human rights lawyer on hunger strike,law,2012-10-24,2
school reforms offer wide range and high hopes to children from all backgrounds,background,2012-10-24,3
prisoner voting row and pmqs: politics live blog,shooting,2012-10-24,2
trinity mirror could face two more lawsuits over alleged phone hacking,law,2012-10-24,2
victoria station killing: man convicted over sofyen belamouadden death,legislation,2012-10-24,2
pakistan taliban threaten another child activist after malala shooting,shooting,2012-10-24,2
"change law that puts children in jail for minor offences, says report",law,2012-10-24,1
"prisoner voting ruling from strasbourg must be followed, says attorney general",shooting,2012-10-24,3
northern ireland: larkin with the law,law,2012-10-25,2
un to investigate civilian deaths from us drone strikes,gun,2012-10-25,2
un to investigate civilian deaths from us drone strikes,background,2012-10-25,2
"matthew e white (no 1,380)",legislation,2012-10-25,2
"matthew e white (no 1,380)",check,2012-10-25,2
"matthew e white (no 1,380)",semi,2012-10-25,2
junior achievement puts teens' business ideas into action,legislation,2012-10-25,3
malawian former presidential aide arrested over student activist's murder,law,2012-10-25,2
cat on a hot tin roof stars answer your questions,shooting,2012-10-25,2
"the threat to local government's heroic, civilising role",control,2012-10-25,2
john everett millais portrait of charles dickens's daughter up for auction,legislation,2012-10-25,2
tom cruise sues magazines for $50m over claims he abandoned suri,automatic,2012-10-25,1
british soldier and royal marine die in gunfight with afghan police officer,gun,2012-10-25,1
the victoria station killing verdict and the perils of applying joint enterprise,legislation,2012-10-25,2
gun on the table taught emanuel steward how to make a deal in boxing,gun,2012-10-26,2
ken clarke hits back over secret courts,background,2012-10-26,2
budget cuts could downgrade uk rights watchdog's un status,gun,2012-10-26,3
budget cuts could downgrade uk rights watchdog's un status,background,2012-10-26,3
gay jamaicans launch legal action over island's homophobic laws,legislation,2012-10-26,2
gay jamaicans launch legal action over island's homophobic laws,law,2012-10-26,2
reader reviews roundup,background,2012-10-26,2
arnold schwarzenegger to reprise his role as conan the barbarian,control,2012-10-26,2
"iran military action not 'right course at this time', downing street says",legislation,2012-10-26,1
shooting top nazis? the nuremberg option wasn't apple pie either,shooting,2012-10-26,2
lawyers struggle to take commercial advantage of social media,law,2012-10-26,2
learning to be an employer – q&a roundup,background,2012-10-26,2
david laws: teachers are failing pupils,law,2012-10-26,2
"uk aid to iran's war on drugs has led to rise in hangings, un warns",gun,2012-10-27,2
"uk aid to iran's war on drugs has led to rise in hangings, un warns",background,2012-10-27,2
rewind radio: the real rachman; law in action; victoria derbyshire – review,law,2012-10-27,2
rewind radio: the real rachman; law in action; victoria derbyshire – review,legislation,2012-10-27,2
gardens: the november checklist,check,2012-10-27,2
barclay brothers close in on control of claridge's hotel,control,2012-10-27,2
media navel-gazing prompted by savile scandal will not help us win back trust,background,2012-10-27,1
florida residents find long lines as early voting begins on lengthy ballot,shooting,2012-10-27,1
florida's progressive education reform a model for the nation – and obama,legislation,2012-10-27,2
french alps shooting: call for children to be returned to family,shooting,2012-10-28,2
how families on both sides of the law face tough choices in somalia,law,2012-10-28,2
prisoners to launch legal action on voting rights,legislation,2012-10-28,2
prisoners to launch legal action on voting rights,shooting,2012-10-28,2
"leveson inquiry should not lead to tough new press laws, says eric pickles",law,2012-10-28,1
"bob diamond should explain libor role in court, says judge",control,2012-10-29,2
why i'm occupying a gas-fired power station chimney,legislation,2012-10-29,2
nick clegg attacks philip hammond for 'jumping the gun' on trident,gun,2012-10-29,2
mark clattenburg: high flyer who courted controversy on and off field,control,2012-10-29,2
the auditors explain their role,control,2012-10-29,2
investing in locally controlled forestry is a triple win,control,2012-10-29,3
luis suárez denied as everton battle back to draw with liverpool,background,2012-10-29,2
premier league: 10 talking points from this weekend's action,legislation,2012-10-29,2
la galaxy 1-0 seattle sounders - as it happened,law,2012-10-29,3
la galaxy 1-0 seattle sounders - as it happened,legislation,2012-10-29,3
a roll call of corporate rogues who are milking the country,control,2012-10-30,2
ubs trader admits losing control over billion pound deals,control,2012-10-30,1
man in afghan police uniform shoots two british soldiers dead,shooting,2012-10-30,2
"qatari sheikh must not approve media law, says human rights group",law,2012-10-30,1
wisconsin takes on added urgency in test of candidates' ground campaigns,background,2012-10-31,2
even a superstorm is no excuse for journalists not to check twitter trolling,check,2012-10-31,1
yunus rahmatullah's unlawful detention? uk should have tried harder,law,2012-10-31,2
christmas toys 2012: furbys and twister take parents back to the future,background,2012-10-31,2
uk supreme court says rendition of pakistani man was unlawful,law,2012-10-31,2
romney back on the campaign trail as obama visited sandy victims - us politics live,background,2012-10-31,1
live debate: the changing role of trustees and charity boards,control,2012-10-31,2
the voluntary sector has a role to play in reducing bme mental health detentions,control,2012-10-31,2
pakistan and indonesia's blasphemy laws have no basis in the qur'an,law,2012-11-01,2
northern ireland prison officer ambush prompts fears of sectarian shooting war,shooting,2012-11-01,2
my part in the office tea round's downfall,background,2012-11-01,2
pest control: why the bugs are winning,control,2012-11-02,3
campaigns mobilise lawyers for legal ground game in election's swing states,law,2012-11-02,2
campaigns mobilise lawyers for legal ground game in election's swing states,background,2012-11-02,2
cashflow: boyd & co,control,2012-11-02,2
"tate takes on africa, and life beyond rolf harris – the week in art",control,2012-11-02,2
la galaxy 2-1 vancouver whitecaps - as it happened,law,2012-11-02,2
la galaxy 2-1 vancouver whitecaps - as it happened,legislation,2012-11-02,2
can i claim back premiums for unnecessary life cover?,background,2012-11-03,2
retiring? it'll pay to check the new annuity rules first,check,2012-11-03,2
play it again: wandering back down fa cup's memory lane,background,2012-11-03,1
univision: the spanish-language station providing a 'voice for the voiceless',legislation,2012-11-03,2
us election officials scrutinise florida as governor curbs early voting,shooting,2012-11-03,2
new york's lights come back on but gas and transit woes continue for region,background,2012-11-03,3
a cure for america's corruptible voting system,shooting,2012-11-03,2
leeds united fight back to earn a fortunate point at brighton,background,2012-11-03,2
one law for macshane and another for laws,law,2012-11-04,2
one law for macshane and another for laws,law,2012-11-04,2
mitt romney's bid to close gap with latino voters finds lukewarm success,legislation,2012-11-04,3
florida's latino politics shaken up as puerto ricans shift the ground,legislation,2012-11-04,2
florida's latino politics shaken up as puerto ricans shift the ground,background,2012-11-04,2
qpr battle back to draw with reading but result leaves both in trouble,background,2012-11-04,1
noisy neighbours may be protected by new law to stop council snooping,law,2012-11-04,1
lone frank: find out what makes you tick,automatic,2012-11-04,2
malawi suspends anti-gay laws as mps debate repeal,law,2012-11-05,2
malawi suspends anti-gay laws as mps debate repeal,law,2012-11-05,2
texas democrats cry foul over 'power grab' to suppress latino vote,legislation,2012-11-05,1
"anti-guns campaigner pat regan was killed by grandson, court hears",gun,2012-11-05,2
tory child sex abuse ring claim: cameron races to control scandal,control,2012-11-05,2
glasgow police officer killed in shooting incident at station,shooting,2012-11-05,2
glasgow police officer killed in shooting incident at station,legislation,2012-11-05,2
bayern munich back on track after thomas müller's wonder strike,background,2012-11-05,2
mia looks back to go forward : 'i'm making space for new thoughts',background,2012-11-05,2
"jimmy savile scandal: bbc, star's estate and hospitals face 43 lawsuits",law,2012-11-05,1
la galaxy 0-1 san jose earthquakes - as it happened,law,2012-11-05,2
la galaxy 0-1 san jose earthquakes - as it happened,legislation,2012-11-05,2
law firms' proudest pro bono moments of 2012,law,2012-11-06,2
"tom odell (no 1,388)",automatic,2012-11-06,2
live q&a: how to get the most out of law fairs,law,2012-11-06,2
"library closures may be unlawful, says commons select committee",law,2012-11-06,2
bornean orangutan rescued with 104 air gun pellet wounds – in pictures,gun,2012-11-06,2
"roll up, roll up! it's the travelling leveson debating circus",control,2012-11-06,2
"roll up, roll up! it's the travelling leveson debating circus",control,2012-11-06,2
