headlines,terms,dates,scores
shooting lobby's outcry as animal activists label gun magazines 'porn',shooting,2012-09-15,1
shooting lobby's outcry as animal activists label gun magazines 'porn',gun,2012-09-15,1
historian uncovers her family link to secret nazi's role in the holocaust,control,2012-09-15,2
john saturnall's feast by lawrence norfolk – review,law,2012-09-15,2
tawdry pictures. but kate's role is itself demeaning,control,2012-09-15,2
vince cable should stop signing away workers' rights by the back door,background,2012-09-15,1
round up: what does the social value act mean for councils?,background,2012-09-15,2
secret justice: back to black,background,2012-09-16,2
ipcc investigate after man with shotgun injured in police shootout,gun,2012-09-16,2
iran confirms it has forces in syria and will take military action if pushed,legislation,2012-09-16,2
the west must be honest about its role in libya's violent chaos,control,2012-09-16,3
learning with roald dahl: news and resources round up,background,2012-09-16,2
kate photos row shows just how difficult it is to enforce a privacy law,law,2012-09-17,2
employment law reforms are licence to treat people badly - and still pay less,law,2012-09-17,2
uk arms exports 'should be checked first by mps',check,2012-09-17,2
obama takes on china with formal trade complaint over auto subsidies,automatic,2012-09-17,2
police officers 'lured to their deaths' in gun and grenade attack,gun,2012-09-18,2
'high value' air passengers may get fast-track passport checks,check,2012-09-18,2
ac grayling's private university to open with just 60 students,background,2012-09-18,2
kate and william win first round in battle over topless photos,background,2012-09-18,2
two police officers killed in greater manchester shooting,shooting,2012-09-18,2
voter id laws and roll purges are the real defrauding of us democracy,law,2012-09-18,2
voter id laws and roll purges are the real defrauding of us democracy,control,2012-09-18,2
kindle's english language teaching role 're-examined',control,2012-09-18,2
strasbourg judges rule indeterminate sentences unlawful,law,2012-09-18,2
nato afghan strategy in disarray after joint ground operations suspended,background,2012-09-18,2
microsoft warns of new zero-day flaw targeting internet explorer,law,2012-09-18,1
juventus steal spotlight from oscar's early starring role for chelsea,control,2012-09-19,2
manchester police shootings: grenades may be from former yugoslavia,shooting,2012-09-19,2
badger activists map setts and get ready for all-out fight to stop the cull guns,gun,2012-09-19,1
ann romney's campaign role gets muddled as election creeps to an end,control,2012-09-19,1
manchester police shootings: second man arrested,shooting,2012-09-19,2
manchester shootings: was there a 'criminal conspiracy' to shelter suspect?,shooting,2012-09-19,2
police shootings: nick clegg cautions against arming officers,shooting,2012-09-19,2
proper self-regulation works better than the law to protect privacy,law,2012-09-19,3
scientology lawyer calls vanity fair 'bigoted' over tom cruise article,law,2012-09-19,2
scientology lawyer calls vanity fair 'bigoted' over tom cruise article,automatic,2012-09-19,2
police shootings suspect dale cregan had been released on bail,shooting,2012-09-19,2
europe is still the closest thing to paradise on earth,shooting,2012-09-19,2
police shootings: nicola hughes's family pay tribute to 'loving girl',shooting,2012-09-19,2
"eu legislators aim for tougher law on oil, gas and mining payments",legislation,2012-09-19,2
"eu legislators aim for tougher law on oil, gas and mining payments",law,2012-09-19,2
one in five supergroup shareholders refuse to back re-election of co-founder,background,2012-09-20,2
samsung set to add apple's iphone 5 to its lawsuits alleging patent infrigement,law,2012-09-20,2
why tom daley shouldn't take the plunge into film,automatic,2012-09-20,2
will police reforms lead to a perfect law and order storm?,law,2012-09-20,2
police shootings prove contempt laws are not fit for purpose,shooting,2012-09-20,2
police shootings prove contempt laws are not fit for purpose,law,2012-09-20,2
bbc pulls final episode of good cop after manchester police shootings,shooting,2012-09-20,3
"demba ba could still leave newcastle in january, admits alan pardew",background,2012-09-20,2
when builders go bust: planning laws a reminder to protect your project,law,2012-09-21,1
motorholme hire reveals need to check t&cs before payment,check,2012-09-21,2
french and uk police join forces to speed up progress in alps shooting case,shooting,2012-09-21,3
universal chief: emi sell-offs won't halt £100m cost savings,semi,2012-09-21,2
nigerian court jails actor for homosexuality under colonial law,law,2012-09-21,2
where does publicly-funded law fit into the new world of tesco law?,law,2012-09-21,2
where does publicly-funded law fit into the new world of tesco law?,law,2012-09-21,2
what happens to law graduates caught out in the paralegal cold?,law,2012-09-21,1
gutka! delhi government to outlaw popular chewing tobacco,law,2012-09-21,2
battery-farmed puppies are a shame on our nation,legislation,2012-09-21,1
emi chief executive roger faxon's email to staff,semi,2012-09-21,2
universal's £1.2bn emi takeover approved – with conditions,semi,2012-09-21,1
us hits back at kremlin over aid agency closure,background,2012-09-21,2
fan ownership: how we took control of our football club,control,2012-09-21,2
green shoots of recovery? the search continues as autumn approaches,shooting,2012-09-22,2
lib dems back boundary changes revolt,background,2012-09-22,2
the relaxation of cannabis laws shows the failure of the war on drugs,law,2012-09-22,1
the terrible thing that happened to barnaby brocket  by john boyne - review,shooting,2012-09-22,1
the liberal democrat conference has given fantasy a leading role,control,2012-09-23,2
"justice and security bill: this is a dangerous, spurious law",law,2012-09-23,3
libya: militias bite back,background,2012-09-24,2
muse – the 2nd law: exclusive album stream,law,2012-09-24,2
the kernel faces legal action by two more former contributors,legislation,2012-09-24,2
premier league: 10 talking points from this weekend's action,legislation,2012-09-24,2
protests in houston after police shoot unarmed man in wheelchair,shooting,2012-09-25,2
frank gardner: journalist in queen row who survived saudi arabia shooting,shooting,2012-09-25,2
syria's civil war: how saying the wrong thing can get you tortured,shooting,2012-09-25,1
obama uses un speech to condemn extremism,gun,2012-09-25,2
obama uses un speech to condemn extremism,background,2012-09-25,2
mahmoud ahmadinejad criticised in iran over size of un entourage,gun,2012-09-25,2
mahmoud ahmadinejad criticised in iran over size of un entourage,background,2012-09-25,2
"uk aid under scrutiny, snapshots of city life, and malawi's battle against hunger",law,2012-09-25,1
president obama's speech to the un general assembly – full transcript,gun,2012-09-25,2
president obama's speech to the un general assembly – full transcript,background,2012-09-25,2
the african-american debate on voting rights,shooting,2012-09-25,2
kenyan amisom peacekeeper held after 'shooting dead six somali civilians',shooting,2012-09-25,2
tech weekly podcast: gesture control technologies,control,2012-09-25,2
is michael jackson's abortion papers controversial? let's look at his work,control,2012-09-25,2
iran tightens online control by creating own network,control,2012-09-25,2
children travelling abroad alone: the safety checks that need to be in place,check,2012-09-25,2
"afghans want peace, but they are caught between forces they can't control",control,2012-09-25,3
david cameron attacks un for inaction on syria,gun,2012-09-26,2
david cameron attacks un for inaction on syria,background,2012-09-26,2
un meeting on the rule of law was just another day of talk,gun,2012-09-26,2
un meeting on the rule of law was just another day of talk,background,2012-09-26,2
un meeting on the rule of law was just another day of talk,law,2012-09-26,2
lib dems reject relaxation of planning laws,law,2012-09-26,2
looting and the dunkirk spirit - two different faces of the northern floods,shooting,2012-09-26,3
police marksman was 'absolutely certain' mark duggan was holding gun,gun,2012-09-26,2
"download, print, fire: gun rights initiative harnesses 3d technology",gun,2012-09-26,2
iranian president takes last stand at un,gun,2012-09-26,2
iranian president takes last stand at un,background,2012-09-26,2
van morrison: born to sing: no plan b – review,background,2012-09-27,2
first squatter jailed under new law,law,2012-09-27,2
shooting sharks: on the set of spielberg's jaws - in pictures,shooting,2012-09-27,2
banknotes reflect glory of nation state,legislation,2012-09-27,3
shooting gallery: artists turn guns into artworks,shooting,2012-09-27,2
shooting gallery: artists turn guns into artworks,gun,2012-09-27,2
john terry guilty and jack wilshere back,background,2012-09-27,2
muse: the 2nd law – review,law,2012-09-27,2
how lawmakers and lobbyists keep a lock on the private prison business,law,2012-09-27,2
"mali's humanitarian crisis may worsen if intervention calls heeded, un warned",gun,2012-09-27,1
"mali's humanitarian crisis may worsen if intervention calls heeded, un warned",background,2012-09-27,1
fox news carries live video of man shooting himself after car chase,shooting,2012-09-28,2
pro-choice activists target jeremy hunt over voting record on abortion rights,shooting,2012-09-28,2
syrian rebels in 'decisive battle for aleppo' as regime hits back in capital,background,2012-09-28,2
where are the customers' yachts? the lawyers have them,law,2012-09-28,2
philippines law threatens press freedom,law,2012-09-28,1
street fundraising plays a vital role in getting charities the funds they need,control,2012-09-28,2
muse: the 2nd law – review,law,2012-09-29,2
"the abuse of children was sickening, but british pakistanis are fighting back",background,2012-09-29,1
london welsh back on song as familiarity breeds content,background,2012-09-29,2
ryder cup 2012: europe feel the pain as davis love's men take control,control,2012-09-29,2
brian claunch shooting intensifies pressure on houston police,shooting,2012-09-29,1
irish gun thefts spark fears of new ulster sniper campaign,gun,2012-09-29,2
cat on a hot tin roof: tennessee williams's southern discomfort,shooting,2012-09-30,1
labour's shiny toffs are taking control,control,2012-09-30,2
california banishes controversial 'gay cure' therapies to 'dustbin of quackery',control,2012-09-30,2
tv thriller homeland goes right back to the edge,background,2012-10-01,3
the income squeeze holding back the economy,background,2012-10-01,2
aurora shooting survivor wants obama and romney to debate gun control,shooting,2012-10-01,2
aurora shooting survivor wants obama and romney to debate gun control,gun,2012-10-01,2
aurora shooting survivor wants obama and romney to debate gun control,control,2012-10-01,2
so you want to be an international lawyer?,law,2012-10-01,2
community infrastructure levies and the law of unintended consequences,law,2012-10-01,2
failed asylum seekers in scotland living below un global poverty threshold,gun,2012-10-01,1
failed asylum seekers in scotland living below un global poverty threshold,background,2012-10-01,1
un report calls for action to fulfil potential of ageing global population,gun,2012-10-01,1
un report calls for action to fulfil potential of ageing global population,background,2012-10-01,1
un report calls for action to fulfil potential of ageing global population,legislation,2012-10-01,1
jimmy mcgovern pens bbc drama on joint enterprise law that can trap the innocent,law,2012-10-02,2
wiki weapon's plan to build printable 3d gun backfires,gun,2012-10-02,2
"ed miliband: one man, one nation",legislation,2012-10-02,2
"labour will introduce new laws against dishonest bankers, cooper to say",law,2012-10-02,1
calling media lawyers: the bench needs you,law,2012-10-02,1
cashflow: compliance control,control,2012-10-02,2
"can you legislate for responsible capitalism? yes, here's how",legislation,2012-10-02,2
controversial pennsylvania voter id photo requirement halted by judge,control,2012-10-02,2
gunmen open fire on students at nigerian university,gun,2012-10-02,2
"steve bell on law, order and andrew mitchell – cartoon",law,2012-10-03,2
democrats struggle to repeat 2008 voter surge despite registration push,legislation,2012-10-03,2
my favourite bond film: the man with the golden gun,gun,2012-10-03,3
louis vuitton: checks and balance at the palais du louvre,check,2012-10-03,2
are b corps redefining business for the 21st century?,background,2012-10-03,2
ed miliband denies playing class card in one nation speech,legislation,2012-10-03,2
not so tender: rail row reflects a flawed process,law,2012-10-04,1
obama hits back after debate dip and accuses romney of not telling the truth,background,2012-10-04,1
mitt romney etch-a-sketches himself back into the presidential race,background,2012-10-04,2
higher education policy: more than student number control and funding,control,2012-10-04,3
"miliband has fired the starting gun for 2015 election, says harriet harman",gun,2012-10-04,2
r (on the application of gujra) v cps - headnotes,control,2012-10-04,2
r (on the application of gujra) v cps - headnotes,background,2012-10-04,2
law students: 'and what else do i get with my masters?',law,2012-10-04,2
chelsea back ashley cole and dave barnard in john terry affair,background,2012-10-05,2
romney makes late play for centre ground after months stuck out right,background,2012-10-05,2
germany to introduce circumcision law,law,2012-10-05,2
"the jobs numbers: never mind the quantity, check the quality",check,2012-10-05,2
magnus carlsen suffers surprise check in advance to all-time high rating,check,2012-10-05,1
sport and development - discussion round up,background,2012-10-05,2
the joy of six: great boxing rounds,background,2012-10-05,3
ws atkins drops 4% after its role in west coast franchise fiasco,control,2012-10-05,1
small business accountancy advice clinic: q&a roundup,background,2012-10-05,2
un unanimously condemns syrian shelling of turkish town,gun,2012-10-05,2
un unanimously condemns syrian shelling of turkish town,background,2012-10-05,2
cat marnell interview: shooting star,shooting,2012-10-06,2
company law: root-and-branch reform is essential to the economy,law,2012-10-06,2
why does jeremy hunt want to turn the clock back on the abortion debate?,background,2012-10-06,2
california: latino vote 'makes a difference'. but do republicans care?,legislation,2012-10-06,3
latino texas: 'san antonio is a peek at the america of tomorrow',legislation,2012-10-06,2
top tips: managing the latest round of right-to-buy,background,2012-10-06,3
firstgroup may take legal action over west coast rail franchise,legislation,2012-10-07,2
branden grace leads from gun to tape to take dunhill links championship,gun,2012-10-07,3
florida latino voters: 'we don't think the government represents us',legislation,2012-10-07,2
medical marijuana advocates hope lawsuit relaxes us drugs policy,law,2012-10-07,3
ahmadi muslims in uk call for urgent action against hate,legislation,2012-10-07,1
teaching the turner prize and inspiring artworks: news and resources round up,background,2012-10-07,3
promises on libel law reform must be kept,law,2012-10-08,2
"mau mau veterans, law students and private prosecutions",law,2012-10-08,2
departing all saints founder hits back at private equity rescuers,background,2012-10-08,2
kony 2012 campaigner jason russell: 'i wasn't in control of my mind or body',control,2012-10-08,2
icancer: closing the net around cancer by getting the public involved,background,2012-10-08,1
why we can't bank on recessions to keep global warming in check,check,2012-10-08,1
christian bale signs back on for david o russell conman film,background,2012-10-08,2
premier league: 10 talking points from this weekend's action,legislation,2012-10-08,2
jaw-jaw and law-law: freedom of speech online,law,2012-10-09,2
is office harassment really a thing of the past?,shooting,2012-10-09,2
mexican navy shoots dead brutal drug cartel leader – but body goes missing,shooting,2012-10-09,1
colombian bullfight spins violently out of control - video,control,2012-10-09,1
"megacities rise, fertile land lies idle, and the un calls for action on ageing",gun,2012-10-09,2
"megacities rise, fertile land lies idle, and the un calls for action on ageing",background,2012-10-09,2
"megacities rise, fertile land lies idle, and the un calls for action on ageing",legislation,2012-10-09,2
goths make a comeback as fashion goes back to black,background,2012-10-09,2
chris grayling's self-defence plans greeted with dismay by lawyers,law,2012-10-09,1
david cameron on right to defend home law - video,law,2012-10-09,2
letter says public interest defence is vital in reformed libel law,law,2012-10-09,2
tories go back to basics on right to defend home,background,2012-10-09,2
cat on a hot tin roof – review,shooting,2012-10-10,2
supreme court conservatives express doubts over texas affirmative action,legislation,2012-10-10,2
romney's 'softened' abortion comments put campaign back on defensive,background,2012-10-10,2
technology's role in scaling up sustainability: saviour or destroyer?,control,2012-10-10,2
back to the 1980s: the rising tide of bed and breakfast accommodation,background,2012-10-10,2
16-year-old bystander wounded in dublin drive-by shooting,shooting,2012-10-10,1
"student activist was murdered, malawian inquiry rules",law,2012-10-10,2
affirmative action back before the supreme court,legislation,2012-10-10,2
affirmative action back before the supreme court,background,2012-10-10,2
malala yousafzai has bullet removed from head after taliban shooting,shooting,2012-10-10,2
nhs reforms should give patients more power and control,control,2012-10-10,2
malala yousafzai: pakistan taliban causes revulsion by shooting girl who spoke out,shooting,2012-10-10,1
nick clegg announces support for new transparency law,law,2012-10-11,2
met police try to block film in trial over fatal shooting of suspect,shooting,2012-10-11,1
"'lf i had a gun, i'd shoot her': how violence could save the x factor",gun,2012-10-11,1
"'lf i had a gun, i'd shoot her': how violence could save the x factor",shooting,2012-10-11,1
acting ethically and within the law,law,2012-10-11,2
lance armstrong case: uci faces questions over role in doping scandal,control,2012-10-11,1
fairground attraction: shoot! existential photography exhibition – in pictures,shooting,2012-10-11,2
nhs quality does not mean central control,control,2012-10-11,1
toni kroos completes germany's rout of republic of ireland in group c,control,2012-10-12,2
toni kroos completes germany's rout of republic of ireland in group c,background,2012-10-12,2
toni kroos completes germany's rout of republic of ireland in group c,check,2012-10-12,2
toni kroos completes germany's rout of republic of ireland in group c,automatic,2012-10-12,2
jimmy savile's broadmoor role came with a bedroom and keys,control,2012-10-12,2
critical eye: book review roundup,background,2012-10-12,2
malala yousafzai: 'fatwa' issued against gunmen,gun,2012-10-12,2
french alps shooting: photographs taken minutes before murders,shooting,2012-10-12,2
tom wood: the people's maverick photographer,automatic,2012-10-12,2
future of law: big brands and alternative business structures,law,2012-10-12,1
loaded gun and drugs found on nelly's tour bus,gun,2012-10-12,2
is there a life outside the lecture theatre for law students?,law,2012-10-12,2
world cup qualifiers: amy lawrence answered your questions,law,2012-10-12,2
top retailers face oft action over online services,legislation,2012-10-12,2
rise of lapdancing clubs is checked as spearmint rhino runs up a loss of £2m,check,2012-10-13,1
uk must champion aviation industry if it wants control of the skies,control,2012-10-13,3
new eu biofuels law could be last straw for farmers hit by wet weather and rising costs,law,2012-10-13,3
fidel castro and hugo chávez played role in colombia's peace talks with farc,control,2012-10-13,3
turkey calls for un security council reform over failure to pressure syria,gun,2012-10-13,1
turkey calls for un security council reform over failure to pressure syria,background,2012-10-13,1
case for drug decriminalisation rests on failure of 40-year-old law,legislation,2012-10-14,1
case for drug decriminalisation rests on failure of 40-year-old law,law,2012-10-14,1
theresa may takes first step to opting out of eu law and order measures,shooting,2012-10-14,2
theresa may takes first step to opting out of eu law and order measures,law,2012-10-14,2
imran khan says taliban's 'holy war' in afghanistan is justified by islamic law,law,2012-10-14,2
"various items: free speech v 'community', lawlessness in libya, sprawling surveillance state",law,2012-10-14,2
maternity leave law has problems that won't be solved by adding dads,law,2012-10-14,1
scottish independence: the other one nation debate,legislation,2012-10-15,2
malala yousafzai arrives at special gunshot unit in british hospital,gun,2012-10-15,2
how we made: joy whitby and phyllida law on play school,law,2012-10-15,1
"northern ireland loyalist shootings: one night of carnage, 18 years of silence",shooting,2012-10-15,1
candy crowley's role in debate questioned by romney and obama,control,2012-10-15,2
don't be afraid to complain about your lawyer says legal ombudsman,law,2012-10-15,1
frieze 2012 and the contemporary art fair: a good or bad thing for artists?,shooting,2012-10-15,1
rspb lodges eu complaint over walshaw moor controversy,control,2012-10-15,2
opting out of eu policing would be tory euroscepticism gone mad,shooting,2012-10-15,1
france's olivier giroud levels in last minute to put spain in jeopardy,background,2012-10-16,2
supreme court denies request to suspend early voting in ohio,shooting,2012-10-16,2
inflation falls dramatically but there's only one way it is going – up,legislation,2012-10-16,1
trayvon martin's parents launch fund to fight stand-your-ground laws,law,2012-10-16,2
gary mckinnon: theresa may had no choice but to use human rights grounds,background,2012-10-16,1
big fat gypsy weddings: c4 chief 'can't recall' seeing controversial ad,control,2012-10-16,2
"l'impressionnisme et la mode, musée d'orsay, paris",law,2012-10-16,2
"l'impressionnisme et la mode, musée d'orsay, paris",legislation,2012-10-16,2
colonial case lawyers fear secret courts plan,law,2012-10-16,2
syria and the battle for regional control,control,2012-10-16,2
"to hear your community, you need to turn down the background noise",background,2012-10-16,2
new york mayor sets up super pac to support issues including gun control,gun,2012-10-17,1
new york mayor sets up super pac to support issues including gun control,control,2012-10-17,1
how europe spun out of control after the greek debt crisis – timeline,control,2012-10-17,1
presidential debate: fact-checking obama and romney's key claims,check,2012-10-17,2
'binders full of women' reconsider voting for mitt romney,shooting,2012-10-17,2
volcker says banking ringfence is flawed,law,2012-10-17,1
do lawyers scare you?,law,2012-10-17,2
jury fail to reach verdict in trial of man in mark duggan gun case,gun,2012-10-17,1
palestinians urged by britain to delay 'non-member state' bid at un,gun,2012-10-17,2
palestinians urged by britain to delay 'non-member state' bid at un,background,2012-10-17,2
obama and romney evade gun control commitment at hofstra debate,gun,2012-10-17,2
obama and romney evade gun control commitment at hofstra debate,control,2012-10-17,2
who controls the internet?,control,2012-10-17,2
liberal  democrats in scotland propose 'home rule all round',background,2012-10-17,2
corsica lawyer antoine sollacaro assassinated in ajaccio,law,2012-10-17,2
free education from political meddling and hand control to teachers,control,2012-10-17,2
france looks to eu transparency law to help lift the 'resource curse',law,2012-10-17,2
how to bring back ward rounds,background,2012-10-17,2
how to bring back ward rounds,background,2012-10-17,2
former army lawyer urges end of 'state torture' to prevent future abuses,law,2012-10-18,2
mitt romney's advice to business leaders on employee voting – it's legal,shooting,2012-10-18,2
proposition 36 promises an end to california's punitive three strikes law,law,2012-10-18,2
uk complicity in unlawful treatment of iraqi detainees 'was institutional',law,2012-10-18,2
round up: procurement capability,background,2012-10-18,2
taliban target media critical of malala's shooting,shooting,2012-10-18,1
"uk wildlife crime laws a mess, mps say",law,2012-10-18,1
sex & drugs & rock & roll ...  and me,control,2012-10-19,2
cometh the hour: the series that brings the 1950s bbc back to life,background,2012-10-19,2
et cetera: non-fiction roundup – reviews,background,2012-10-19,2
"no humans shooting today, but plenty of other hunters crouching in wait",shooting,2012-10-19,1
women soldiers' role in afghan frontline villages caught on camera,control,2012-10-19,2
"scary lawyers, gary mckinnon and paying for law",law,2012-10-19,2
"scary lawyers, gary mckinnon and paying for law",law,2012-10-19,2
who controls the internet? highlights from live hangout with jemima kiss,control,2012-10-19,2
padfone's take of combining phone and tablet soon will be thing of the past,shooting,2012-10-19,2
i was eaten by zombies: an insider's guide to live action gaming,legislation,2012-10-19,2
law degree: so i want to be a lawyer ... how do i pay for it?,law,2012-10-19,2
law degree: so i want to be a lawyer ... how do i pay for it?,law,2012-10-19,2
why women fade into the background on wikipedia,background,2012-10-19,2
us businessman defends controversial geoengineering experiment,control,2012-10-19,1
police criticised for attempting to hide women's legal action,legislation,2012-10-19,2
the jordanian spring has begun,gun,2012-10-19,2
