headlines,terms,dates,scores
wade michael page named as temple gunman as fbi examines far-right links,gun,2012-08-06,2
wisconsin temple shooting: sikhs have been silent scapegoats since 9/11,shooting,2012-08-06,2
crop data gives drought-stricken farmers a leg up on getting by with less,legislation,2012-08-06,1
is studying law boring?,law,2012-08-06,1
wisconsin temple gunman identified as army veteran wade michael page,gun,2012-08-06,2
britain's lawrence okoye throws himself into the olympic discus final,law,2012-08-06,2
curiosity rover: nasa nerves turn to elation after perfect mars landing,legislation,2012-08-06,2
"egypt to impose 'full control' over sinai, says president",control,2012-08-06,2
london 2012: lawrence okoye's failure caps poor day for gb athletes,law,2012-08-07,1
london 2012: why phillips idowu was right to do his own thing,shooting,2012-08-07,3
indian relatives of sikh temple shooting victims mourn from half a world away,shooting,2012-08-07,2
gu kailai trial: china braced for global attention,gun,2012-08-07,2
wisconsin temple shooting police radio exchange – video,shooting,2012-08-07,2
jennifer lawrence set for $10m pay deal for hunger games sequel,law,2012-08-07,2
"roll up, roll up, buy your press card here...",control,2012-08-07,2
"roll up, roll up, buy your press card here...",control,2012-08-07,2
egypt: stung into action,legislation,2012-08-08,2
standard chartered shares rebound,background,2012-08-08,2
london 2012: gb hopes end in tears after controversial argentina goal,control,2012-08-08,2
six of the best law books,law,2012-08-08,3
apple and amazon patch security flaws exposed by hack heard round the world,law,2012-08-08,1
apple and amazon patch security flaws exposed by hack heard round the world,background,2012-08-08,1
olympic athletics: usain bolt back in action – as it happened,background,2012-08-08,1
olympic athletics: usain bolt back in action – as it happened,legislation,2012-08-08,1
wisconsin temple gunman died of self-inflicted wound after shot by police,gun,2012-08-08,1
perú busca construir una nueva relación con las empresas mineras,control,2012-08-08,2
"afghanistan civilian deaths fall, says un",gun,2012-08-08,2
"afghanistan civilian deaths fall, says un",background,2012-08-08,2
sikh temple shooting: commentary and analysis from around the web,shooting,2012-08-08,1
sikh temple shooting: commentary and analysis from around the web,background,2012-08-08,1
gu kailai trial: concern in china grows over transparency of murder case,gun,2012-08-08,2
"betrayed by the tories, the lib dems are fighting back",background,2012-08-08,2
cyclists who are a law unto themselves make a recipe for anarchy,law,2012-08-08,2
belfast man in court over gun attack on police,gun,2012-08-08,2
what will i study during a law degree?,law,2012-08-08,2
sudan reaches agreement on aid access to rebel-controlled areas,control,2012-08-08,2
i'm all for 'have-a-go heroes' – but a verbal clip round the ear is no substitute for state support,background,2012-08-09,1
gu kailai trial ends after a few hours but details remain vague,gun,2012-08-09,2
new yorkers remember wisconsin shooting victims in evening vigil – in pictures,shooting,2012-08-09,2
wisconsin temple shooting victims remembered at vigils across us,shooting,2012-08-09,2
winning new business: lawyers4mumpreneurs,law,2012-08-09,3
syria is bound by the laws of war,law,2012-08-09,3
cross-borders law,law,2012-08-09,2
gu kailai trial ends with murder charges 'uncontested',gun,2012-08-09,2
malawi's new law targeting chinese traders in rural areas draws criticism,law,2012-08-09,2
malawi's new law targeting chinese traders in rural areas draws criticism,law,2012-08-09,2
shirley maclaine's downton role is in the best us-uk culture clash tradition,control,2012-08-09,3
tom mcfeely: from ira hunger striker to bankrupt millionaire property developer,automatic,2012-08-10,2
barclay brothers win case to retain control of top hotels,control,2012-08-10,3
"extreme porn, students and religion. law: definitely not boring",law,2012-08-10,2
inside aleppo: air strikes on war-torn city leave anguish on the ground,background,2012-08-10,1
are you cut out for a law degree?,law,2012-08-10,2
edinburgh festival turns clock back 50 years to momentous literary conference,background,2012-08-10,2
targeted killing's 'flexibility' doctrine that enables us to flout the law of war,law,2012-08-10,1
what makes our ndaa lawsuit a struggle to save the us constitution,law,2012-08-10,2
how small businesses can pitch to big retailers – q&a roundup,background,2012-08-10,2
voter id laws: the republican ruse to disenfranchise 5 million americans,law,2012-08-10,2
malawi's food safety threatened by contaminated groundnuts,law,2012-08-10,2
gu kailai trial: four police in court accused of helping cover up murder,gun,2012-08-10,1
national campaign against moorland bog-burning to launch as grouse-shooting begins,shooting,2012-08-10,2
why the claws are out for the rspb,law,2012-08-11,2
price of bacon set to soar as producers are hit by new eu animal welfare laws,law,2012-08-11,3
ben lawsky: marathon man who became the latest scourge of wall street,law,2012-08-11,2
edinburgh fringe theatre roundup,background,2012-08-11,2
libel law reform poses a serious test for lord justice leveson,law,2012-08-11,2
the beastie boy who really is a role model – to rock stars,control,2012-08-12,2
doreen lawrence: 'i got quite emotional. i thought: hold it together',law,2012-08-12,2
2008 macbeth: is this a gun i see before me?,gun,2012-08-12,2
the sickening circularity of america's gun control debate,gun,2012-08-13,1
the sickening circularity of america's gun control debate,control,2012-08-13,1
controversial thomas jefferson book pulled over complaints of inaccuracies,control,2012-08-13,1
syrian rebels 'shoot down' fighter jet,shooting,2012-08-13,2
olympics 2012: how to get involved in shooting,shooting,2012-08-13,2
paul ryan gives campaign a shot in the arm: commentary from around the web,background,2012-08-14,2
the fruits of summer – your green shoots photographs,shooting,2012-08-14,2
didier deschamps lays down law as france youth underpin fresh start,law,2012-08-14,1
olympics exposed flaw at the heart of brazilian football,law,2012-08-14,1
texas a&m university shooting: gunman dies after police officer and civilian bystander are shot dead,shooting,2012-08-14,1
texas a&m university shooting: gunman dies after police officer and civilian bystander are shot dead,gun,2012-08-14,1
family research council security guard shot by gunman at dc headquarters,gun,2012-08-15,2
"we have the legislation, but not the will, to tackle dangerous dogs",legislation,2012-08-15,1
london 2012 and the law - quiz,law,2012-08-15,2
o'brien 'not fit to control inm' - irish times columnist,control,2012-08-15,1
twelve top tv lawyers,law,2012-08-15,2
women's role at peterloo revisited in manchester anniversary walk,control,2012-08-15,2
julian assange case: stay patient and do the right thing,shooting,2012-08-16,3
floyd lee corkins charged with assault in shooting at family research council,shooting,2012-08-16,2
beauty news: back to the real world,background,2012-08-16,3
houla killings: un blames syria troops and militia,gun,2012-08-16,2
houla killings: un blames syria troops and militia,background,2012-08-16,2
sir mervyn king criticised for role in bob diamond exit,control,2012-08-17,2
laura wilson's crime fiction roundup – reviews,background,2012-08-17,2
ian brady: a remorseless killer with an overwhelming need for control,control,2012-08-17,2
south african police shoot dead striking miners,shooting,2012-08-17,2
south african miners' families back julius malema's call for nationalisation,background,2012-08-18,2
paralympics 2012: paralympians check in at new-look olympic village,check,2012-08-18,2
reading's adam le fondre stays cool from spot to keep stoke in check,legislation,2012-08-19,3
reading's adam le fondre stays cool from spot to keep stoke in check,check,2012-08-19,3
learning about endangered species: news and resources round up,background,2012-08-19,2
china and gu kailai trial: party reasserts control after local problem,gun,2012-08-20,2
china and gu kailai trial: party reasserts control after local problem,control,2012-08-20,2
china: gu kailai spared death penalty for killing neil heywood,gun,2012-08-20,1
gu kailai profile: charming persona betrayed inner turmoil,gun,2012-08-20,3
"amid the mess and madcap scheduling, la liga reignites – and delights",law,2012-08-20,1
"amid the mess and madcap scheduling, la liga reignites – and delights",legislation,2012-08-20,1
"leasehold property laws in need of sweeping reform, says thinktank",law,2012-08-20,2
south africa's lonmin miner shootings: do we choose to look away?,shooting,2012-08-20,2
tony scott: twitter pays tribute to top gun director,gun,2012-08-20,3
top gun director tony scott dies - video,gun,2012-08-20,1
gu kailai given suspended death sentence over 'despicable' murder,gun,2012-08-20,1
"tony scott, top gun director and brother of ridley, dies in los angeles",gun,2012-08-20,1
tv review: the queen's mother in law; bad education; gates,law,2012-08-21,1
"pussy riot members face threat of violence in russian jail, lawyer warns",law,2012-08-21,2
sony bounces back at gamescom 2012,background,2012-08-21,2
case law argues london's priced out tenants are 'homeless',law,2012-08-21,1
scottish law 'will remain middle class unless ministers act',law,2012-08-21,2
the fight for control of the internet has become critical,control,2012-08-22,2
eurozone crisis: greek hopes for leniency over austerity set back,background,2012-08-22,1
harriet harman calls for cross-party action to limit murdochs' power in uk,legislation,2012-08-22,2
south african gold miners file lawsuit against industry giants for negligence,law,2012-08-22,1
academies should be subject to the law on pupils with special needs,law,2012-08-22,3
the terrible thing that happened to barnaby brocket by john boyne - review,shooting,2012-08-22,1
china democracy activist's partner appeals to un over harassment,gun,2012-08-22,3
china democracy activist's partner appeals to un over harassment,background,2012-08-22,3
queen's mother-in-law documentary gets right royal reception,law,2012-08-22,1
tv review: whatever happened to harry hill? vic & bob's lucky sexy winners; just around the corner,background,2012-08-23,2
elisabeth murdoch rounds on  brother in mactaggart lecture,background,2012-08-23,2
channel 4 lines up gun-crime drama and david tennant panel show,gun,2012-08-23,1
naked rambler faces mental health checks after breaking down in court,check,2012-08-23,2
prince harry naked pictures: royal aides threatened legal action against papers,legislation,2012-08-23,2
paralympics 2012: shooting schedule,shooting,2012-08-23,2
catch-up tv guide: from loose ends to the batman shootings,shooting,2012-08-24,2
london paralympic games: your day-by-day guide to the action,legislation,2012-08-24,2
generation boomerang: children who go back to mum and dad,background,2012-08-24,2
scene of the empire state building shooting – in pictures,shooting,2012-08-24,1
arm of the law reveals julian assange arrest tactics,law,2012-08-24,2
"tackling gun violence, one block at a time, in new york",gun,2012-08-24,1
new york gunman kills former boss in empire state building shooting,gun,2012-08-24,2
new york gunman kills former boss in empire state building shooting,shooting,2012-08-24,2
syrian regime hits back in damascus as ill-equipped rebels struggle,background,2012-08-24,2
empire state building shooting: mayor bloomberg holds press conference - video,shooting,2012-08-24,2
live bullfights back on spanish state tv after outcry over 'shunning of culture',background,2012-08-24,2
empire state building shooting: footage from the scene - video,shooting,2012-08-24,1
rafael correa hits back over ecuador's press freedom and charge of hypocrisy,background,2012-08-24,2
premier league: amy lawrence answered your questions,law,2012-08-24,2
wrapped in red tape: cookies law for charities,law,2012-08-24,2
harry reveals why leveson and british law are impotent in the digital age,law,2012-08-25,2
rewind tv: parade's end; the last weekend; funny fortnight; the queen's mother-in-law – review,law,2012-08-25,3
nick cave: 'lawless is not so much a true story as a true myth',law,2012-08-25,2
"jessica chastain: 'in lawless, my character maggie is always moving forward'",law,2012-08-25,3
the charisma of la coruña,law,2012-08-25,3
the charisma of la coruña,legislation,2012-08-25,3
empire state building gunman jeffrey johnson 'was always alone',gun,2012-08-25,2
empire state building shooting victim says nypd fired 'randomly' into street,shooting,2012-08-25,1
paralympics 2012: alex zanardi back at brands hatch on a hand bike,background,2012-08-26,2
samsung hits back at apple but shares tumble after smartphone patent ruling,background,2012-08-27,2
nypd chief ray kelly defends officers over empire state building shooting,shooting,2012-08-27,2
us open 2012: andy murray takes on hungry ivan dodig in second round,background,2012-08-28,2
rolling stones back in the studio in paris,background,2012-08-28,1
aurora shooting: victims' families condemn organisers over relief fund,shooting,2012-08-28,2
apple's rot starts with its samsung lawsuit win,law,2012-08-28,2
rachel corrie lawsuit result 'dangerous precedent' say human rights groups,law,2012-08-28,2
jury foreman in apple-samsung lawsuit defends case outcome,law,2012-08-28,2
"a somalia refugee's new life, barriers to immigration, and the role of sport",control,2012-08-28,2
how to get ahead in ... building control and surveying,control,2012-08-28,2
"football has gone back to the back three, but why can be a mystery",background,2012-08-28,2
"football has gone back to the back three, but why can be a mystery",background,2012-08-28,2
real madrid v barcelona: spanish super cup second leg – as it happened,legislation,2012-08-29,3
"leveson 'loading a gun' against papers, warns independent's editor",gun,2012-08-29,3
the role of god in the 2012 us election,control,2012-08-29,2
china: lawyers fear new regulation against 'disrupting' hearings,law,2012-08-29,2
south africa lonmin mine massacre puts nationalisation back on agenda,background,2012-08-29,1
"mars curiosity rover sends 'sounds, sights and smells' back home",background,2012-08-29,2
java exploit: security experts warn of malware flaw,law,2012-08-29,1
surrey's murali kartik angers somerset with controversial run-out,control,2012-08-30,1
texas loses latest voter id battle after judges strike down 'retrogressive' law,law,2012-08-30,1
martin sorrell prepares to move wpp headquarters back to london,background,2012-08-30,2
french government under pressure over marseille gun deaths,gun,2012-08-30,2
republicans still struggle with the spectre of george w bush,law,2012-08-30,2
egypt underlines iran's isolation at non-aligned movement summit,legislation,2012-08-30,1
loyalists create a new flashpoint and shoot themselves in foot,shooting,2012-08-30,2
pakistan blasphemy case: 'muslims could take law into their own hands',law,2012-08-30,2
indian athlete who captivated nation left out of all-male paralympic team,legislation,2012-08-30,2
neil heywood's relatives will not appeal gu kailai's suspended death sentence,gun,2012-08-30,1
whitehall needs reality check over civil service talent cut,check,2012-08-30,3
"daily mail accuses neil morrissey lawyers of abusing 'no win, no fee' deal",law,2012-08-30,2
george zimmerman granted new judge on grounds of bias at bail hearing,background,2012-08-30,1
"tim dowling: back to life, back to reality…",background,2012-08-31,2
"tim dowling: back to life, back to reality…",background,2012-08-31,2
book reviews roundup,background,2012-08-31,2
martin rowson on squatting law reforms – cartoon,law,2012-08-31,2
law criminalising squatting to be challenged in court by cottage dweller,law,2012-08-31,2
south african miners face a travesty of justice under an apartheid-era law,law,2012-08-31,1
secret royal veto powers over new laws to be exposed,law,2012-08-31,2
gesture-controlled angry birds hit samsung smart tv,control,2012-08-31,3
live technology clinic roundup - advice for small businesses,background,2012-08-31,2
andaman islands: delhi must impose its law against human safaris,law,2012-09-01,2
short walks from bogotá by tom feiling – review,automatic,2012-09-01,2
tom stoppard: 'anna karenina comes to grief because she has fallen in love for the first time',automatic,2012-09-01,1
tom dixon: 'light is a mysterious field',automatic,2012-09-01,2
channel 4 hits back at critics after boost from paralympics audiences,background,2012-09-01,2
tony nicklinson's family back call to carry on legal fight with new claimant,background,2012-09-01,3
george osborne plans deregulation of planning laws,law,2012-09-02,2
top london law firms profit from feuding russian oligarchs,law,2012-09-03,2
mo farah becomes a role model for somali school pupils,control,2012-09-03,2
real mallorca ready to shoot for the stars under joaquín caparrós,shooting,2012-09-03,2
the samsung controversy and the murky world of tech blogging,control,2012-09-03,2
john w henry defends liverpool strategy as rodgers rules out owen,law,2012-09-03,2
the thick of it: malcolm's back – but who's he got with him?,background,2012-09-03,2
azelle rodney shooting: police car chase - video,shooting,2012-09-04,2
how is web personalisation affecting the news?,legislation,2012-09-04,2
the possession seizes control of the us box office,control,2012-09-04,2
"chris grayling, justice secretary: non-lawyer and 'on the up' politician",law,2012-09-04,2
widening participation: time to put gender back on the agenda,background,2012-09-04,2
shooting for glory at the olympics,shooting,2012-09-04,1
jim carrey to play small role in kick-ass 2,control,2012-09-04,2
abdullah al-senussi: spy with secrets of lockerbie bombing sent back to libya,background,2012-09-05,2
quebec separatists' election victory overshadowed by fatal shooting,shooting,2012-09-05,2
louisiana looks for 'smoking gun' to link isaac tar balls to gulf oil disaster,gun,2012-09-05,1
tom cruise wife audition claims denied,automatic,2012-09-05,2
tom archer's best photograph: secret sheffield,automatic,2012-09-05,2
fatal shooting at pauline marois quebec victory speech,shooting,2012-09-05,1
quebec shooting rekindles fears over anglo-french divide,shooting,2012-09-05,2
quebec gunman arrested after fatal shooting at premier-elect's victory ceremony – video,gun,2012-09-05,2
quebec gunman arrested after fatal shooting at premier-elect's victory ceremony – video,shooting,2012-09-05,2
salford's birth control pioneers,control,2012-09-05,2
annecy shootings: second girl found alive in car eight hours later,shooting,2012-09-05,2
paralympics 2012: gb men crash out to canada in basketball semi-final,semi,2012-09-06,2
the arts: reality check,check,2012-09-06,2
six songs of me: tom jenkinson from hey man check my band,automatic,2012-09-06,2
six songs of me: tom jenkinson from hey man check my band,check,2012-09-06,2
"young alps shooting victim could still live normal life, say experts",shooting,2012-09-06,1
a guide to surviving law school,law,2012-09-06,2
daniel craig's casino royale trunks in bond memorabilia charity auction,legislation,2012-09-06,2
civil rights under threat as states plan assault on anti-discrimination laws,law,2012-09-06,2
france shootings: four-year-old girl and sister could be key witnesses,shooting,2012-09-06,2
french alps shooting: prosecutor describes scene - video,shooting,2012-09-06,2
french alps shooting: prosecutor describes how girl found alive among bodies – video,shooting,2012-09-06,2
using weapons against burglars: should we shoot the messengers?,shooting,2012-09-06,1
"alps shootings: girl, 4, found alive under bodies in back of car",shooting,2012-09-06,2
"alps shootings: girl, 4, found alive under bodies in back of car",background,2012-09-06,2
lawrence norfolk: a life in writing,law,2012-09-07,2
republican voter id laws' threat to us civil rights,law,2012-09-07,2
man charged after us airlines plane grounded in explosives hoax,background,2012-09-07,2
french alps shooting: brother of victim denies dispute,shooting,2012-09-07,2
"french alps shootings: robbery, feud and iraq war link among theories",shooting,2012-09-07,2
alps shootings: murders have 'hallmarks of a professional assassination',shooting,2012-09-07,2
marikana mine shootings revive bitter days of soweto and sharpeville,shooting,2012-09-07,2
another uncontroversial two years of avoiding the sack,control,2012-09-07,3
"grayling in, clarke out - and secret courts are back on the agenda",background,2012-09-07,1
french alps shootings: the main theories examined,shooting,2012-09-07,2
do brendan rodgers's limping liverpool need a health check?,check,2012-09-07,2
"your views on the news - planning law, airline seats and disabled benefits",law,2012-09-07,3
prince harry back in afghanistan as apache helicopter pilot,background,2012-09-07,2
how small retailers can get location right – live q&a roundup,background,2012-09-07,2
french alps shootings: experts hope bullet casings will lead to killer,shooting,2012-09-07,2
france shooting: girl left for eight hours in car with murdered family,shooting,2012-09-07,1
french alps shooting: cameron and hollande pledge to find perpetrators - video,shooting,2012-09-07,1
leveson looks even less likely to end up as law after the reshuffle,law,2012-09-08,1
lawless – review,law,2012-09-08,2
jeremy hunt is criticised for his role in £650m virgin hospital deal,control,2012-09-08,2
"law on assisted dying is ridiculous, says health minister",law,2012-09-08,1
the secret teacher: let's free education from political control,control,2012-09-08,2
girl injured in french alps shootings emerges from coma,shooting,2012-09-09,1
stuart le pla obituary,legislation,2012-09-09,2
"french alps shooting: victims each shot twice in the head, says prosecutor – video",shooting,2012-09-09,1
teaching politics and the cabinet reshuffle: news and resources roundup,background,2012-09-09,2
divorce law criticised as 'incomplete and uninformative',law,2012-09-10,2
armando iannucci calls on bbc to fight back against critics,background,2012-09-10,2
new york officials locked in row over 9/11 museum costs and control,control,2012-09-10,2
iraq: back to the future,background,2012-09-10,2
police and crime commissioners: a leap in the dark for law and order,law,2012-09-10,2
"french alps shootings: single weapon was 7.65mm pistol, say investigators",shooting,2012-09-10,2
bagram prison handed over to afghan control - video,control,2012-09-10,2
french alps shooting: bomb disposal unit leaves hilli home in surrey,shooting,2012-09-10,1
french alps shootings: police evacuate victims' neighbours,shooting,2012-09-10,2
"government committed to un overseas aid target, says justine greening",gun,2012-09-11,2
"government committed to un overseas aid target, says justine greening",background,2012-09-11,2
divorce law reform: beyond the hausfrau and pater familias,law,2012-09-11,3
"secret courts could suppress evidence of uk role in torture, says un official",control,2012-09-11,2
"secret courts could suppress evidence of uk role in torture, says un official",gun,2012-09-11,2
"secret courts could suppress evidence of uk role in torture, says un official",background,2012-09-11,2
9/11 at 11: where the real ground zero of a new american century lies,background,2012-09-11,2
"cannabis trade 'explosion' causing surge in gun violence, police warn",gun,2012-09-11,1
india must scrap its repressive sedition laws,law,2012-09-11,2
sikh temple shooting: cctv shows policeman shot during massacre - video,shooting,2012-09-11,1
french alps shootings: hiker says he thought girl was dead,shooting,2012-09-11,2
obama hits back at romney for playing politics over libyan consulate attack,background,2012-09-12,2
french alps shooting: investigators pursue three lines of inquiry,shooting,2012-09-12,2
south africa mines hit by wildcat strikes after marikana police shootings,shooting,2012-09-12,2
"prenups, marital property, divorce: law firms respond",law,2012-09-12,2
us election system criticised over finance rules and voting restrictions,shooting,2012-09-13,2
james cameron: 'hollywood gets action women wrong',legislation,2012-09-13,2
un security council resolutions should not trump basic rights,gun,2012-09-13,1
un security council resolutions should not trump basic rights,background,2012-09-13,1
twitter claims government surveillance plans will leave firm open to lawsuits,law,2012-09-13,2
should public notice legislation be updated?,legislation,2012-09-13,2
french alps shootings: british cyclist describes scene of murders,shooting,2012-09-13,2
'stop and detain' counter-terrorism powers may be scaled back,background,2012-09-13,2
naked rambler sent back to prison,background,2012-09-13,2
critical eye – book reviews roundup,background,2012-09-14,2
photography: shoot to thrill – a lomography course in brighton,shooting,2012-09-14,1
spacewatch: the titius-bode law,law,2012-09-14,2
alps shootings survivor tells police she saw only one gunman,shooting,2012-09-14,2
alps shootings survivor tells police she saw only one gunman,gun,2012-09-14,2
phone hacking: sarah ferguson and tony adams among new lawsuits,law,2012-09-14,2
are the coalition's employment law plans bad news for workers?,law,2012-09-14,1
"controversial tv: my 24 hours of aliens, spirit guides, and yvette from 'allo 'allo",control,2012-09-14,1
kate topless photos: closer 'has broken french privacy laws',law,2012-09-14,2
round up: civil service – getting on or getting out?,background,2012-09-14,2
keep your emoticons in check,check,2012-09-14,2
quiet at the back: classrooms around the world – in pictures,background,2012-09-14,2
kate topless pictures: palace consulting lawyers,law,2012-09-14,2
how to grow your manufacturing company: q&a roundup,background,2012-09-14,2
