headlines,terms,dates
bush to set up anti-terror centre,bush,2004-08-02
no bounce for kerry,kerry,2004-08-02
us sounds terror warning,bush,2004-08-02
mr wonderful takes a cruise by john nott,john,2004-08-02
us paper takes on 'misleading' moore,bush,2004-08-02
kerry tries to persuade voters it's time for a new commander in chief,kerry,2004-08-02
what the us papers say,bush,2004-08-03
journalist faces wrath after kerry incident,kerry,2004-08-03
we are a nation in danger - bush,bush,2004-08-03
george mallalieu,george,2004-08-03
cia asks bush to discontinue blog,bush,2004-08-05
kerry courts america's corporate leaders,kerry,2004-08-05
what the terror alerts really tell us,bush,2004-08-05
'dishonest' anti-kerry ads cause a storm,kerry,2004-08-06
"george melly, nuts & son of nuts",george,2004-08-07
us pioneer's vision offers hope to africa,bush,2004-08-07
kerry boost as economy hints at slide,kerry,2004-08-07
why bush could be a fan of terror,bush,2004-08-07
john berger pays tribute to his good friend,john,2004-08-07
boys on the bus get stuck in traffic,bush,2004-08-07
jobs data hits bush election prospects,bush,2004-08-07
bush names new cia director,bush,2004-08-10
kerry's big idea? there isn't one,kerry,2004-08-10
bush names rightwing republican as cia chief,bush,2004-08-11
bush needs to change the subject,bush,2004-08-12
kerry hit by 'race card' ads,kerry,2004-08-14
dear john,john,2004-08-15
john ensures city suffer familiar fate,john,2004-08-15
"history is not on your side, mr kerry",kerry,2004-08-15
plumed kerry courts tribal vote,kerry,2004-08-15
"us to redeploy 100,000 troops and shut bases",bush,2004-08-15
bush plans us troop moves,bush,2004-08-16
bush plans us troop moves,bush,2004-08-16
john woo returns to chinese roots,john,2004-08-16
the women who get kerry's vote: teresa and theron,kerry,2004-08-17
us halts pre-poll afghan violence,bush,2004-08-17
the us press on ...,bush,2004-08-17
"kerry's royal roots will give him victory, says burke's",kerry,2004-08-17
us must share the blame,bush,2004-08-17
john oliver and andy zaltzman,john,2004-08-18
the guardian profile: john prescott,john,2004-08-19
military documents challenge kerry critic,kerry,2004-08-19
foreign policy tops us election agenda,bush,2004-08-19
john weightman,john,2004-08-19
kerry goes to war to put the record straight,kerry,2004-08-20
john slater,john,2004-08-21
dear john,john,2004-08-22
'bush should call off his dogs',bush,2004-08-23
why bush is on the carpet with hoover,bush,2004-08-23
anger as bush bids to exploit olympic games,bush,2004-08-23
fellow skipper throws kerry lifeline as mud starts to stick,kerry,2004-08-23
democrats hope the dispossessed of smalltown usa will make bush pay,bush,2004-08-24
bush hails kerry's 'admirable' war record,bush,2004-08-24
bush hails kerry's 'admirable' war record,kerry,2004-08-24
north korea denounces 'tyrant' bush,bush,2004-08-24
uk to take tough line against us over kyoto,bush,2004-08-24
bush's games hijack leaves a very sour taste,bush,2004-08-24
john clark,john,2004-08-25
kerry fights off attacks in swing states,kerry,2004-08-26
bush and kerry neck and neck,bush,2004-08-26
bush and kerry neck and neck,kerry,2004-08-26
us army reveals wider abu ghraib abuses,bush,2004-08-26
adviser to bush quits over ads,bush,2004-08-26
john inverdale,john,2004-08-27
bush u-turn on climate change wins few friends,bush,2004-08-27
bush admits mistake over iraq,bush,2004-08-28
paranoia stalks bush rally,bush,2004-08-28
dear john,john,2004-08-29
faltering bush plays terror card,bush,2004-08-29
olympic gold hero accuses bush,bush,2004-08-29
howard hits back over bush rebuff,bush,2004-08-29
the day i was 'kidnapped' by elton john,john,2004-08-29
bush and blair: four more years may bring wide rifts on the middle east and cuba,bush,2004-08-30
dear john ...,john,2004-08-30
russia and georgia battle for control,george,2004-08-30
bush's big chance,bush,2004-08-30
rift harms tory links with bush,bush,2004-08-30
huge protest against bush on eve of party meeting,bush,2004-08-30
bush puts softer face on hard right agenda,bush,2004-08-30
no 10's silent support for kerry,kerry,2004-08-31
"he's young, good looking, and hispanic - could he be the next george bush in the white house?",george,2004-08-31
"he's young, good looking, and hispanic - could he be the next george bush in the white house?",bush,2004-08-31
let's stop bush-bashing and listen to what he has to say,bush,2004-08-31
bush says war on terror will be won,bush,2004-08-31
zigzag democrat cheers on bush,bush,2004-09-01
let us write our own history - the declaration of a party thirsting for unity,bush,2004-09-01
republicans seek four more years of bush,bush,2004-09-01
kerry struggles to move out of shadow of iraq,kerry,2004-09-02
bush sells himself as candidate for change,bush,2004-09-02
george w bush's missing year,george,2004-09-02
george w bush's missing year,bush,2004-09-02
cheney lambasts kerry over security,kerry,2004-09-02
vice-president attacks kerry's lack of resolve on war and peace,kerry,2004-09-02
bush's positive record,bush,2004-09-03
economic uncertainty makes us poll a close call,bush,2004-09-03
outraged kerry takes the gloves off at last after republican jibes,kerry,2004-09-03
"despite the double-speak, bush's message is clear",bush,2004-09-03
bush casts himself as the lone ranger,bush,2004-09-03
george jr sent out of texas by father as a 'drunken liability',george,2004-09-03
jobs growth boosts bush's chances,bush,2004-09-03
bush unfit to lead - kerry,bush,2004-09-03
bush unfit to lead - kerry,kerry,2004-09-03
full text: george bush's speech to the republican convention,george,2004-09-03
full text: george bush's speech to the republican convention,bush,2004-09-03
bush - 'i will never relent',bush,2004-09-03
bush vows to protect america,bush,2004-09-03
voters find a hole in bush's image,bush,2004-09-03
bush: war on terror will not cease,bush,2004-09-03
why bush's man is fighting dirty,bush,2004-09-04
i'm betting on bush - and stockpiling defence,bush,2004-09-04
modest jobs rise may help bush,bush,2004-09-04
'he's trumping kerry on likeability',kerry,2004-09-06
in brief: starsky and bush boost italian box office,bush,2004-09-06
ailing kerry campaign to target economy,kerry,2004-09-06
blair may face tougher race than bush in run-up to polls,bush,2004-09-06
much hope but little expectation for kerry,kerry,2004-09-07
"forget vietnam - it's the economy, clinton tells kerry",kerry,2004-09-07
you don't have to be dumb to vote for bush,bush,2004-09-07
kerry and bush trade blows as war rhetoric escalates,kerry,2004-09-08
kerry and bush trade blows as war rhetoric escalates,bush,2004-09-08
now it's bush's turn to squirm,bush,2004-09-08
greenspan's upbeat comments may signal us rates rise,bush,2004-09-08
"kerry is back in the race, says latest poll",kerry,2004-09-08
the trouble with george,george,2004-09-08
"us economy on the up, says greenspan",bush,2004-09-08
bush braced for kitty treatment,bush,2004-09-08
bush under pressure over military record,bush,2004-09-09
documents put bush's vietnam role back on election agenda,bush,2004-09-10
new poll gives bush healthy lead,bush,2004-09-10
new ammunition for kerry,kerry,2004-09-10
"50 days to go, 10 points behind, kerry struggles for second wind",kerry,2004-09-11
'war president' bush has always been soft on terror,bush,2004-09-11
kill bush,bush,2004-09-11
bush faces assault on war record,bush,2004-09-12
"george shearing, like fine wine",george,2004-09-12
kerry stumbles in key states as bush widens lead in polls,kerry,2004-09-13
kerry stumbles in key states as bush widens lead in polls,bush,2004-09-13
bush team 'knew of abuse' at guantánamo,bush,2004-09-13
don't mess with the bushes,bush,2004-09-14
bush's brother at centre of row over nader nomination on florida ballot,bush,2004-09-15
9/11 widows join kerry campaign,kerry,2004-09-15
wto chief says kerry threats are 'campaign talk',kerry,2004-09-16
john lewis celebrates,john,2004-09-16
forgery row threatens to derail kerry,kerry,2004-09-16
john lewis's year off to 'cracking' start,john,2004-09-16
bush rebukes move by putin to limit russian democracy,bush,2004-09-16
bush pitches for small-town america,bush,2004-09-17
rambling kerry gets himself lost,kerry,2004-09-17
fictional candidate weighs into us election,bush,2004-09-17
"george duke, the essential george duke",george,2004-09-17
"george duke, the essential george duke",george,2004-09-17
us apologises for terror news leaks,bush,2004-09-17
john buller,john,2004-09-18
when tony met kerry (in his dreams),kerry,2004-09-19
bush fights 'in the red' menace,bush,2004-09-19
blow for kerry as nader wins florida battle,kerry,2004-09-19
bookies scramble aboard bush bandwagon,bush,2004-09-19
"al-qaida would back bush, says uk envoy",bush,2004-09-20
bush's foes want to back kerry but he's just too vague,bush,2004-09-20
bush's foes want to back kerry but he's just too vague,kerry,2004-09-20
foreign office retains lofty disdain of bush - and most world leaders,bush,2004-09-21
"iraq war was right, bush tells un",bush,2004-09-21
president bush's speech to the un,bush,2004-09-21
kerry on attack over iraq,kerry,2004-09-21
kerry appeases party critics by starting to talk tough on iraq,kerry,2004-09-21
in brief: john rhys-davies hints at general grievous role,john,2004-09-21
woody allen lambasts bush at san sebastián film festival,bush,2004-09-21
john seymour,john,2004-09-21
york st john college,john,2004-09-21
liverpool john moores university,john,2004-09-21
the college of st mark and st john,john,2004-09-21
bush fails to raise jewish support,bush,2004-09-22
defiant bush defends war in speech to un,bush,2004-09-22
poll giving kerry lead stirs controversy,kerry,2004-09-22
john bull's other island,john,2004-09-23
full text of john prescott's speech,john,2004-09-23
bush and musharraf discuss security,bush,2004-09-23
the hollow world of george bush,george,2004-09-23
the hollow world of george bush,bush,2004-09-23
'nipplegate' fails to rouse us parents,bush,2004-09-24
bush and kerry head to head,bush,2004-09-24
bush and kerry head to head,kerry,2004-09-24
waltons steal show in us rich list,bush,2004-09-24
"kenny wheeler/ john taylor, where do we go from here?",john,2004-09-24
can john elway win the us election for bush?,john,2004-09-24
can john elway win the us election for bush?,bush,2004-09-24
can john elway win the us election for bush?,bush,2004-09-24
life of prescott bush,bush,2004-09-25
how bush's grandfather helped hitler's rise to power,bush,2004-09-25
top us officials clash over need to limit iraq poll,bush,2004-09-25
security obsession pushes swing states into bush's grasp,bush,2004-09-26
brown and bush set for clash over debt relief,bush,2004-09-26
kerry needs a narrative - and fast,kerry,2004-09-27
senator kerry stars in online shooter,kerry,2004-09-27
gwen and augustus john on show at tate britain,john,2004-09-28
beating around the bush,bush,2004-09-28
why mr bush makes nice with musharraf,bush,2004-09-28
kerry gets nod in rival's back yard,kerry,2004-09-29
bush ignored warnings on iraq insurgency threat before invasion,bush,2004-09-29
soros goes on tour to do his bit to defeat bush,bush,2004-09-30
prescott wraps up conference with attack on bush,bush,2004-09-30
a sprinkle of stardust on our john and paul,john,2004-09-30
ninety minutes on primetime: high noon for kerry,kerry,2004-09-30
kerry starts to sway the undecided,kerry,2004-10-01
kerry leaves bush scowling,kerry,2004-10-01
kerry leaves bush scowling,bush,2004-10-01
round one to kerry,kerry,2004-10-01
i do not really care for kerry,kerry,2004-10-01
the bush administration is at best incompetent,bush,2004-10-01
bush is one of us,bush,2004-10-01
bush is one of us,bush,2004-10-01
everyone knows exactly how and where bush stands,bush,2004-10-01
bush has fallen short every step of the way,bush,2004-10-01
first blood to kerry in tv debate,kerry,2004-10-01
bush and kerry clash over iraq,bush,2004-10-01
bush and kerry clash over iraq,kerry,2004-10-01
bush lashes out after debate loss,bush,2004-10-02
"bush looked scared, kerry was at home",bush,2004-10-02
"bush looked scared, kerry was at home",kerry,2004-10-02
life after john,john,2004-10-02
wall street marks bush as a 'buy' stock,bush,2004-10-02
watching henry fonda outshoot john wayne,john,2004-10-02
springsteen and stipe sing out for kerry,kerry,2004-10-03
'the pressure is now on mr bush',bush,2004-10-04
john mccririck and eminem,john,2004-10-04
60 million watch us election debate,bush,2004-10-04
fox news apologises for kerry fabrication,kerry,2004-10-04
john watkinson,john,2004-10-04
kerry stops the slide,kerry,2004-10-04
post-debate poll puts kerry ahead by a whisker,kerry,2004-10-04
bush allies admit war blunders,bush,2004-10-05
pastor bush,bush,2004-10-05
john mack,john,2004-10-05
swing states swing kerry's way,kerry,2004-10-06
bush is dead wrong,bush,2004-10-06
air partner benefits from us election campaign,bush,2004-10-06
sign up for our free us election briefing,bush,2004-10-07
'god has a plan. bush will hold back the evil',bush,2004-10-08
bush's mystery bulge,bush,2004-10-08
poor jobs data a blow for bush,bush,2004-10-08
bush's war on science,bush,2004-10-08
"dear john, try this ...",john,2004-10-08
independent. articulate. insensitive. heinz kerry is a new kind of consort,kerry,2004-10-08
bush to rely on attack as best form of defence,bush,2004-10-08
'why is blair in bush's gang?',bush,2004-10-09
"aghadoe heights, killarney, kerry",kerry,2004-10-09
job loss figures deliver a blow to bush,bush,2004-10-09
bush and kerry clash in second tv battle,bush,2004-10-09
bush and kerry clash in second tv battle,kerry,2004-10-09
kerry has slim lead ahead of second debate,kerry,2004-10-09
kerry must learn from reagan in last debate,kerry,2004-10-10
how buoyant bush survived round two,bush,2004-10-10
"no beating about the bush, miller was australian in excelsis",bush,2004-10-11
there is nothing about john kerry that appeals to me,john,2004-10-11
there is nothing about john kerry that appeals to me,kerry,2004-10-11
the bush wire theory: more than a hunch?,bush,2004-10-11
all eyes on third debate after kerry ups 'likeability' rating,kerry,2004-10-11
us exit poll gives karzai victory,bush,2004-10-12
the madness of george,george,2004-10-12
john brown sells contract publishing arm for £20m,john,2004-10-12
the madness of george,george,2004-10-12
tv channels to rubbish kerry on eve of poll,kerry,2004-10-12
bush special envoy embroiled in controversy over iraq debt,bush,2004-10-13
"dear clark county voter, give us back the america we loved. yours sincerely, john le carré",bush,2004-10-13
"dear clark county voter, give us back the america we loved. yours sincerely, john le carré",john,2004-10-13
scholars condemn bush policies,bush,2004-10-13
how to contact the us media,bush,2004-10-13
viva kerry!,kerry,2004-10-14
bush's best is not good enough,bush,2004-10-14
bush is the problem,bush,2004-10-14
was the bulge under george bush's jacket a radio receiver?,george,2004-10-14
was the bulge under george bush's jacket a radio receiver?,bush,2004-10-14
bush and kerry clash on domestic policy,bush,2004-10-14
bush and kerry clash on domestic policy,kerry,2004-10-14
bush and kerry clash in final debate,bush,2004-10-14
bush and kerry clash in final debate,kerry,2004-10-14
anti-bush but not anti-american,bush,2004-10-15
kerry prowess ensures race will go to wire,kerry,2004-10-15
the wrap: poll reveals world anger at bush,bush,2004-10-15
overstretched us puts nato under pressure,bush,2004-10-15
the world backs kerry,kerry,2004-10-15
poll reveals world anger at bush,bush,2004-10-15
"we like americans, we don't like bush",bush,2004-10-15
why i became intimate with kerry and bush,kerry,2004-10-16
why i became intimate with kerry and bush,bush,2004-10-16
"military are rallying behind bush, says survey",bush,2004-10-16
"under siege since 9/11, arab voters shift to kerry",kerry,2004-10-16
doubts about us morale in iraq as troops refuse 'suicide mission',bush,2004-10-16
has bush lost his reason?,bush,2004-10-17
kerry offers the best hope for all,kerry,2004-10-17
no holds barred as bush and kerry enter the final straight,bush,2004-10-17
no holds barred as bush and kerry enter the final straight,kerry,2004-10-17
uk troops will help us avoid the draft,bush,2004-10-18
hoon: us troop request 'not political',bush,2004-10-18
us troop request received warily,bush,2004-10-18
john soothill,john,2004-10-19
kerry's debate victories count for little as bush retakes the lead,kerry,2004-10-19
kerry's debate victories count for little as bush retakes the lead,bush,2004-10-19
sir john moberly,john,2004-10-19
"eurynome and ophion in a film by alfred hitchcock, by john delacourt",john,2004-10-19
team bush declares war on the new york times,bush,2004-10-19
putin backs bush victory,bush,2004-10-19
john law,john,2004-10-19
voters angry at chaos in early us polls,bush,2004-10-20
bush and kerry dance to the tune of ariel sharon,bush,2004-10-20
bush and kerry dance to the tune of ariel sharon,kerry,2004-10-20
mps demand vote on us troop request,bush,2004-10-20
high stakes in us election,bush,2004-10-21
john ablitt,john,2004-10-21
us tv takes steps to avoid election fiasco repeat,bush,2004-10-21
john ware: i may leave tv if panorama is marginalised again,john,2004-10-21
poll shows cross-party mps' support for kerry,kerry,2004-10-21
christian leader faults bush on iraq deaths,bush,2004-10-21
george w kerry?,george,2004-10-21
george w kerry?,kerry,2004-10-21
george w kerry,george,2004-10-21
george w kerry,kerry,2004-10-21
"america, let us love you again ...",bush,2004-10-21
kissing stops as us poll draws in wives,bush,2004-10-21
"george, god here ...",george,2004-10-22
bush faces nuclear fallout in nevada over £60bn mountain of radioactive waste,bush,2004-10-22
the full text of john lloyd's memorial lecture,john,2004-10-22
kerry wins student vote,kerry,2004-10-22
kerry seeks a shot in the arm from gun lobby,kerry,2004-10-22
why bush wishes they all could be california firms,bush,2004-10-23
bush sets wolves on kerry campaign,bush,2004-10-23
bush sets wolves on kerry campaign,kerry,2004-10-23
kerry aides hope clinton's late arrival will swing states,kerry,2004-10-24
alan barnes & john horler stablemates,john,2004-10-24
abortion crusade turns republican women off bush,bush,2004-10-24
"bush exploits suffering of 9/11, says carter",bush,2004-10-25
clinton rises from sick bed to boost kerry campaign,kerry,2004-10-25
clinton drafted in to help kerry,kerry,2004-10-25
in brief: bush butters up indie film-makers,bush,2004-10-25
florida newspapers desert bush as media swing to kerry,bush,2004-10-25
florida newspapers desert bush as media swing to kerry,kerry,2004-10-25
49 iraqi army recruits shot dead in ambush,bush,2004-10-25
john brown's booty,john,2004-10-25
broadcasting legend john peel dies aged 65,john,2004-10-26
john peel show track list,john,2004-10-26
john peel dies aged 65,john,2004-10-26
john peel dies aged 65,john,2004-10-26
broadcasting legend john peel dies aged 65,john,2004-10-26
murdoch: fox news does not favour bush,bush,2004-10-26
"thinner and frailer, the comeback kid puts heart into kerry's campaign",kerry,2004-10-26
missing iraqi arsenal gives kerry ammunition,kerry,2004-10-26
fallout from dot bomb and 9/11 ensures one corner of texas cares little for bush,bush,2004-10-27
new iron curtain divides europe over bush,bush,2004-10-27
why africa roots for kerry,kerry,2004-10-27
"is that playing at the right speed, john? radio's eternal teenager with an ear for next big thing",john,2004-10-27
"john peel, champion of budding rock stars, dies",john,2004-10-27
bush feels the heat over iraq amid rising costs and allawi accusation of 'neglect',bush,2004-10-27
john peel,john,2004-10-27
john peel: the exotic soul of radio 1,john,2004-10-27
john grome,john,2004-10-27
bush has fallen victim to his own hubris,bush,2004-10-28
st john armitage,john,2004-10-28
our special musical debt to john peel,john,2004-10-28
bush goes with gut feeling in the heartland,bush,2004-10-28
bush and kerry: where they stand on the key issues,bush,2004-10-28
bush and kerry: where they stand on the key issues,kerry,2004-10-28
bush tops film badman poll,bush,2004-10-28
last night john peel saved my life,john,2004-10-28
british tourist dies in australian bush,bush,2004-10-28
oil prices blight us growth hopes,bush,2004-10-29
the town that learned to love george bush,george,2004-10-29
the town that learned to love george bush,bush,2004-10-29
the case for kerry,kerry,2004-10-29
bush v kerry? it's really ford v bmw,bush,2004-10-29
bush v kerry? it's really ford v bmw,kerry,2004-10-29
eminem song puts bush in the dock,bush,2004-10-29
could kerry curry german favour?,kerry,2004-10-29
bush tv ad pulled over doctored crowd scene,bush,2004-10-29
middle east sees benefits of bush,bush,2004-10-29
red sox victory helps kerry make his pitch,kerry,2004-10-29
labour gears up for kerry win,kerry,2004-10-29
a strong europe - or bush's feral us capitalism,bush,2004-10-29
a strong europe - or bush's feral us capitalism,bush,2004-10-29
dear john,john,2004-10-29
kerry 'could heal eu rift',kerry,2004-10-30
us threat increases tension in ukraine poll,bush,2004-10-30
tory oil tycoon who won't be backing bush,bush,2004-10-30
arnie pumps up the volume for bush,bush,2004-10-30
bush wins boost from terror tape,bush,2004-10-31
why i'm voting for bush (but only just),bush,2004-10-31
us must act over climate says queen,bush,2004-10-31
the winner is... us conservatism,bush,2004-10-31
why polls are bad for us,bush,2004-10-31
us election campaign 'most expensive ever',bush,2004-11-01
kerry could bring peace at a price,kerry,2004-11-01
"bush, kerry, bin laden - locked in a silent embrace",bush,2004-11-01
"bush, kerry, bin laden - locked in a silent embrace",kerry,2004-11-01
anti-bush campaigner offers fahrenheit 9/11 for free,bush,2004-11-01
kerry's sporting chance,kerry,2004-11-01
'foreign media are about as useful as lice' - kerry aide,kerry,2004-11-01
why even a hawk like me is backing kerry,kerry,2004-11-02
"bush: for rural folk, a display of power",bush,2004-11-02
the bush baiters,bush,2004-11-02
"on election eve, fahrenheit 9/11 makes us pay-per-view",bush,2004-11-02
us elections in brief,bush,2004-11-02
oil traders speculate on kerry victory,kerry,2004-11-02
let the people decide - frantic finale to historic us election,bush,2004-11-02
kerry:the longest day in 45-year quest,kerry,2004-11-02
