headlines,terms,dates,scores
terrorism: lords say 42-day law will put fair trials at risk,law,2008-08-04,3
us eyes up pakistan's lawless lands,law,2008-08-04,2
big crowds back zuma at corruption charges hearing,background,2008-08-04,1
actions speak louder than words,legislation,2008-08-04,2
police: amnesty voices concern as use of taser guns grows,gun,2008-08-05,2
bringing homicide law up to date,law,2008-08-05,2
money makes the treadmill go round,background,2008-08-05,2
rayner takes five to punish law,law,2008-08-06,2
former ba bosses face price-fixing charges,background,2008-08-06,2
gun control lobby 'infiltrated by pro-rifle movement spy',gun,2008-08-06,2
gun control lobby 'infiltrated by pro-rifle movement spy',control,2008-08-06,2
forensics: bullets tagged with pollen could help solve gun crimes,gun,2008-08-06,2
is the eu dictating immigration law?,law,2008-08-06,2
charges imminent in ba price-fixing case,background,2008-08-06,2
still gunning for the western,gun,2008-08-06,2
executives face court over fuel surcharge fixing by ba and virgin,background,2008-08-07,2
britain gets ready to hit the ground pedalling,background,2008-08-07,2
israeli officer to stay in army despite shooting,shooting,2008-08-07,2
harmison roars back for england to give pietersen a dream start,background,2008-08-07,2
inquiry blames hospital for c diff deaths,control,2008-08-07,2
inquiry blames hospital for c diff deaths,background,2008-08-07,2
inquiry blames hospital for c diff deaths,check,2008-08-07,2
inquiry blames hospital for c diff deaths,automatic,2008-08-07,2
israeli soldiers charged over shooting of palestinian prisoner,shooting,2008-08-07,2
olympics is china's training ground for world leadership,background,2008-08-07,2
check out the trailer for bret easton ellis' the informers,check,2008-08-07,2
labour leadership contest hotting up - in scotland,shooting,2008-08-07,1
literary reflections on sport and the law,law,2008-08-08,2
welcome to the grouse moor where no guns will be heard on the glorious twelfth,gun,2008-08-08,1
restaurant review: the gun,gun,2008-08-08,2
mobile roundup august,background,2008-08-08,2
neal lawson v robert philpot,law,2008-08-08,2
us immigration control is necessary,control,2008-08-08,2
kingsnorth climate camp: police and protesters prepare for action,legislation,2008-08-08,3
olympic protests held around the world,background,2008-08-08,2
green gadgets that can help save money by remote control,control,2008-08-09,2
russian tanks roll into georgia as cities burn,control,2008-08-09,1
four arrested in breach of kingsnorth power station security,legislation,2008-08-09,2
small businesses ask ofgem to check their soaring energy bills,check,2008-08-10,3
california: marijuana law goes up in smoke as federal agents raid dispensaries,law,2008-08-10,1
russia takes control of south ossetian capital after georgian retreat,control,2008-08-10,2
olympics: zagunis takes gold as us women fencers make a clean sweep,gun,2008-08-10,3
police will 'work round clock' to catch killers of graduates murdered in their flat,background,2008-08-11,1
gordon brown calls on russia to end military action against georgia,legislation,2008-08-11,2
olympics: great britain exit in first round as korea punish italy to take gold,background,2008-08-11,2
us employers and unions battle over proposed labour laws,law,2008-08-11,2
grouse season: 'shooting no longer plays a role in the management of what we do here',shooting,2008-08-11,1
grouse season: 'shooting no longer plays a role in the management of what we do here',control,2008-08-11,1
australian media faces privacy law,law,2008-08-11,2
tom daley's olympic debut - as it happened,automatic,2008-08-11,2
benítez kicks off in europe to familiar background of wrangling,background,2008-08-12,2
food and fuel prices send inflation to new high as city fears interest rate increase,legislation,2008-08-12,3
ex-drugs policy director calls for legalisation,legislation,2008-08-12,2
nervous about your a-level results? here's how to bounce back,background,2008-08-12,2
'snooper's charter' to check texts and emails,check,2008-08-12,3
boxing: price control vital as british team suffer mixed fortunes,control,2008-08-12,1
inflation surges to 16-year high,legislation,2008-08-12,2
the reaction to my opera exposes how oppressive our terror laws are,law,2008-08-13,2
"ethnic minority lawyers discriminated against, report finds",law,2008-08-13,2
a reality check for nato,check,2008-08-13,2
three dead in gangland-style shooting at german ice-cream parlour,shooting,2008-08-13,1
us supreme court kicks exxon valdez case back to california court,background,2008-08-13,2
reuters attacks israel's failure to take action over cameraman's death,legislation,2008-08-13,2
riots erupt in kashmir as thousands mourn shooting deaths,shooting,2008-08-13,2
two held after three killed in german ice-cream parlour shooting,shooting,2008-08-13,2
bank of england says inflation to fall sharply as economy slows,legislation,2008-08-13,3
seaman's diary for auction,legislation,2008-08-14,2
olympics: it's wrestlemania: swede gets his mankini in a knot and throws back bronze medal,background,2008-08-14,2
us rules out military role in georgia but warns russia off,control,2008-08-14,2
georgia conflict could set back russia's us relations 'for years',background,2008-08-14,2
james whale launches talksport legal action,legislation,2008-08-14,2
"british libel laws violate human rights, says un",law,2008-08-14,2
"british libel laws violate human rights, says un",gun,2008-08-14,2
"british libel laws violate human rights, says un",background,2008-08-14,2
olympics: indian shooting champion bindra's rifle 'tampered with',shooting,2008-08-14,2
gary glitter to be deported back to uk next week,background,2008-08-14,2
law slams lancashire for dumping cork,law,2008-08-14,2
football: barton facing legal action on tandy incident,legislation,2008-08-15,2
"us must share power in new world order, says turkey's controversial president",control,2008-08-15,3
back to russia,background,2008-08-15,2
check out the trailer for 'fight club sequel' choke,check,2008-08-15,2
"lapdancing licensing laws must change, say council leaders",law,2008-08-15,2
shop around for a good account:  all the banks need your business,background,2008-08-16,3
give me a randy politician any time - as long as he cuts inflation,legislation,2008-08-16,3
ask tom,automatic,2008-08-16,2
controlling the new russia requires new thinking,control,2008-08-16,2
"olympics: tearful kelly flops  - now for bossing athletics, and maybe a playboy shoot",shooting,2008-08-16,1
tanks and katyushas bristle round isolated tbilisi,background,2008-08-17,2
"the american school where teachers carry a pen, a ruler and ... a gun",gun,2008-08-17,2
climate controls,control,2008-08-17,3
britain's terror laws have left me and my family shattered,law,2008-08-17,2
poster service: girls and guns in the french new wave,gun,2008-08-17,2
just why have camille paglia and co turned on madonna?,control,2008-08-18,2
"dance, gunfire, tea - but little sympathy",gun,2008-08-18,2
unions file complaint against wal-mart in labour law dispute,law,2008-08-18,1
olympics: jeffries win secures bronze and sets up semi with ireland's egan,semi,2008-08-19,2
illicit thrills in the back row,background,2008-08-19,2
french soldiers killed in taliban gun battle,gun,2008-08-19,2
la times publisher: i'll do it my way,law,2008-08-19,2
la times publisher: i'll do it my way,legislation,2008-08-19,2
barwick will leave with mcclaren millstone hanging around his neck,background,2008-08-20,2
economy: stagflation stalks the nation and leaves the bank of england split three ways over rates,legislation,2008-08-20,2
"at last, the cure  for back pain?",background,2008-08-20,1
ground control? hand it over,background,2008-08-20,1
ground control? hand it over,control,2008-08-20,1
"paedophiles could be subject to stricter movement controls, says smith",control,2008-08-20,2
us election: 'how many homes do i own? ... i'll get back to you',background,2008-08-21,2
family firm gains continental control,control,2008-08-21,2
kent in control as joseph shines,control,2008-08-21,3
"mi5 criticised for role in case of torture, rendition and secrecy",control,2008-08-21,1
my role in the longest film ever,control,2008-08-21,1
boots on the ground is the key to the white house,background,2008-08-21,2
elevator pitch: pricecheck.at does just that - on your mobile,check,2008-08-21,2
"british security services colluded in unlawful detention of terror suspect, court rules",law,2008-08-21,2
california legislation seeks to ban pets on the laps of drivers,legislation,2008-08-21,2
ground down,background,2008-08-22,2
"'i'm an inspiration, not a role model'",control,2008-08-22,3
green groups plea for public comment on endangered species law changes,law,2008-08-22,2
un calls for georgia refugees to be allowed home,gun,2008-08-22,2
un calls for georgia refugees to be allowed home,background,2008-08-22,2
check out josh brolin as bush and frank langella as nixon,check,2008-08-22,2
it's a guy thing,shooting,2008-08-23,2
the death and afterlife of an la punk,law,2008-08-23,1
the death and afterlife of an la punk,legislation,2008-08-23,1
the old have a powerful role to play. we're going to enjoy it,control,2008-08-23,2
british tourists hurt after gun attack at spanish nightclub,gun,2008-08-23,1
the star who came back from the depths,background,2008-08-23,2
spanish shooting blamed on dublin gangs' revenge attack,shooting,2008-08-23,1
law-breaking lancashire punished,law,2008-08-23,2
"rare charred pepper steak sandwiches with grainy mustard mayonnaise, watercress and tomato pesto",automatic,2008-08-23,2
instant justice creating nation of criminals,legislation,2008-08-23,3
celebrity bric-a-brac auction,legislation,2008-08-24,2
"joe biden's pro-riaa, pro-fbi tech voting record",shooting,2008-08-24,2
edinburgh tv festival 2008: is bbc worldwide 'out of control'?,control,2008-08-24,2
rock music's shooting stars,shooting,2008-08-24,2
hope for expats as spain lands in court over land grab law,law,2008-08-25,2
olympics: adlington flies home but her feet are as ever on the ground,background,2008-08-25,2
"birmingham: sister, 5, shoots toddler in head with father's air rifle",shooting,2008-08-25,2
letting the iraqis take control,control,2008-08-25,2
a1gp delays opening round as it races to build new chassis,background,2008-08-25,2
air travel: virgin atlantic and ba exchange insults over terminal 5 fiasco,background,2008-08-26,1
legislating against civil interests in india,legislation,2008-08-26,2
chinese corruption law targets lovers and families of officials,law,2008-08-26,1
georgia tech has computer control licked,control,2008-08-26,2
airgun controls urged after toddler shot in head by sister,gun,2008-08-26,2
airgun controls urged after toddler shot in head by sister,control,2008-08-26,2
"india's bollywood bandit shot dead by police after shooting, stabbing and robbing his way to infamy",shooting,2008-08-27,1
computer virus infects orbiting space station,legislation,2008-08-27,2
victims of converted replica submachine gun supplier,gun,2008-08-27,2
guilty: the man who ran a garden-shed gun factory linked to nine murder scenes,gun,2008-08-27,2
northern ireland: sniper shoots at police as trouble flares in ulster,shooting,2008-08-27,2
big boys take all the fun out of playing around online,background,2008-08-27,2
jury convicts man who sold converted replica guns to gangsters,gun,2008-08-27,2
"last night's carling cup, uefa cup and champions league action",legislation,2008-08-27,2
peter k austin's top 10 endangered languages,background,2008-08-27,2
peter k austin's top 10 endangered languages,check,2008-08-27,2
"air travel: budget airline zoom grounds flights, blaming fuel price rises",background,2008-08-28,2
"our citizens, their law",law,2008-08-28,2
life sentence for the man behind garden shed gun factory,gun,2008-08-28,2
anbar back in iraqi hands as al-qaida ousted,background,2008-08-28,2
launch of controversial child database delayed,control,2008-08-28,1
check out pacino and de niro on screen together in righteous kill,check,2008-08-28,2
hurricane alert puts new orleans on evacuation footing,shooting,2008-08-28,2
self-taught gunsmith jailed for converting replicas to kill,gun,2008-08-28,1
law and order in katine,law,2008-08-28,2
man who ran illegal gun factory sentenced to life,gun,2008-08-28,2
film weekly: francois ozon on shooting angel in england while we get into the wackness groove,shooting,2008-08-28,2
court backs mexico city's free abortion law,law,2008-08-28,2
bbc fiction controller jane tranter looks to next role,control,2008-08-28,2
bbc fiction controller jane tranter looks to next role,control,2008-08-28,2
family: get-out claws,law,2008-08-29,2
"meet the barracuda: anti-abortion, pro-death penalty and gun-lover",gun,2008-08-29,2
blair has no right to lecture on the rule of law,law,2008-08-29,1
karadzic refuses to enter war crimes pleas at un tribunal,gun,2008-08-29,3
karadzic refuses to enter war crimes pleas at un tribunal,background,2008-08-29,3
michael jackson – back at the top,background,2008-08-29,2
ask tom,automatic,2008-08-30,2
new laws topped with a big dollop of madness,law,2008-08-30,2
apple boss comes back from the dead to do his own thing,background,2008-08-30,2
apple boss comes back from the dead to do his own thing,shooting,2008-08-30,2
liverpool gets its rattle back,background,2008-08-30,2
would you back a gun-toting former beauty queen for vice-president?,background,2008-08-30,2
would you back a gun-toting former beauty queen for vice-president?,gun,2008-08-30,2
"extreme and risky action the only way to tackle global warming, say scientists",legislation,2008-08-31,2
murder inquiry opens after wife's remains found in wreckage reveal gunshot wound,gun,2008-08-31,2
back to reality,background,2008-08-31,2
back in business,background,2008-08-31,2
"toddler dies after being shot by sister, five, in airgun accident",gun,2008-09-01,2
us hands back control of anbar to iraqi forces,background,2008-09-01,2
us hands back control of anbar to iraqi forces,control,2008-09-01,2
zero tolerance on the law of averages,law,2008-09-01,1
w raymond powell,law,2008-09-01,2
toddler dies from airgun injuries,gun,2008-09-01,2
putin shoots a tiger as europe grapples with russian aggression,shooting,2008-09-01,2
sarah palin: the gun-toting governor of alaska,gun,2008-09-01,2
background: the lessons from katrina,background,2008-09-01,2
who knows if palin will bring victory or defeat? but the culture wars are back,background,2008-09-02,2
republicans look to get convention back on track,background,2008-09-02,2
controversial hardliner set to replace japanese pm,control,2008-09-02,2
firewall around palin ahead of her big moment,background,2008-09-03,2
king's prints: elvis gun application up for sale,gun,2008-09-03,2
losing the ground beneath their feet,background,2008-09-03,1
uk art world's biggest gun sets its sights on the future,gun,2008-09-03,2
back to basics with the republic's revolutionaries,background,2008-09-03,2
british soldier convicted of manslaughter after shooting friend,shooting,2008-09-03,2
tony blair sister-in-law 'trapped in gaza',law,2008-09-03,1
rogue trader's lawyers aim to show socgen complicity,law,2008-09-03,2
check out the first trailer proper for zack and miri make a porno,check,2008-09-03,1
falling back on diazepam,background,2008-09-03,2
gunman who killed six in us was 'mentally ill',gun,2008-09-03,2
"us election: republican convention gets off the ground with addresses from thompson, lieberman and bush",background,2008-09-03,3
at least six dead in us shooting spree,shooting,2008-09-03,2
"years after supposed funeral, son gets his father back",background,2008-09-04,2
hamilton: i feel totally in control,control,2008-09-04,3
not a nation of wasillas,legislation,2008-09-04,2
tony blair police minder leaves loaded gun in starbucks toilets,gun,2008-09-04,2
film posters that definitely don't glamourise guns,gun,2008-09-04,2
turning back the clock: hot wards and media populism,background,2008-09-05,2
la rocks to a new beat,law,2008-09-05,3
la rocks to a new beat,legislation,2008-09-05,3
grounded by natwest's five-star policy,background,2008-09-05,3
is oil going back under $100 a barrel? not if opec can help it,background,2008-09-05,2
alcohol control and unruly behaviour,control,2008-09-05,2
"le freak, c'est chic",legislation,2008-09-05,2
i'm not a bad dad. i just love toy guns,gun,2008-09-05,1
doctor opposes new law on organ donors,law,2008-09-05,2
"marquee names, big crowds, more stages  . . . tour keeps british cycling on a roll",control,2008-09-05,2
bringing dads back home,background,2008-09-05,2
can we find our economic salvation on the shop floor?,legislation,2008-09-06,2
back in the old ddr: how that stark stasi style has come in from the cold,background,2008-09-06,1
ask tom,automatic,2008-09-06,2
the week middle america bit back,background,2008-09-06,2
"so, mr bond, are you actually a leg or a breast man?",legislation,2008-09-06,2
if you only do one thing this week … stop clock-watching,shooting,2008-09-07,2
"fast-thinking, fleet-footed exiles make light work of new laws",law,2008-09-07,2
us open semi-final: nadal v murray - as it happened,semi,2008-09-07,3
polygamy law suffers judicial revolt,law,2008-09-08,2
"keith girling, bassetlaw",law,2008-09-08,2
council-controlled jails won't help,control,2008-09-08,2
would you tick the ethos box?,automatic,2008-09-08,2
tobacco: russian regulator launches legal action against bat,legislation,2008-09-08,2
"sex, violence and classroom action",legislation,2008-09-08,1
us election: michigan anti-obama ads tied to controversial author corsi,control,2008-09-08,1
the worst kind of affirmative action,legislation,2008-09-08,1
itv names law & order cast,law,2008-09-08,2
schools charity donation broke law,law,2008-09-08,2
revolution on the barrel of a gun,gun,2008-09-08,2
"ready, steady ... quit! pork leg in coca-cola does for thai pm",legislation,2008-09-09,2
what do the new tories stand for? law and order policy,law,2008-09-09,2
top us lawyer hired to prepare google-yahoo anti-cartel case,law,2008-09-09,3
message control,control,2008-09-09,3
us authorities hire top lawyer to prepare antitrust case against google,law,2008-09-09,3
semillon,semi,2008-09-09,2
sri lanka shoots down rebel plane after bloody raid,shooting,2008-09-09,2
"la diary: shooting scripts, styling and schadenfreude",law,2008-09-09,2
"la diary: shooting scripts, styling and schadenfreude",legislation,2008-09-09,2
"la diary: shooting scripts, styling and schadenfreude",shooting,2008-09-09,2
row over lingering french antisemitism fuelled by marriage of president's son,semi,2008-09-10,2
judge is asked: why did police shoot barrister?,shooting,2008-09-10,2
iraq soldier jailed for shooting colleague dead,shooting,2008-09-10,2
check out the first full-length trailer for quantum of solace,check,2008-09-10,1
hirst's auction does not demean the art world,legislation,2008-09-10,1
family of barrister shot dead by police say inquiry was unlawful,law,2008-09-10,1
copyright law is an ass,law,2008-09-11,2
back to ground zero,background,2008-09-11,1
back to ground zero,background,2008-09-11,1
a shaw thing in stratford-upon-ontario,shooting,2008-09-11,2
"toothless, clawless and clueless",law,2008-09-11,1
investors check out of retailers,check,2008-09-11,2
remote control warfare,control,2008-09-11,2
abramovich finds himself cast in unfamiliar role of underdog,control,2008-09-12,2
science going round in circles from stonehenge to cern,background,2008-09-12,2
am i eligible for any of the government's latest insulation grants?,legislation,2008-09-12,2
police: shot barrister's family hit back at ipcc after video allegations,background,2008-09-12,3
hodgson's boot spares starry sale an early reality check,check,2008-09-12,2
newcastle fail in talks to lure back keegan,background,2008-09-12,1
zimbabwe power-sharing deal gives police control to mdc,control,2008-09-12,2
back to the pre-human future,background,2008-09-12,2
shadow of guantanamo follows freed inmates back to their homes,background,2008-09-13,2
banks make joint effort to hand back £1bn,background,2008-09-13,2
upfront: reality tv check,check,2008-09-13,2
is this any way to treat our nation of carers?,legislation,2008-09-13,2
'sarah's law' trial run prompts vigilante fears,law,2008-09-13,2
inflation will force king to write to no 11 again,legislation,2008-09-13,2
new law puts more struggling debtors at risk of repossession,law,2008-09-13,1
shooting stars,shooting,2008-09-13,2
city find lampard and co too rich for them,control,2008-09-13,2
carter guides all blacks back to top of the world,background,2008-09-13,2
cosy consensus suggests policymakers are trusting in a maginot line against inflation,legislation,2008-09-14,2
lawyers' drive for diversity hindered by multiple rows,law,2008-09-14,2
test schemes offer mothers right to sex-offender checks on partners,check,2008-09-14,3
lawwell on arsenal shortlist,law,2008-09-15,2
supermarket's dentist offers check-ups before check-out,check,2008-09-15,2
supermarket's dentist offers check-ups before check-out,check,2008-09-15,2
"israeli shelling of beit hanoun a possible war crime, desmond tutu tells un",gun,2008-09-15,2
"israeli shelling of beit hanoun a possible war crime, desmond tutu tells un",background,2008-09-15,2
wall street crisis: time to turn back the clock on financial regulation,background,2008-09-15,3
thaksin brother-in-law nominated for thai pm,law,2008-09-15,2
a check-up by the check-out: dentist opens supermarket surgery,check,2008-09-15,2
a check-up by the check-out: dentist opens supermarket surgery,check,2008-09-15,2
wan opposes google-yahoo advertising deal on competition grounds,background,2008-09-15,2
crime pays in a law-abiding land,law,2008-09-16,2
"sarah's law will spread suspicion and hurt among friends and neighbours, and children will suffer",law,2008-09-16,3
how can the rich still be buying our silence with this 13th-century law?,law,2008-09-16,2
new us law requiring country of origin label on food to take effect,law,2008-09-16,2
tap-dancing to songs about remote controls,control,2008-09-16,2
lib dems call for rapid action to prevent repossessions,legislation,2008-09-16,2
haemorrhaging of western influence at un wrecks attempts to push human rights agenda,gun,2008-09-17,1
haemorrhaging of western influence at un wrecks attempts to push human rights agenda,background,2008-09-17,1
western influence at un wanes as power balance shifts,gun,2008-09-17,2
western influence at un wanes as power balance shifts,background,2008-09-17,2
a british law & order? no thanks,law,2008-09-17,2
anti-gun instructions for universities - a misfire?,gun,2008-09-17,2
israel's kadima begins voting to elect new head,shooting,2008-09-17,2
former la times staff sue zell,law,2008-09-17,2
former la times staff sue zell,legislation,2008-09-17,2
big government is back,background,2008-09-17,2
vincent cable: 'we need to firmly embed depositor protection within the law',law,2008-09-17,2
"time we found our feet, instead of letting the lawmen blow us off them",law,2008-09-18,1
"give prisoners right to vote, says un",gun,2008-09-18,3
"give prisoners right to vote, says un",background,2008-09-18,3
law labours away but kent keep title hopes alive,law,2008-09-18,1
pleasurable stroking: 'the control stroker happened to be a swedish radiographer',control,2008-09-18,3
football weekly extra: is john terry above the law?,law,2008-09-18,3
get a proper job! why savvy artists have a plan b,background,2008-09-18,3
checking out the check-in,check,2008-09-19,2
checking out the check-in,check,2008-09-19,2
around britain with a fork,background,2008-09-19,2
california legislators to vote on state budget compromise,legislation,2008-09-19,2
"check out the trailer for synecdoche, new york",check,2008-09-19,2
militants die after gun battle with police in delhi,gun,2008-09-19,2
law set to make the elementary decision to play dr watson,law,2008-09-19,2
the limp arm of the law,law,2008-09-19,2
'plain packets' law to strip cigarettes of their glamour,law,2008-09-20,2
critics round on the queen of french shock fiction,background,2008-09-20,2
the us took action in the face of crisis. we must do the same,legislation,2008-09-20,2
ask tom,automatic,2008-09-20,2
catholic group dogged by controversy seeks salvation through science,control,2008-09-21,2
catholic group dogged by controversy seeks salvation through science,legislation,2008-09-21,2
father killed in double shooting,shooting,2008-09-21,2
"straw vows to act against 'scandalous' 'no win, no fee' lawyers",law,2008-09-21,1
usmanov ready to let kroenke control arsenal,control,2008-09-22,2
ex-boyfriend held over double shooting,shooting,2008-09-22,2
us election: inexperienced palin swots up on diplomacy with busy un visit,gun,2008-09-22,1
us election: inexperienced palin swots up on diplomacy with busy un visit,background,2008-09-22,1
us election: mccain aides attack group's voter registration processes,legislation,2008-09-22,2
us election: palin to get a taste of international diplomacy during un visit,gun,2008-09-22,2
us election: palin to get a taste of international diplomacy during un visit,background,2008-09-22,2
"john mccain, lawbreaker?",law,2008-09-22,2
checklist,check,2008-09-23,2
de menezes jurors taken to scene of fatal shooting,shooting,2008-09-23,1
ec wants price caps to prevent mobile phone 'bill-shock',check,2008-09-23,2
a new law of nature,law,2008-09-23,2
george bush focuses on terrorism during un address,gun,2008-09-23,2
george bush focuses on terrorism during un address,background,2008-09-23,2
the questions raised by finland's latest school shooting,shooting,2008-09-23,2
finland school shooting: 'everything was done to prevent this happening again',shooting,2008-09-23,1
jude and sienna back together. sort of.,background,2008-09-23,2
