headlines,terms,dates,scores
ec plans cap on mobile roaming charges,check,2008-09-23,2
finnish gunman's video puts youtube policies back in spotlight,gun,2008-09-23,2
finnish gunman's video puts youtube policies back in spotlight,background,2008-09-23,2
ten and gunman die in finnish school shooting,gun,2008-09-23,1
ten and gunman die in finnish school shooting,shooting,2008-09-23,1
finnish gunman dies in hospital after killing 10 at school,gun,2008-09-23,1
finland school shooting kills nine,shooting,2008-09-23,1
jury visit tube site of de menezes shooting,shooting,2008-09-23,1
if there is any justice sport will remain a law unto itself,law,2008-09-24,2
never mind palin's politics. just check out the earrings,check,2008-09-24,1
gun that brought about first world war goes on show,gun,2008-09-24,1
south africa snub controversial elvs to prepare for lions,control,2008-09-24,2
the future is one nation,legislation,2008-09-24,2
yahoo grenoble opens: roll out the purple carpet!,control,2008-09-24,2
gest on a roll with pre-watershed catchphrase,control,2008-09-24,2
the unfortunate case of the tube station and the righteous kill poster,legislation,2008-09-24,1
arms control gets the cold war shoulder,control,2008-09-24,2
pakistan denies shooting down us spy plane,shooting,2008-09-24,2
suspicion of adults 'denies children role models',control,2008-09-24,2
british energy: background,background,2008-09-24,2
timeline: school shootings,shooting,2008-09-24,2
finland school massacre brings day of mourning and review of gun laws,gun,2008-09-24,3
finland school massacre brings day of mourning and review of gun laws,law,2008-09-24,3
good referees were glad to be grey but now the laws are too black and white,law,2008-09-25,3
"jazz review: john law, the ghost in the oak/chorale",law,2008-09-25,2
new law could end 'studentification' of towns,law,2008-09-25,2
shooting stars,shooting,2008-09-25,2
checklist,check,2008-09-25,2
eu must implement firearms controls,control,2008-09-25,2
agents set to face full force of european law,law,2008-09-25,2
us election: democrats say republican discouraged students from voting,shooting,2008-09-25,2
constitutionally flawed,law,2008-09-25,1
hearts content after players and staff check bank accounts,check,2008-09-26,3
studs u like,gun,2008-09-26,2
studs u like,background,2008-09-26,2
studs u like,automatic,2008-09-26,2
urc: universal remote control or useless rotten crud,control,2008-09-26,1
gordon brown calls for end to 'age of irresponsibility' in un speech,gun,2008-09-26,2
gordon brown calls for end to 'age of irresponsibility' in un speech,background,2008-09-26,2
"every move you make every law you break, the police will be watching you",law,2008-09-26,2
ba cancels more flights after air traffic computer failure,background,2008-09-26,1
the claws that remain stuck in serota,law,2008-09-26,2
flight delays continue after air traffic control failure,control,2008-09-26,1
how the empire struck back,background,2008-09-27,2
whitehall accused of blocking un plan to stop tax evasion,gun,2008-09-27,2
whitehall accused of blocking un plan to stop tax evasion,background,2008-09-27,2
the party has turned its back on its voters,background,2008-09-27,2
"soldiers who hand prisoners to us could face legal action, mps warned",legislation,2008-09-28,1
bring back keynes,background,2008-09-29,2
tory transport policy back on the rails,background,2008-09-29,2
what price action over darfur?,legislation,2008-09-29,2
bank role for the left,control,2008-09-29,2
wall st held a gun to our heads,gun,2008-09-29,2
lawrence injured in dog accident,law,2008-09-29,2
banking crisis: iceland takes control of glitnir,control,2008-09-29,2
the arab world's cold war patron seems to be back,background,2008-09-29,1
new website lets charity donors check how money is spent,check,2008-09-30,2
gordon brown: we are taking decisive action on financial crisis,legislation,2008-09-30,2
no 400: the fantastic laura b,background,2008-09-30,3
governing bodies back polish fa despite corruption allegations,background,2008-09-30,2
ledger's lawyer launches suit over $10m insurance payout,law,2008-09-30,2
muslims around the world prepare for eid al-fitr,background,2008-09-30,2
tom stoddart's best shot,automatic,2008-10-01,3
us election: registration law leads to accusations of voter suppression in florida,legislation,2008-10-01,2
us election: registration law leads to accusations of voter suppression in florida,law,2008-10-01,2
pensions investors get greater control,control,2008-10-01,2
ms sufferer asks court to clarify the law on assisted suicide,law,2008-10-02,1
one in five teachers would back return of the cane,background,2008-10-02,2
commissioner of controversy,control,2008-10-02,2
should the law on assisted suicide be clarified?,law,2008-10-02,1
shooting for space,shooting,2008-10-03,2
legal action for compensation puts ryanair on collision course with courts,legislation,2008-10-03,2
reward for byrne in new role as cabinet enforcer,control,2008-10-03,3
around europe,background,2008-10-03,2
big brothel research 'seriously flawed',law,2008-10-03,1
controlling the classroom,control,2008-10-03,2
gay uda gunman: 'i hid my true self',gun,2008-10-04,2
let's get back to the basics of economics,background,2008-10-04,2
strike cripples eurostar's bid to  get service back on track after fire,background,2008-10-04,2
watchdog clears tories of breaking electoral law,law,2008-10-05,2
pavey in third and on a roll after finding the right formula to be in perfect shape,control,2008-10-05,3
geraghty back but benjamin sinks the exiles,background,2008-10-05,2
un right to chastise us,gun,2008-10-05,3
un right to chastise us,background,2008-10-05,3
background: the troubled history of the met and racism allegations,background,2008-10-05,2
flaws in laws on abandonment,law,2008-10-06,1
flaws in laws on abandonment,law,2008-10-06,1
"lives lost through lack of leadership in un response to humanitarian crises, britain warns",gun,2008-10-06,1
"lives lost through lack of leadership in un response to humanitarian crises, britain warns",background,2008-10-06,1
rural communities best equipped to cope with climate change: un report,gun,2008-10-06,2
rural communities best equipped to cope with climate change: un report,background,2008-10-06,2
one thing is now certain: the uncertainty must end,shooting,2008-10-06,2
disarray in europe as governments struggle to agree coordinated action,legislation,2008-10-06,2
mps return to find issue of 42-day detention back with a vengeance,background,2008-10-06,2
glasgow east byelection result delays mcconnell's move to malawi,law,2008-10-06,2
cameron's con trick,control,2008-10-06,2
de menezes shooting blamed on 'extraordinary circumstances',shooting,2008-10-06,2
a reality check for britain's defence strategy,check,2008-10-06,2
the left handed gun: pop goes the poster,gun,2008-10-06,1
andrew caspari to quit radio 4 role,control,2008-10-06,2
rights law 'makes uk forces shun arrests',law,2008-10-07,2
yakuza hire top lawyers for protection as new laws bite,law,2008-10-07,2
yakuza hire top lawyers for protection as new laws bite,law,2008-10-07,2
weapons display fires up gun debate,gun,2008-10-07,3
dirty tricks claims as parties battle over voter registration,legislation,2008-10-07,2
yahoo worker accused of role in india terror,control,2008-10-07,2
downing st forced to act as events started to look out of control,control,2008-10-07,2
dirty tricks claims as parties battle over voter registration,legislation,2008-10-07,2
database nation,legislation,2008-10-07,2
no such thing as 'made in china',shooting,2008-10-07,1
iceland government seizes control of landsbanki,control,2008-10-07,2
yakuza bosses take legal classes to evade strict new law,law,2008-10-07,2
la man shoots family and then himself,law,2008-10-07,2
la man shoots family and then himself,legislation,2008-10-07,2
la man shoots family and then himself,shooting,2008-10-07,2
police shoot dog that attacked child,shooting,2008-10-08,2
britain lobbies meps in attempt to weaken laws for greener cars,law,2008-10-08,2
swing state gun lover explains his opposition to barack obama,gun,2008-10-08,2
"boris, his deputy and the law",law,2008-10-08,2
how drugs laws compound race inequality,law,2008-10-08,2
la victoire du camembert,law,2008-10-08,2
la victoire du camembert,legislation,2008-10-08,2
downing st forced to act as events started to look out of control,control,2008-10-08,2
uk should back green energy plan,background,2008-10-09,2
labour peers urge brown to back down in detention fight,background,2008-10-09,1
mbeki urged to save zimbabwe coalition deal as inflation soars,legislation,2008-10-09,2
no-frills boss who keeps one foot on the ground,background,2008-10-09,1
olazábal hits ground running on return to action,background,2008-10-09,2
olazábal hits ground running on return to action,legislation,2008-10-09,2
"""chaos"" in de menezes control room",control,2008-10-09,2
gordon brown considers legal action against iceland,legislation,2008-10-09,2
"zimbabwe's inflation rate surges to 231,000,000%",legislation,2008-10-09,2
"kinder, gentler account control in windows 7",control,2008-10-09,2
"police control room 'in chaos' on day of de menezes shooting, inquest told",control,2008-10-09,1
"police control room 'in chaos' on day of de menezes shooting, inquest told",shooting,2008-10-09,1
check out the new trailer for oliver stone's w,check,2008-10-09,2
check out the new trailer for oliver stone's w,law,2008-10-09,2
"are charles saatchi and nigel lawson related, by any chance?",law,2008-10-09,2
"rhys jones murder accused covered tracks after shooting, court hears",shooting,2008-10-09,1
the curse of roanoke won't hold bill clinton back,background,2008-10-09,1
foxx and darabont set to join forces for law abiding citizen,law,2008-10-09,2
cat on a hot tin roof,shooting,2008-10-10,2
the only thing we have to fear is not feeling fearful enough,shooting,2008-10-10,1
flight of the kiwis could leave world game grounded,background,2008-10-10,1
"comedy preview: stephen k amos, brighton",background,2008-10-10,2
"comedy preview: stephen k amos, brighton",check,2008-10-10,2
shot barrister's case throws spotlight on gun police,gun,2008-10-10,2
"accused teenager admitted shooting rhys jones, court hears",shooting,2008-10-10,1
markets crash: how panic spread around the globe,background,2008-10-10,2
"police inquiry into barrister shooting is lawful, says judge",shooting,2008-10-10,2
"police inquiry into barrister shooting is lawful, says judge",law,2008-10-10,2
sharp-shooting scunthorpe take over at the top,shooting,2008-10-11,1
election pendulum swings back to obama in ohio's dying downtowns,background,2008-10-11,2
what marilyn monroe's mother-in-law really thought,law,2008-10-11,1
palin fights back after troopergate judgment,background,2008-10-11,2
brown under pressure as lords prepares to reject 42-day law,law,2008-10-12,2
bellamy back with no bang and vows to sharpen his shooting,background,2008-10-12,1
bellamy back with no bang and vows to sharpen his shooting,shooting,2008-10-12,1
afghanistan's best hope is for controlled warlordism,control,2008-10-12,3
la clique,law,2008-10-12,2
la clique,legislation,2008-10-12,2
don't worry about inflation,legislation,2008-10-12,1
"homelessness, the economic crisis and voting",shooting,2008-10-12,2
remote control,control,2008-10-13,2
officer admits deleting part of record of events before tube shooting,shooting,2008-10-13,2
spinning out of control,control,2008-10-13,2
chapple steps up after law is shown the door,law,2008-10-13,2
teenager tells rhys jones jury of shouts after shooting,shooting,2008-10-13,2
why i will vote against the 42-day law,law,2008-10-13,2
lancashire axe law and appoint chapple as captain,law,2008-10-13,2
first look at downey jr and jude law as holmes and watson,law,2008-10-13,2
limited options for latino voters,legislation,2008-10-13,2
richards shuns role in world cup bid,control,2008-10-14,2
government drops second controversial proposal in terror bill,control,2008-10-14,1
scrapping sats for 14-year-olds: the background,background,2008-10-14,2
rhys jones trial: 14-year-old witness describes hooded gunman on bmx bike,gun,2008-10-14,2
42-day detention: good day to bury bad laws,law,2008-10-14,1
new york's law chief shoots down aig junkets,law,2008-10-15,2
new york's law chief shoots down aig junkets,shooting,2008-10-15,2
just what are madonna's gun heels saying?,gun,2008-10-15,2
grim economic data delivers reality check,check,2008-10-15,2
implant allows monkeys to move paralysed limbs by mind control,control,2008-10-15,2
branagh pulls out of directing jude law in hamlet,law,2008-10-15,2
"boy saw gunman fire shots, rhys jones murder trial hears",gun,2008-10-15,2
ricky gervais: 'i took all my money out of the bank today and i bought a gun',gun,2008-10-15,2
guilty of murder: man who set up shooting from prison cell,shooting,2008-10-16,2
can you get the taxes back on unused airline tickets?,background,2008-10-16,2
colombian art: back from the brink,background,2008-10-16,2
britons who have fallen foul of the law in dubai,law,2008-10-16,2
bring back bonds,background,2008-10-16,2
"obama v mccain, round three",background,2008-10-16,2
new abortion law storm as mps get free vote on easing restrictions,law,2008-10-17,2
"seven shootings, one murder - the grisly history of a pistol known as exhibit rs1",shooting,2008-10-17,1
deposed top bankers face long wait to get back in the boardroom,background,2008-10-17,1
moyes reveals why he delayed new contract: fear of losing control,control,2008-10-17,1
a week when the banking system was pulled back from the brink,background,2008-10-17,2
daily mail md zitter gets expanded role,control,2008-10-17,2
looking back in regret at winstanley,background,2008-10-17,2
lawyers swoop on financial carrion,law,2008-10-17,2
internet police catching up with outlaws,law,2008-10-17,2
david cameron is back - but he's storing up trouble for himself with this speech,background,2008-10-17,2
stephen carter to prepare uk digital action plan,legislation,2008-10-17,2
lost genius of rap back from the shadows,background,2008-10-18,2
"they shoot squirrels, don't they?",shooting,2008-10-18,1
ask tom,automatic,2008-10-18,2
police appeal for witnesses after man dies in south london shooting,shooting,2008-10-18,1
ganguly century puts india in control,control,2008-10-18,2
flawless hamilton's cruise to victory provides the perfect riposte,law,2008-10-19,3
wartime machine gun may have downed hercules,gun,2008-10-19,1
ing bank accepts €10bn dutch cash injection,shooting,2008-10-19,2
back to the future,background,2008-10-19,2
hopkins rolls back the years to crush pavlik,background,2008-10-19,1
harman to block commons votes on liberalising abortion laws,law,2008-10-20,2
biting back at oliver's empire,background,2008-10-20,2
back to school,background,2008-10-20,2
peter mandelson to face mps over controversial proposals,control,2008-10-20,1
'obama is a liar' - gun owners sound off,gun,2008-10-20,2
'obama is a liar' - gun owners sound off,gun,2008-10-20,2
"russia, iran and qatar announce cartel that will control 60% of world's gas supplies",control,2008-10-21,2
in praise of ... lawrence lessig,law,2008-10-21,2
is personalisation a threat to the quality of care services?,legislation,2008-10-21,2
the law on overseas donations,law,2008-10-21,2
change the law on party funding,law,2008-10-21,2
gourcuff gives reason to cheer as booing takes centre stage,shooting,2008-10-21,3
financial crisis: action taken by central banks and governments,legislation,2008-10-21,2
"evicted chagos islanders have no right to return home, law lords rule",law,2008-10-22,1
more parents use lawyers to secure school places,law,2008-10-22,1
the great green electricity con,control,2008-10-22,2
i capuleti e i montecchi,legislation,2008-10-22,2
i capuleti e i montecchi,check,2008-10-22,2
i capuleti e i montecchi,semi,2008-10-22,2
un and wal-mart highlight china food safety concerns,gun,2008-10-22,3
un and wal-mart highlight china food safety concerns,background,2008-10-22,3
newspaper distributors to keep opt-out from competition law,law,2008-10-22,2
la diary: maconie's list - the play!,law,2008-10-22,2
la diary: maconie's list - the play!,legislation,2008-10-22,2
turning back the clock,background,2008-10-22,2
yemen urged to investigate hundreds of cases of unlawful detention,law,2008-10-23,1
revealed: the leftist plot to control the white house,control,2008-10-23,2
salvation remains elusive for hapless tottenham against udinese,legislation,2008-10-23,2
us election: the leftist plot to control the white house,control,2008-10-23,2
"sharia law incompatible with human rights legislation, lords say",law,2008-10-23,2
"sharia law incompatible with human rights legislation, lords say",legislation,2008-10-23,2
in their eyes: jacob lawrence's paintings of america's great migration,law,2008-10-23,2
us election: indiana judge rules against closing early voting sites,shooting,2008-10-23,2
background: the grayrigg derailment,background,2008-10-23,2
artists beginning with b,background,2008-10-24,2
smoking gun,gun,2008-10-24,2
o'neill to check claims carew partied on eve of villa match,check,2008-10-24,3
should clooney and co save it for the movies?,control,2008-10-24,2
labour is back on the attack,background,2008-10-24,1
survivors of the 'mouth of hell' back with tales of a deadly tour of duty,background,2008-10-25,3
new laws on porn 'will criminalise thousands',law,2008-10-25,2
fellaini header keeps united in check,check,2008-10-25,2
jennifer hudson's mother and brother believed dead in double shooting,shooting,2008-10-25,1
the clean air act: jump-starting climate action,legislation,2008-10-27,3
redknapp admits desire to bring defoe back to tottenham,background,2008-10-27,2
the long arm of the law,law,2008-10-27,2
niger slavery: background,background,2008-10-27,2
arkansas campus shooting kills two,shooting,2008-10-27,1
it's too easy to buy a gun,gun,2008-10-27,1
back to the land – again,background,2008-10-27,2
artists beginning with c (part two),control,2008-10-27,2
artists beginning with c (part two),background,2008-10-27,2
artists beginning with c (part two),check,2008-10-27,2
artists beginning with c (part two),automatic,2008-10-27,2
artists beginning with g (part one),gun,2008-10-27,2
artists beginning with g (part one),legislation,2008-10-27,2
artists beginning with g (part one),background,2008-10-27,2
artists beginning with g (part one),shooting,2008-10-27,2
carew back in good books as villa stroll on,background,2008-10-27,2
fed expected to lead round of rate cuts,background,2008-10-27,3
the law: turnstile terms,law,2008-10-27,2
exiles galvanised by fly geraghty and take aim at semi-final place,semi,2008-10-27,2
the longer arm of the law,law,2008-10-27,2
the bonnets are back,background,2008-10-27,2
the fat lady has not begun to sing,gun,2008-10-28,1
"shooting first, talking later",shooting,2008-10-28,2
assisted dying laws do not always protect the vulnerable,law,2008-10-28,2
vw shares up 147% as result of porsche move to seize control,control,2008-10-28,2
do the tribes really need more guns?,gun,2008-10-29,2
police marksmen shoot man dead in essex,shooting,2008-10-29,2
lufthansa takes control of britain's bmi,control,2008-10-29,2
"microsoft, google and yahoo pledge to protect internet freedoms around world",background,2008-10-29,2
controlling the final chapter,control,2008-10-29,2
jeff ford going back to channel five,background,2008-10-29,2
what the law says on assisted suicide,law,2008-10-29,1
artists beginning with r (part one),control,2008-10-29,2
artists beginning with r (part one),background,2008-10-29,2
tom megahy,automatic,2008-10-29,2
flawed plans,law,2008-10-29,2
the man behind the man: obama and the aide who makes his campaign tick,automatic,2008-10-29,2
this inhuman law,law,2008-10-29,1
jury shown picture of gun allegedly used to kill rhys jones,gun,2008-10-29,2
iraq rebukes us for commando raid as syria appeals to un,gun,2008-10-29,2
iraq rebukes us for commando raid as syria appeals to un,background,2008-10-29,2
lewis carnie to stand in as radio 2 controller after sachsgate resignation,control,2008-10-30,2
us election: lawyers arrive in florida for potential post-election fight,law,2008-10-30,2
back to the future in the caspian corridor,background,2008-10-30,2
get back to the basics,background,2008-10-30,2
nine dead in congo after panic and looting break out,shooting,2008-10-30,1
tom clancy's endwar,automatic,2008-10-30,2
berbatov dazzles for united to help ronaldo strike back,background,2008-10-30,2
lufthansa takes control of bmi,control,2008-10-30,2
police kill man brandishing gun after row with girlfriend,gun,2008-10-30,2
artists beginning with r (part two),control,2008-10-30,2
artists beginning with r (part two),background,2008-10-30,2
no turning back,background,2008-10-31,1
rock & pop review: girls aloud: out of control,control,2008-10-31,2
levy claims ramos had lost control of dressing room,control,2008-10-31,2
"the bush gang's parting gift: a final, frantic looting of public wealth",shooting,2008-10-31,3
investors want rules to claw back excessive executive bonuses,law,2008-10-31,2
investors want rules to claw back excessive executive bonuses,background,2008-10-31,2
hanging chad guy leads army of lawyers in florida,law,2008-10-31,2
us lawyer driving the turnaround on the tube,law,2008-10-31,2
"police gave no warning before de menezes shooting, say witnesses",shooting,2008-10-31,2
"""make sure you double-check...""",check,2008-11-01,2
on trend? check,check,2008-11-01,2
the law of dying,law,2008-11-01,1
underdog snaps and snarls as he enters the final round,background,2008-11-01,1
sunday pundit roundup,background,2008-11-02,2
la traviata,law,2008-11-02,2
la traviata,legislation,2008-11-02,2
this week's cd review roundup,background,2008-11-02,2
global pile-up ahead as us auto industry loses its drive,automatic,2008-11-02,2
mp attempts to stop un job for iraq war lawyer,gun,2008-11-02,2
mp attempts to stop un job for iraq war lawyer,background,2008-11-02,2
mp attempts to stop un job for iraq war lawyer,law,2008-11-02,2
shooting shoulder to shoulder with capa,shooting,2008-11-02,1
a nation could be on the verge of its mandela moment,legislation,2008-11-02,2
the urban-rural coalition in action,legislation,2008-11-03,2
newspaper society calls in lawyers over bbc's local news plans,law,2008-11-03,2
stephen poliakoff shoots first feature film in a decade,shooting,2008-11-03,2
de menezes police 'out of control',control,2008-11-03,2
doubters wrong to round on glock for 'gifting' hamilton the f1 title,background,2008-11-03,1
gunmen kidnap french aid worker in kabul,gun,2008-11-03,2
one nation under secularism,legislation,2008-11-03,2
"mental illness, the law and rudeness",law,2008-11-03,2
a kafkaesque excuse for ignorance of the law,law,2008-11-03,1
hooked on gun-toting bloggers,gun,2008-11-03,3
rebel mps join union bid to overturn thatcher laws,law,2008-11-04,2
france votes for 'three strikes' filesharing law,law,2008-11-04,2
gps get £100 for checks on people with learning difficulties,check,2008-11-04,2
un drone inquiry,gun,2008-11-04,2
un drone inquiry,background,2008-11-04,2
over half state schools breach admission laws,law,2008-11-04,2
