headlines,terms,dates
syria: mig fighter jets bomb aleppo as rebels dig in,immigration,2012-08-06
syria: mig fighter jets bomb aleppo as rebels dig in,migrant,2012-08-06
liberian refugees in western ivory coast – in pictures,refugee,2012-08-06
olympics 2012: brazil reach football final by beating south korea,south,2012-08-07
greek crackdown on illegal immigrants leads to mass arrests,migrant,2012-08-07
tom waits: 'i'm a night-owl reporter' – a classic interview from the vaults,deport,2012-08-07
ted and diary of a wimpy kid: the anti-olympians win at the box office,undocumented,2012-08-07
visa reports olympic consumer spending boost,visa,2012-08-07
visa reports olympic consumer spending boost,deport,2012-08-07
honduran radio reporter's son shot,deport,2012-08-07
pakistan's fata area reports significant increase in school enrolment,deport,2012-08-09
cycling spain's camino de santiago with children,border,2012-08-10
cycling spain's camino de santiago with children,deport,2012-08-10
live discussion: what can housing providers learn from octavia hill?,visa,2012-08-10
fascinated us awaits trial of mexican drug cartel's 'queen of the pacific',mexico,2012-08-11
mexico and brazil fans give their verdict on the olympic football final - video,mexico,2012-08-11
mexico rave as brazil are sent crashing in olympic football final,mexico,2012-08-11
mexico claim olympic football gold after oribe peralta stuns brazil,mexico,2012-08-11
london 2012 olympics: how britain's multicultural capital won the hearts of people from every nation,immigration,2012-08-11
the paralympics offer an even greater moral lesson,green,2012-08-12
journalist asylum-seeker released from detention,asylum,2012-08-13
mexican drug war's innocent victims: 'they tried to kill me with my kids',mexico,2012-08-13
'australia's plan to deport refugees to islands won't stop us making the trip',deport,2012-08-13
'australia's plan to deport refugees to islands won't stop us making the trip',refugee,2012-08-13
australia to deport boat asylum seekers to pacific islands,deport,2012-08-13
australia to deport boat asylum seekers to pacific islands,asylum,2012-08-13
australian refugee plan criticised by human rights groups,refugee,2012-08-13
eritrea's flag-carrying runner seeks asylum in uk to flee repressive regime,asylum,2012-08-14
the bo xilai and gu kailai scandal masks the battle for china's future,border,2012-08-14
"the winner is … the olympics, though ted held up well for a stoned cgi bear",undocumented,2012-08-14
sunny olympic weather departs britain as rain returns,deport,2012-08-14
australia's boat asylum seekers solution looks eerily to the past,asylum,2012-08-15
wonder by r j palacio - review,immigration,2012-08-15
wonder by r j palacio - review,border,2012-08-15
wonder by r j palacio - review,deport,2012-08-15
wonder by r j palacio - review,refugee,2012-08-15
wonder by r j palacio - review,migrant,2012-08-15
wonder by r j palacio - review,green,2012-08-15
wonder by r j palacio - review,card,2012-08-15
niger-mali refugee crisis: 'we came with nothing … there is nothing to eat. nothing' – video,refugee,2012-08-15
doctor who: asylum of the daleks – spoiler-free review,asylum,2012-08-15
"julian assange will be granted asylum, says official",asylum,2012-08-15
ecuadoreans back rafael correa's decision to offer julian assange asylum,asylum,2012-08-16
england v south africa – as it happened,visa,2012-08-16
england v south africa – as it happened,south,2012-08-16
julian assange asylum row puts uk in catch-22 situation,asylum,2012-08-16
ecuador grants asylum to julian assange - video,migrant,2012-08-16
ecuador grants asylum to julian assange - video,asylum,2012-08-16
julian assange asylum: ecuador is right to stand up to the us,asylum,2012-08-16
europe must do more to help arab spring's 'double refugees',refugee,2012-08-16
theresa may blocks chinese visa changes over security fears,visa,2012-08-16
the story of a somali refugee: 'now that i'm in sweden i feel free and very happy' – video,refugee,2012-08-16
"dear george osborne, it's time for plan b, say top economists",border,2012-08-17
"yotam ottolenghi recipes: hainanese chicken rice, plus penang acar",card,2012-08-17
rafael correa's domestic agenda behind ecuador's assange asylum,asylum,2012-08-17
squad sheets: reading v stoke city,visa,2012-08-17
tourism bosses say visa red tape – and cost – are putting off chinese visitors,visa,2012-08-17
julian assange 'doing all right' amid ecuador asylum row,asylum,2012-08-17
"julian assange asylum: britain will not give safe passage, says william hague – video",asylum,2012-08-17
julian assange asylum offer leads ecuador and uk into diplomatic row,asylum,2012-08-17
south tyrol: where austria and italy collide,south,2012-08-18
england v south africa – day three as it happened,visa,2012-08-18
england v south africa – day three as it happened,south,2012-08-18
un observers leave syria as mandate expires,undocumented,2012-08-18
ecuador's rafael correa: assange granted asylum to prevent extradition to a 'third country' – video,asylum,2012-08-18
england close to losing match and world no1 test status to south africa,south,2012-08-19
a teddy bear manufacturer's view on ted,undocumented,2012-08-19
the v festival in pictures,visa,2012-08-19
how south america sees the julian assange case,south,2012-08-20
england v south africa - as it happened,visa,2012-08-20
england v south africa - as it happened,south,2012-08-20
child mortality at double emergency threshold in south sudan refugee camp,south,2012-08-20
child mortality at double emergency threshold in south sudan refugee camp,refugee,2012-08-20
visa's wave and pay technology fails to win olympic gold,visa,2012-08-21
julian assange asylum: rafael correa says it is suicidal for uk to enter ecuador embassy – video,asylum,2012-08-21
asylum seekers in libya: one man's story of prison conditions,asylum,2012-08-23
green climate fund to discuss $100bn pledged by rich countries,green,2012-08-23
crossing borders to escape natural calamities is no easy option,border,2012-08-23
manchester united make official inquiry about mexico's hector herrera,mexico,2012-08-23
us embassy staff shot at by mexican police,mexico,2012-08-24
greenpeace storms arctic oil platform,green,2012-08-24
libya militia members accused of killing three sub-saharan migrants,migrant,2012-08-24
scattered sand: the story of china's rural migrants by hsiao-hung pai – review,migrant,2012-08-25
china's rural migrant workers deserve more respect from the city-dwellers,immigration,2012-08-25
china's rural migrant workers deserve more respect from the city-dwellers,migrant,2012-08-25
doctor who blasts into nyc for sneak screening of asylum of the daleks,asylum,2012-08-27
cory booker and chris christie: irresistible force v immovable object,visa,2012-08-28
"a somalia refugee's new life, barriers to immigration, and the role of sport",refugee,2012-08-28
"a somalia refugee's new life, barriers to immigration, and the role of sport",immigration,2012-08-28
"a somalia refugee's new life, barriers to immigration, and the role of sport",migrant,2012-08-28
"green news roundup: heathrow, sea ice and wildlife photography",green,2012-08-29
border agency ban threatens london metropolitan university,border,2012-08-29
south africa lonmin mine massacre puts nationalisation back on agenda,south,2012-08-29
stop playing the net migration numbers game,immigration,2012-08-30
stop playing the net migration numbers game,migrant,2012-08-30
london metropolitan university visa licence revoked: q&a,visa,2012-08-30
"net immigration falls slightly to 216,000, says ons",immigration,2012-08-30
"net immigration falls slightly to 216,000, says ons",migrant,2012-08-30
"immigration figures benefiting from strong measures, says damian green - video",immigration,2012-08-30
"immigration figures benefiting from strong measures, says damian green - video",migrant,2012-08-30
"immigration figures benefiting from strong measures, says damian green - video",green,2012-08-30
border agency decision threatens thousands of international students,border,2012-08-30
mexican journalist lydia cacho: 'i don't scare easily',mexico,2012-08-31
academic refugees: 'my hope is to contribute to this county - if i'm given the opportunity',refugee,2012-08-31
obama's justice department grants final immunity to bush's cia torturers,deport,2012-08-31
obama's justice department grants final immunity to bush's cia torturers,migrant,2012-08-31
"your views on the news – heathrow, green leadership and london met",green,2012-08-31
dozens more rescued in australia asylum seeker boat emergency,asylum,2012-08-31
migration confusion is costing britain dear,immigration,2012-09-01
migration confusion is costing britain dear,migrant,2012-09-01
migration confusion is costing britain dear,border,2012-09-01
kingsley hall: rd laing's experiment in anti-psychiatry,border,2012-09-01
kingsley hall: rd laing's experiment in anti-psychiatry,card,2012-09-01
anna karenina: joe wright's coup de théâtre on tolstoy's doomed heroine,border,2012-09-01
anna karenina: joe wright's coup de théâtre on tolstoy's doomed heroine,deport,2012-09-01
"doctor who: asylum of the daleks - series 33, episode one",asylum,2012-09-01
undocumented latinos end protest tour of south at democratic convention,undocumented,2012-09-02
undocumented latinos end protest tour of south at democratic convention,south,2012-09-02
england v south africa – as it happened,visa,2012-09-02
england v south africa – as it happened,south,2012-09-02
uk border agency criticised over student visas,border,2012-09-03
uk border agency criticised over student visas,visa,2012-09-03
syrians at refugee camp struggle with choking sand and wretched conditions,refugee,2012-09-03
pakistan car bomb kills two in attack on us vehicle,card,2012-09-03
"cabinet is more male, white, southern and oxbridge after reshuffle",south,2012-09-04
"record number of people fleeing syria, un reports",undocumented,2012-09-04
"record number of people fleeing syria, un reports",deport,2012-09-04
desmond tutu expresses outrage at failing politicians in south africa,south,2012-09-04
top 10 family days out in south and west dorset,south,2012-09-04
london met university will 'fundamentally contest' visas decision,visa,2012-09-04
england v south africa – fifth odi as it happened,visa,2012-09-05
england v south africa – fifth odi as it happened,south,2012-09-05
eritrean refugees trapped by security fence at israeli-egyptian border,refugee,2012-09-05
eritrean refugees trapped by security fence at israeli-egyptian border,border,2012-09-05
a sense of history unfolding on the greenpeace arctic sunrise,green,2012-09-06
undocumented woman benita veliz makes dream act speech to dnc,undocumented,2012-09-06
sun praised for undercover work exposing illegal immigration,immigration,2012-09-07
sun praised for undercover work exposing illegal immigration,migrant,2012-09-07
congo olympic and paralympic team members seek asylum in uk,asylum,2012-09-08
marco rubio v julian castro: the battle for 50m hispanic votes,visa,2012-09-08
government concerns over g4s and serco to house asylum seekers,asylum,2012-09-09
police and crime commissioners: a leap in the dark for law and order,border,2012-09-10
exporting: ronalt ltd,deport,2012-09-10
bp selling oil fields in gulf of mexico ahead of deepwater horizon fines,mexico,2012-09-10
exporting: ecostudio xv ltd,deport,2012-09-10
chinese migrants invited to dinner in attempt to bridge social gulf,migrant,2012-09-10
bp raises $5.55bn from sale of gulf of mexico assets,mexico,2012-09-10
caption competition: what are ed balls and vince cable really thinking?,undocumented,2012-09-10
uk trade deficit drops after sharp rise in exports outside eu,deport,2012-09-11
"green news roundup: climate minister, badger cull and arctic sea ice",green,2012-09-12
uk's 'largest' meteorite goes on display at salisbury and south wiltshire museum,south,2012-09-12
jim yong kim's trip to south africa was just a pr exercise for the world bank,south,2012-09-12
international student visas: 'whatchoo talkin' bout willetts'?,visa,2012-09-13
"chris brown only wanted a mexican sugar skull, but just look what his tattooist gave him instead",mexico,2012-09-13
is there even less arctic sea ice than the satellites show?,green,2012-09-13
willetts launches drive to salvage uk's reputation after curbs on student visas,visa,2012-09-13
nectar makes a point about rewarding green issues,green,2012-09-14
"big picture: birds in nets, by todd forsgren - in pictures",green,2012-09-14
tamils to be deported despite clear torture evidence,deport,2012-09-14
car review: citroen ds5,card,2012-09-15
us officials ready to target banks over safeguarding failures – report,deport,2012-09-15
eyewitness extra: mexico city,mexico,2012-09-15
"support grows for rise in public spending, even with higher taxes",green,2012-09-16
far-right ideas: britains's generation gap,immigration,2012-09-16
merkel's 'heart bleeds' but no wonder migrants find jibes no laughing matter,migrant,2012-09-17
exporting: across research,deport,2012-09-17
"italy abandoning refugees to poverty and isolation, says report",refugee,2012-09-18
"italy abandoning refugees to poverty and isolation, says report",deport,2012-09-18
justice department fast and furious investigation clears eric holder,deport,2012-09-19
eric holder's exoneration by fast and furious report strains credibility,deport,2012-09-19
graciela iturbide's best photograph: a mexican seri woman,mexico,2012-09-19
immigration watchdog urges greater use of family detention centre,immigration,2012-09-19
immigration watchdog urges greater use of family detention centre,migrant,2012-09-19
loyalty cards: how they compare and things to beware,card,2012-09-19
bp moves higher on reports of texas city sale,deport,2012-09-19
ukba awards contract to track down illegal migrants to uk to capita,migrant,2012-09-19
new mexico governor removes 'forcible rape' language from state policy,mexico,2012-09-20
barack obama: lack of immigration reform my biggest failure so far,immigration,2012-09-20
barack obama: lack of immigration reform my biggest failure so far,migrant,2012-09-20
undocumented latinos in arizona fear for children as key clause takes effect,undocumented,2012-09-20
"green news roundup: arctic sea ice, badger cull and mega mine",green,2012-09-20
cem özdemir: why german industry is thanking the green party,green,2012-09-20
juárez: bette davis shines in an otherwise clunky historical drama,visa,2012-09-20
backpacker diaries: travellers' tales from south america,south,2012-09-21
bolivia carnival: wet and wild,visa,2012-09-21
pakistan explodes in fury as south asia's muslims join anti-us protests,south,2012-09-21
london metropolitan university wins reprieve in student visa row,visa,2012-09-21
the joy of six: early ryder cups,border,2012-09-21
green shoots of recovery? the search continues as autumn approaches,green,2012-09-22
latinos' renewed hope for immigration reform after the 2012 election,immigration,2012-09-22
latinos' renewed hope for immigration reform after the 2012 election,migrant,2012-09-22
why mark lawrenson's diving similes tend to go down like big ron,undocumented,2012-09-23
mitt romney is too rational for a deluded republican base,immigration,2012-09-23
liverpool v manchester united – as it happened,visa,2012-09-23
london met's visa curb is at the heart of the government's market experiment,visa,2012-09-23
syria's refugee children - in pictures,refugee,2012-09-24
migration watch claims are an unjustified attack on overseas students,immigration,2012-09-24
migration watch claims are an unjustified attack on overseas students,migrant,2012-09-24
how record sea ice melt is changing life for greenlanders – video,green,2012-09-24
andrew mitchell described armed officers as 'plebs' according to report,deport,2012-09-24
"syria civil war: 'we expend the one thing we have, men. men are dying'",undocumented,2012-09-25
syrian child refugee hassan: 'the mosque was full of bodies' - video,refugee,2012-09-25
syrian child refugee emmad: 'the mountain route was very risky' - video,refugee,2012-09-25
syrian child refugee bisan: 'it was a massacre' - video,refugee,2012-09-25
syrian refugee omar: 'i was sleeping when the shell fell' - video,refugee,2012-09-25
"syrian refugee ali: 'whenever i hear a shelling, i get scared and cry' - video",refugee,2012-09-25
defence export policy and the uk's help for oppressive regimes,deport,2012-09-26
jarvis cocker on radio: this isn't hardcore,visa,2012-09-26
south african's goldmines beset by simmering resentment,south,2012-09-26
government defends secrecy over 'high-risk' immigration blacklist,immigration,2012-09-26
government defends secrecy over 'high-risk' immigration blacklist,migrant,2012-09-26
mexican legal challenge to enrique peña nieto's election win dismissed,mexico,2012-09-26
"green news roundup: toxic waste, wind myths and animal orchestras",green,2012-09-26
"human rights are the best weapon to combat hunger, report says",deport,2012-09-26
cuban journalist arrested for his investigative reporting,deport,2012-09-26
"climate change is already damaging global economy, report finds",deport,2012-09-26
david howell: 'europe are good enough to win the ryder cup',border,2012-09-27
nigeria protests after saudis deport female hajj pilgrims,deport,2012-09-27
banknotes reflect glory of nation state,immigration,2012-09-27
south sudan's refugee camps flooded – in pictures,south,2012-09-27
south sudan's refugee camps flooded – in pictures,refugee,2012-09-27
how to stay positive in the face of adversity – gsbq event report,deport,2012-09-27
south sudan refugee camps rendered inaccessible by heavy rains,south,2012-09-27
south sudan refugee camps rendered inaccessible by heavy rains,refugee,2012-09-27
"plastic debris reaches southern ocean, previously thought to be pristine",south,2012-09-27
department of homeland security makes concession on same-sex status,deport,2012-09-28
why is labour so quiet on green issues?,green,2012-09-28
ed miliband tells british banks: change now or be broken up,undocumented,2012-09-29
queens park rangers v west ham united – as it happened,visa,2012-10-01
the alternative ratings for the greatest ryder cup of all time,border,2012-10-01
ed balls cheers delegates with attack on david cameron,undocumented,2012-10-01
failed asylum seekers in scotland living below un global poverty threshold,asylum,2012-10-01
failed asylum seekers in scotland living below un global poverty threshold,undocumented,2012-10-01
napolitano's same-sex couples directive: a milestone in immigration justice,immigration,2012-10-01
napolitano's same-sex couples directive: a milestone in immigration justice,migrant,2012-10-01
from the vault: europe capitulate in brookline in ryder cup 1999,border,2012-10-01
the best credit card deals to suit your needs,card,2012-10-01
new york times public editor won't advocate against 'illegal immigrant',migrant,2012-10-02
romney shifts immigration stance and vows to honour obama's visa pledge,immigration,2012-10-02
romney shifts immigration stance and vows to honour obama's visa pledge,migrant,2012-10-02
romney shifts immigration stance and vows to honour obama's visa pledge,visa,2012-10-02
world twenty20: australia v pakistan – as it happened,visa,2012-10-02
turkey strikes syrian targets after cross-border mortar bomb kills five,border,2012-10-03
ed miliband's conference turn sparks new admiration from delegates,undocumented,2012-10-03
asylum seekers in ireland languish in the magdalene laundries of our time,asylum,2012-10-03
david cameron: the ed miliband effect is the least of his problems,undocumented,2012-10-04
"migration of low-skilled workers into uk is too high, says ed miliband",immigration,2012-10-04
"migration of low-skilled workers into uk is too high, says ed miliband",migrant,2012-10-04
"migration of low-skilled workers into uk is too high, says ed miliband",undocumented,2012-10-04
mexico city on the road to cleaner air – video,mexico,2012-10-04
"a cruise to the falklands, south georgia and antarctica: readers' travel writing competition",south,2012-10-05
double death in asylum seeker family reveals gap in state benefits,asylum,2012-10-05
"student visa row damages image of uk higher education, warns lse chief",visa,2012-10-05
border agency teams up with police in drive to target foreign criminals,border,2012-10-05
ed miliband condemns labour party heckler of schoolgirl,undocumented,2012-10-05
theresa may considers curbs on eu migration,immigration,2012-10-07
theresa may considers curbs on eu migration,migrant,2012-10-07
arizona immigrants: young latinos ready to 'really release the energy',migrant,2012-10-07
"julian assange supporters ordered to forfeit £93,500 bail money",border,2012-10-08
france's first lady sends chocolates to florence cassez in mexican jail,mexico,2012-10-08
recommended reading for ed miliband,undocumented,2012-10-09
mexican navy shoots dead brutal drug cartel leader – but body goes missing,mexico,2012-10-09
"megacities rise, fertile land lies idle, and the un calls for action on ageing",undocumented,2012-10-09
"megacities rise, fertile land lies idle, and the un calls for action on ageing",immigration,2012-10-09
wales v scotland: four classic encounters,visa,2012-10-10
bbc reporting scrutinised after accusations of liberal bias,deport,2012-10-10
"bbc's coverage of religion, immigration and europe to be scrutinised in review",immigration,2012-10-10
"bbc's coverage of religion, immigration and europe to be scrutinised in review",migrant,2012-10-10
abu qatada extradition fight moves to immigration commission,immigration,2012-10-10
abu qatada extradition fight moves to immigration commission,migrant,2012-10-10
david cameron's tinpot aspiration nation,immigration,2012-10-11
toni kroos completes germany's rout of republic of ireland in group c,undocumented,2012-10-12
toni kroos completes germany's rout of republic of ireland in group c,mexico,2012-10-12
toni kroos completes germany's rout of republic of ireland in group c,card,2012-10-12
turkey sends jets to border in response to presence of syrian helicopter,border,2012-10-12
deepwater horizon pipe 'responsible for new oil slick in gulf of mexico',mexico,2012-10-12
live discussion: housing and migration,immigration,2012-10-12
live discussion: housing and migration,migrant,2012-10-12
mexico's drug cartels target journalists in brutal killing spree,mexico,2012-10-13
obama v romney: which candidate would be better for tech start-ups?,visa,2012-10-13
kenya's kenyatta university opens its doors to somali refugees in dadaab,refugee,2012-10-15
belgium v scotland – as it happened,visa,2012-10-16
forced migration in the 21st century: urbanised and unending,immigration,2012-10-16
forced migration in the 21st century: urbanised and unending,migrant,2012-10-16
mexican website editor murdered,mexico,2012-10-16
romney softens immigration stance on 'self-deportation' at debate,immigration,2012-10-17
romney softens immigration stance on 'self-deportation' at debate,migrant,2012-10-17
romney softens immigration stance on 'self-deportation' at debate,deport,2012-10-17
mexico authorities move to exhume bodies of zetas cartel boss's parents,mexico,2012-10-17
david cameron and ed miliband at pmqs: politics live blog,undocumented,2012-10-17
st louis cardinals 8 - san francisco giants 3 - as it happened,card,2012-10-18
get your documents in order for  a smooth half-term getaway,undocumented,2012-10-19
get your documents in order for  a smooth half-term getaway,border,2012-10-19
refugee council: the women facing violence in the uk – 1bn rising video,refugee,2012-10-19
going green for halloween: ransack your recycling box for class decorations,green,2012-10-19
south sudan looking to deal with sudan to pour oil on troubled waters,south,2012-10-19
rewind tv: order and disorder; me and mrs jones; hebburn; fresh meat – review,border,2012-10-20
rewind tv: order and disorder; me and mrs jones; hebburn; fresh meat – review,border,2012-10-20
top tips: managing housing and migration,immigration,2012-10-20
top tips: managing housing and migration,migrant,2012-10-20
foreign policy debate: candidates set to spar as polls tied – as it happened,undocumented,2012-10-22
'unacceptable force' used by g4s staff deporting pregnant woman,deport,2012-10-22
"mexican drug cartel boss confirmed dead, says us",mexico,2012-10-22
barcelona v celtic - as it happened,visa,2012-10-23
sri lankan asylum seekers' deportation halted at last minute,asylum,2012-10-23
sri lankan asylum seekers' deportation halted at last minute,deport,2012-10-23
obama v romney: around the world in 90 minutes,visa,2012-10-23
we must impose a carbon limit on new electricity generation here and now,immigration,2012-10-23
tamil asylum seekers try for 11th hour block on deportation,asylum,2012-10-23
tamil asylum seekers try for 11th hour block on deportation,deport,2012-10-23
un calls for syrian ceasefire to mark muslim holiday,undocumented,2012-10-24
oil-affected wildlife in the gulf of mexico – in pictures,mexico,2012-10-24
mistresspieces: why switching art by men and women doesn't work,undocumented,2012-10-25
"green news roundup: whales, weather and wildlife",green,2012-10-25
"an asylum party, jungle-bashing and sloe gin",asylum,2012-10-25
syrian car bomb breaks eid al-adha ceasefire,card,2012-10-26
nhl lockout: will there even be a season?,green,2012-10-26
gay jamaicans launch legal action over island's homophobic laws,immigration,2012-10-26
"eyewitness extra: ciudad juarez, mexico",mexico,2012-10-26
car review: seat alhambra,card,2012-10-27
manchester city v swansea city – as it happened,visa,2012-10-27
florida's progressive education reform a model for the nation – and obama,immigration,2012-10-27
imran khan detained and 'interrogated over drone views' by us immigration,immigration,2012-10-27
