headlines,terms,dates
imran khan detained and 'interrogated over drone views' by us immigration,migrant,2012-10-27
eyewitness: yayladagi refugee camp,refugee,2012-10-27
st louis rams v new england patriots in london,visa,2012-10-28
children and asylum,asylum,2012-10-29
drink-driving to diligence: mexico en route to better road safety – video,mexico,2012-10-29
drink-driving to diligence: mexico en route to better road safety – video,undocumented,2012-10-29
drink-driving to diligence: mexico en route to better road safety – video,green,2012-10-29
mexico city's 'alcoholímetro' making headway in dangerous driving battle,mexico,2012-10-29
the blond 'mexican beggar child' story holds a mirror to us perceptions of race,mexico,2012-10-30
somalia's refugee camps leave women and girls vulnerable to violent assault – audio slideshow,refugee,2012-10-30
north mali prepares for war as refugees dream of liberation from al-qaida,refugee,2012-10-31
one-third of congolese men admit committing sexual violence,undocumented,2012-10-31
at least 130 burmese refugees drown in shipwreck,refugee,2012-10-31
asylum seekers continue to be stigmatised by the british press,asylum,2012-10-31
"eyewitness extra: aguascalientes, mexico",mexico,2012-10-31
heseltine's no 10 report blasts coalition over growth strategy,deport,2012-10-31
shell reports 6% fall in third quarter profits,deport,2012-11-01
how negative reporting on asylum seekers made morgan's life a misery,deport,2012-11-01
how negative reporting on asylum seekers made morgan's life a misery,asylum,2012-11-01
three men arrested over northern ireland prison officer murder,undocumented,2012-11-02
mahmoud abbas outrages palestinian refugees by waiving his right to return,refugee,2012-11-04
uk and germany agree crackdown on tax loopholes for multinationals,green,2012-11-05
atp world tour finals: andy murray v tomas berdych - in pictures,visa,2012-11-05
uk and germany agree tax crackdown on multinational companies,green,2012-11-05
andy murray v tomas berdych – as it happened,visa,2012-11-05
syria crisis: divisons among opposition as heavy fighting is reported in damascus - monday 5 november,deport,2012-11-05
mexican journalists question truth of murder trial,mexico,2012-11-05
ryanair extends booking fee to cash passport cards,card,2012-11-06
female genital mutilation: asylum seeker fights deportation to the gambia,asylum,2012-11-06
female genital mutilation: asylum seeker fights deportation to the gambia,deport,2012-11-06
"the week in tv: homeland, american horror story: asylum, horror europa with mark gatiss and hatfields & mccoys - video",asylum,2012-11-06
