headlines,terms,dates
"cuts to renewables agency will hurt australia's global r&d ranking, says report",global,2016-09-11
adani's carmichael coalmine proves environment laws 'too weak' – report,coal,2016-09-11
adani's carmichael coalmine proves environment laws 'too weak' – report,environment,2016-09-11
liberty media purchase of f1 likely to result in even greater profits,green,2016-09-11
"uk jobs market 'skating on thin ice' since brexit vote, says survey",job,2016-09-12
george clooney-backed report: south sudan president profits from civil war,warming,2016-09-12
world's first large-scale tidal energy farm launches in scotland,deal,2016-09-12
"book deals, boardrooms, an eu role? what david cameron could do next",deal,2016-09-12
tesco admits responsibility for fuel leak that polluted river,fuel,2016-09-12
religion’s role in the global population crisis,global,2016-09-12
tata steel's uk crisis hits global results,global,2016-09-12
lost in a moment review – otherworldly tech-house party with a hint of ibiza,environment,2016-09-12
five myths about global women's economic empowerment,global,2016-09-12
syrian ceasefire deal - the guardian briefing,deal,2016-09-12
millions of children fleeing war 'systematically denied' basic rights,warming,2016-09-13
sam dastyari is a fine political artist. but his mistake revealed bigger issues,coal,2016-09-13
greens push to outlaw all mining in great australian bight,green,2016-09-13
backroom talks lead to two-man battle for uefa president’s job,job,2016-09-13
"uk domestic policies dented middle incomes, not globalisation, says thinktank",global,2016-09-13
campaigners criticise uk government’s response to air pollution warning,warming,2016-09-13
how a global adventure can refresh your school's thinking,global,2016-09-13
how can we better value water as global shortages start to threaten economies?,global,2016-09-13
panorama: why are gambling machines addictive? review – scandal of the century,deal,2016-09-13
pågan: the tropical paradise the us wants to turn into a war zone,coal,2016-09-13
pågan: the tropical paradise the us wants to turn into a war zone,warming,2016-09-13
labor accused of being 'clean energy charlatans'  after deal to cut $500m from arena,deal,2016-09-13
courts to undergo £1bn digital reform after successful pilots,fuel,2016-09-14
was that climate change? scientists are getting faster at linking extreme weather to warming,warming,2016-09-14
jeremy corbyn to investigate idea of universal basic income,deal,2016-09-14
theresa may set to give go-ahead for hinkley point c nuclear plant,coal,2016-09-14
rugby union’s global season talks reveal game of two halves,global,2016-09-14
ftse climbs after miners recovery and in-line uk jobs data,job,2016-09-14
why can't scientists agree on e-cigarettes?,green,2016-09-14
deepwater horizon review – mark wahlberg v bp in angry disaster movie,environment,2016-09-14
brexit was a revolt against liberalism. we’ve entered a new political era,coal,2016-09-15
trump presents vision for creating 25m jobs in economic policy speech,job,2016-09-15
icc widens remit to include environmental destruction cases,environment,2016-09-15
hinkley point c nuclear power station gets government green light,coal,2016-09-15
hinkley point c nuclear power station gets government green light,green,2016-09-15
"from poldark to bieber, there's a male body ideal but is it problematic?",deal,2016-09-15
your guide to hinkley point c – the uk's first new nuclear plant for 20 years,coal,2016-09-15
global investment in energy falls but renewables remain strong,global,2016-09-15
"in offices of the future, sensors may track your every move – even in the bathroom",green,2016-09-15
nuclear power is risky and expensive; here's a better idea,deal,2016-09-15
"superannuation backflip on $500,000 cap wins over coalition conservatives",coal,2016-09-15
australia to change medical regulations to allow faster access to new drugs and devices,coal,2016-09-15
the marriage equality plebiscite message: our parliament can't do its job,job,2016-09-15
"south sudanese general paid $1.5m for melbourne home, says war profiteering report",warming,2016-09-15
david attenborough's aquatic ape series for radio 4 based on 'wishful thinking',fuel,2016-09-16
"marine life, nuclear power and clever crows – green news roundup",green,2016-09-16
"west failing to deliver nuclear deal promises, says iran vice-president",deal,2016-09-16
discover toronto's style vibe: 'a peaceful city with a side order of busy',fuel,2016-09-16
calls to halt nt light festival over fears for vulnerable rock wallaby,environment,2016-09-16
classic chic v sportwear: this season's style swap,environment,2016-09-16
information is a potent weapon in the new cold war,warming,2016-09-17
the observer view on global warming,global,2016-09-17
the observer view on global warming,warming,2016-09-17
"at a global forum of feminists, one thing is clear: it's where you live that counts",global,2016-09-17
there's no magic wand - creating jobs won't simply solve the world's problems,job,2016-09-17
tony abbott says europe is facing 'peaceful invasion' of asylum seekers,fuel,2016-09-18
st helens warming up to play-off form after cruising past widnes,warming,2016-09-18
'the nation state is back': front national's marine le pen rides on global mood,global,2016-09-18
'no time to waste': climate changes for films on global warming,global,2016-09-18
'no time to waste': climate changes for films on global warming,warming,2016-09-18
nus president malia bouattia: ‘political activists are being demonised’,coal,2016-09-18
'stand up to hate': clinton makes urgent appeal to end trump-fueled divide,fuel,2016-09-19
theresa may dismisses threat of brexit deal veto,deal,2016-09-19
coalition to reveal plan to tackle welfare dependence across generations,coal,2016-09-19
rio de janeiro returns to normal after marathon of mega events,deal,2016-09-19
the guardian view on technology’s ethical egotism: about profits not people,coal,2016-09-19
tackling corruption will deal a lethal blow to the illegal wildlife trade,deal,2016-09-19
universities fear uk's global reputation in jeopardy due to brexit,global,2016-09-19
ftse 100 jumps 1.5% as miners recover but dairy crest down on milk price warning,warming,2016-09-19
mitie sounds profit warning after brexit vote hits client spending,warming,2016-09-19
scott morrison rejects monetary policy 'experiments' to deal with low inflation,deal,2016-09-19
liberal mp says turnbull can't possibly claim world's best border protection policy,fossil,2016-09-19
adani carmichael coalmine faces new legal challenge from conservation foundation,coal,2016-09-19
theresa may: uk to ratify paris climate change deal this year,deal,2016-09-20
simon mcburney: british theatrical alchemist ready to dazzle broadway,coal,2016-09-20
obama's final un assembly address: 'at this moment we all face a choice',environment,2016-09-20
'our kids can’t play with toy guns': tyre king police shooting a painful reminder,fuel,2016-09-20
gsk makes emma walmsley most powerful woman in ftse 100,fuel,2016-09-20
"global trade deal threatens paris climate goals, leaked documents show",global,2016-09-20
"global trade deal threatens paris climate goals, leaked documents show",deal,2016-09-20
theresa may calls on un to meet challenges of globalisation,global,2016-09-20
man v rat: could the long war soon be over?,environment,2016-09-20
man v rat: could the long war soon be over?,warming,2016-09-20
greenland's huge annual ice loss is even worse than thought,green,2016-09-21
greenland's huge annual ice loss is even worse than thought,green,2016-09-21
"women do four years more work than men in lifetime, report shows",environment,2016-09-21
"world lagging behind on global health targets, researchers warn",global,2016-09-21
the guardian view on the global economic outlook: dark clouds ahead,global,2016-09-21
un warns over global fallout from debt crisis in poor countries,global,2016-09-21
the secrets of becoming a successful journalist by senior guardian contributors,fuel,2016-09-21
oecd in brexit warning u-turn as it revises growth forecast for uk,warming,2016-09-21
labour ex-minister chris mullin backs electoral pact with lib dems and greens - politics live,green,2016-09-21
trump and brexit add yet more spice to ryder cup’s theatres of cultural war,warming,2016-09-21
painting for peace: global mural project highlights the walls that divide our cities,global,2016-09-21
uk advertising watchdog admits it was wrong to ban greenpeace fracking advert,green,2016-09-21
greener pastures: the dairy farmers committed to sustainability,green,2016-09-22
carney backs green finance to cut emissions and boost growth,green,2016-09-22
100 countries push to phase out potentially disastrous greenhouse gas,green,2016-09-22
'butcher of kabul' pardoned in afghan peace deal,deal,2016-09-22
vasectomies: turning an 'act of love' into a global movement,global,2016-09-22
galilee basin coal must be left in ground as a ‘priority’ – new report,coal,2016-09-22
"global coral bleaching event might become new normal, expert warns",global,2016-09-22
"waste crime is 'the new narcotics', says environment agency chief",environment,2016-09-22
turnbull tells un secure borders essential for managing global migration flow,global,2016-09-22
centrelink could be sued over 'privatisation' of job schemes,job,2016-09-22
the beautiful game 2.0: how fifa 17 taught real football a lesson,fuel,2016-09-23
"bjørn lomborg centre got $640,000 for report saying limiting warming rise to 2c not worth it",warming,2016-09-23
"london stock exchange boss warns 100,000 jobs at risk from brexit vote",job,2016-09-23
lessons from the environmental frontline,environment,2016-09-23
britain’s loose definition of extremism is stoking a global crackdown on dissent,global,2016-09-23
money isn't enough. medical research needs a cultural revolution,coal,2016-09-23
wildlife trade summit is a 'do or die' moment for endangered animals,environment,2016-09-23
dutch parliament votes to close down country's coal industry,coal,2016-09-23
‘i am lake urmia’: a social media campaign takes on the environment in iran,environment,2016-09-23
"ivory crackdown, greenland ice loss and asian hornets – green news roundup",green,2016-09-23
"ivory crackdown, greenland ice loss and asian hornets – green news roundup",green,2016-09-23
uk visitors handed over £1.8bn in july as weak pound fuels spending spree,fuel,2016-09-23
terns follow record warm temperatures in 'shock' migration to north of alaska,warming,2016-09-23
how football fans can deal with falling out of love with former icons,deal,2016-09-23
the ethical carnivore by louise gray review – one way to stop us eating so much meat,coal,2016-09-23
farming on the edge: the indian salt producers coping with 48c heat,warming,2016-09-23
nigel farage calls hillary clinton 'a truly awful candidate' – as it happened,fuel,2016-09-23
how climate science deniers can accept so many 'impossible things' all at once,fossil,2016-09-23
uk accused of blocking un inquiry into claim of war crimes in yemen,warming,2016-09-24
trust in the media is the first casualty of a post-factual war,warming,2016-09-24
canadian town steams over nestlé bid to control local spring water well,coal,2016-09-24
environmental health officers call for smoking ban in playgrounds,environment,2016-09-25
our job now is to consider a future without work,job,2016-09-25
labour conference: iain mcnicol issues coded backing to corbyn's critics – as it happened,coal,2016-09-25
west ham united v southampton: premier league – as it happened,environment,2016-09-25
atlético madrid v deportivo: la liga – as it happened,environment,2016-09-25
jerusalem rebuilt in new york’s green and pleasant land,green,2016-09-25
"russia could be guilty of war crimes in syria, says boris johnson",warming,2016-09-25
auctioneer simon de pury: ‘owning art puts you on a different level’,deal,2016-09-25
the rise and rise of tabletop gaming,warming,2016-09-25
climate chief: uk must not use brexit to water down environment laws,environment,2016-09-26
"us emissions set to miss 2025 target in paris climate change deal, research finds",deal,2016-09-26
female playwrights deliver manchester's global festival of childbirth,global,2016-09-26
"global collaboration needed on 'bad actor' rules, says hsbc legal chief",global,2016-09-26
"farming mega-mergers threaten food security, say campaigners",warming,2016-09-26
bridget jones's baby fends off magnificent seven to keep global box office crown,global,2016-09-26
africa's portable solar revolution is thwarting thieves,warming,2016-09-26
deal-making and dirty tricks: inside the race for un secretary general,deal,2016-09-26
"support for renewable energy up, trust in political action down",coal,2016-09-26
greenpeace blockades ioi palm oil refinery in rotterdam port,green,2016-09-27
toxic emissions surged after agl acquired bayswater coal-fired power plant,coal,2016-09-27
"cutting welfare to fund tax cuts for top earners 'unconscionable', coalition told",coal,2016-09-27
greenland's receding icecap to expose top-secret us nuclear project,green,2016-09-27
bid to drill shale wells in nottinghamshire 'should get green light',green,2016-09-27
revealed: how senior laos officials cut deals with animal traffickers,deal,2016-09-27
manu chao – the king of global folk punk returns home,global,2016-09-27
wolseley cuts 800 more jobs as profits dip,job,2016-09-27
ian macfarlane says he cleared new mining industry job with pm's office,job,2016-09-27
'the horrible night has ceased': colombia peace deal resounds in farc's heartland,deal,2016-09-27
bp and shell investors urged to reward bosses for backing green energy,green,2016-09-28
fa chief felt sorry sam allardyce lost england job of a lifetime,job,2016-09-28
"superannuation funds encouraging greater fossil fuel exploration, report says",fossil,2016-09-28
"superannuation funds encouraging greater fossil fuel exploration, report says",fuel,2016-09-28
celtic v manchester city: champions league – as it happened,environment,2016-09-28
environmentalists 'expected better' of trudeau as canada backs gas project,environment,2016-09-28
"rein in protectionism to boost global growth, says christine lagarde",global,2016-09-28
fracking is a lousy way to create jobs,job,2016-09-28
"as long as greed governs global sport, corruption will be endemic",global,2016-09-28
king's college london diverts fossil fuel endowments to clean energy,fossil,2016-09-28
king's college london diverts fossil fuel endowments to clean energy,fuel,2016-09-28
pangolins thrown a lifeline at global wildlife summit with total trade ban,global,2016-09-28
sam allardyce leaves england job and says 'entrapment has won' – as it happened,job,2016-09-28
edf and uk government set to sign deal on hinkley point c,deal,2016-09-28
edf and uk government set to sign deal on hinkley point c,coal,2016-09-28
"at last, the destruction of heritage has been recognised as a weapon of war",warming,2016-09-28
"sebastian faulks webchat – your questions answered on hemingway, warfare and political apathy",coal,2016-09-28
sam allardyce: a history of suspicion and a dream job that ended after 67 days,job,2016-09-28
richell prize: susie greenhill wins literary award for 'ecological love story',green,2016-09-28
allardyce speaks of his sadness at losing england manager job to ‘entrapment’,job,2016-09-28
banning nuclear weapons is crucial for global health,global,2016-09-28
facebook and google: most powerful and secretive empires we've ever known,fuel,2016-09-28
shimon peres dies: global reaction to former israeli leader's death – latest,global,2016-09-28
robin's alarm flashes red for danger across the green space,green,2016-09-28
clementine ford: ‘there’s something really toxic with the way men bond in australia’,environment,2016-09-28
yosemite chief resigns as national parks embroiled in sexual harassment scandal,deal,2016-09-29
commonwealth bank: coal seam gas makes property 'unacceptable' as loan security,coal,2016-09-29
the guardian view of vogue v the bloggers: business is winning,environment,2016-09-29
corbyn doubtful he can make his mps oppose heathrow expansion,fuel,2016-09-29
uk ‘consistently waters down’ reforms of eu farming subsidies,warming,2016-09-29
gentrification is a global problem. it's time we found a better solution,global,2016-09-29
"us providing light arms to kurdish-led coalition in syria, officials confirm",coal,2016-09-29
chemical weapons are being used against the darfuris. this is a war crime,warming,2016-09-29
how 3d printing can revolutionise the medical profession,coal,2016-09-29
shares in deutsche bank sharply up amid speculation of doj deal,deal,2016-09-30
united nations close to landmark deal to curb airplane emissions,deal,2016-09-30
"wildlife trafficking, air pollution and farm subsidies – green news roundup",green,2016-09-30
eu gives green light to ratifying paris climate deal,green,2016-09-30
eu gives green light to ratifying paris climate deal,deal,2016-09-30
postponed granted luck of the draw for chantilly prix de l’arc de triomphe,deal,2016-09-30
postponed granted luck of the draw for chantilly prix de l’arc de triomphe,deal,2016-09-30
hinkley point c developers face £7.2bn cleanup bill at end of nuclear plant's life,coal,2016-09-30
eve out of her ruins by ananda devi review – teenage lust amid the tropical heat and dust,coal,2016-09-30
poor countries call for help in getting green stuff into climate projects,green,2016-09-30
is manchester about to become a global digital leader?,global,2016-09-30
liam fox: globalisation needs to be championed more vigorously,global,2016-09-30
don’t blame globalisation for poverty,global,2016-09-30
former new zealand pm helen clark expected to battle on for un top job,job,2016-09-30
"jobs, wealth and gentrification? what new chinatown could do for liverpool",job,2016-10-01
"medical staff in dark about policies to mitigate health risks of climate change, study says",coal,2016-10-02
countries fail to agree on complete ban to protect african lions from global trade,green,2016-10-02
countries fail to agree on complete ban to protect african lions from global trade,global,2016-10-02
world's nations agree elephant ivory markets must close,green,2016-10-02
"after article 50, brexit will be easy. a trade deal will be anything but",deal,2016-10-02
rory stewart: global order out of control as russia 'swaggers',global,2016-10-02
boris johnson: russian complicity in war crimes precludes syria talks,warming,2016-10-02
agrichemicals and ever more intensive farming will not feed the world,warming,2016-10-02
african grey parrot has global summit to thank for protected status,global,2016-10-02
hidden faultline: how trump v clinton is laying bare america's class divide,environment,2016-10-02
trump renews voter fraud warning and says clinton 'could be crazy',warming,2016-10-02
janus henderson deal shows brexit hasn't altered london's status,deal,2016-10-03
w kamau bell: 'if you don't like me that's fine – just let me do my thing',warming,2016-10-03
eu signs deal to deport unlimited numbers of afghan asylum seekers,deal,2016-10-03
what have you lied about to get a job? share your stories,job,2016-10-03
shell’s rio roadshow: springboard for green startups or just a lott of oily spin?,green,2016-10-03
amber rudd pledges to prevent migrants 'taking jobs british people could do' - politics live,job,2016-10-04
secret aid worker: it's ok to not love this job all the time,job,2016-10-04
green groups accuse sadiq khan of betrayal over east london tunnel,green,2016-10-04
"world bank issues warning on stunting in children, but points to peru's success",warming,2016-10-04
sharks and rays win new protections at global wildlife summit,global,2016-10-04
"renewable energy: get your story straight, act tells coalition",coal,2016-10-04
tim kaine v mike pence: what to know about the vice-presidential candidates,environment,2016-10-04
solar outstrips coal in past six months of uk electricity generation,coal,2016-10-04
sublime moment with a warbler on the canyon's rim,environment,2016-10-04
"paris climate deal a 'turning point' in global warming fight, obama says",deal,2016-10-05
"paris climate deal a 'turning point' in global warming fight, obama says",global,2016-10-05
"paris climate deal a 'turning point' in global warming fight, obama says",warming,2016-10-05
imf urges governments to tackle record global debt of $152tn,global,2016-10-05
conservationists deal last-minute blow to 'unlawful' fracking bid,deal,2016-10-05
fossil fuel industry's methane emissions far higher than thought,fossil,2016-10-05
fossil fuel industry's methane emissions far higher than thought,fuel,2016-10-05
the seven big decisions made at the cites global wildlife summit,global,2016-10-05
tory conference – the eurocidal maniacs have found their ‘theresa bae’,deal,2016-10-05
"healthcare in afghanistan: ‘doctors are threatened at gunpoint, even by civilians’",green,2016-10-05
governments must heed imf warning of  $152tn global debt timebomb,warming,2016-10-05
governments must heed imf warning of  $152tn global debt timebomb,global,2016-10-05
new acland coalmine expansion: activists' lawyers stress water risk in final arguments,coal,2016-10-05
from russia with love of disruption and the environment,environment,2016-10-05
bank inquiry: anz has 'no link' to malaysian 1mdb scandal – as it happened,deal,2016-10-05
plastic substitutes and other breakthroughs from 25 years of green chemistry,green,2016-10-06
first deal to curb aviation emissions agreed in landmark un accord,deal,2016-10-06
intensive farming v the environment,warming,2016-10-06
intensive farming v the environment,environment,2016-10-06
intensive farming v the environment,environment,2016-10-06
gears of war 4 review – a shot in the arm for a fading series,warming,2016-10-06
gears of war 4 review – a shot in the arm for a fading series,warming,2016-10-06
telling nhs doctors to go home is self-harming madness,warming,2016-10-06
the wonderful football freestyling world of indi cowie,fuel,2016-10-06
"hard brexit could cost scotland £2,000 a head and 80,000 jobs",job,2016-10-06
flint warnings as atlantic city may be forced into state takeover of water,warming,2016-10-06
australia must deliver benefits of globalisation to win public support – top public servant,global,2016-10-06
are we smart enough to know how smart animals are? by frans de waal – review,deal,2016-10-06
small businesses buoyed by global possibilities after brexit,global,2016-10-06
banking inquiry: westpac has 'no plans' to change political donations policy – live,coal,2016-10-06
"exiled from pakistan, destitute afghans return to a country at war",warming,2016-10-06
"whistleblower refers email to watchdog, alleging unlawful approval of gas plants",fuel,2016-10-06
"carmichael coal mine: politics, activism and the search for truth",coal,2016-10-07
overwhelming global response to giving away australian wildlife sanctuary,global,2016-10-07
"uk fracking, record temperatures and fishy accents – green news roundup",green,2016-10-07
brisbane roar v melbourne victory: a-league season opener – as it happened,environment,2016-10-07
wells fargo banking scandal a financial crisis we can finally understand,deal,2016-10-07
tom hanks: political ignorance is the greatest threat to humanity,coal,2016-10-07
poor countries urge fast action on paris deal to stop catastrophic warming,deal,2016-10-07
poor countries urge fast action on paris deal to stop catastrophic warming,warming,2016-10-07
book celebrates vladimir putin as 'global cultural phenomenon',global,2016-10-07
indian medical students use pads and poems to tackle period taboos,coal,2016-10-07
letters: political action is central to addressing mental health crisis,coal,2016-10-08
juan manuel santos: peace prize winner still in search of the final deal,deal,2016-10-08
"from bruce springsteen to tyson fury, men are opening up about depression",environment,2016-10-08
welsh tidal lagoon project could open way for £15bn revolution in uk energy,deal,2016-10-08
western sydney wanderers v sydney fc: a-league sydney derby - as it happened,environment,2016-10-08
"it’s a bargain state pension deal: put in £700, get £5,000 out",deal,2016-10-08
"investment fraud targets are men in their 60s in urban areas, say police",environment,2016-10-09
world bank says paris climate goals at risk from new coal schemes,coal,2016-10-09
healthcare innovations won’t cure global health inequality – political action will,global,2016-10-09
healthcare innovations won’t cure global health inequality – political action will,coal,2016-10-09
"theresa may's local council set to spend £50,000 to fight heathrow runway",coal,2016-10-10
robert f kennedy jr takes big business to task over pollution at sxsw eco,fossil,2016-10-10
robert f kennedy jr takes big business to task over pollution at sxsw eco,fuel,2016-10-10
heather stanning: ‘we put an awful lot of pressure on ourselves to win gold in rio’,fuel,2016-10-10
nine ways funding for the global hiv response could go further,global,2016-10-10
"desert trip review - mccartney, stones and co give oldchella a hint of rebellion",coal,2016-10-10
global summit to strike deal on phase-out of hfcs,global,2016-10-10
global summit to strike deal on phase-out of hfcs,deal,2016-10-10
trump v clinton: who won the second presidential debate?,environment,2016-10-10
robert de niro calls jon voight 'delusional' over support for trump,deal,2016-10-10
caring for creation makes the christian case for climate action,warming,2016-10-10
hundreds of jobseekers flock to planned casino in new york: 'it's a new start',job,2016-10-10
"climate change, ufos and screaming molluscs; what fuels dd dumbo's quirky indie-pop?",fuel,2016-10-10
