headlines,terms,dates
china warns uk relations are at 'historical juncture' over hinkley point,coal,2016-08-08
sir philip green told to 'do the right thing' and plug bhs pension deficit,green,2016-08-08
"gold can be a big deal for small investors, but nothing is certain",deal,2016-08-08
back to art school: grayson perry and gillian wearing meet tomorrow's stars,warming,2016-08-08
'alarming' trend in queensland tree clearing figures spurs call for tighter laws,warming,2016-08-08
"waste of resources is biggest threat to planet, warns scottish environment agency",environment,2016-08-08
kevin rudd outlines 10-point plan to reform un in response to globalisation,global,2016-08-08
manchester united hope record paul pogba deal is a watershed moment,deal,2016-08-09
manchester united hope record paul pogba deal is a watershed moment,environment,2016-08-09
uk is biggest online drug dealing country in europe,deal,2016-08-09
"uk trade deficit widens, as thinktank warns of possible recession – as it happened",fossil,2016-08-09
brazilian judge orders rio 2016 organisers to allow peaceful protests,fuel,2016-08-09
china-uk investment: key questions following hinkley point c delay,coal,2016-08-09
the eu is right to oppose a global ivory ban,global,2016-08-09
"bike share mapping creates beautiful portraits of london, nyc and berlin",fuel,2016-08-09
what's it really like to study for a postgrad degree in europe?,green,2016-08-09
greenpeace sounds alarm over china's long-distance fishing fleet,green,2016-08-09
why malcolm roberts' demand for 'empirical evidence' on climate change is misleading,coal,2016-08-09
lesson of #censusfail: continued funding cuts mean agencies can’t do their job,job,2016-08-10
bank of england shakes off qe wobble with successful £1.17bn bond buy –as it happened,fuel,2016-08-10
'my job is to make children hopeful': inside liberia's deaf school,job,2016-08-10
rising avocado prices fuelling illegal deforestation in mexico,fuel,2016-08-10
rio olympics: michael phelps wins 21st swimming gold medal – as it happened,deal,2016-08-10
census 2016: the political game has changed and coalition failed its first test,coal,2016-08-10
census 2016: the political game has changed and coalition failed its first test,coal,2016-08-10
facebook v adblock: the anti-ad empire strikes back,environment,2016-08-11
"chemical weapons attacks in syria may normalise war crimes, experts warn",warming,2016-08-11
bhs scandal has long way to run despite shutters coming down,deal,2016-08-11
pen/nabokov award relaunched to promote 'global voices' in us,global,2016-08-11
is your local pub under threat? share your photos and stories,coal,2016-08-11
may urged to pull plug immediately on hinkley c over spying allegations,coal,2016-08-11
google maps palestine row: why neutrality in tech is an impossible dream,fossil,2016-08-11
old mutual falls after results while shire slips on deal talk,deal,2016-08-11
coalition split over intervention in queensland land clearing,coal,2016-08-11
"the fictional, extraordinary life of the greenland shark – 392 years and counting",green,2016-08-12
'it's a beautiful thing': ahmadi muslims find strength at uk gathering,fuel,2016-08-12
"england v pakistan: fourth test, day two – as it happened",environment,2016-08-12
pinewood studios to be taken private in £323m deal with aermont capital,deal,2016-08-12
ethical questions raised in search for sardinian centenarians' secrets,coal,2016-08-12
"a 400-year-old shark, fracking 'bribes' and hinkley c – green news roundup",coal,2016-08-12
"a 400-year-old shark, fracking 'bribes' and hinkley c – green news roundup",green,2016-08-12
out of the wood: how carpentry is helping men tackle loneliness,environment,2016-08-12
don dale to the nauru files: political response to the outrages couldn't be more different,coal,2016-08-12
panama papers: iceland calls elections six months early in wake of scandal,deal,2016-08-12
"gunfire, logistical chaos? all things considered, rio is going rather well",coal,2016-08-13
the rising power of china will create new political fissures in the west,coal,2016-08-13
warrington’s daryl clark back to his best and has his sights on trophies,warming,2016-08-13
from the rich black soil of the liverpool plains springs hope for coalmine-free future,coal,2016-08-13
poor globally being failed on sanitation,global,2016-08-14
can we feed 10 billion people on organic farming alone?,warming,2016-08-14
"world's largest vertical farm grows without soil, sunlight or water in newark",coal,2016-08-14
thai bombings: police arrest two men over coordinated attacks,environment,2016-08-14
advice on job hunting in uncertain times – live chat,job,2016-08-14
"kate mara: ‘if we were up for the same job, our agents wouldn't tell us’",job,2016-08-14
anna meares' sixth medal elevates her among the great australian olympians,deal,2016-08-14
chelsea v west ham united: premier league – as it happened,environment,2016-08-15
how scientific rigour helped team gb’s saddle-sore cyclists on their medal trail,deal,2016-08-15
rio water pollution reflects global crisis,global,2016-08-15
rough trade: the global economy needs a jumpstart to benefit all,global,2016-08-15
climate urgency: we've locked in more global warming than people realize,global,2016-08-15
climate urgency: we've locked in more global warming than people realize,warming,2016-08-15
only one concessional loan from coalition's dairy rescue plan approved,coal,2016-08-15
"canada's trade deal with eu a model for brexit? not quite, insiders say",deal,2016-08-15
"canada's trade deal with eu a model for brexit? not quite, insiders say",deal,2016-08-15
the secret life of an organiser: i clear my clients’ physical and emotional clutter,coal,2016-08-15
"unfair, stressful or ‘a good idea’? what pupils think of the 11-plus exam",fuel,2016-08-15
chinese universities break into top 100 global index for first time,global,2016-08-15
world's hottest month shows challenges global warming will bring,global,2016-08-16
world's hottest month shows challenges global warming will bring,warming,2016-08-16
obama tightens emissions and fuel efficiency rules for heavy duty trucks,fuel,2016-08-16
greener alternatives to hinkley point c,green,2016-08-16
greener alternatives to hinkley point c,coal,2016-08-16
piranhas with human-like teeth in michigan fuel concern over invasive fish,fuel,2016-08-16
edinburgh fringe performers swept up in 2016's political whirlwind,coal,2016-08-16
fears of global yellow fever epidemic grow as vaccine stocks dwindle,global,2016-08-16
illegal mines and local mafia take shine off latin american gold,coal,2016-08-16
brexit weekly briefing: westminster's lack of a plan leads to turf war,warming,2016-08-16
islamophobia: why adnan doesn't get a job callback but aidan does,job,2016-08-16
new zealand's most shameful secret: 'we have normalised child poverty',fuel,2016-08-16
tidal energy support ebbs and flows,deal,2016-08-17
sadiq khan names deputy mayor for environment and energy,environment,2016-08-17
how the fossil fuel industry's new pitch is more like an epitaph than a life lesson,fossil,2016-08-17
how the fossil fuel industry's new pitch is more like an epitaph than a life lesson,fuel,2016-08-17
jewish community leader says removing 18c would send 'worst possible message',fossil,2016-08-17
brexit trade deals: the gruelling challenge of taking back control,deal,2016-08-17
coal ship crew stranded without food or fuel off australia's east coast,coal,2016-08-17
coal ship crew stranded without food or fuel off australia's east coast,fuel,2016-08-17
childhood obesity strategy: not even an e for effort,green,2016-08-18
childhood obesity strategy: not even an e for effort,green,2016-08-18
childhood obesity strategy: not even an e for effort,deal,2016-08-18
childhood obesity strategy: not even an e for effort,environment,2016-08-18
childhood obesity strategy: not even an e for effort,fuel,2016-08-18
why the new york yankees can't lose even when they try to,green,2016-08-18
the chibok girls are just one part of the ordeal of women in north-east nigeria,deal,2016-08-18
yellow fever in angola and the drc: a stark warning from an old enemy,warming,2016-08-19
fighting rages in aleppo despite global anger at image of injured child,global,2016-08-19
beijing decries 'china-phobia' after britain cools on hinkley point nuclear deal,deal,2016-08-19
omran’s picture must be a turning point in syria’s war,warming,2016-08-20
trump and clinton's free trade retreat: a pivotal moment for the world's economic future,environment,2016-08-20
the troubling evolution of corporate greenwashing,green,2016-08-20
green party candidate jill stein calls for climate state of emergency,green,2016-08-20
aleppo's underground orphanage offers a haven for children bereaved by war,warming,2016-08-20
what’s needed to tackle britain’s homelessness scandal,deal,2016-08-21
no economy is even close to achieving its personal best,green,2016-08-21
"olympics alternative review: glory, gaffes and bright green water",green,2016-08-21
easternisation: war and peace in the asian century by gideon rachman – review,warming,2016-08-21
"think jobs, spending and house prices seem brexit-proof? fingers crossed for next year",job,2016-08-21
bbc weather turns warm but rather misty,warming,2016-08-21
enterprise rent-a-car becomes paid alec member despite green efforts,green,2016-08-22
green man review – from fusion to folk in the misty mountains,green,2016-08-22
​deus ex: mankind divided review – beautiful if half-baked cyberpunk sequel,fuel,2016-08-22
liberian nurses learn to spot danger signs in babies as healthcare gets shot in arm,warming,2016-08-22
historical documents reveal arctic sea ice is disappearing at record speed,coal,2016-08-22
the secret life of an army officer: i’m a liberal who wouldn’t vote for war,warming,2016-08-22
scott morrison attacks super funds not investing in coal for 'political reasons’,coal,2016-08-22
scott morrison attacks super funds not investing in coal for 'political reasons’,coal,2016-08-22
win a (home) pair of premier league tickets to chelsea v burnley,environment,2016-08-23
the political crusades targeting national parks for drilling and exploitation,coal,2016-08-23
"australia will need to remove co2 from air to keep warming below 2c, climate body says",warming,2016-08-23
the deaths on the british coastline are a reminder of the sea’s awful power,fuel,2016-08-23
nt government did secret coal deal a day before going into caretaker mode,environment,2016-08-23
nt government did secret coal deal a day before going into caretaker mode,coal,2016-08-23
nt government did secret coal deal a day before going into caretaker mode,deal,2016-08-23
inside shanghai tower: china's tallest skyscraper claims to be world's greenest,green,2016-08-23
must you know the details? why we need a global code on the reporting of violence,global,2016-08-23
life expectancy in syria fell by six years at start of civil war,warming,2016-08-24
"queensland solar projects that could create 2,600 jobs at risk in federal cuts",job,2016-08-24
global rugby union season talks stall to leave 2019 fixture list in limbo,global,2016-08-24
discovery of potentially earth-like planet proxima b raises hopes for life,global,2016-08-24
discovery of potentially earth-like planet proxima b raises hopes for life,job,2016-08-24
a 'radical alternative': how one man changed the perception of los angeles,coal,2016-08-24
balkan countries unite in a war on waste,warming,2016-08-24
super funds and fossil fuels: scott morrison should study the facts,fossil,2016-08-24
super funds and fossil fuels: scott morrison should study the facts,fuel,2016-08-24
premiership rugby’s mark mccafferty urges talks on global calendar,global,2016-08-25
war of words hots up between us and eu over tax avoidance,warming,2016-08-25
county cricket: surrey v lancashire and much more – as it happened,environment,2016-08-25
would you wear wool shoes to save the environment?,environment,2016-08-25
italy earthquake: death toll soars as powerful aftershock rocks amatrice,fuel,2016-08-25
"global warming is melting the greenland ice sheet, fast",global,2016-08-25
"global warming is melting the greenland ice sheet, fast",warming,2016-08-25
"global warming is melting the greenland ice sheet, fast",green,2016-08-25
jaffa cakes: ruby tandoh and marcus wareing on how to make them,warming,2016-08-25
"pokémon: gotta catch them all, even in the library",green,2016-08-25
climate scientists write another letter warning of unfolding crisis for turnbull to ignore,warming,2016-08-25
"the burkini ban ruling is a start, but france has more issues to deal with",deal,2016-08-26
"us national parks, badger cull and microplastics – green news roundup",green,2016-08-26
behind the scenes at the vmas: 'we create a pretty volatile environment',environment,2016-08-26
'i've done really bad things': the undercover cop who abandoned the war on drugs,warming,2016-08-26
"sorry josh frydenberg, gas is not the answer to the problem of coal",coal,2016-08-26
grandmother of african art finds unlikely partner in war on aids,warming,2016-08-27
coalition's policies go around in circles instead of finding the sensible centre,coal,2016-08-27
local difficulties in the cash-strapped national health service,coal,2016-08-28
"kenya’s seaside looks peaceful, but a murderous war is being waged",warming,2016-08-28
labor says coalition has lied and included additional cuts in 'omnibus' savings bill,coal,2016-08-29
afropunk 2016 review: a musical kaleidoscope of outcasts and misfits,coal,2016-08-29
"holoscenes: lars jan's 3,500-gallon warning to humanity",warming,2016-08-29
the anthropocene epoch could inaugurate even more marvellous eras of evolution,green,2016-08-29
eu staff petition attacks barroso over goldman sachs job,job,2016-08-29
philip green suffers another round of newspaper excoriation,green,2016-08-29
world first for shetlands in tidal power breakthrough,deal,2016-08-29
climate sceptic mp appointed chair of environment and energy committee,environment,2016-08-29
"middle-aged men at highest risk of dying from drug overdose, report finds",environment,2016-08-29
coalition environment committee chairman takes aim at solar subsidies,coal,2016-08-30
coalition environment committee chairman takes aim at solar subsidies,environment,2016-08-30
arm shareholders approve softbank takeover,warming,2016-08-30
america's problems aren't obama's fault. they're george w bush's,warming,2016-08-30
"nasa: earth is warming at a pace 'unprecedented in 1,000 years'",warming,2016-08-30
climate change authority splits over ets report commissioned by coalition,coal,2016-08-30
the ‘graduate job’ gravy train is shuddering to a halt,job,2016-08-30
labor national secretary george wright quits for job with bhp billiton,job,2016-08-30
victoria to permanently ban fracking and coal seam gas exploration,coal,2016-08-30
brains and bone saws: a day with the chief medical examiner of new york city,coal,2016-08-31
chelsea confirm deal struck for david luiz to return from psg,deal,2016-08-31
"restricting immigration will be at heart of brexit deal, theresa may says",deal,2016-08-31
oldest fossils on earth discovered in 3.7bn-year-old greenland rocks,fossil,2016-08-31
oldest fossils on earth discovered in 3.7bn-year-old greenland rocks,green,2016-08-31
a car made from tequila? ford motor co says it's good for the planet,coal,2016-08-31
labour urges theresa may to speed up paris climate deal ratification,deal,2016-08-31
"cigarettes, asbestos, now fossil fuels. how big business impacts public health",fossil,2016-08-31
"cigarettes, asbestos, now fossil fuels. how big business impacts public health",fuel,2016-08-31
england v pakistan: fourth odi – as it happened,environment,2016-09-01
mps back plan to force global firms to publicly disclose income and tax,global,2016-09-01
the guardian view on pope francis: an unlikely voice for the environment,environment,2016-09-01
lions tour the prize but first comes treadmill even robots would find wearing,green,2016-09-01
lions tour the prize but first comes treadmill even robots would find wearing,warming,2016-09-01
global season will only happen if new zealand and home nations work together,global,2016-09-01
mia: aim review – fearless but fragmented global pop,global,2016-09-01
"dilma rousseff might be gone, but brazil’s political crisis certainly isn’t",coal,2016-09-01
imf urges g20 to champion globalisation at china summit,global,2016-09-01
tony blair says it is 'possible' uk could stay in eu - politics live,fossil,2016-09-01
top graduates missing out on banking jobs for lacking 'polish',job,2016-09-01
drowning: do you know enough about this global killer? – quiz,global,2016-09-01
"fuel economy: just two cars deliver advertised mileage, tests show",fuel,2016-09-01
labor wins three last-minute votes to force coalition to debate banks – as it happened,coal,2016-09-01
senate calls on coalition to rule out financing adani's carmichael coalmine,coal,2016-09-01
senate calls on coalition to rule out financing adani's carmichael coalmine,coal,2016-09-01
thousands of uk churches ditch fossil fuel electricity,fossil,2016-09-01
thousands of uk churches ditch fossil fuel electricity,fuel,2016-09-01
gaping chasm between coalition's climate mantra and the real debate,coal,2016-09-02
bishop of grantham first c of e bishop to declare he is in gay relationship,coal,2016-09-02
bishop of grantham first c of e bishop to declare he is in gay relationship,green,2016-09-02
bishop of grantham first c of e bishop to declare he is in gay relationship,deal,2016-09-02
bishop of grantham first c of e bishop to declare he is in gay relationship,environment,2016-09-02
bishop of grantham first c of e bishop to declare he is in gay relationship,fuel,2016-09-02
the guardian view on green leadership: a challenge and an opportunity,green,2016-09-02
weak us jobs report dampens prospect of rate rise  - as it happened,job,2016-09-02
hurricane hermine causes severe flooding but shrinks to tropical storm,coal,2016-09-02
caroline lucas and jonathan bartley elected green party co-leaders – as it happened,green,2016-09-02
university: an introduction to political activism,coal,2016-09-02
sports direct: global pension funds to vote against mike ashley re-election,global,2016-09-02
"asiatic cheetahs, pope francis and chicken bones – green news roundup",green,2016-09-02
caroline lucas and jonathan bartley voted joint green party leaders,green,2016-09-02
l is for london: share your artwork now,global,2016-09-02
l is for london: share your artwork now,deal,2016-09-02
l is for london: share your artwork now,coal,2016-09-02
l is for london: share your artwork now,fossil,2016-09-02
l is for london: share your artwork now,fuel,2016-09-02
"frog and scot, deal, kent: ‘the lack of pretension is as bracing as a dive into the british briny’ – restaurant review",deal,2016-09-02
"us jobs report: economy added 151,000 jobs in august, fewer than expected",job,2016-09-02
"us jobs report: economy added 151,000 jobs in august, fewer than expected",job,2016-09-02
change.org cuts a third of its global workforce,global,2016-09-02
turkey's syria offensive shows how each party is fighting its own war,warming,2016-09-02
hanjin shipping bankruptcy causes turmoil in global sea freight,global,2016-09-02
nick kyrgios v horacio zeballos: us open second round - as it happened,environment,2016-09-02
why apple’s low-tax deal is no blueprint for brexit britain,deal,2016-09-03
the observer view on global reform of corporate tax,global,2016-09-03
breakthrough as us and china agree to ratify paris climate deal,green,2016-09-03
breakthrough as us and china agree to ratify paris climate deal,deal,2016-09-03
"paris climate deal: where us and china have led, others must quickly follow",deal,2016-09-03
theresa may could face hinkley point c nuclear row at g20 meeting with xi jinping,coal,2016-09-03
we can resettle refugees in australia and it's not just wishful thinking. this is how,fuel,2016-09-04
green party's jill stein argues right to appear at presidential debates,green,2016-09-04
japan's brexit demands range from possible to fanciful,fossil,2016-09-04
japan's brexit demands range from possible to fanciful,fuel,2016-09-04
"g20: is it time to go back to the future, before globalisation?",global,2016-09-04
theresa may joins g20 summit to face brexit warnings from us and japan,warming,2016-09-04
top 200 universities in the world 2016: the global trends,global,2016-09-05
greens cannot afford to ignore economics,green,2016-09-05
"women ask for pay increases as often as men but receive them less, study says",environment,2016-09-05
cristiano ronaldo’s museum: a reminder of a great ego and an even greater talent,green,2016-09-05
an insider's guide to sana'a: 'we live in a prolonged war zone',warming,2016-09-05
tory mps call for shift in farming subsidies to green protections,warming,2016-09-05
tory mps call for shift in farming subsidies to green protections,green,2016-09-05
morocco to give 600 mosques a green makeover,green,2016-09-05
india's silk road offers path to prosperity but not equality for female weavers,fossil,2016-09-05
queensland university of technology to dump fossil fuel investments,fossil,2016-09-05
queensland university of technology to dump fossil fuel investments,fuel,2016-09-05
"australians should not be fearful of islamic state attack ‘propaganda’, police say",fuel,2016-09-06
pope should know that resisting birth control is bad for the environment,environment,2016-09-06
eu ethics watchdog intervenes over barroso's goldman job,job,2016-09-06
"brexit means brexit, corbynistas and ‘facts’ – the new political glossary",coal,2016-09-06
"bozos, goat lovers and sons of whores: a history of political insults",coal,2016-09-06
passage through mexico: the global migration to the us,global,2016-09-06
"trump's warnings of a 'rigged' election may be dangerous, say experts",warming,2016-09-06
brexit negotiators urged to examine tougher rules on farming antibiotics,warming,2016-09-06
turkish coal plants in line for public subsidies,coal,2016-09-06
palm oil firm accused of hiring men to kidnap smog inspectors in indonesia,environment,2016-09-06
un human rights chief  zeid ra'ad al hussein calls for world to reject populist bigots - in full,global,2016-09-06
un human rights chief  zeid ra'ad al hussein calls for world to reject populist bigots - in full,deal,2016-09-06
un human rights chief  zeid ra'ad al hussein calls for world to reject populist bigots - in full,coal,2016-09-06
why i can’t forgive nick clegg and his party of useful idiots,fuel,2016-09-06
city of sydney council to divest from fossil fuels regardless of election result,fossil,2016-09-06
city of sydney council to divest from fossil fuels regardless of election result,fuel,2016-09-06
poorest countries hit hardest as world lags behind on global education goals,global,2016-09-06
c of e  bishops urged to unequivocally welcome gay christians,coal,2016-09-07
c of e  bishops urged to unequivocally welcome gay christians,green,2016-09-07
c of e  bishops urged to unequivocally welcome gay christians,deal,2016-09-07
c of e  bishops urged to unequivocally welcome gay christians,environment,2016-09-07
c of e  bishops urged to unequivocally welcome gay christians,fuel,2016-09-07
warren gatland singles out dylan hartley as possible lions captain,fossil,2016-09-07
it's equal pay day. it took us 69 extra days to catch up to the men,environment,2016-09-07
corbyn pledges to ban fracking as part of labour's new green agenda,green,2016-09-07
saving africa's elephants isn't just a 'white man's job',job,2016-09-07
"war disproportionately affects women, so why so few female peacekeepers?",warming,2016-09-07
why labour is putting energy reform at the heart of its green agenda,green,2016-09-07
feeding sparrows on holy island: an ethical dilemma,coal,2016-09-07
'queen of disco' donna summer musical in the works for broadway,coal,2016-09-08
justine greening responds to urgent commons question on grammar schools - politics live,green,2016-09-08
liberty media’s f1 deal strikes right notes but highlights ecclestone’s contribution,deal,2016-09-08
somali refugee fadumo dayib runs for president 26 years after fleeing civil war,warming,2016-09-08
uk's micro focus and hewlett-packard agree £6.6bn software deal,green,2016-09-08
uk's micro focus and hewlett-packard agree £6.6bn software deal,deal,2016-09-08
carmichael coalmine appeal says adani 'misled' native title tribunal over benefits,coal,2016-09-08
nicholas serota: even he was shocked by the success of tate modern,green,2016-09-09
getting a job in sport: how to turn your passion into a rewarding career,job,2016-09-09
getting a job in sport: how to turn your passion into a rewarding career,warming,2016-09-09
construction and export figures fuel hopes uk economy is growing,fuel,2016-09-09
philip green described as 'britain's donald trump' in vanity fair,green,2016-09-09
"lost wilderness, pandas bounce back and giraffes – green news roundup",green,2016-09-09
"global food crisis triggered cultural shift towards junk food, say researchers",global,2016-09-09
"sugar warnings have not reduced consumption in england, figures show",warming,2016-09-09
mourinho v guardiola: their poisonous rivalry finally hits the premier league,environment,2016-09-09
sir philip green: i am working every day on bhs pension crisis,green,2016-09-09
we need to be careful about demanding migrants speak english,fuel,2016-09-09
isis is as much an offshoot of our global civilisation as google,global,2016-09-09
refuelling at the avian departure lounge,fuel,2016-09-09
irish rower dies in poland after freak accident hours after winning medal,deal,2016-09-10
don’t blame the fashion world for the cult of skinny – even roald dahl plays his part,green,2016-09-10
