headlines,terms,dates
senator al franken accuses donald trump of launching antisemitic tv ad,coal,2016-11-06
marrakech climate talks: giving the fossil fuel lobby a seat at the table,fossil,2016-11-06
marrakech climate talks: giving the fossil fuel lobby a seat at the table,fuel,2016-11-06
donald trump jr's gun rights coalition includes olympian and beauty queen,coal,2016-11-06
breaking the code review – telling autistic turing's fateful truth,fuel,2016-11-06
texas scientist and evangelical takes to the web to convert climate cynics,coal,2016-11-06
a world gone mad: the diaries of astrid lindgren 1939-45 review – the jackboots before pippi’s long stockings,green,2016-11-06
seizing our sovereignty or declaring war on democracy: split view on judges’ ruling,warming,2016-11-06
nicholas stern: cost of global warming ‘is worse than i feared’,global,2016-11-06
nicholas stern: cost of global warming ‘is worse than i feared’,warming,2016-11-06
australian unions call for 'just transition' from coal-generated electricity,coal,2016-11-07
"clinton, trump and foreign policy: global conflicts await the next president",global,2016-11-07
"win or lose, republicans are heading for civil war after election day",warming,2016-11-07
new generation of ethical hackers aims to impress recruiters,coal,2016-11-07
rugged men build rugged walls in a rugged landscape,environment,2016-11-07
us faces host of global threats during transition until next president,global,2016-11-07
quentin bryce in high-powered group calling for coal power to be phased out,coal,2016-11-07
jack wilshere raring to go for england after rediscovering love for game,warming,2016-11-08
my online bank gave me a tesco moment,environment,2016-11-08
we need a brexit deal that heals the north-south divide,deal,2016-11-08
who controls whom? the monarchy v the media,environment,2016-11-08
"jobless, jaded, and voting for trump in ohio: 'he’ll be different, in some way'",job,2016-11-08
"uk risks losing global influence if it quits single market, says former civil servant",global,2016-11-08
"global 'greening' has slowed rise of co2 in the atmosphere, study finds",global,2016-11-08
"global 'greening' has slowed rise of co2 in the atmosphere, study finds",green,2016-11-08
charles foster: 'my freaky zoological method acting was fun',coal,2016-11-08
damian green dismisses 'offensive' un report on uk disability rights,green,2016-11-08
m&s's chequered history of global expansion – timeline,global,2016-11-08
hong kong lawyers prepare protest march after china inflames political crisis,coal,2016-11-08
