headlines,terms,dates
"global demand for energy will peak in 2030, says world energy council",global,2016-10-10
facebook enjoys £11m uk tax credit despite £5bn global profit,global,2016-10-10
malcolm turnbull says labor's stance on renewable energy is 'political claptrap',coal,2016-10-10
coal-fired power stations: senate committee to examine how best to close them,coal,2016-10-11
elon musk hits back at coal baron who called him a 'fraud' over green subsidies,coal,2016-10-11
elon musk hits back at coal baron who called him a 'fraud' over green subsidies,green,2016-10-11
bankers warn brexit could force jobs out of london,job,2016-10-11
irish finance minister stands firm on apple tax deal in budget speech,deal,2016-10-11
deal to double flights between uk and china takes off,deal,2016-10-11
amazon reportedly planning to build a series of physical stores selling groceries,coal,2016-10-11
ex-minister francis maude takes brexit advisory job at law firm,job,2016-10-11
is using less water the secret to cutting our greenhouse gas emissions?,green,2016-10-11
"eu petition on barroso's goldman sachs job signed by more than 150,000",job,2016-10-11
"fujitsu to cut up to 1,800 uk jobs",job,2016-10-11
hurricane-ravaged haiti has 'alarming' levels of hunger and malnutrition,warming,2016-10-11
uk loses top 10 spot in global energy ranking for the first time,global,2016-10-11
coalition urged to regulate indigenous hunting of endangered animals,coal,2016-10-11
'hell on earth': the great urban scandal of family life lived on a rubbish dump,deal,2016-10-11
preserving historical buildings: the most sustainable thing is not to build new stuff,coal,2016-10-12
how google is using big data to protect the environment,environment,2016-10-12
national grid: two coal plants to get £77m to be on winter standby,coal,2016-10-12
doctor who stars regenerated as mr men,environment,2016-10-12
klinsmann says julian green 'back in the picture' for usa after scoring again,green,2016-10-12
ethiopia is in a state of emergency. the tyrannical government must go,coal,2016-10-12
monetary policy has an enormous impact on politics. it's time for a radical rethink,coal,2016-10-12
"lloyds accused of 'death by a thousand cuts' as it axes 1,340 jobs",job,2016-10-12
can cities be feminist? inside the global rise of female mayors,global,2016-10-12
yasuni man film is an intimate portrait of a beautiful land under siege for its oil,fuel,2016-10-12
black mist burnt country review – exhibition covers devastation of nuclear war,warming,2016-10-12
why teaching graduates to be flexible is more important than worrying about jobs that don't yet exist,job,2016-10-13
chris rock reportedly makes $40m deal with netflix for two comedy specials,deal,2016-10-13
holland/potter/loueke/harland: aziza cd review – ace new jazz quartet with global influences,global,2016-10-13
drake v sufjan stevens and the history of the mashup album,environment,2016-10-13
power stations to get early warning against jellyfish invasions,warming,2016-10-13
chelsea confirm kit deal with nike worth £60m a season until 2032,deal,2016-10-13
central america's rampant violence fuels an invisible refugee crisis,fuel,2016-10-13
world's billionaires lose £215m each as global economy struggles,global,2016-10-13
the real sharknado: how sharks deal with extreme weather,deal,2016-10-13
electric cars set to pass 2m landmark globally by end of 2016,global,2016-10-13
will jobs exist in 2050?,job,2016-10-13
'no one in fashion really cares about a diverse world' – r j hernández,warming,2016-10-13
'no one in fashion really cares about a diverse world' – r j hernández,green,2016-10-13
'no one in fashion really cares about a diverse world' – r j hernández,environment,2016-10-13
'no one in fashion really cares about a diverse world' – r j hernández,job,2016-10-13
wa is home to the longest unbroken evolution of plant species. don't frack it,warming,2016-10-13
world bank tribunal dismisses mining firm's $250m claim against el salvador,fuel,2016-10-14
"from marmite to the royal yacht, britain is now a global joke",global,2016-10-14
"electric cars, an escaped gorilla and fracking – green news roundup",green,2016-10-14
fantastic beasts and where to find them 'global fan event': what we learned,global,2016-10-14
"global sea levels are rising fast, so where does that leave the cities most at risk?",global,2016-10-14
'it's our global addiction': scottish oil drama crude drills down to reality,global,2016-10-14
"why losing the european medicines agency is bad news for patients, jobs – and the nhs",job,2016-10-14
facing my fear: i was always scared of the dark. then ptsd made it even worse,green,2016-10-14
"coal price rally raises australian hopes – but it won't last, say economists",coal,2016-10-14
"we should be putting the brake on the carmichael coalmine, not hitting the accelerator",coal,2016-10-14
scott morrison and the budget just got lucky with the price of coal,coal,2016-10-15
kigali deal on hfcs is big step in fighting climate change,deal,2016-10-15
greenhouse gases deal will make little difference to west,green,2016-10-15
greenhouse gases deal will make little difference to west,deal,2016-10-15
samarco dam collapse: one year on from brazil's worst environmental disaster,environment,2016-10-15
my kids are more important than my career – so to hell  with the job,job,2016-10-15
tim dowling: can we reassemble our fractured family in a virtual environment?,environment,2016-10-15
"radical steps needed to avoid decline in construction industry, says review",coal,2016-10-16
a long-distance traveller on a refuelling stopover,fuel,2016-10-16
ofm awards 2016 best ethical restaurant: silo,coal,2016-10-16
ofm awards 2016 best ethical restaurant: silo,fossil,2016-10-16
ofm awards 2016 best ethical restaurant: the runners-up,coal,2016-10-16
american honey review – a magical mystery tour of the us,coal,2016-10-16
"gatwick’s the best choice in many ways, but a heathrow hub fudge could sweeten the deal",deal,2016-10-16
global warming experiment turns up the heat in puerto rican forest,global,2016-10-17
global warming experiment turns up the heat in puerto rican forest,warming,2016-10-17
son heung-min became a global brand at leverkusen but still faces difficult return,global,2016-10-17
the gap between ambition and action in tackling global warming,global,2016-10-17
the gap between ambition and action in tackling global warming,warming,2016-10-17
regional know-how: the best websites for contacting local guides,coal,2016-10-17
antarctic marine reserves deal within reach as russia thaws environmental stance,deal,2016-10-17
antarctic marine reserves deal within reach as russia thaws environmental stance,environment,2016-10-17
"uk’s failure to rein in tax havens hinders global corruption battle, say mps",global,2016-10-18
amy goodman showed us the perils of standing up to the fossil fuel industry,fossil,2016-10-18
amy goodman showed us the perils of standing up to the fossil fuel industry,fuel,2016-10-18
theresa may given stark warning about leaving customs union,warming,2016-10-18
bayer leverkusen v tottenham hotspur: champions league – live!,environment,2016-10-18
sir philip green hints bhs pension deal close in bid to save knighthood,green,2016-10-18
sir philip green hints bhs pension deal close in bid to save knighthood,deal,2016-10-18
the global crisis of gender inequality – and america's shameful secret,global,2016-10-18
the global crisis of gender inequality – and america's shameful secret,fuel,2016-10-18
eu struggles to keep canada trade deal on track,deal,2016-10-18
hygge – a soothing balm for the traumas of 2016,global,2016-10-18
eurostar to cut 80 jobs as brexit and terror attacks hit ticket sales,job,2016-10-18
the world is in quito to discuss cities – but are local voices heard at habitat iii?,coal,2016-10-18
malcolm turnbull says there is 'no chance' of coalition watering down gun laws – politics live,coal,2016-10-18
sas: who dares wins review – why do ‘misfit’ men seek this kind of discipline?,environment,2016-10-18
how forza horizon 3 became the most beautiful game on xbox,fuel,2016-10-18
green subsidies to push uk energy bills higher than planned,green,2016-10-18
hans-ulrich obrist tops list of art world's most powerful,fuel,2016-10-19
mps' debate about sir philip green's knighthood is premature,green,2016-10-19
why won't the global agenda for inclusive cities recognise lgbtq citizens?,global,2016-10-19
"el mundo se da cita en quito para discutir las ciudades, pero ¿están siendo escuchadas las voces locales?",fuel,2016-10-19
"el mundo se da cita en quito para discutir las ciudades, pero ¿están siendo escuchadas las voces locales?",green,2016-10-19
"el mundo se da cita en quito para discutir las ciudades, pero ¿están siendo escuchadas las voces locales?",environment,2016-10-19
the real refugee scandal is that the uk has been locking up children,deal,2016-10-19
people power is ending ttip and other unpopular eu free-trade deals,deal,2016-10-19
alianza de futbol: the program giving young latinos a shot at soccer stardom,deal,2016-10-19
wa premier colin barnett does not support adler gun coming into his state – as it happened,warming,2016-10-19
coalition asleep at the wheel as household debt warning gets louder,coal,2016-10-19
coalition asleep at the wheel as household debt warning gets louder,warming,2016-10-19
the gun control debate shows the coalition still hasn't worked out how to negotiate,coal,2016-10-19
conservative mp backs tony abbott's account of adler shotgun deal row,deal,2016-10-20
mps back motion to strip sir philip green of his knighthood,green,2016-10-20
lupita nyong’o: ‘art is political in whatever way you slice it’,coal,2016-10-20
global wine production expected to fall by 5% due to 'climatic events',global,2016-10-20
"droughts don’t have to spell disaster. el niño countries, take note",fuel,2016-10-20
the uk public love wind power and they don't even know it,green,2016-10-20
philip green accuses work and pensions committee chair of making false claims,green,2016-10-20
i quit! share your job resignation stories,job,2016-10-20
"philip green unlikely to be compelled over bhs pension deficit, says expert",green,2016-10-20
'talaq' and the battle to ban the three words that grant india's muslim men instant divorce,environment,2016-10-20
"heathrow expansion, nuclear fusion and tasmanian devils – green news roundup",green,2016-10-21
"bombardier to cut 7,500 jobs, raising fears for british workforce",job,2016-10-21
después de hábitat iii: un futuro urbano más fuerte deberá basarse en el derecho a la ciudad,deal,2016-10-21
después de hábitat iii: un futuro urbano más fuerte deberá basarse en el derecho a la ciudad,green,2016-10-21
después de hábitat iii: un futuro urbano más fuerte deberá basarse en el derecho a la ciudad,environment,2016-10-21
después de hábitat iii: un futuro urbano más fuerte deberá basarse en el derecho a la ciudad,fuel,2016-10-21
"bangladesh v england: first test, day two – as it happened",environment,2016-10-21
pope francis targets deal with china in year of mercy,deal,2016-10-21
global warming continues; 2016 will be the hottest year ever recorded,global,2016-10-21
global warming continues; 2016 will be the hottest year ever recorded,warming,2016-10-21
kicking philip green is absurd. here’s who mps should be castigating,green,2016-10-21
the best (and worst) jokes from the al smith dinner,global,2016-10-21
the best (and worst) jokes from the al smith dinner,deal,2016-10-21
the best (and worst) jokes from the al smith dinner,coal,2016-10-21
refugee children arriving in the uk need warm support – not cold bureaucracy,warming,2016-10-21
islabikes' radical new plan means you may never need to buy your child a bike again,coal,2016-10-21
how to get a job in elite sports,job,2016-10-21
"britain’s political modernisers have been crushed, and their replacements have no vision",coal,2016-10-21
"saracens v scarlets, munster win, northampton lose: champions cup – as it happened",environment,2016-10-22
"bangladesh v england: first test, day three – as it happened",environment,2016-10-22
inside the impossible life of a new york street vendor,fossil,2016-10-22
uk drops out of top five best countries in which to make deals,deal,2016-10-23
"after el niño, what weird weather could la niña bring?",fuel,2016-10-23
"as the new mp for batley and spen, i know jo cox’s shoes will be hard to fill",job,2016-10-23
lord and lady heseltine​ ​on gardening: 'we shot​ ​350 squirrels​ ​– absolutely awful things',fuel,2016-10-23
"bangladesh v england: first test, day four – as it happened",environment,2016-10-23
"detroit incinerator is hotspot for health problems, environmentalists claim",environment,2016-10-23
can’t we agree to just not have heathrow at all?,green,2016-10-23
the week in radio: the global election; #whoisneil; rich hall’s (us election) breakdown,global,2016-10-23
at&t agrees to buy time warner for $85bn as trump slams deal,deal,2016-10-23
"study says 850,000 uk public sector jobs could be automated by 2030",job,2016-10-24
"women now drink as much alcohol as men, global study finds",global,2016-10-24
heathrow third runway expected to get may cabinet green light,green,2016-10-24
alan jones launches great barrier reef site after criticising 'global warming hoax',global,2016-10-24
alan jones launches great barrier reef site after criticising 'global warming hoax',warming,2016-10-24
ba scraps service to chinese city cited by airport expansionists,global,2016-10-24
belgium fails to back canada trade deal; tata chairman mistry departs – as it happened,deal,2016-10-24
football association signs six-year fa cup overseas tv rights deal,deal,2016-10-24
the brexit economy: falling pound and rising inflation fuel fears of slowdown,fuel,2016-10-24
live q&a: how can the environment and development sectors work together to achieve the sdgs?,environment,2016-10-24
la esperanza de la generación: las chicas desafiando la misoginia en el centro rural de paraguay,deal,2016-10-24
la esperanza de la generación: las chicas desafiando la misoginia en el centro rural de paraguay,green,2016-10-24
la esperanza de la generación: las chicas desafiando la misoginia en el centro rural de paraguay,environment,2016-10-24
la esperanza de la generación: las chicas desafiando la misoginia en el centro rural de paraguay,fuel,2016-10-24
la esperanza de la generación: las chicas desafiando la misoginia en el centro rural de paraguay,deal,2016-10-24
what does peace in colombia have to do with the environment?,environment,2016-10-24
¿qué tiene que ver con el medio ambiente la paz en colombia?,fuel,2016-10-24
¿qué tiene que ver con el medio ambiente la paz en colombia?,green,2016-10-24
¿qué tiene que ver con el medio ambiente la paz en colombia?,environment,2016-10-24
murder of brazil official marks new low in war on amazon environmentalists,warming,2016-10-24
murder of brazil official marks new low in war on amazon environmentalists,environment,2016-10-24
tunisian coalition party fights for women's rights with gender violence bill,coal,2016-10-24
"fairfax chief wants media ownership rules relaxed, even if it helps news corp",green,2016-10-24
"coalition can bring back green 'lawfare' bill if senate supports it, says turnbull",coal,2016-10-24
"coalition can bring back green 'lawfare' bill if senate supports it, says turnbull",green,2016-10-24
hinkley c shows the value of social science in the most toxic public debates,coal,2016-10-24
trump and clinton camps raise concerns over at&t-time warner deal,deal,2016-10-24
environment group named in wikileaks email release responds to attacks,environment,2016-10-24
"belgium given eu ultimatum to secure canada trade deal, but wallonia defiant",deal,2016-10-24
"terror, global warming or a trump presidency. what are we scared of?",global,2016-10-25
"terror, global warming or a trump presidency. what are we scared of?",warming,2016-10-25
world cup final 1970: brazil v italy – as it happened,environment,2016-10-25
australia's coal seam gas emissions may be vastly underestimated – report,coal,2016-10-25
unsound festival review – a shared spirit of internationalist musical exploration,coal,2016-10-25
"local residents on heathrow's third runway: 'i would lose my house, community and friends'",coal,2016-10-25
heathrow approval puts business above political and environment issues,coal,2016-10-25
heathrow approval puts business above political and environment issues,environment,2016-10-25
¿acabará con la crisis de agua del perú la gran visión del nuevo presidente?,deal,2016-10-25
"as political crisis looms, quetta attack piles pressure on pakistan pm",coal,2016-10-25
"press regulation, itv job cuts, poldark sex row",job,2016-10-25
16 of the worst bits of jargon - and a few possible alternatives,fossil,2016-10-25
"coal will be important 'for many, many decades to come', says turnbull",coal,2016-10-25
wa must embrace dawn of renewable energy era or risk being left behind,warming,2016-10-26
"australia's political donations must be capped to fix 'broken' system, expert urges",coal,2016-10-26
britain’s contribution to global poverty,global,2016-10-26
"expect zika virus to reach india and africa, medical research charity warns",coal,2016-10-26
little progress on uk gender pay gap; £84bn brexit black hole warning – as it happened,warming,2016-10-26
enough said by mark thompson review – how to save political debate,coal,2016-10-26
spain reviews plan to let ​russian warships refuel en route to syria,fuel,2016-10-26
spain reviews plan to let ​russian warships refuel en route to syria,green,2016-10-26
spain reviews plan to let ​russian warships refuel en route to syria,environment,2016-10-26
compostable and edible packaging: the companies waging war on plastic,warming,2016-10-26
iceland election could propel radical pirate party into power,coal,2016-10-26
donald trump is no outsider: he mirrors our political culture,coal,2016-10-26
world series 2016 game 1: chicago cubs v cleveland indians – as it happened,environment,2016-10-26
labor opposed to turnbull's controversial 'green lawfare' changes,green,2016-10-26
mozambique debt crisis could be first sign of global financial shockwave,global,2016-10-27
"the rule of law must apply equally, even to terrorists",green,2016-10-27
no 10 denies 'sweetheart deal' with nissan,deal,2016-10-27
belgian politicians drop opposition to eu-canada trade deal,deal,2016-10-27
west's failure to reconnect iran to global banks 'risks breaching nuclear deal',global,2016-10-27
west's failure to reconnect iran to global banks 'risks breaching nuclear deal',deal,2016-10-27
which is the world’s most wasteful city?,fuel,2016-10-27
canadian pm cancels brussels trip amid crisis talks to save trade deal,deal,2016-10-27
access to data could be vital in addressing the global water crisis,global,2016-10-27
a royal revolution: is prince charles's model village having the last laugh?,deal,2016-10-27
india’s war on the sex selection drugs linked to stillbirths,warming,2016-10-27
world series 2016 game 2: chicago cubs v cleveland indians – as it happened,environment,2016-10-27
why the attack on 'foreign-funded' environment groups stinks of hypocrisy,environment,2016-10-28
shipping industry criticised for failure to reach carbon emissions deal,deal,2016-10-28
tetris: the games people play by box brown review – the history of a global phenomenon,global,2016-10-28
"mass extinction, whaling and a new marine park – green news roundup",green,2016-10-28
contraceptive jabs for men may work - but what about the male pill?,environment,2016-10-28
ba owner 'doubts' heathrow can build runway within budget,global,2016-10-28
melbourne city v adelaide united: a-league – as it happened,environment,2016-10-28
can urban greenspace have an effect on children's behaviour?,green,2016-10-28
diy doctors: new zealand medical students 'operating on themselves at home',coal,2016-10-28
pauline hanson leaves coalition at crossroads – and all roads lead north,coal,2016-10-28
"we must agree peace by christmas or hope will end, says colombian leader",green,2016-10-29
"denis suárez: 'when i signed manchester city were more english, now it’s a global club’",global,2016-10-29
tax breaks and talent fuel uk’s creative industry boom,fuel,2016-10-29
nissan deal: chuka umunna asks for 'letter of comfort' to be revealed,deal,2016-10-29
merlin labron-johnson’s kitchen: ‘trying to cook with a dull knife is practically impossible’,fossil,2016-10-29
world series 2016 game 4: chicago cubs v cleveland indians – as it happened,environment,2016-10-30
peter garrett says alp can reverse vote decline by prioritising environment,environment,2016-10-30
brexit: greg clark's commons statement on the nissan deal - politics live,deal,2016-10-31
the oil detox: these companies are using yeast to wean us off fossil fuels,fossil,2016-10-31
the oil detox: these companies are using yeast to wean us off fossil fuels,fuel,2016-10-31
josé manuel barroso cleared of ethics breach over goldman sachs job,job,2016-10-31
don't settle for the lesser of two evils in this election. vote for the green party,green,2016-10-31
end of british summer time triggers national grid warning system,warming,2016-10-31
12 ways environment and development sectors can collaborate to meet the sdgs,environment,2016-10-31
young and anxious: do your children express fears over global events?,global,2016-10-31
radical thinking reveals the secrets of making change happen,coal,2016-10-31
coal doesn’t help the poor; it makes them poorer,coal,2016-10-31
could a mild outbreak of humanity be behind the coalition's cynical new asylum politics?,coal,2016-10-31
nissan's post-brexit deal could lead to 'colossal' bills for taxpayer,deal,2016-10-31
childline anxiety calls spike as children express fears over global events,global,2016-10-31
ludogorets v arsenal: champions league – as it happened,environment,2016-11-01
borussia mönchengladbach v celtic: champions league – as it happened,environment,2016-11-01
"hinkley point c will not cost taxpayers extra, says edf energy boss",coal,2016-11-01
"pound could fall to $1.15 as city accepts reality of brexit, says baml – as it happened",global,2016-11-01
rio's famous beaches take battering as scientists issue climate change warning,warming,2016-11-01
'my granddaughter loses sleep over terrorism': children's fears over global events,global,2016-11-01
cicli-activistas de costa rica: ‘la sociedad civil tiene que abrir camino’,deal,2016-11-01
"thomson reuters to cut 2,000 jobs worldwide",job,2016-11-01
orgreave was part of the class war that ended with 96 dead at hillsborough,warming,2016-11-01
"norway is green – but not green enough, say students",green,2016-11-01
"norway is green – but not green enough, say students",green,2016-11-01
war is hell – for the natural world too,warming,2016-11-01
compromise on 'green lawfare' changes flagged by josh frydenberg,green,2016-11-01
"the brexit war can still be won, but we must start fighting back",warming,2016-11-02
peace dividend at greenham common,green,2016-11-02
chilcot says blair went 'beyond the facts' in making case for iraq war - politics live,warming,2016-11-02
uk coal-powered electricity projected to fall by record amount,coal,2016-11-02
it's easy to hate on celebrity magazines – but the stories they tell can be helpful,fuel,2016-11-02
smashing the silicon valley patriarchy: anti-lean in strategy puts onus on men,environment,2016-11-02
dinosaur brains and other remarkable fossil finds,fossil,2016-11-02
looking for a teaching job? here's how to avoid a dysfunctional school,job,2016-11-02
peter dutton says refugee crackdown meant to stop 'sham relationship' visas,environment,2016-11-02
australia being 'left behind' by global momentum on climate change,global,2016-11-03
the pension regulator v sir philip green – what happens next?,environment,2016-11-03
the pension regulator v sir philip green – what happens next?,green,2016-11-03
greece set to win €1.75bn from eu climate scheme to build two coal plants,coal,2016-11-03
"world on track for 3c of warming under current global climate pledges, warns un",warming,2016-11-03
"world on track for 3c of warming under current global climate pledges, warns un",global,2016-11-03
saving peterborough’s green backyard: 'it's a point of stillness in a crazy world',green,2016-11-03
pensions regulator begins legal proceedings against sir philip green,green,2016-11-03
warning over invasive flatworm posing threat to uk wildlife,warming,2016-11-03
"hazelwood coal power station to close with loss of up to 1,000 jobs",coal,2016-11-03
"hazelwood coal power station to close with loss of up to 1,000 jobs",job,2016-11-03
"paris agreement, air pollution and your carbon footprint – green news roundup",green,2016-11-04
bank of england deputy: uk should be grateful mark carney is staying,fuel,2016-11-04
clyde warship contract green light  'secures jobs for 20 years',green,2016-11-04
clyde warship contract green light  'secures jobs for 20 years',job,2016-11-04
has the netflix effect created a global village or turned us into narcissists?,global,2016-11-04
australian bureau of statistics to slash jobs despite census bungle,job,2016-11-04
men much less likely to seek mental health help than women,environment,2016-11-05
rugby league four nations: australia v new zealand - as it happened,environment,2016-11-05
to deal with climate change we need a new financial system,deal,2016-11-05
what's in store at the marrakech climate talks – and will australia still back coal?,coal,2016-11-05
senator al franken accuses donald trump of launching antisemitic tv ad,global,2016-11-06
senator al franken accuses donald trump of launching antisemitic tv ad,deal,2016-11-06
