headlines,terms,dates
manufacturing's facts make global sense,global,2000-08-07
fly the filthy skies. but tax the fuel,fuel,2000-08-07
bid for drinks arm of seagram,warming,2000-08-07
war on extremists turns into muddle,warming,2000-08-07
casualties of globalism,global,2000-08-08
net firms strike $7bn wap deal,deal,2000-08-09
lady young takes over environment watchdog,environment,2000-08-10
flying kites on fuel tax,fuel,2000-08-11
greenpeace to challenge legality of gm crop trials,green,2000-08-12
a green man in a grey world,green,2000-08-13
africa is loser in global digital divide,global,2000-08-14
magazine deal threatens newspapers,deal,2000-08-14
aiming off over kosovo,warming,2000-08-15
changing the face of fish farming,warming,2000-08-16
greenhouse build-up worst for 20m years,green,2000-08-17
merger proving mission impossible,fossil,2000-08-18
li deal dashes c&w hope of £5bn to spend,deal,2000-08-18
sweatshop v corporation,environment,2000-08-19
prescott unveils green manifesto,green,2000-08-19
women outstrip men as victims of smoking,environment,2000-08-22
job loss fears as harland and wolff faces cash crisis,job,2000-08-23
coalfield town switches to green fuel,coal,2000-08-23
coalfield town switches to green fuel,green,2000-08-23
coalfield town switches to green fuel,fuel,2000-08-23
fo report backs exiled islanders' fight with uk,fossil,2000-08-24
the mending of men,environment,2000-08-24
rovers return to low tax and jobs aplenty,job,2000-08-26
welsh tories balk at clerk's salary,global,2000-08-26
welsh tories balk at clerk's salary,global,2000-08-26
us deals blow to cocaine trade as 25 tonnes seized,deal,2000-08-27
local museums facing a slow death by a thousand budget cuts,coal,2000-08-29
'killer mouse' warning on arctic islands,warming,2000-08-29
tbwa and hakuhodo unveil global joint-venture for nissan,global,2000-08-30
hopeful dance with destiny,fuel,2000-08-30
how greenspan would manage euro,green,2000-08-30
warming threat to many species,warming,2000-08-31
advertising industry rides wave of global consolidation,global,2000-09-01
are you a model candidate: a 2:1 who's fun?,deal,2000-09-02
"imf is a feudal fossil, says report",deal,2000-09-04
"imf is a feudal fossil, says report",fossil,2000-09-04
more ethical dilemmas,coal,2000-09-05
"faster, higher, greener",green,2000-09-06
m&s reveals e-commerce deals,deal,2000-09-06
bcom3 plans global agency network,global,2000-09-06
"dump n-waste on local tips, says watchdog",coal,2000-09-06
granada clinches web portal deal with arsenal,deal,2000-09-07
useful messages,fuel,2000-09-07
blair warns us of trade war,warming,2000-09-07
hauliers say no to cheap fuel deal,fuel,2000-09-07
hauliers say no to cheap fuel deal,deal,2000-09-07
prosser hands over part of his bass job,job,2000-09-07
ba seeks pact with northwest,global,2000-09-08
opec fuels new dissent,fuel,2000-09-08
french chaos as fuel tax blockades spread,fuel,2000-09-08
promoting business in the global economy,global,2000-09-08
jobs with added value,job,2000-09-10
why it takes a law degree to make money from the net,green,2000-09-10
a man of ideals,deal,2000-09-11
zarak buy fuels spirent's ambitions,fuel,2000-09-11
fuelling dissent,fuel,2000-09-12
jobs threat as chase devours jp morgan,job,2000-09-13
new dot.com stakes first claim to global business service provision,global,2000-09-13
"old war horses, young guns and a summer to remember",warming,2000-09-13
protesters - closet environmentalists?,environment,2000-09-13
fuel crisis: the causes...,fuel,2000-09-13
global oil market rudderless,global,2000-09-14
how the oil men faced down a furious pm,environment,2000-09-14
doing the big deal,deal,2000-09-14
kennedy tells party to tap 'anti-political sentiments',coal,2000-09-15
kennedy tells party to tap 'anti-political sentiments',coal,2000-09-15
no fuel tax concession says brown,fuel,2000-09-15
will the new economy be green?,green,2000-09-16
"oh brother, craig's the man of the moment",environment,2000-09-16
hopes and fears as plan starts to ban war diamonds,warming,2000-09-16
painting britain green,green,2000-09-16
why joe cole and co ought to be in sydney,coal,2000-09-16
fuel - what a scorcher,fuel,2000-09-17
uk in secret biological war on drugs,coal,2000-09-17
uk in secret biological war on drugs,warming,2000-09-17
dresdner $1.35bn us deal creates millionaires' row,deal,2000-09-18
protest in prague opinions on globalisation are shifting,global,2000-09-18
the fuel story in pictures,fuel,2000-09-18
no truck with the environment,environment,2000-09-18
cabinet split over fuel price deal,fuel,2000-09-19
cabinet split over fuel price deal,deal,2000-09-19
"dixons call centre gives sheffield a 1,000-job fillip",job,2000-09-20
gilbert de botton,deal,2000-09-20
conservatives pledge 3p fuel tax cut,fuel,2000-09-20
leak points to us approval for time warner/aol deal,deal,2000-09-21
warming to incubators,warming,2000-09-21
emi signs first online publishing deal,deal,2000-09-21
protesters to face down money men,environment,2000-09-21
greenpeace wins key gm case,green,2000-09-21
inaction man keeps party faithful happy,fuel,2000-09-21
the pocket generals  plan for war,warming,2000-09-22
britannia is just so uncool when it comes to fuel,fuel,2000-09-22
all things bright and beautiful,fuel,2000-09-23
mps warn jobs at risk as urban regeneration plans face eu veto,job,2000-09-23
engine of growth runs low on fuel,fuel,2000-09-23
traffic-free day fails to fuel uk interest,fuel,2000-09-23
mps warn jobs at risk as urban regeneration plans face eu veto,job,2000-09-23
not so wonderful in copenhagen,fuel,2000-09-24
the fateful dead,fuel,2000-09-24
defiant prescott rallies party faithful,fuel,2000-09-25
g7 piles pressure on opec with global slump warning,global,2000-09-25
g7 piles pressure on opec with global slump warning,warming,2000-09-25
gus will help make net more rewarding,warming,2000-09-25
the dealmakers - and how they will be rewarded,deal,2000-09-26
a green and pleasant land,green,2000-09-26
redstone avoids bt's local loop obstacles,coal,2000-09-26
swedish firm deals blow to british-backed dam project,deal,2000-09-26
the jobs that nobody wants,job,2000-09-27
the jobs that nobody wants,job,2000-09-27
ibm paints a picture of jobs and inspiration,job,2000-09-28
mandela thanks labour faithful,fuel,2000-09-29
resisting the urge to take the first job that comes along,job,2000-09-30
new deal as cards fight for a place in the sun,deal,2000-09-30
"eggs, thugs and globalisation",global,2000-10-01
eating the greens,green,2000-10-01
jung von matt lands global launch of bmw's mini cooper,global,2000-10-02
vodafone hands global task to mccann-erickson,global,2000-10-02
ethical index sees uk entrants,coal,2000-10-02
britain's $200bn leads global takeover boom,global,2000-10-04
portillo in shadow cabinet row over fuel cut,fuel,2000-10-05
leeds team wins football news deal with aol,deal,2000-10-06
tories pitch for poll position with radical blend of old and new,coal,2000-10-06
power-sharing saves lives. and jobs too,job,2000-10-08
power-sharing saves lives. and jobs too,job,2000-10-08
local government comes first for french politicians,coal,2000-10-09
money dealers in limbo as dinar endures a wild ride,deal,2000-10-10
exxonmobil names global media shortlist,global,2000-10-10
green light for aol/time warner deal,green,2000-10-11
green light for aol/time warner deal,deal,2000-10-11
monti to clear aol-time warner deal,deal,2000-10-11
warning from history points to crash,warming,2000-10-12
war jitters lead to sell-off,warming,2000-10-12
messier outlines global vision for vivendi,global,2000-10-12
vivendi/seagram deal faces further ec scrutiny,deal,2000-10-12
eskandarian takes top job at new havas network,job,2000-10-12
dressed-down ted baker seeks global brand extension,global,2000-10-12
awash with warnings,warming,2000-10-13
pollution warning as flood victims mop up,warming,2000-10-16
reuters puts greenhouse float on ice,green,2000-10-17
"4,000 jobs to go as chevron takes over texaco",job,2000-10-17
hardliner quits us war against drugs,warming,2000-10-17
"it's in the bag, environment-wise",environment,2000-10-18
land rover adds two more to global pitch,global,2000-10-19
cable & wireless moves global pr business to brodeur worldwide,global,2000-10-19
al gore fights for his life,global,2000-10-19
al gore fights for his life,deal,2000-10-19
al gore fights for his life,coal,2000-10-19
reuters fails to name day for greenhouse float,green,2000-10-20
warning: only high-flyers need apply for a cut of this,warming,2000-10-21
a green and pleasant land?,green,2000-10-21
settlers' war fired by fanaticism and fear,warming,2000-10-21
now europe's biggest glacier falls to global warming,global,2000-10-22
now europe's biggest glacier falls to global warming,warming,2000-10-22
must i take a pay cut after job swap?,job,2000-10-22
blair to attack sniping greens,green,2000-10-22
feeling groovy - and green,green,2000-10-22
the men who made politics boring again,environment,2000-10-23
bridging the green gap,green,2000-10-23
meacher is rebuked for floating fuel tax escalator,fuel,2000-10-23
would you stay in a job for the shagpile?,job,2000-10-24
no big idea from blair on the environment,deal,2000-10-24
no big idea from blair on the environment,environment,2000-10-24
tony blair: 'a new coalition for the environment',coal,2000-10-24
tony blair: 'a new coalition for the environment',environment,2000-10-24
blair announces £100m boost for environment,environment,2000-10-24
cyber-rabbi to go global,global,2000-10-24
greens still growing well,green,2000-10-24
blair accused of failing the environment,environment,2000-10-24
autonomy makes deal with ntt,deal,2000-10-25
greens sceptical as blair embraces ecology,green,2000-10-25
reuters links with banks in fx deal,deal,2000-10-25
c&w in global branding talks with london agencies,global,2000-10-26
eurosport strikes world cup sponsorship deal,deal,2000-10-27
where does blair really stand on the environment?,environment,2000-10-27
record oil profits set to fuel anger,fuel,2000-10-28
are storms the result of global warming?,global,2000-10-30
are storms the result of global warming?,warming,2000-10-30
global warming: it's with us now,global,2000-10-31
global warming: it's with us now,warming,2000-10-31
what's the best way to get a new job?,job,2000-10-31
banks agree to end laundering,green,2000-10-31
early warning,warming,2000-11-01
sky global flotation on track says murdoch,global,2000-11-03
mrs murdoch deals with it,deal,2000-11-03
adding fuel to the debate,fuel,2000-11-03
arsenal given green light to field weakened team,green,2000-11-03
climate change may be down to farming,warming,2000-11-04
"killings, beatings, framings, drug dealing - and that's just the police",deal,2000-11-04
labour's tough  tactics to halt fuel protest,fuel,2000-11-05
two running men with no time to think,environment,2000-11-05
savage helps taylor get back to the day job,job,2000-11-06
more fuel on tax debate,fuel,2000-11-07
