headlines,terms,dates
us sounds terror warning,stimulus,2004-08-02
"banks should pay for debt advice, say lib dems",debtstudent,2004-08-02
interest rate rise 'certain' as economy grows,economy,2004-08-02
fa 'must overhaul pr strategy',manufacture,2004-08-02
deal on global trade holds out hope for poor nations,trade,2004-08-02
deal on global trade holds out hope for poor nations,national,2004-08-02
lie detector plan worries cabinet,loan,2004-08-02
"'higher tax, fewer services' in country",tax,2004-08-02
"sun, sea and tax",tax,2004-08-02
fa debacle: send us your views,manufacture,2004-08-02
fa debacle: send us your views,stimulus,2004-08-02
us paper takes on 'misleading' moore,stimulus,2004-08-02
c4 faces loss of us sitcom staple,stimulus,2004-08-02
yukos gets breathing space over tax bill,tax,2004-08-03
a long way from fair trade,trade,2004-08-03
royal bank plays down talk of abbey bid,bankruptcy,2004-08-03
tories 'to drop fees by upping loan rates',loan,2004-08-03
what became of other memorable ad slogans?,trade,2004-08-03
consumers confident despite spiralling debt,debtstudent,2004-08-03
i am new to the uk - how do i open a bank account?,bankruptcy,2004-08-03
pakistan arrests revealed us targets,stimulus,2004-08-03
us shelves new travel rules for britons,stimulus,2004-08-03
hedge fund warning as hsbc reports record profit,export,2004-08-03
cox family tries to capture cable firm,manufacture,2004-08-03
"transfer fees a thing of the past, says report",export,2004-08-04
royal bank hints at overseas bid,bankruptcy,2004-08-04
mps meet murdoch on us junket,stimulus,2004-08-04
"economy growth slowing, survey suggests",economy,2004-08-04
desmond weighs in to men's mag market,market,2004-08-04
desmond weighs in to men's mag market,market,2004-08-04
lib dem radicals call for pro-market switch,market,2004-08-04
lib dem radicals call for pro-market switch,market,2004-08-04
t&g trades well despite slowdown,trade,2004-08-04
fda looks into az reporting,export,2004-08-04
anelka for sale only if monaco break the bank at monte carlo,bankruptcy,2004-08-05
£3bn airbus buy signals virgin's challenge to ba,bailout,2004-08-05
£3bn airbus buy signals virgin's challenge to ba,bankruptcy,2004-08-05
ointment ban hurts s&n sales,bankruptcy,2004-08-05
eu ends tariff-free israeli trade,tariff,2004-08-05
eu ends tariff-free israeli trade,trade,2004-08-05
cashpoints: bank of england lifts interest rates to 4.75%,bankruptcy,2004-08-05
in brief: dillon signs up for love bug remake,loan,2004-08-05
cisse joins palace on loan,loan,2004-08-05
us intensifies security at ports,stimulus,2004-08-05
us intensifies security at ports,export,2004-08-05
us intensifies security at ports,import,2004-08-05
british energy rejects a restructured rescue plan,loan,2004-08-05
what the terror alerts really tell us,stimulus,2004-08-05
market manoeuvres,market,2004-08-05
market manoeuvres,market,2004-08-05
oil threat to world economy,economy,2004-08-05
can i take advantage of my son's tax-free account?,tax,2004-08-05
explosion in number of bankrupts,bankruptcy,2004-08-06
new hope over old debts after repossession ruling,debtstudent,2004-08-06
debt on the net,debtstudent,2004-08-06
senior al-qaida prisoners face us extradition,stimulus,2004-08-06
the dos and don'ts of debt,debtstudent,2004-08-06
private hospitals face tax break squeeze,tax,2004-08-06
reed says enforced access plan is daft,loan,2004-08-06
going for broke: bankruptcy numbers soar,bankruptcy,2004-08-06
scotland to raise council tax on second homes,tax,2004-08-06
tributes and tears at hearing as child abuse expert awaits his fate,export,2004-08-06
bank hints at further interest rate rise,bankruptcy,2004-08-06
oxford pays its debt to ancients in pindaric song,debtstudent,2004-08-06
scotland to raise council tax on second homes,tax,2004-08-06
fa must pick apple lessons for brand new start,manufacture,2004-08-06
just the two of us,stimulus,2004-08-06
males lust most for designer labels,stimulus,2004-08-06
us pioneer's vision offers hope to africa,stimulus,2004-08-07
"it's still the economy, stupid",economy,2004-08-07
kerry boost as economy hints at slide,economy,2004-08-07
toll motorway plan threatens historic rural beauty spots,loan,2004-08-07
ba trebles long-haul surcharges,bailout,2004-08-07
ba trebles long-haul surcharges,bankruptcy,2004-08-07
oil and us jitters prompt fears of global slowdown,stimulus,2004-08-07
power supply cannot be left to the market,market,2004-08-07
power supply cannot be left to the market,market,2004-08-07
loans boom turns to bust,loan,2004-08-07
euro disney must hit debt deadline - or it's au revoir,debtstudent,2004-08-07
it takes focus to beat lacklustre stock market,stock,2004-08-07
it takes focus to beat lacklustre stock market,stock,2004-08-07
it takes focus to beat lacklustre stock market,market,2004-08-07
it takes focus to beat lacklustre stock market,market,2004-08-07
cheer for students as loan rate falls,debtstudent,2004-08-07
cheer for students as loan rate falls,loan,2004-08-07
make us hippies happy,stimulus,2004-08-07
vaughan's men are hungry for more,retirement,2004-08-07
vaughan's men are hungry for more,retirement,2004-08-07
richards: the man who would be king,manufacture,2004-08-07
guide to age,package,2004-08-07
the expert gardener,export,2004-08-07
debt is krasner's deadliest opponent,debtstudent,2004-08-07
ba to triple fuel surcharge,bailout,2004-08-08
ba to triple fuel surcharge,bankruptcy,2004-08-08
ask the experts,export,2004-08-08
how the olympic flame sparked a new golden age,package,2004-08-08
fury at ban on hiv help for refugees,bankruptcy,2004-08-08
ba back in profit but facing strike,bailout,2004-08-09
ba back in profit but facing strike,bankruptcy,2004-08-09
parmalat turns legal guns on deutsche bank,bankruptcy,2004-08-09
gap year volunteer work 'to count against debts',debtstudent,2004-08-09
ba raises fuel surcharges,bailout,2004-08-09
ba raises fuel surcharges,bankruptcy,2004-08-09
now you tell us,stimulus,2004-08-09
economy drive,economy,2004-08-09
the world economy sinks or swims in the black stuff,economy,2004-08-09
baseball bat murders shock us,stimulus,2004-08-09
fsa approves islamic bank,bankruptcy,2004-08-09
lloyds tsb considers fresh assault on abbey national,national,2004-08-09
supermarket bargain,market,2004-08-10
supermarket bargain,market,2004-08-10
shell advert seeks 'our man in iraq',manufacture,2004-08-10
graz ak 0 - 2 liverpool,401k,2004-08-10
itunes track list hits 1 million,401k,2004-08-10
medical students to have tuition fees paid,debtstudent,2004-08-10
australian underwear giant strides into uk market,market,2004-08-10
australian underwear giant strides into uk market,market,2004-08-10
national housing federation,national,2004-08-10
pr stunts: an expert's guide,export,2004-08-10
injury catches up with luis enrique,stimulus,2004-08-11
us forces prepare major assault on najaf,stimulus,2004-08-11
unions claim nhs pay package breakthrough,package,2004-08-11
subscription revenues overtake tv ad spend,trade,2004-08-11
bank eases interest rate fears,bankruptcy,2004-08-11
google defies the market naysayers in drive to float,market,2004-08-11
google defies the market naysayers in drive to float,market,2004-08-11
six killed in iraq market blast,market,2004-08-11
six killed in iraq market blast,market,2004-08-11
tories plan to swing axe at dti,loan,2004-08-11
trump casinos head into bankruptcy,bankruptcy,2004-08-11
now channel 4 targets top of the pops,401k,2004-08-11
"student debt hits £12,000, says study",debtstudent,2004-08-11
"student debt hits £12,000, says study",debtstudent,2004-08-11
clear swoops on beijing ad sites,trade,2004-08-11
us warns iraqis to get out of central najaf,stimulus,2004-08-11
evolution of an ad market,trade,2004-08-11
evolution of an ad market,market,2004-08-11
evolution of an ad market,market,2004-08-11
bank eases interest rate fears,bankruptcy,2004-08-11
zidane retires after 10 years with france,retirement,2004-08-12
zidane retires after 10 years with france,retirement,2004-08-12
adderall to tap new us market,stimulus,2004-08-12
adderall to tap new us market,market,2004-08-12
adderall to tap new us market,market,2004-08-12
toys were us ... as wal-mart wins again,stimulus,2004-08-12
goldman sachs speaks of 'revenge of the old economy',economy,2004-08-12
"ba fortunes are up, down, flying around",bailout,2004-08-12
"ba fortunes are up, down, flying around",bankruptcy,2004-08-12
£4bn deal to import natural gas,import,2004-08-12
taxman hits motorola with big bill,tax,2004-08-12
bug in system 'could leave students penniless',debtstudent,2004-08-12
mandelson takes eu trade job,trade,2004-08-12
celebrity market continues to soar,market,2004-08-12
celebrity market continues to soar,market,2004-08-12
estate agency reports 'slowdown' in property market,export,2004-08-12
estate agency reports 'slowdown' in property market,market,2004-08-12
estate agency reports 'slowdown' in property market,market,2004-08-12
graduates confident despite tough job market,market,2004-08-12
graduates confident despite tough job market,market,2004-08-12
xfm throws lifeline to student radio,debtstudent,2004-08-12
fa says england game goes ahead,manufacture,2004-08-12
"cashpoints: crackdown on uninsured drivers, 'slowdown' in the property market",market,2004-08-12
"cashpoints: crackdown on uninsured drivers, 'slowdown' in the property market",market,2004-08-12
unconventional wisdom,national,2004-08-13
cairn goes exploring in nepal,export,2004-08-13
councils push for capital smoking ban,bankruptcy,2004-08-13
ba check-in staff vote for strike,bailout,2004-08-13
ba check-in staff vote for strike,bankruptcy,2004-08-13
aol launches $300 pc in the us,stimulus,2004-08-13
"give us back our land, say masai",stimulus,2004-08-13
bank customers want 'face-to-face service',bankruptcy,2004-08-13
fears grow for turner & newall pensioners as us talks fail,stimulus,2004-08-13
rock act smells success after lynx ad,manufacture,2004-08-13
rock act smells success after lynx ad,trade,2004-08-13
end of an affair: how british package tourists are staying away from spain,package,2004-08-13
new kids on block double lads' mag market,market,2004-08-13
new kids on block double lads' mag market,market,2004-08-13
trade role elevates mandelson to europe's inner circle,trade,2004-08-13
computer glitch hits student loans,debtstudent,2004-08-13
computer glitch hits student loans,loan,2004-08-13
all the men i've never slept with,retirement,2004-08-14
all the men i've never slept with,retirement,2004-08-14
students missing out on gap year cash,debtstudent,2004-08-14
bank holiday targeted as ba staff back strike,bankruptcy,2004-08-14
bank holiday targeted as ba staff back strike,bailout,2004-08-14
bank holiday targeted as ba staff back strike,bankruptcy,2004-08-14
guide to age,package,2004-08-14
plan to end whitehall sleaze rule,loan,2004-08-15
"i'll quit if we fail, says po chief",export,2004-08-15
"i'll quit if we fail, says po chief",import,2004-08-15
don't let airport costs drive you parking mad,import,2004-08-15
ask the experts,export,2004-08-15
history's man,manufacture,2004-08-15
running miles into debt,debtstudent,2004-08-15
so what's the game plan at old trafford?,loan,2004-08-15
rebrov keen to resume double act with shevchenko,manufacture,2004-08-15
football can unite us,stimulus,2004-08-15
sainsbury and us giant in mystery rendezvous,stimulus,2004-08-15
are multinationals to blame?,national,2004-08-15
why reacting against reactors is irrational,national,2004-08-15
e-binge that will cost us dear,stimulus,2004-08-15
rebel de jour,debtstudent,2004-08-15
rebel de jour,trade,2004-08-15
multinationals hand taxman £20bn final demand,national,2004-08-15
multinationals hand taxman £20bn final demand,tax,2004-08-15
whiz kids of the third age thrive in business,package,2004-08-16
diouf heading for year's loan at forward-looking bolton,loan,2004-08-16
bank chief to head diabetes uk,bankruptcy,2004-08-16
new life company targets retired people,retirement,2004-08-16
new life company targets retired people,retirement,2004-08-16
trademarking colours,trade,2004-08-16
water boss adds weight to saga flotation plan,loan,2004-08-16
"if it's all greek or double dutch, bazza's the man",manufacture,2004-08-16
us army to prune halliburton bills,stimulus,2004-08-17
us must share the blame,stimulus,2004-08-17
videogames' culture of fear: an interview with emily newton dunn,manufacture,2004-08-17
private hospital receives £18m charity tax break,tax,2004-08-17
us relaxes policy on visa violations,stimulus,2004-08-17
barclays buys into mumbai's booming offshoring market,market,2004-08-17
barclays buys into mumbai's booming offshoring market,market,2004-08-17
market graders,market,2004-08-17
market graders,market,2004-08-17
model schools for a niche market,market,2004-08-17
model schools for a niche market,market,2004-08-17
keegan rejects anelka loan deal,loan,2004-08-18
new report heralds house prices slowdown,export,2004-08-18
"as a sole trader, why do i need a business account?",trade,2004-08-18
bank unanimous on rates rise,bankruptcy,2004-08-18
roeg directs 'pubic shaving' vodka ad,trade,2004-08-18
labour dissent at plan to invite allawi,loan,2004-08-18
google waits on us regulator,stimulus,2004-08-18
eco soundings,economy,2004-08-18
us airways raises pressure on workers to escape liquidation,stimulus,2004-08-19
marconi chiefs share £8.7m windfall by cashing in stock,stock,2004-08-19
marconi chiefs share £8.7m windfall by cashing in stock,stock,2004-08-19
rebels blockade kathmandu in maoist drive to oust monarchy,bailout,2004-08-19
citigroup's £7bn bond trade under investigation,trade,2004-08-19
forever in your debt,debtstudent,2004-08-19
london's sex trade 'like a slave market',trade,2004-08-19
london's sex trade 'like a slave market',market,2004-08-19
london's sex trade 'like a slave market',market,2004-08-19
foreign policy tops us election agenda,stimulus,2004-08-19
ba and unions hold talks,bailout,2004-08-19
ba and unions hold talks,bankruptcy,2004-08-19
report reveals london's sex slaves,export,2004-08-19
can we take advantage of my partner's tax status?,tax,2004-08-19
virgin pips radio 1 in online chart countdown,401k,2004-08-19
make a big noise and support make trade fair,trade,2004-08-19
"please, ken, spare us the olympics",stimulus,2004-08-19
"cashpoints: property market 'cooling,' while mortgage lending hits new highs",market,2004-08-19
"cashpoints: property market 'cooling,' while mortgage lending hits new highs",market,2004-08-19
undercover tv reporter guilty of gang murder,export,2004-08-19
rhinos repent over harris claims,retirement,2004-08-19
rhinos repent over harris claims,retirement,2004-08-19
middle man,manufacture,2004-08-20
ba strike threat called off,bailout,2004-08-20
ba strike threat called off,bankruptcy,2004-08-20
oil prices edge closer to $50 mark,market,2004-08-20
oil prices edge closer to $50 mark,market,2004-08-20
schwartz calls for free market in higher education,market,2004-08-20
schwartz calls for free market in higher education,market,2004-08-20
us court says file-sharing sites are not illegal,stimulus,2004-08-20
no change at top of us university league table,stimulus,2004-08-20
who is luis garcia?,stimulus,2004-08-20
child experts back five-in-one jab,export,2004-08-20
ba confident of avoiding strike after day of talks,bailout,2004-08-20
ba confident of avoiding strike after day of talks,bankruptcy,2004-08-20
hollinger wins 10-day reprieve on breeden report,export,2004-08-20
us press hit by new circulation figures scandal,stimulus,2004-08-20
ministers deny tax fiddle leniency,tax,2004-08-20
popular ways to raise tax,tax,2004-08-20
new internet tool will cut student debt,debtstudent,2004-08-21
new internet tool will cut student debt,debtstudent,2004-08-21
when tax breaks become ad breaks,tax,2004-08-22
when tax breaks become ad breaks,trade,2004-08-22
tax exiles and owners of piggy banks welcome,tax,2004-08-22
ask the experts,export,2004-08-22
how google floated past wall st,stock,2004-08-22
how google floated past wall st,debtstudent,2004-08-22
how google floated past wall st,stimulus,2004-08-22
how google floated past wall st,stock,2004-08-22
pinsent will retire ... and then return: redgrave,retirement,2004-08-22
pinsent will retire ... and then return: redgrave,retirement,2004-08-22
chinese aim for world domination,national,2004-08-22
homes tax sweetener for millions,tax,2004-08-22
don't belittle our a-level students,debtstudent,2004-08-22
ad men turning us into a coffee nation,trade,2004-08-22
ad men turning us into a coffee nation,retirement,2004-08-22
ad men turning us into a coffee nation,retirement,2004-08-22
ad men turning us into a coffee nation,stimulus,2004-08-22
ad men turning us into a coffee nation,national,2004-08-22
man who designed a generation,manufacture,2004-08-22
inherited tax bracket,tax,2004-08-23
green student to take on clarke,debtstudent,2004-08-23
"make inheritance tax fairer, urges thinktank",tax,2004-08-23
students set to spend £1bn on alcohol,debtstudent,2004-08-23
nhs faces 'retirement timebomb',retirement,2004-08-23
nhs faces 'retirement timebomb',retirement,2004-08-23
the men who stepped up to the plate,retirement,2004-08-23
the men who stepped up to the plate,retirement,2004-08-23
downing street considers online marketplace,market,2004-08-23
downing street considers online marketplace,market,2004-08-23
"on may 1 paul drayson was given a peerage. on june 17 he gave labour a £500,000 cheque",401k,2004-08-24
nobody tells us when we win,stimulus,2004-08-24
us pays debt at last to vietnam war allies,stimulus,2004-08-24
us pays debt at last to vietnam war allies,debtstudent,2004-08-24
northcliffe man takes over associated,manufacture,2004-08-24
britain in split with us on west bank homes,stimulus,2004-08-24
britain in split with us on west bank homes,bankruptcy,2004-08-24
uk to take tough line against us over kyoto,stimulus,2004-08-24
toys r us feels the squeeze,market,2004-08-24
toys r us feels the squeeze,retirement,2004-08-24
toys r us feels the squeeze,bankruptcy,2004-08-24
toys r us feels the squeeze,market,2004-08-24
toys r us feels the squeeze,retirement,2004-08-24
toys r us feels the squeeze,trade,2004-08-24
toys r us feels the squeeze,export,2004-08-24
toys r us feels the squeeze,import,2004-08-24
toys r us feels the squeeze,manufacture,2004-08-24
toys r us feels the squeeze,tariff,2004-08-24
toys r us feels the squeeze,stimulus,2004-08-24
profile: sir mark thatcher,market,2004-08-25
profile: sir mark thatcher,market,2004-08-25
us economy boosted by rise in manufacturing orders,stimulus,2004-08-25
us economy boosted by rise in manufacturing orders,economy,2004-08-25
us economy boosted by rise in manufacturing orders,manufacture,2004-08-25
autotrader to target women with odd-couples adverts,trade,2004-08-25
mark thatcher arrested over coup,market,2004-08-25
mark thatcher arrested over coup,market,2004-08-25
eco soundings,economy,2004-08-25
dti rejects rate cap for loans,loan,2004-08-26
man utd investors taken off side,manufacture,2004-08-26
lord k creates succession of problems,stock,2004-08-26
lord k creates succession of problems,market,2004-08-26
lord k creates succession of problems,401k,2004-08-26
lord k creates succession of problems,bankruptcy,2004-08-26
lord k creates succession of problems,stock,2004-08-26
lord k creates succession of problems,market,2004-08-26
lord k creates succession of problems,package,2004-08-26
thai troops remove refugees desperate for new life in us,stimulus,2004-08-26
diageo goes dutch in vodka market,market,2004-08-26
diageo goes dutch in vodka market,market,2004-08-26
mark thatcher 'was planning texas move',market,2004-08-26
mark thatcher 'was planning texas move',market,2004-08-26
bt told to make further price cuts,debtstudent,2004-08-26
guy ritchie's 'dangerous' car ad is withdrawn,trade,2004-08-26
kevin maxwell faces £1m debt claim,debtstudent,2004-08-26
microsoft faces new ec inquiry,economy,2004-08-26
microsoft faces new ec inquiry,economy,2004-08-26
put us all on rations,stimulus,2004-08-26
clubs grumble over missing internationals,national,2004-08-26
welsh set to ease £70m debt,debtstudent,2004-08-27
britain 'can afford' more bank holidays,bankruptcy,2004-08-27
us universities lead the way in e-learning,stimulus,2004-08-27
bt told to cut cost of lines to rivals,debtstudent,2004-08-27
vivendi tax deal stymies vodafone's plans for sfr,tax,2004-08-27
us sweeps clean in face of  greek furore,stimulus,2004-08-27
"lights, cameras, and no action",national,2004-08-27
now taxman wants a slice of mis-selling payouts,tax,2004-08-28
last call for ba as goodwill takes flight,bailout,2004-08-28
last call for ba as goodwill takes flight,bankruptcy,2004-08-28
we all pay price for murky gas market,market,2004-08-28
we all pay price for murky gas market,market,2004-08-28
house-price rises stall as market reaches peak,market,2004-08-28
house-price rises stall as market reaches peak,market,2004-08-28
culture divide disappears as spanish invasion gathers pace,manufacture,2004-08-28
hp targets digital lifestyle market,market,2004-08-28
hp targets digital lifestyle market,market,2004-08-28
"pots of money for some, retirement anxieties for the many",retirement,2004-08-28
"pots of money for some, retirement anxieties for the many",retirement,2004-08-28
seven-year hitch in the inheritance tax rules,tax,2004-08-28
now the taxman's after your pay-out,tax,2004-08-28
man watching,manufacture,2004-08-28
jaguar cuts production as weak dollar hits key market sales,market,2004-08-28
jaguar cuts production as weak dollar hits key market sales,market,2004-08-28
"revealed: nelson, the iconic man of war, was really a kind, tender fellow (who loved the french)",manufacture,2004-08-29
gondoliers row into action to unravel venice traffic tangle,national,2004-08-29
ordinary men doing extraordinary things,retirement,2004-08-29
ordinary men doing extraordinary things,retirement,2004-08-29
channel 4 and bbc discuss alliance,401k,2004-08-30
dirty den on the europe question,debtstudent,2004-08-30
europe's darkest corner,market,2004-08-30
europe's darkest corner,market,2004-08-30
fasten your seatbelts and prepare for the property market to land,market,2004-08-30
fasten your seatbelts and prepare for the property market to land,market,2004-08-30
britons losing taste for debt,debtstudent,2004-08-31
dallaglio quits international rugby,national,2004-08-31
rogue traders,trade,2004-08-31
are 1940s national savings certificates still valuable?,national,2004-08-31
"alitalia axe hangs over 7,000 staff as bankruptcy looms",bankruptcy,2004-09-01
let us write our own history - the declaration of a party thirsting for unity,stimulus,2004-09-01
franco's last aide aims to soldier on,trade,2004-09-01
scotland moves towards smoking ban,bankruptcy,2004-09-01
bt rapped over broadband pricing,debtstudent,2004-09-01
survey finds 1 million 'hidden' carers,401k,2004-09-01
student radio backer faces huge debts,debtstudent,2004-09-01
student radio backer faces huge debts,debtstudent,2004-09-01
rtl comments further dampen talk of channel 4 link with five,401k,2004-09-01
"greedy black plundered hollinger, says report",export,2004-09-01
ark nudge,market,2004-09-01
ark nudge,market,2004-09-01
world bank consults on big laos dam project,bankruptcy,2004-09-01
kent reliance fills a niche,market,2004-09-01
kent reliance fills a niche,market,2004-09-01
"stranger than fiction, but one fact is that he has a book to sell",manufacture,2004-09-01
struggling palace sign inter pair on loan,loan,2004-09-01
'people are calling us laughing stock fc',stimulus,2004-09-02
'people are calling us laughing stock fc',stock,2004-09-02
'people are calling us laughing stock fc',stock,2004-09-02
favourite rejects top fa job,manufacture,2004-09-02
maverick of st mary's waives rules,stock,2004-09-02
maverick of st mary's waives rules,debtstudent,2004-09-02
maverick of st mary's waives rules,stimulus,2004-09-02
maverick of st mary's waives rules,stock,2004-09-02
"foundation degrees key to fe, says report",export,2004-09-02
marconi repays £669m of debt,debtstudent,2004-09-02
forget 'hour glass' women and sleek men - flab is making us tube shaped,retirement,2004-09-02
forget 'hour glass' women and sleek men - flab is making us tube shaped,retirement,2004-09-02
forget 'hour glass' women and sleek men - flab is making us tube shaped,stimulus,2004-09-02
will we have to pay tax when we sell our houses?,tax,2004-09-02
jarvis in student digs sale,debtstudent,2004-09-02
film studios sold for 1 euro by vivendi,401k,2004-09-02
al-jazeera has made news in arabic ... now it hopes to make its mark in english,market,2004-09-02
al-jazeera has made news in arabic ... now it hopes to make its mark in english,market,2004-09-02
livingstone warns of big hike in tube fares and council tax,tax,2004-09-02
there will be another beslan,loan,2004-09-03
allied closes on diageo in us market,stimulus,2004-09-03
allied closes on diageo in us market,market,2004-09-03
allied closes on diageo in us market,market,2004-09-03
gang culture blamed as 'manhunt' killer is sentenced to life,manufacture,2004-09-03
economic uncertainty makes us poll a close call,economy,2004-09-03
economic uncertainty makes us poll a close call,stimulus,2004-09-03
'military action is no alternative',national,2004-09-03
a terrible lesson from a classroom in beslan,loan,2004-09-03
london cabbies stop plan to limit hours,loan,2004-09-03
wembley's us bribery trial postponed,stimulus,2004-09-03
marconi clears debt four years early,debtstudent,2004-09-03
all action globetrotting,national,2004-09-03
scotland close to public smoking ban,bankruptcy,2004-09-03
eu takes legal action over sellafield waste,national,2004-09-03
is plot important?,import,2004-09-03
microsoft launches itunes rival in us,stimulus,2004-09-03
lib dems riven by radical nhs plan,loan,2004-09-03
ireland's smoking ban is a drag on diageo,bankruptcy,2004-09-03
