headlines,terms,dates
uk metal brokers accused of rogue trade complicity,trade,2004-10-04
letwin promises 'low-tax economy',tax,2004-10-04
letwin promises 'low-tax economy',economy,2004-10-04
getting deeper into debt,debtstudent,2004-10-04
howard hopes tax pledge will lift gloom,tax,2004-10-04
letwin to pledge reform of 'unfair' taxes,tax,2004-10-04
regional assemblies 'may add to council tax bills',tax,2004-10-04
health briefing: october 4 2004,401k,2004-10-04
students attack plan for scottish top-up fees,debtstudent,2004-10-04
students attack plan for scottish top-up fees,loan,2004-10-04
"cheers greet kilroy, the man who would be ukip king",manufacture,2004-10-04
tories 'may axe council tax',tax,2004-10-04
confidence in housing market fades,market,2004-10-04
confidence in housing market fades,market,2004-10-04
brown's plan to foil eastern challenge,loan,2004-10-04
nervous party hopes for a little more action,national,2004-10-04
man bites watchdog,manufacture,2004-10-04
fans begin action against takeover,national,2004-10-05
ebay boss named most powerful businesswoman in us,stimulus,2004-10-05
elan takes $55m hit for legal costs,loan,2004-10-05
takeover talk fuels ascent of man,manufacture,2004-10-05
kick-off whistle blows as tampa bay's leprechaun makes move for man utd,manufacture,2004-10-05
emap eyes upmarket women's launch,market,2004-10-05
emap eyes upmarket women's launch,market,2004-10-05
howard: trust us to deliver,stimulus,2004-10-05
full text: tim collins' speech,stimulus,2004-10-05
"letwin: believe me, no tax cuts",tax,2004-10-05
blair to set up plan for africa,loan,2004-10-05
unison embarks on tv ad recruitment drive,trade,2004-10-05
renaissance man,manufacture,2004-10-05
the age gap,package,2004-10-05
masked man enters the theatre of dreams,manufacture,2004-10-06
disability act flawed,manufacture,2004-10-06
row erupts as top sharon aide says there will be no palestinian state,trade,2004-10-06
iraq kept up wmd pretence 'to deter iran',market,2004-10-06
iraq kept up wmd pretence 'to deter iran',market,2004-10-06
footballer's fiancee held by customs at airport after new york shopping spree,import,2004-10-06
afghans try to curb drugs trade,trade,2004-10-06
ofgem blames imports for leap in gas prices,import,2004-10-06
ted baker sets sights on us as profits rise,stimulus,2004-10-06
mad about the strad,trade,2004-10-06
factory ban hits flu vaccine supplies,bankruptcy,2004-10-06
men about the house,retirement,2004-10-06
men about the house,retirement,2004-10-06
air partner benefits from us election campaign,stimulus,2004-10-06
a peerless act of betrayal,manufacture,2004-10-06
unions angered by kodak plan to cut 600 jobs,loan,2004-10-06
burmese ban for european firms,bankruptcy,2004-10-07
sign up for our free us election briefing,stimulus,2004-10-07
blair demands international action to aid africa,national,2004-10-07
blair demands international action to aid africa,national,2004-10-07
bank holds interest rates at 4.75%,bankruptcy,2004-10-07
man in the middle,manufacture,2004-10-07
commission attacks national duty,national,2004-10-07
sudan accepts blair's five-point peace plan,loan,2004-10-07
'our alliance with the us remains pivotal',stimulus,2004-10-08
congestion plan puts squeeze on edinburgh,loan,2004-10-08
apple (stock) is rotten,stock,2004-10-08
apple (stock) is rotten,stock,2004-10-08
the wrap roundup: hostage ken bigley reported dead,export,2004-10-08
jessops to float on stock market,stock,2004-10-08
jessops to float on stock market,stock,2004-10-08
jessops to float on stock market,market,2004-10-08
jessops to float on stock market,market,2004-10-08
can glazer walk away with man united?,manufacture,2004-10-09
don't pass the port,export,2004-10-09
don't pass the port,import,2004-10-09
bbc has cunning plan for japan with blackadder,loan,2004-10-09
sixth-form students still waiting for their 'bribe',debtstudent,2004-10-09
traded funds set for breakthrough,trade,2004-10-09
the man who would be king,manufacture,2004-10-10
crisis ends dream of early retirement,retirement,2004-10-10
crisis ends dream of early retirement,retirement,2004-10-10
"ban cut-price drink, urges police chief",bankruptcy,2004-10-10
boys aged 10 for sale in sex scandal,package,2004-10-10
"r l burnside, a bothered mind",market,2004-10-10
"r l burnside, a bothered mind",retirement,2004-10-10
"r l burnside, a bothered mind",bankruptcy,2004-10-10
"r l burnside, a bothered mind",market,2004-10-10
"r l burnside, a bothered mind",retirement,2004-10-10
"r l burnside, a bothered mind",trade,2004-10-10
"r l burnside, a bothered mind",export,2004-10-10
"r l burnside, a bothered mind",import,2004-10-10
"r l burnside, a bothered mind",manufacture,2004-10-10
"r l burnside, a bothered mind",tariff,2004-10-10
"r l burnside, a bothered mind",national,2004-10-10
"r l burnside, a bothered mind",loan,2004-10-10
"r l burnside, a bothered mind",bailout,2004-10-10
"r l burnside, a bothered mind",stimulus,2004-10-10
pouring oil on troubled economists,economy,2004-10-10
we will have to retire later,retirement,2004-10-10
we will have to retire later,retirement,2004-10-10
glazer steps up pressure on man u board,manufacture,2004-10-11
glazer steps up pressure on man u board,debtstudent,2004-10-11
glazer steps up pressure on man u board,bailout,2004-10-11
glazer steps up pressure on man u board,bankruptcy,2004-10-11
glazer steps up pressure on man u board,stimulus,2004-10-11
glazer steps up pressure on man u board,manufacture,2004-10-11
kingsmill joins ba board,bailout,2004-10-11
kingsmill joins ba board,bankruptcy,2004-10-11
experts call for global crackdown on spam,export,2004-10-11
tories unveil pensions crisis plan,loan,2004-10-11
business plan brings nobel success,loan,2004-10-11
old age 'treated like an illness',package,2004-10-11
"students turn to wet t-shirt contests, but it's not for fun - they need the money",debtstudent,2004-10-11
news corp raises us shareholder concerns,stimulus,2004-10-11
the health market is back,market,2004-10-11
the health market is back,market,2004-10-11
our debt to derrida,debtstudent,2004-10-11
credit suisse trims bt forecasts,debtstudent,2004-10-12
m&s reports further sales fall,export,2004-10-12
my tax rebate has not come through - what are my rights?,tax,2004-10-12
bmw nips down-market,market,2004-10-12
bmw nips down-market,market,2004-10-12
old age pensionless,package,2004-10-12
channel 4 veteran quits the board,401k,2004-10-12
holiday firm ends ban on gay couples,bankruptcy,2004-10-12
blair to bank on social mobility,bankruptcy,2004-10-12
government gets tough with town halls over driving down council tax rises,tax,2004-10-12
"rsa exports 1,200 jobs to india",export,2004-10-12
international round-up,national,2004-10-13
"council tax to be income-linked, byers claims",tax,2004-10-13
bush special envoy embroiled in controversy over iraq debt,debtstudent,2004-10-13
1.7m people owed unclaimed council tax benefits,tax,2004-10-13
pensions report calls for radical shake-up and hints at compulsory saving,export,2004-10-13
"work longer, save, pay more tax or stay poor",tax,2004-10-13
the question mark over mcdonald's,market,2004-10-13
the question mark over mcdonald's,market,2004-10-13
bank signals pause in rising interest rates,bankruptcy,2004-10-13
england push for later six nations,national,2004-10-13
fallon sees red as title slips away,loan,2004-10-13
cole set to return against villa after fa reduces three-match ban,manufacture,2004-10-14
cole set to return against villa after fa reduces three-match ban,bankruptcy,2004-10-14
how internationals can ruin your week - or your year,national,2004-10-14
falling sales and price war hit dutch supermarket chain,market,2004-10-14
falling sales and price war hit dutch supermarket chain,market,2004-10-14
ryanair and iberia in tax break row,tax,2004-10-14
"us insurance sector corrupt, says spitzer",stimulus,2004-10-14
celebrity chefs face eta extortion claim,export,2004-10-14
controversy over iraq debt deepens,debtstudent,2004-10-14
"israel could become pariah state, warns report",export,2004-10-14
lib dem lord russell dies aged 67,package,2004-10-14
mp calls for slavery remembrance day,import,2004-10-14
"cashpoints: pensions commission calls for change, but workers still hope to retire young",retirement,2004-10-14
"cashpoints: pensions commission calls for change, but workers still hope to retire young",retirement,2004-10-14
fuller enlists eastenders veteran for us soap project,stimulus,2004-10-14
warners to co-produce for chinese market,market,2004-10-14
warners to co-produce for chinese market,market,2004-10-14
bt goes green,debtstudent,2004-10-14
workers still eye early retirement,retirement,2004-10-14
workers still eye early retirement,retirement,2004-10-14
authors write off plan to compile austrian cultural classics,loan,2004-10-14
"junk food ban would starve tv networks, say advertisers",bankruptcy,2004-10-14
ny times maintains ad upturn hopes,trade,2004-10-14
"this 'please miss, she did it too' politics gets us nowhere",stimulus,2004-10-14
jarvis sells pfi unit to reduce debt mountain,debtstudent,2004-10-14
nhs appoints man from the motor trade to root out racism and sexism,manufacture,2004-10-14
nhs appoints man from the motor trade to root out racism and sexism,trade,2004-10-14
homes plan 'will swamp' countryside,loan,2004-10-14
private university students to get state support,debtstudent,2004-10-14
what a difference 40 years makes,401k,2004-10-15
blair: no tax rises to rescue pensions,tax,2004-10-15
carlyle pulls out of iraq debt recovery consortium,debtstudent,2004-10-15
burmese ban for european firms,bankruptcy,2004-10-15
marketing and its malcontents,market,2004-10-15
marketing and its malcontents,market,2004-10-15
cabbies trade shares on 'tbay',trade,2004-10-15
"force workers to boost skills, urges milburn aide",trade,2004-10-15
cutting taxes 'morally desirable',tax,2004-10-15
new act sony hopes hex will bewitch britain,manufacture,2004-10-15
bt tightfisted over broadband offer,debtstudent,2004-10-16
bank on magenta to show her true colours,bankruptcy,2004-10-16
"students given a £100,000 shot at proving they can master the market",debtstudent,2004-10-16
"students given a £100,000 shot at proving they can master the market",market,2004-10-16
"students given a £100,000 shot at proving they can master the market",market,2004-10-16
"why is war-torn iraq giving $190,000 to toys r us?",market,2004-10-16
"why is war-torn iraq giving $190,000 to toys r us?",retirement,2004-10-16
"why is war-torn iraq giving $190,000 to toys r us?",bankruptcy,2004-10-16
"why is war-torn iraq giving $190,000 to toys r us?",market,2004-10-16
"why is war-torn iraq giving $190,000 to toys r us?",retirement,2004-10-16
"why is war-torn iraq giving $190,000 to toys r us?",trade,2004-10-16
"why is war-torn iraq giving $190,000 to toys r us?",export,2004-10-16
"why is war-torn iraq giving $190,000 to toys r us?",import,2004-10-16
"why is war-torn iraq giving $190,000 to toys r us?",manufacture,2004-10-16
"why is war-torn iraq giving $190,000 to toys r us?",tariff,2004-10-16
eu trio seeks us backing for iran nuclear deal,stimulus,2004-10-16
cabbies trade fares for shares,trade,2004-10-16
the man who could have been bill gates,manufacture,2004-10-16
guide to age,package,2004-10-16
housing market on track for soft landing,market,2004-10-17
housing market on track for soft landing,market,2004-10-17
bloodless coup that made it easy to put money into the stock market,stock,2004-10-17
bloodless coup that made it easy to put money into the stock market,stock,2004-10-17
bloodless coup that made it easy to put money into the stock market,market,2004-10-17
bloodless coup that made it easy to put money into the stock market,market,2004-10-17
how to prepare for an uncertain retirement,retirement,2004-10-17
how to prepare for an uncertain retirement,retirement,2004-10-17
live aid: the man,manufacture,2004-10-17
sex-change husband fights irish state ban,bankruptcy,2004-10-17
expert remedies to solve a whole world of problems,export,2004-10-17
banks in dock for card debt suicides,debtstudent,2004-10-17
leeds gamble on casino to ease debt,debtstudent,2004-10-18
estate agents report price fall,export,2004-10-18
economic crime 'costs uk £100m a day',economy,2004-10-18
itunes downloads pass 150m mark,market,2004-10-18
itunes downloads pass 150m mark,market,2004-10-18
row over working hours delays eu jobs report,export,2004-10-18
news international poaches express executive,national,2004-10-18
sainsbury's to stock up on shelf stackers,stock,2004-10-18
sainsbury's to stock up on shelf stackers,stock,2004-10-18
demand to give up zarqawi as us pounds city,stimulus,2004-10-18
record oil prices encourage energy firms to explore peru,export,2004-10-19
anxiety hurts us toy sales,stimulus,2004-10-19
cazenove asks $50 question of ba,bailout,2004-10-19
cazenove asks $50 question of ba,bankruptcy,2004-10-19
us wealth gap grows for ethnic minorities,stimulus,2004-10-19
tim binyon,stimulus,2004-10-19
man 'killed himself over credit card debt',manufacture,2004-10-19
students underestimate debt burden,debtstudent,2004-10-19
students underestimate debt burden,debtstudent,2004-10-19
bank row looms over basic account target,bankruptcy,2004-10-19
freedom law 'could increase council tax bills',tax,2004-10-19
marketing spend shows sustained rise,market,2004-10-19
marketing spend shows sustained rise,market,2004-10-19
property market faces up to 12 months of stagnation,market,2004-10-19
property market faces up to 12 months of stagnation,market,2004-10-19
property market faces up to 12 months of stagnation,national,2004-10-19
channel 4 tipped to win tests,401k,2004-10-19
dublin may trade roots of its history for a modern view,trade,2004-10-20
broker's advice dents copper firm,debtstudent,2004-10-20
new data points to property market slowdown,market,2004-10-20
new data points to property market slowdown,market,2004-10-20
tax law 'killing spin-off research ventures',tax,2004-10-20
viewers trade wife swap for family history,trade,2004-10-20
the third man,manufacture,2004-10-20
bob the builder fixes £18m us cable deal,stimulus,2004-10-20
plan to fix middle england's grocer,loan,2004-10-20
'vulnerable' bank debtor's suicide,bankruptcy,2004-10-20
man utd investors win in nursing home takeover,manufacture,2004-10-20
ins and outs,bailout,2004-10-20
death of the salesman gives birth to a new plan,loan,2004-10-20
raf man found dead in air base alert,manufacture,2004-10-21
crashed it plan costs avis millions,loan,2004-10-21
absent fans leave whelan in despair,loan,2004-10-21
increase in us tuition fees,stimulus,2004-10-21
"cashpoints: minister calls women's pensions a 'national scandal', while house prices continue to fall",national,2004-10-21
"america, let us love you again ...",stimulus,2004-10-21
'you've ways of making us walk',stimulus,2004-10-21
hit fires chief who pulled off us deal,stimulus,2004-10-21
"'the real reason, of course, is tax'",tax,2004-10-21
taxing times,tax,2004-10-21
man u fan turns to nomura in effort to block us tycoon,manufacture,2004-10-22
man u fan turns to nomura in effort to block us tycoon,debtstudent,2004-10-22
man u fan turns to nomura in effort to block us tycoon,bailout,2004-10-22
man u fan turns to nomura in effort to block us tycoon,bankruptcy,2004-10-22
man u fan turns to nomura in effort to block us tycoon,stimulus,2004-10-22
man u fan turns to nomura in effort to block us tycoon,manufacture,2004-10-22
man u fan turns to nomura in effort to block us tycoon,stimulus,2004-10-22
"european market is inferior, says astrazeneca",market,2004-10-22
"european market is inferior, says astrazeneca",market,2004-10-22
'it has sent a chill through the nation',national,2004-10-22
kerry wins student vote,debtstudent,2004-10-22
havens that have become a tax on the world's poor,tax,2004-10-22
uk economy slows down,economy,2004-10-22
newspaper report has google in a spin,export,2004-10-22
charity warns of debt problem crisis,debtstudent,2004-10-22
the casino economy,economy,2004-10-22
fat dividend looks more like a cunning plan,loan,2004-10-22
hard sell for the man from the pru,manufacture,2004-10-23
career doing a u-turn? pack a basic repair kit then sit tight and enjoy the open road,package,2004-10-23
lazard's war may sink stock market listing,stock,2004-10-23
lazard's war may sink stock market listing,stock,2004-10-23
lazard's war may sink stock market listing,market,2004-10-23
lazard's war may sink stock market listing,market,2004-10-23
economist gets ready to celebrate its first million,economy,2004-10-23
strong results from wpp lifts ad industry's morale,trade,2004-10-23
frothy friday has traders on the run,trade,2004-10-23
lifelong loan that seemed like a life sentence,loan,2004-10-23
mp calls crisis meetings over bond mis-selling,import,2004-10-23
the dos and don'ts of debt,debtstudent,2004-10-23
the age of anxiety,package,2004-10-23
dire warnings from global warming report,export,2004-10-24
kenyans say no thanks to national dress,national,2004-10-24
the age of anxiety,package,2004-10-24
wake up to a bigger retirement package,retirement,2004-10-24
wake up to a bigger retirement package,retirement,2004-10-24
wake up to a bigger retirement package,package,2004-10-24
debt dogs graduates into thirties,debtstudent,2004-10-24
what rick stein has done for us,stimulus,2004-10-24
"'it's the economy, dammit'",economy,2004-10-24
the man who fell to earth,manufacture,2004-10-24
online risks for us web users,stimulus,2004-10-25
'stagnation not deflation' in housing market,national,2004-10-25
'stagnation not deflation' in housing market,market,2004-10-25
'stagnation not deflation' in housing market,market,2004-10-25
national targets set for libraries,national,2004-10-25
hotel plan could ruin aeolian islands,loan,2004-10-25
robosapiens get the toy market in their sights,market,2004-10-25
robosapiens get the toy market in their sights,market,2004-10-25
'he gave us the soundtrack to our lives',stimulus,2004-10-26
'he gave us the soundtrack to our lives',stimulus,2004-10-26
concessions offered by ec president as crunch vote looms,economy,2004-10-26
students study for an entrepreneurial future,debtstudent,2004-10-26
news corp shareholders back murdoch's us listing plan,stimulus,2004-10-26
news corp shareholders back murdoch's us listing plan,loan,2004-10-26
united bosses read us tycoon's game,stimulus,2004-10-26
big players lobbying for piece of the action,national,2004-10-26
kent commuters face the bullet,market,2004-10-27
kent commuters face the bullet,market,2004-10-27
carling cup round-up  mark tallentire,market,2004-10-27
carling cup round-up  mark tallentire,market,2004-10-27
new home loans 29% down on last year,loan,2004-10-27
"don't raise rates, cbi urges bank of england",bankruptcy,2004-10-27
call for 'fairer' green tax system,tax,2004-10-27
ofcom ready to give and take in bt report,debtstudent,2004-10-27
ofcom ready to give and take in bt report,export,2004-10-27
regent inns admits debt woes,retirement,2004-10-27
regent inns admits debt woes,retirement,2004-10-27
regent inns admits debt woes,debtstudent,2004-10-27
eco sounding,economy,2004-10-27
digital age puts britain on the map,package,2004-10-27
us approval for kidney dialysis drug offers timely relief for shire,stimulus,2004-10-28
three-day clearing? don't bank on it,bankruptcy,2004-10-28
important to do your homework first,import,2004-10-28
rock of ages,package,2004-10-28
st john armitage,stock,2004-10-28
st john armitage,debtstudent,2004-10-28
st john armitage,stimulus,2004-10-28
st john armitage,stock,2004-10-28
our special musical debt to john peel,debtstudent,2004-10-28
landmark ruling as judge erases couple's debt,debtstudent,2004-10-28
i just can't seem to clear my card debt,debtstudent,2004-10-28
bahrain-based bank takes over south staffordshire water firm,bankruptcy,2004-10-28
haymarket blames tough conditions for profit slump,market,2004-10-28
haymarket blames tough conditions for profit slump,market,2004-10-28
row over plan to cut scottish exam subjects,loan,2004-10-28
us and them,stimulus,2004-10-29
a poll tax of souls,tax,2004-10-29
guide to age,package,2004-10-29
oil prices blight us growth hopes,stimulus,2004-10-29
sean coughlan,loan,2004-10-29
former aide guilty of cutting up stolen dalí painting to create fake masterpiece,trade,2004-10-29
economists warn of big tax rise,economy,2004-10-29
economists warn of big tax rise,tax,2004-10-29
"court frees merseyside couple from loan debt that soared from £5,750 to £384,000",loan,2004-10-29
"court frees merseyside couple from loan debt that soared from £5,750 to £384,000",debtstudent,2004-10-29
china tries to cool its economy,economy,2004-10-29
haymarket's earnings fall 10%,market,2004-10-29
haymarket's earnings fall 10%,market,2004-10-29
a strong europe - or bush's feral us capitalism,stimulus,2004-10-29
auditors cast doubt on rover's chinese bail-out,bailout,2004-10-30
retail chief hangs up after bt brawl,debtstudent,2004-10-30
the exxon factor,manufacture,2004-10-30
apple q3 global market share falls to 1.8%,market,2004-10-30
apple q3 global market share falls to 1.8%,market,2004-10-30
straw reveals game plan for europe poll,loan,2004-10-30
when inheritance tax really hits home,tax,2004-10-30
credit rules to stop 'extortionate' loans,export,2004-10-30
credit rules to stop 'extortionate' loans,loan,2004-10-30
act should help unwary avoid traps,manufacture,2004-10-30
terrace taunt that was once a conservative mp,import,2004-10-30
economics guru warns of end to spending spree,economy,2004-10-31
i must plan for an 18-year age gap,loan,2004-10-31
i must plan for an 18-year age gap,package,2004-10-31
of dice and men,retirement,2004-10-31
of dice and men,retirement,2004-10-31
stress becomes the no 1 complaint of british workers,401k,2004-10-31
big little man,manufacture,2004-10-31
"desmond dreams of retirement, but for now the beat goes on",retirement,2004-10-31
"desmond dreams of retirement, but for now the beat goes on",retirement,2004-10-31
the winner is... us conservatism,stimulus,2004-10-31
why polls are bad for us,stimulus,2004-10-31
pumped-up oil prices will hurt us all,stimulus,2004-11-01
tax laws that favour art,tax,2004-11-01
condom firm opts for ofex float,economy,2004-11-01
scotland unveils schools reform package,package,2004-11-01
marconi to drop us chief officer,stimulus,2004-11-01
health briefing: november 1 2004,401k,2004-11-01
uk manufacturing shows small increase,manufacture,2004-11-01
the grudge won't budge from us top spot,stimulus,2004-11-01
cbi calls for restraint on tax,tax,2004-11-01
the man with a plan for labour election victory,manufacture,2004-11-01
the man with a plan for labour election victory,loan,2004-11-01
onward student pirates,debtstudent,2004-11-01
beazley looks to us expansion,stimulus,2004-11-02
mission accomplished as cobham buys cyber surveillance expert,export,2004-11-02
baa reports 'robust' performance,export,2004-11-02
the number gets full marks from ad men,trade,2004-11-02
the number gets full marks from ad men,retirement,2004-11-02
the number gets full marks from ad men,retirement,2004-11-02
row over lost data on tax rebates,tax,2004-11-02
7 million not saving for retirement,retirement,2004-11-02
7 million not saving for retirement,retirement,2004-11-02
oil traders speculate on kerry victory,trade,2004-11-02
traders sniff bad odour over perfume shop,trade,2004-11-02
poverty pay and debt,debtstudent,2004-11-02
