headlines,terms,dates
matalan grows in tough times,loan,2004-09-03
bank of ireland fined over tax scam,bankruptcy,2004-09-03
bank of ireland fined over tax scam,tax,2004-09-03
the man who gave me a slap in the face,manufacture,2004-09-03
why bush's man is fighting dirty,manufacture,2004-09-04
when market runners come with riders,market,2004-09-04
when market runners come with riders,market,2004-09-04
at least black spared us his dark side,stimulus,2004-09-04
southampton's ambitious chairman is a man you cross at your peril,manufacture,2004-09-04
i'm betting on bush - and stockpiling defence,stock,2004-09-04
i'm betting on bush - and stockpiling defence,stock,2004-09-04
taxman forces merrill to scrap dual pay,tax,2004-09-04
stone age,package,2004-09-04
davies promises deliverance for the nation,national,2004-09-04
the expert gardener,export,2004-09-04
uk faces court action for nuclear safety failings,national,2004-09-04
pensioners fail to breach unfair dismissal age barrier,package,2004-09-04
helping themselves to avoid tax,tax,2004-09-04
over-65s lose workplace discrimination case,national,2004-09-04
one man and his cogs,manufacture,2004-09-05
inside marketing and pr,market,2004-09-06
inside marketing and pr,market,2004-09-06
hunting season opened on illegal loan sharks,loan,2004-09-06
be top of the class at managing student debt,debtstudent,2004-09-06
be top of the class at managing student debt,debtstudent,2004-09-06
ailing kerry campaign to target economy,economy,2004-09-06
the man who lost his past,manufacture,2004-09-06
william hill reports profits increase,export,2004-09-06
ex-observer editor moves into futures market,market,2004-09-06
ex-observer editor moves into futures market,market,2004-09-06
are you man enough?,manufacture,2004-09-06
trial tagging company looks at markets without bars in western europe,market,2004-09-06
trial tagging company looks at markets without bars in western europe,market,2004-09-06
the olympic gold equation: do the wealthiest nations always win?,national,2004-09-06
nelson turns blind eye to age,package,2004-09-06
eu welcome for plan to rein in coke,loan,2004-09-07
turbocad student edition module 1,debtstudent,2004-09-07
turbocad student edition module 1,401k,2004-09-07
"black boys betrayed by racist school system, says report",export,2004-09-07
uk manufacturing output falls again,manufacture,2004-09-07
grief and anger in beslan,loan,2004-09-07
directors face no-risk retirement,retirement,2004-09-07
directors face no-risk retirement,retirement,2004-09-07
alan smithers: declaration of independence,loan,2004-09-07
"forget vietnam - it's the economy, clinton tells kerry",economy,2004-09-07
"merrill banker was out of her depth, boss tells tribunal",bankruptcy,2004-09-07
st leger boost for rule of law,stock,2004-09-07
st leger boost for rule of law,debtstudent,2004-09-07
st leger boost for rule of law,stimulus,2004-09-07
st leger boost for rule of law,stock,2004-09-07
holmes aims to profit from shot at the gold trade,trade,2004-09-08
kerry and bush trade blows as war rhetoric escalates,trade,2004-09-08
greenspan's upbeat comments may signal us rates rise,stimulus,2004-09-08
ba cuts debt with qantas sale,bailout,2004-09-08
ba cuts debt with qantas sale,bankruptcy,2004-09-08
ba cuts debt with qantas sale,debtstudent,2004-09-08
marketing upturn aids aegis,market,2004-09-08
marketing upturn aids aegis,market,2004-09-08
sharp-suited schmoozer and trade union darling,trade,2004-09-08
mps to vote on hunting ban,bankruptcy,2004-09-08
labour hits out at tory loans policy,loan,2004-09-08
"us economy on the up, says greenspan",stimulus,2004-09-08
"us economy on the up, says greenspan",economy,2004-09-08
students slam tory loans plan,debtstudent,2004-09-08
students slam tory loans plan,loan,2004-09-08
students slam tory loans plan,loan,2004-09-08
tories to scrap fees but increase loans,loan,2004-09-08
shrek 2 leads profitable us summer,stimulus,2004-09-08
ba to sell qantas stake,bailout,2004-09-08
ba to sell qantas stake,bankruptcy,2004-09-08
the wrap: inside middle school no 1,401k,2004-09-08
poland 1 - 2 england,401k,2004-09-08
women 'most at risk of poverty in old age',package,2004-09-08
kid-glove treatment is the only way for the national manager,national,2004-09-09
morrison seeks loan move,loan,2004-09-09
coventry fury at davenport loan deal,export,2004-09-09
coventry fury at davenport loan deal,loan,2004-09-09
irish pubs ban and german tax take toll of gallaher,bankruptcy,2004-09-09
irish pubs ban and german tax take toll of gallaher,tax,2004-09-09
milan look to stam for extra solidity,loan,2004-09-09
burnside; and de burgh,debtstudent,2004-09-09
burnside; and de burgh,trade,2004-09-09
don't look past milan,loan,2004-09-09
smoking ban 'not tough enough',bankruptcy,2004-09-09
bbc critic takes shadow culture role,manufacture,2004-09-09
bank holds interest rates steady,bankruptcy,2004-09-09
lib dems propose 'flexible retirement',retirement,2004-09-09
lib dems propose 'flexible retirement',retirement,2004-09-09
hammers swoop for davenport,export,2004-09-09
battle to save rare 14th century psalter for the nation,national,2004-09-09
calls grow for action as millions more face rising gas bills,national,2004-09-09
wall street journal dashes ad hopes,trade,2004-09-09
students condemn tory plan to shake up funding,debtstudent,2004-09-09
students condemn tory plan to shake up funding,loan,2004-09-09
"no fees, more loans - and lots of interest at election time",loan,2004-09-09
video joins audio in portable market,market,2004-09-09
video joins audio in portable market,market,2004-09-09
reporting both sides of the story,export,2004-09-09
blair and howard pledge action on climate change,national,2004-09-10
disney's eisner to retire in two years,retirement,2004-09-10
disney's eisner to retire in two years,retirement,2004-09-10
world bank consults over giant laos dam project,bankruptcy,2004-09-10
fighting the battle agains age,package,2004-09-10
humberside police chief agrees to early retirement,retirement,2004-09-10
humberside police chief agrees to early retirement,retirement,2004-09-10
ex-sunday mirror man appointed tribune editor,manufacture,2004-09-10
atari retro-fest in us,stimulus,2004-09-10
sky man poached for al-jazeera launch,manufacture,2004-09-10
itv aims at broad market for digital,market,2004-09-10
itv aims at broad market for digital,market,2004-09-10
green stalks m&s again with £3m ad campaign,trade,2004-09-10
what al-qaida did to us - part two,stimulus,2004-09-10
what al-qaida did to us,stimulus,2004-09-10
what al-qaida did to us - part three,stimulus,2004-09-10
north sea oil decline widens trade gap,trade,2004-09-10
new york in thrall to power of davenport,export,2004-09-10
student needs to stretch her funds,debtstudent,2004-09-11
why we should all cheer for tim,stimulus,2004-09-11
caz and the dying art of stockbroking,stock,2004-09-11
caz and the dying art of stockbroking,stock,2004-09-11
the cbi's megaphone man,manufacture,2004-09-11
regent chiefs leave with no sense of loss,retirement,2004-09-11
regent chiefs leave with no sense of loss,retirement,2004-09-11
surprise at smaller us trade gap,stimulus,2004-09-11
surprise at smaller us trade gap,trade,2004-09-11
incite is censured by stock exchange,stock,2004-09-11
incite is censured by stock exchange,stock,2004-09-11
agro culture,manufacture,2004-09-11
az's exanta hits expert obstacle,export,2004-09-11
don't make it easy for the taxman,tax,2004-09-11
natwest's new balancing act,manufacture,2004-09-11
ask the experts,export,2004-09-12
"fair trade, no logo... but is it cute?",trade,2004-09-12
"youth of today: no savings,  no pension, huge debts",debtstudent,2004-09-12
no tax - but you still get less interest,tax,2004-09-12
market leader,market,2004-09-12
market leader,market,2004-09-12
bayer refit leads to us sales pact,stimulus,2004-09-13
bae adds digitalnet to us assets,stimulus,2004-09-13
us airways vows to rise again,stimulus,2004-09-13
north-south economic growth gulf widens,economy,2004-09-13
parents delay retirement to pay for university,retirement,2004-09-13
parents delay retirement to pay for university,retirement,2004-09-13
market moves,market,2004-09-13
market moves,market,2004-09-13
16 killed in us strikes on falluja,stimulus,2004-09-13
can this man see into the future?,manufacture,2004-09-13
three days in beslan,loan,2004-09-13
seven die as move to oust afghan city's warlord prompts riot,bailout,2004-09-13
us tools up as assault rifle ban expires,stimulus,2004-09-13
us tools up as assault rifle ban expires,bankruptcy,2004-09-13
the stupid economy,economy,2004-09-13
arsenal 1 - 0 psv eindhoven,401k,2004-09-14
arsenal 1 - 0 psv eindhoven,401k,2004-09-14
bank warns of house price drop,bankruptcy,2004-09-14
medicine man,manufacture,2004-09-14
uk slips in growing overseas student market,debtstudent,2004-09-14
uk slips in growing overseas student market,market,2004-09-14
uk slips in growing overseas student market,market,2004-09-14
can the bank make us sign a new loan agreement?,bankruptcy,2004-09-14
can the bank make us sign a new loan agreement?,stimulus,2004-09-14
can the bank make us sign a new loan agreement?,loan,2004-09-14
47 dead in baghdad market blast,market,2004-09-14
47 dead in baghdad market blast,market,2004-09-14
emap swoops for ofcom radio man,manufacture,2004-09-14
unions threaten action over job cut plans,national,2004-09-14
many are delaying retirement to fund children's education,retirement,2004-09-14
many are delaying retirement to fund children's education,retirement,2004-09-14
restaurant inspectors urge 'scores on doors',manufacture,2004-09-14
government 'hindering uk manufacturing',manufacture,2004-09-14
qinetiq continues us defence assault,stimulus,2004-09-14
ec takes on carmakers over parts,economy,2004-09-15
regent delays results after discovering audit error,retirement,2004-09-15
regent delays results after discovering audit error,retirement,2004-09-15
citigroup admits £7bn bond trade was wrong,trade,2004-09-15
ad revenues rise at associated newspapers,trade,2004-09-15
work age bias remains 'ongoing problem',package,2004-09-15
"smoking ban 'would save 5,000 lives a year'",bankruptcy,2004-09-15
tax cuts for the well off? that's a bit rich,tax,2004-09-15
eco soundings,economy,2004-09-15
investigation into arrest of muslim student,debtstudent,2004-09-15
"co-op sees loans rise, profits fall",loan,2004-09-16
lib dems propose new 'health tax',tax,2004-09-16
loan worries for scottish students,loan,2004-09-16
loan worries for scottish students,debtstudent,2004-09-16
the pariah factor,manufacture,2004-09-16
doctors call for tax relief on exercise to tackle obesity,tax,2004-09-16
i've earned extra cash but paid out more - should i pay tax?,tax,2004-09-16
readers back saga float plan,loan,2004-09-16
sun slips quietly into its middle age,package,2004-09-16
btg sues amazon over use of marketing technology,market,2004-09-16
btg sues amazon over use of marketing technology,market,2004-09-16
implementation of ban likely to add to difficulties in long-running battle,bankruptcy,2004-09-16
what now for the men in tights?,retirement,2004-09-16
what now for the men in tights?,retirement,2004-09-16
associated ad revenue rises 8.5%,trade,2004-09-16
call to scrap council tax,tax,2004-09-17
alexander chancellor's guide to age,package,2004-09-17
we always backed the free market,market,2004-09-17
we always backed the free market,market,2004-09-17
generation x,export,2004-09-17
generation x,tax,2004-09-17
generation x,export,2004-09-17
generation x,tax,2004-09-17
kevin mark trail,market,2004-09-17
kevin mark trail,market,2004-09-17
teachers warn against retirement changes,retirement,2004-09-17
teachers warn against retirement changes,retirement,2004-09-17
fictional candidate weighs into us election,stimulus,2004-09-17
channel 4 signs 80m euro deal in scramble for digital capacity,401k,2004-09-17
signs of slower international enrolments fail to scare the elt 'canary',national,2004-09-17
unions to get their way on rail nationalisation,national,2004-09-17
market forces,market,2004-09-18
market forces,market,2004-09-18
it's on your bike and apply the tax breaks,tax,2004-09-18
new tax break will help british film-makers take on hollywood,tax,2004-09-18
all the queen's men,retirement,2004-09-18
all the queen's men,retirement,2004-09-18
a debt of honour,debtstudent,2004-09-18
man in the mirror: an interview with r kelly,manufacture,2004-09-19
man in the mirror: an interview with r kelly,market,2004-09-19
man in the mirror: an interview with r kelly,retirement,2004-09-19
man in the mirror: an interview with r kelly,bankruptcy,2004-09-19
man in the mirror: an interview with r kelly,market,2004-09-19
man in the mirror: an interview with r kelly,retirement,2004-09-19
man in the mirror: an interview with r kelly,trade,2004-09-19
man in the mirror: an interview with r kelly,export,2004-09-19
man in the mirror: an interview with r kelly,import,2004-09-19
man in the mirror: an interview with r kelly,manufacture,2004-09-19
man in the mirror: an interview with r kelly,tariff,2004-09-19
wallpaper man gets feet behind the desk,manufacture,2004-09-19
argentina asks brown to help ease debt burden,debtstudent,2004-09-19
stump up now for a ripe old age,package,2004-09-19
money in the bank but moyes stays in present,bankruptcy,2004-09-19
foreign hotspots for a happy retirement,retirement,2004-09-20
foreign hotspots for a happy retirement,retirement,2004-09-20
ulster tv bullish as ad revenues soar,trade,2004-09-20
mortgage lending falls as housing market slows,market,2004-09-20
mortgage lending falls as housing market slows,market,2004-09-20
age discrimination widely felt at work ... by the young,package,2004-09-20
age discrimination widely felt at work ... by the young,national,2004-09-20
investors urge drug firms to do more for world's poor,manufacture,2004-09-20
housing market reaches stalemate,market,2004-09-20
housing market reaches stalemate,market,2004-09-20
"sliced, diced and dissipated, it's still bad debt",debtstudent,2004-09-21
us consortium offers £1.5bn for warner chilcott,stimulus,2004-09-21
kroes accepts life ban from business,bankruptcy,2004-09-21
us online advertising spending surges,stimulus,2004-09-21
new tax breaks for film-makers unveiled,tax,2004-09-21
iraqi reporters in election training,export,2004-09-21
"labour will increase taxes, says letwin",tax,2004-09-21
the experts run for cover,export,2004-09-21
havens that have become a tax on the world's poor,tax,2004-09-21
de montfort university,debtstudent,2004-09-21
de montfort university,trade,2004-09-21
balancing act,manufacture,2004-09-21
the college of st mark and st john,stock,2004-09-21
the college of st mark and st john,debtstudent,2004-09-21
the college of st mark and st john,stimulus,2004-09-21
the college of st mark and st john,stock,2004-09-21
the college of st mark and st john,market,2004-09-21
the college of st mark and st john,market,2004-09-21
the college of st mark and st john,stock,2004-09-21
the college of st mark and st john,debtstudent,2004-09-21
the college of st mark and st john,stimulus,2004-09-21
the college of st mark and st john,stock,2004-09-21
"st mary's college, twickenham",stock,2004-09-21
"st mary's college, twickenham",debtstudent,2004-09-21
"st mary's college, twickenham",stimulus,2004-09-21
"st mary's college, twickenham",stock,2004-09-21
"rose bruford college, kent",market,2004-09-21
"rose bruford college, kent",market,2004-09-21
kent institute of art & design,market,2004-09-21
kent institute of art & design,market,2004-09-21
the university of kent,market,2004-09-21
the university of kent,market,2004-09-21
london school of economics and political science,economy,2004-09-21
"ravensbourne college of design & communication, kent",market,2004-09-21
"ravensbourne college of design & communication, kent",market,2004-09-21
us smallpox cut hits acambis,stimulus,2004-09-21
first sharia-compliant bank opens doors,bankruptcy,2004-09-22
safeway market share dips,market,2004-09-22
safeway market share dips,market,2004-09-22
third fed rate rise as us picks up,stimulus,2004-09-22
cost of aiding arms exports,export,2004-09-22
"russ meyer, skin-flick auteur, dies aged 82",package,2004-09-22
bank unanimous on rates decision,bankruptcy,2004-09-22
first uk islamic bank opens its doors,bankruptcy,2004-09-22
unison warns of possible strike action over pensions,national,2004-09-22
tax break could be worth £4m a film,tax,2004-09-22
"take a break or burn out, jockeys warned",bailout,2004-09-22
lse reports surge in listings,export,2004-09-23
amstrad seeks us music boost,trade,2004-09-23
amstrad seeks us music boost,stimulus,2004-09-23
manufacturing fightback deflected,manufacture,2004-09-23
report condemns foreign office property deals,export,2004-09-23
tax office forks out almost £1m in compensation,tax,2004-09-23
british energy seeks stock exchange delisting,stock,2004-09-23
british energy seeks stock exchange delisting,stock,2004-09-23
what's the best long-term investment plan for children?,loan,2004-09-23
can you get stung by capital gains tax on a second house?,tax,2004-09-23
howells warns of merciless university market,market,2004-09-23
howells warns of merciless university market,market,2004-09-23
'eat local' plan to tackle obesity,loan,2004-09-23
manufacturing sector 'stuck in low gear',manufacture,2004-09-23
livingstone risks labour ire to attack tuition fees,retirement,2004-09-23
livingstone risks labour ire to attack tuition fees,retirement,2004-09-23
'she could wrestle any man ... ',manufacture,2004-09-23
"plaid meets for conference, £46,000 in debt",debtstudent,2004-09-23
itv to fight back against ad revenue shortfall,trade,2004-09-23
shell's revival plan falls flat in the city,loan,2004-09-23
'we just had to act over aids',manufacture,2004-09-23
students begin term in temporary housing,debtstudent,2004-09-24
howard pledge to limit inheritance tax,tax,2004-09-24
wpp incentive plan pays sorrell £16m,loan,2004-09-24
"coronation street veteran to quit, but not quite yet",national,2004-09-24
reid pledges action on smoking,national,2004-09-24
can john elway win the us election for bush?,stimulus,2004-09-24
the debt the west owes the third world,debtstudent,2004-09-25
tales from a rough trade,trade,2004-09-25
city spitting over red tape and taxes,tax,2004-09-25
the man who removed the sweater from the sweater girl,manufacture,2004-09-25
"lock, stock and caught over a barrel",stock,2004-09-25
"lock, stock and caught over a barrel",stock,2004-09-25
"sarah, 40",401k,2004-09-25
hometrack reports record fall,export,2004-09-25
students set for a taxing term,debtstudent,2004-09-25
students set for a taxing term,tax,2004-09-25
tory anger over tax cut proposal,tax,2004-09-25
brown to bail out world's poorest,bailout,2004-09-25
hain steps off line on inheritance tax,tax,2004-09-26
chancellor puts the economy to the fore,economy,2004-09-26
"go on, admit it, my van's the man",manufacture,2004-09-26
market forces,market,2004-09-26
market forces,market,2004-09-26
how to make a loan range far and wide,loan,2004-09-26
tony blair's third age,package,2004-09-26
'stealth tax' on pensions,tax,2004-09-26
brown and bush set for clash over debt relief,debtstudent,2004-09-26
cold september for the housing market,market,2004-09-26
cold september for the housing market,market,2004-09-26
"listing in london, time out seeks new ports",export,2004-09-26
"listing in london, time out seeks new ports",import,2004-09-26
wagg faces ban for cocaine,bankruptcy,2004-09-27
brown: economy is vital to voters,economy,2004-09-27
"£5 an hour minimum wage would not cost jobs, says pay expert",export,2004-09-27
mature tastes,manufacture,2004-09-27
porto slide back to square one,export,2004-09-28
porto slide back to square one,import,2004-09-28
cazenove's man of the moment,manufacture,2004-09-28
rain fails to dampen m&b trade,trade,2004-09-28
tax inquiry hits hilfiger shares,tax,2004-09-28
alan barnes,loan,2004-09-28
olympiakos 1 - 0 liverpool,401k,2004-09-28
olympiakos 1 - 0 liverpool,401k,2004-09-28
appointee's report,export,2004-09-28
smoking ban nears but not for pubs,bankruptcy,2004-09-28
ad revenues rise at srh amid takeover talk,trade,2004-09-28
counter culture,manufacture,2004-09-28
don't bank on it,bankruptcy,2004-09-28
man united defends agents' fees,manufacture,2004-09-28
market for dull but reliable companies in unfashionable industries,market,2004-09-29
market for dull but reliable companies in unfashionable industries,market,2004-09-29
market punishes man,market,2004-09-29
market punishes man,market,2004-09-29
market punishes man,manufacture,2004-09-29
euro disney debt plan agreement,debtstudent,2004-09-29
euro disney debt plan agreement,loan,2004-09-29
optimistic industry predicts 4.4% rise in ad spend,trade,2004-09-29
eno retests market with bieito's dirty don,market,2004-09-29
eno retests market with bieito's dirty don,market,2004-09-29
avon calls back 40 years later,401k,2004-09-29
thomson favourite to buy itv's moving picture co,economy,2004-09-29
union pickets hsbc over plan to move jobs abroad,loan,2004-09-29
eco sounding,economy,2004-09-29
bribery culture harming poor nations,manufacture,2004-09-29
bribery culture harming poor nations,national,2004-09-29
ins and outs,bailout,2004-09-29
de vries sets hearts on fire,debtstudent,2004-09-30
de vries sets hearts on fire,trade,2004-09-30
"student debt levels exaggerated, says us expert",debtstudent,2004-09-30
"student debt levels exaggerated, says us expert",debtstudent,2004-09-30
"student debt levels exaggerated, says us expert",stimulus,2004-09-30
"student debt levels exaggerated, says us expert",export,2004-09-30
'the goverment has to act now',manufacture,2004-09-30
malta is not a tax haven,tax,2004-09-30
us firm gets results for nhs - but soft sell masks an expensive truth,stimulus,2004-09-30
draft charities bill report: main points,export,2004-09-30
sean connery quits film project as variety reports he may be retiring,export,2004-09-30
sky revamps brand with high-profile ad campaign,trade,2004-09-30
charities call for tax credit rethink as poor face more hardship,tax,2004-09-30
wildlife trade? it's a jungle out there,trade,2004-09-30
cashpoints: the property market slows while consumer confidence dives,market,2004-09-30
cashpoints: the property market slows while consumer confidence dives,market,2004-09-30
labour's balancing act,manufacture,2004-10-01
g7 backs brown plan to ease the oil crisis,loan,2004-10-01
border controls for student shangri-la,debtstudent,2004-10-01
pinochet accused in tax fraud inquiry,tax,2004-10-01
lady archer's ex-pa declared bankrupt,bankruptcy,2004-10-01
ann maurice has gone from a hippie drop-out to a tv star with millions invested.  mark anstead met her,market,2004-10-01
ann maurice has gone from a hippie drop-out to a tv star with millions invested.  mark anstead met her,market,2004-10-01
washington leans on g7 to back imf loan with iraq debt write-off,loan,2004-10-01
washington leans on g7 to back imf loan with iraq debt write-off,debtstudent,2004-10-01
criminal inquiry into us loan firm,stimulus,2004-10-01
criminal inquiry into us loan firm,loan,2004-10-01
the cost of tax avoidance,tax,2004-10-01
concern as tories plan to scrap new deal,loan,2004-10-01
manufacturing growth weakens,manufacture,2004-10-01
civil servants vote on industrial action over job cuts,national,2004-10-01
time for action,national,2004-10-01
plan for new £300m public television service,loan,2004-10-01
former aide to blair denies report is aimed at taming bbc,trade,2004-10-01
former aide to blair denies report is aimed at taming bbc,export,2004-10-01
plan to sell off juvenile jails as job lot,loan,2004-10-01
russia's co2 promise will kickstart carbon trade,trade,2004-10-01
how can i transfer my skills to the uk job market?,market,2004-10-01
how can i transfer my skills to the uk job market?,market,2004-10-01
ba needs to lose weight,bailout,2004-10-02
ba needs to lose weight,bankruptcy,2004-10-02
g7 torpedoes brown's debt write-off push,debtstudent,2004-10-02
refuges needed to curb sex trade,trade,2004-10-02
"princess 1, paparazzi 0 - welcome to hello!ville",401k,2004-10-02
taxing time at the seaside,tax,2004-10-02
the legacy of gordon's tax grab,tax,2004-10-02
bank fear on house prices,bankruptcy,2004-10-02
don't push workers to save for old age,package,2004-10-02
why hang on to a house when you could fund your retirement?,retirement,2004-10-02
why hang on to a house when you could fund your retirement?,retirement,2004-10-02
'a sensible - if unexciting - investment strategy allowed me to retire by 55',retirement,2004-10-02
'a sensible - if unexciting - investment strategy allowed me to retire by 55',retirement,2004-10-02
is us investor planning jarvis boardroom putsch?,stimulus,2004-10-02
wall street marks bush as a 'buy' stock,stock,2004-10-02
wall street marks bush as a 'buy' stock,stock,2004-10-02
barclays in hot water over india dam loan,loan,2004-10-02
bigley's kidnappers may trade hostage for cash,trade,2004-10-02
lourdes of love goes commercial as aged irish struggle to find wives,package,2004-10-02
"if blair has a fault, it is just that he wants to save us",stimulus,2004-10-02
fuel price protesters blockade french ports,export,2004-10-02
fuel price protesters blockade french ports,import,2004-10-02
bradley fails in appeal over ban,bankruptcy,2004-10-02
why big loan is no problem for blairs,loan,2004-10-02
why the salary circus needs a balancing act,manufacture,2004-10-02
has the isa age been frozen out?,package,2004-10-02
has the isa age been frozen out?,bailout,2004-10-02
the power of unreasonable man,manufacture,2004-10-02
tories plan 'timetable for action',loan,2004-10-03
fraud curb bars overseas students,debtstudent,2004-10-03
"it's the economy, stupid",economy,2004-10-04
guardian weekly relaunched in the us,stimulus,2004-10-04
tax havens undermine poor countries,tax,2004-10-04
