headlines,terms,dates,scores
peer in gay rights row quits ba board,super,2004-08-02,2
interest rate rise 'certain' as economy grows,democrat,2004-08-02,3
cricket triumph proves a catch for c4,protest,2004-08-02,3
fa 'must overhaul pr strategy',protest,2004-08-02,2
animal rights groups fight us activist ban,house,2004-08-02,2
protest against chinese army at tattoo,protest,2004-08-02,2
us faces loss of second relay gold,house,2004-08-03,1
svengate evokes memories of gatting fiasco,senate,2004-08-03,2
gulf allies 'all faced chemical exposure',rallies,2004-08-03,2
space invaders,pac,2004-08-03,2
don't let the rot set in,protest,2004-08-03,1
what the us papers say,house,2004-08-03,2
pakistan arrests revealed us targets,house,2004-08-03,2
us shelves new travel rules for britons,house,2004-08-03,2
rate threat to homeowners,democrat,2004-08-03,2
the informer: britain and us face fresh abuse allegations,house,2004-08-04,2
mps meet murdoch on us junket,house,2004-08-04,2
housebuilding plans need 'radical improvement',house,2004-08-04,3
"house prices still rising, says halifax",house,2004-08-04,2
save us from the armchair generals,house,2004-08-04,2
us and them,house,2004-08-04,2
us officials defend terror alert,house,2004-08-04,2
whose benefit?,house,2004-08-04,2
lib dem radicals call for pro-market switch,democrat,2004-08-04,2
"mortgage lenders' house price figures are flawed, says builder",house,2004-08-04,1
eviction proves a winner for channel 4,protest,2004-08-05,3
"higher rates are cooling house price growth, says halifax",house,2004-08-05,3
the saloon bar follies that keep us clinging to the rock,house,2004-08-05,2
what the terror alerts really tell us,house,2004-08-05,2
talktime: al franken,rallies,2004-08-05,2
air craft,democrat,2004-08-06,3
army officers cleared of east timor crimes,protest,2004-08-06,2
white house race gets nasty,house,2004-08-06,1
republicans pick racist,republican,2004-08-06,1
"don't panic says bradford & bingley, house prices won't crash",house,2004-08-06,1
humans are sentient too,senate,2004-08-06,2
musharraf profits under us pressure,house,2004-08-06,3
bush's campaign trail gaffe,campaign,2004-08-06,2
beckhams' pr guru left out in the cold,protest,2004-08-06,1
bitter rate rise medicine begins to cool house price fever,democrat,2004-08-06,3
bitter rate rise medicine begins to cool house price fever,house,2004-08-06,3
us pioneer's vision offers hope to africa,house,2004-08-07,3
gypsy camp plea by police  to deter racist thugs,campaign,2004-08-07,1
pricewatch east anglia,protest,2004-08-07,2
how to buy a house,house,2004-08-07,2
lost in space,pac,2004-08-07,2
'some of us have to work you know...',house,2004-08-07,2
regulars fight to save pub 'treasure',republican,2004-08-08,3
open house,house,2004-08-09,2
rising prices could prompt new rate hike,democrat,2004-08-09,3
is there a mollusc sexer in the house?,house,2004-08-09,2
house prices soar in wales and the north,house,2004-08-09,2
baseball bat murders shock us,house,2004-08-09,2
a woman's touch could keep soho's house in order,house,2004-08-09,2
pr stunts: an expert's guide,protest,2004-08-10,3
republicans fund nader as decisive electoral weapon,republican,2004-08-10,2
"shoppers deterred by interest rate rises, say retailers",democrat,2004-08-10,2
surveys dash hopes of house price slowdown,house,2004-08-10,2
bank eases interest rate fears,democrat,2004-08-11,2
bush names rightwing republican as cia chief,republican,2004-08-11,2
bank eases interest rate fears,democrat,2004-08-11,2
chaucer in da house,house,2004-08-12,2
us closes in on rebel shia cleric,house,2004-08-12,2
house music,house,2004-08-12,2
"if brown gets his way, house prices will fall. bring it on",house,2004-08-13,2
"give us back our land, say masai",house,2004-08-13,2
estate agents feel impact of rate rises,pac,2004-08-13,2
estate agents feel impact of rate rises,democrat,2004-08-13,2
"a missed test, a road crash: games open amid scandal and rumour",protest,2004-08-14,1
super plonk,super,2004-08-14,2
white house leak inquiry summons journalists,house,2004-08-14,2
a plague on all your houses,house,2004-08-14,2
the purple heart of a campaign,campaign,2004-08-15,2
a little council house counsel,house,2004-08-15,2
how not to lose your house,house,2004-08-15,1
army use fijians to conquer all-comers,house,2004-08-15,2
new york ready to unleash fury on republicans,republican,2004-08-15,2
tory u-turn to give teens control of sex lives,rallies,2004-08-15,2
time for a bet on the house,house,2004-08-15,2
rebel de jour,democrat,2004-08-15,2
bush plans us troop moves,house,2004-08-16,3
the haunting of hill house,house,2004-08-16,2
hamiltons take on pr fixer max clifford in libel battle,protest,2004-08-16,2
interest rate peak may be in sight,democrat,2004-08-16,3
us army to prune halliburton bills,house,2004-08-17,2
the us press on ...,house,2004-08-17,2
us to pull back troops from asia and europe,house,2004-08-17,2
fbi 'harassing' protesters,protest,2004-08-17,2
us must share the blame,house,2004-08-17,3
lib dem call to shift quangos to the regions,democrat,2004-08-17,2
final whistle for pe teachers under lib dem plans,super,2004-08-17,1
final whistle for pe teachers under lib dem plans,democrat,2004-08-17,1
protesters try to stop c4 broadcast,protest,2004-08-17,2
freeze sets in on house prices,house,2004-08-17,2
public duty,republican,2004-08-18,2
"pommie lingo test is unfair dinkum, mate",protest,2004-08-18,2
new report heralds house prices slowdown,house,2004-08-18,2
roeg directs 'pubic shaving' vodka ad,republican,2004-08-18,2
"don't use pearl as electoral pawn, family tells politicians",house,2004-08-18,1
saudis polish their image in us ads,house,2004-08-18,2
adidas dumps drug-test duo from athens campaign,campaign,2004-08-19,1
scotland seeks own definition of public benefit,republican,2004-08-19,2
more in-house bbc shows face the axe,house,2004-08-19,2
us forces kill two in iraq jail riot,house,2004-08-19,2
us press hit by new circulation figures scandal,house,2004-08-20,2
chat-up lines,rallies,2004-08-21,2
my work space,pac,2004-08-21,2
kennedy's name on us 'no-fly' list,house,2004-08-21,1
firms shun a-levels for in-house tests,house,2004-08-22,2
firms shun a-levels for in-house tests,protest,2004-08-22,2
there's gold underneath your house,house,2004-08-22,3
ad men turning us into a coffee nation,house,2004-08-22,2
senators propose taking apart cia,senate,2004-08-23,3
gunners have all the answers to biggest test,protest,2004-08-23,2
mr sex's new soap saves lives,rallies,2004-08-23,2
house prices fall again,house,2004-08-23,2
dr martens kicks off global ad campaign,campaign,2004-08-23,2
us deal 'wrecks middle east peace',house,2004-08-23,2
us deal 'wrecks middle east peace',protest,2004-08-23,2
nobody tells us when we win,house,2004-08-24,2
democrats hope the dispossessed of smalltown usa will make bush pay,democrat,2004-08-24,2
the protesters are coming...,protest,2004-08-24,2
'the campaign is nasty and false',campaign,2004-08-24,2
middle east peace hopes,protest,2004-08-24,3
cash hopes underpin housebuilders,house,2004-08-24,2
finish your sentences,senate,2004-08-24,2
britain in split with us on west bank homes,house,2004-08-24,2
peer gynt,super,2004-08-24,2
super indies are in line for tomorrow's big prize,super,2004-08-24,2
uk to take tough line against us over kyoto,house,2004-08-24,2
arm falls 18% on us deal,house,2004-08-24,1
new attitudes needed to break middle east deadlock,protest,2004-08-25,2
white van man keeps house prices down,house,2004-08-25,2
us economy boosted by rise in manufacturing orders,house,2004-08-25,2
persimmon upbeat on house prices as profits rise 45%,house,2004-08-25,3
us army reveals wider abu ghraib abuses,house,2004-08-26,2
public 'overestimate' asylum lottery cash,republican,2004-08-26,2
new campaign targets bingeing women's vanity,campaign,2004-08-26,1
one in 20 london households worth over £1m,house,2004-08-26,2
put us all on rations,house,2004-08-26,2
blunkett bars us animal rights activist from britain,house,2004-08-26,2
russian super-rich turn back the clock in palatial fashion,super,2004-08-27,2
black rivals line up for historic senate fight in lincoln's state,senate,2004-08-27,2
"thatcher family had bags packed ready to flee to us, police say",pac,2004-08-27,2
house of sand and fog,house,2004-08-27,2
traders plot campaign to make uk shop around the clock,campaign,2004-08-28,2
house-price rises stall as market reaches peak,house,2004-08-28,2
east meets zest,protest,2004-08-28,3
un tells north korea to protect its environment,protest,2004-08-28,2
us studies a vital interest,house,2004-08-28,3
a lotus-eater in hollywood,senate,2004-08-29,2
car wars test mettle of germany,protest,2004-08-29,2
fbi probes 'spy suspect deep inside' the pentagon,protest,2004-08-29,2
bush and blair: four more years may bring wide rifts on the middle east and cuba,protest,2004-08-30,2
shaky united already off pace,pac,2004-08-30,1
protests put end to reggae festival,protest,2004-08-30,2
house prices rise fastest in cornwall's 'padstein',house,2004-08-30,2
the crate escape,democrat,2004-08-30,2
fasten your seatbelts and prepare for the property market to land,senate,2004-08-30,2
fragile lives,rallies,2004-08-30,2
new york gets ready for wave of rallies,rallies,2004-08-30,2
huge protest against bush on eve of party meeting,protest,2004-08-30,2
"impeach blair, says labour mp",campaign,2004-08-31,2
"he's young, good looking, and hispanic - could he be the next george bush in the white house?",house,2004-08-31,2
one in four 9/11 relatives says republicans exploiting tragedy,republican,2004-08-31,1
blacks used hollinger as personal 'piggy bank',house,2004-08-31,2
fear and loathing at the republican convention,republican,2004-08-31,2
in brief: moore jeered at republican conference,republican,2004-08-31,2
opera house prepares for £31m revamp,house,2004-08-31,2
republican star turns target waverers,republican,2004-08-31,2
zigzag democrat cheers on bush,democrat,2004-09-01,2
let us write our own history - the declaration of a party thirsting for unity,house,2004-09-01,2
"a chance meeting: intertwined lives of american writers and artists, 1854-1967 by rachel cohen",rallies,2004-09-01,2
government urged to ignore 'nimby' homes protests,protest,2004-09-01,2
today at the republican convention,republican,2004-09-01,2
republicans seek four more years of bush,republican,2004-09-01,2
rates raise unlikely as house prices slow,house,2004-09-01,2
use of initiative,house,2004-09-01,2
mortgage slowdown eases rate rise fears,democrat,2004-09-01,2
hughes to be lib dem president,democrat,2004-09-01,2
backwoods preacher pours hellfire on democrats,democrat,2004-09-02,2
cashpoints: interest rates start to bite as house price growth slows to three-year low,house,2004-09-02,1
forget 'hour glass' women and sleek men - flab is making us tube shaped,house,2004-09-02,1
will we have to pay tax when we sell our houses?,house,2004-09-02,2
are there any democrats in the house?,democrat,2004-09-02,2
are there any democrats in the house?,house,2004-09-02,2
interest rates start to bite as house price growth slows to three-year low,house,2004-09-02,1
public domain,republican,2004-09-02,2
judge fines city of new york and orders release of jailed protesters,protest,2004-09-03,2
economic uncertainty makes us poll a close call,house,2004-09-03,2
outraged kerry takes the gloves off at last after republican jibes,republican,2004-09-03,2
demme attacks us politics at venice festival,house,2004-09-03,2
republican convention boosts fox news,republican,2004-09-03,2
"interest rate rises cool house prices, says halifax",democrat,2004-09-03,3
"interest rate rises cool house prices, says halifax",house,2004-09-03,3
full text: george bush's speech to the republican convention,republican,2004-09-03,2
bush vows to protect america,protest,2004-09-03,2
adidas enters ring for britain's teen boxing sensation,senate,2004-09-03,2
the campaign of hate set to oust gay tory,campaign,2004-09-04,1
"with just one puff, he was a superhero",super,2004-09-04,1
my work space,pac,2004-09-04,2
"laurel house, aldeburgh",house,2004-09-04,2
republic see off cyprus,republican,2004-09-04,2
"guinness, black and champagne moments",campaign,2004-09-04,2
house prices fall for first time in two years,house,2004-09-04,2
laid-back isle of taste sensations,senate,2004-09-05,2
which house price index should i trust?,house,2004-09-05,2
getting your house in order,house,2004-09-05,2
chatroom girls in drug pact tragedy,pac,2004-09-05,1
animal rights activists hit training camp to sharpen up battle plans,campaign,2004-09-06,2
bovis predicts cooling of house prices,house,2004-09-06,2
ailing kerry campaign to target economy,campaign,2004-09-06,2
"solicitors, the new superheroes",super,2004-09-06,2
brown allies ready to block milburn role as labour chairman,rallies,2004-09-06,2
labour glee over lib dem infighting,democrat,2004-09-06,2
russians hold mass anti-terror protests,protest,2004-09-07,2
penguin pack big ideas into tiny tomes,pac,2004-09-07,3
angry putin rejects public beslan inquiry,republican,2004-09-07,1
bovis confident despite brake on house prices,house,2004-09-07,3
greenspan's upbeat comments may signal us rates rise,house,2004-09-08,3
"us economy on the up, says greenspan",house,2004-09-08,2
blair questions lib dem sums on pensions,democrat,2004-09-08,2
mandelson steps down as mp,campaign,2004-09-08,2
mouse house could lose mickey trademark,house,2004-09-08,2
"us military death toll in iraq hits 1,000",house,2004-09-08,2
animal rights groups protest at 20% rise in experiments on primates,protest,2004-09-08,2
morrison goal neutralises swiss,rallies,2004-09-09,2
oxford goes to court over animal protests,protest,2004-09-09,2
republicans enlist castro in poll campaign,republican,2004-09-10,2
republicans enlist castro in poll campaign,campaign,2004-09-10,2
protesters must face facts,protest,2004-09-10,3
british backpacking couple shot dead after row with thai policeman,pac,2004-09-10,2
green stalks m&s again with £3m ad campaign,campaign,2004-09-10,2
what al-qaida did to us - part two,house,2004-09-10,2
what al-qaida did to us,house,2004-09-10,2
pub groups to curb smoking in bars,republican,2004-09-10,2
the days london invites us all in,house,2004-09-11,2
the venerable francis house,house,2004-09-11,2
the east is ready,protest,2004-09-11,2
more open houses,house,2004-09-11,2
de niro's goodfella image under fire,democrat,2004-09-11,2
welcome to champagne country... just off the m25,campaign,2004-09-12,1
salt victim backs food campaign,campaign,2004-09-12,2
parallels between crimea and iraq,rallies,2004-09-13,2
mired in the campaign mud again,campaign,2004-09-13,2
fathers' rights protester scales buckingham palace,protest,2004-09-13,2
government launches 'magic bullet' salt campaign,campaign,2004-09-13,2
government launches 'magic bullet' salt campaign,campaign,2004-09-13,2
house prices rose in july,house,2004-09-13,2
16 killed in us strikes on falluja,house,2004-09-13,2
mcdonald's on the ball in pr battle,protest,2004-09-13,1
thirteen die in us attack on baghdad crowd,house,2004-09-13,1
britain's first taste of the japanese short-stay capsule hotel will pack a lot of luxury into a little space,pac,2004-09-13,3
britain's first taste of the japanese short-stay capsule hotel will pack a lot of luxury into a little space,pac,2004-09-13,3
'battle lines have been drawn',rallies,2004-09-13,1
bank warns of house price drop,house,2004-09-14,2
pr and p2p,protest,2004-09-14,2
luc besson wins vodafone ad campaign case,campaign,2004-09-14,2
us troops face new torture claims,house,2004-09-14,2
the wrap: protester breaches royal security,protest,2004-09-14,2
public promised more say in policing,republican,2004-09-14,2
protesters throw royal security into disarray,protest,2004-09-14,2
qinetiq continues us defence assault,house,2004-09-14,2
the life and times of a would-be superhero,super,2004-09-14,3
dressed to protest,protest,2004-09-14,2
14% rise in house prices,house,2004-09-14,2
protests as mps vote for hunt ban,protest,2004-09-15,2
minister tells pro-hunters to vote not protest,protest,2004-09-15,2
twigg makes concessions on tests for 7-year-olds,protest,2004-09-15,3
9/11 widows join kerry campaign,campaign,2004-09-15,2
mccartney tries to pacify the doubters,pac,2004-09-15,2
homeowners told house prices could fall by 30%,house,2004-09-15,2
a house of the future with all the (green) mod cons,house,2004-09-15,2
lib dem leader brushes off manifesto critics,democrat,2004-09-15,2
protesting 'stops batman seeing baby daughter',protest,2004-09-15,2
wto chief says kerry threats are 'campaign talk',campaign,2004-09-16,2
new look interiors for sydney opera house,house,2004-09-16,2
more hostages taken as us fears grow,house,2004-09-16,2
bbc tipped off about protest,protest,2004-09-16,2
death of a republican punk,republican,2004-09-16,2
death of a republican punk,republican,2004-09-16,2
protest over tram funding u-turn,protest,2004-09-16,2
unseasonable spending may forecast interest rate rise,democrat,2004-09-16,3
should we marry before i buy a share of my partner's house?,house,2004-09-16,2
bbc blamed for failing to alert police over protest tip-off,protest,2004-09-16,2
spoon-fed wilson faces an a-level test,protest,2004-09-16,2
mps fear that increased safety measures will threaten open democracy,democrat,2004-09-16,2
protest threat forces ministerial retreat,protest,2004-09-17,2
my work space,pac,2004-09-17,2
the damage to our democracy,democrat,2004-09-17,2
open house london,house,2004-09-17,2
white house 'knew of abuse' at guantanamo,house,2004-09-17,2
the acid test of bush's folly,protest,2004-09-17,2
fictional candidate weighs into us election,house,2004-09-17,2
blair urges public to back 2012 bid,republican,2004-09-17,2
security crackdown likely as hunt starts for 'insider' who aided protest,protest,2004-09-17,2
"meanwhile, on the roof of lord's, a catwoman protest",protest,2004-09-18,2
"heigh ho, protesting they will go",protest,2004-09-18,2
man in the mirror: an interview with r kelly,democrat,2004-09-19,2
man in the mirror: an interview with r kelly,republican,2004-09-19,2
man in the mirror: an interview with r kelly,super,2004-09-19,2
man in the mirror: an interview with r kelly,rallies,2004-09-19,2
man in the mirror: an interview with r kelly,protest,2004-09-19,2
are house prices really falling like the leaves?,house,2004-09-19,2
'night letters' from the taliban threaten afghan democracy,democrat,2004-09-19,2
battle lines drawn over the multibillion-dollar question,rallies,2004-09-19,1
iraq hostages plead for their lives,rallies,2004-09-19,2
ease up on tests and give kids a break,protest,2004-09-19,2
"democracy: our cause, iraq's sacrifice",democrat,2004-09-20,2
today at the liberal democrat conference,democrat,2004-09-20,2
the future depends on green houses,house,2004-09-20,2
the iraq intelligence fiasco exposes us to terrible danger,house,2004-09-20,3
annan condemns us abuses in iraq,house,2004-09-21,3
"funding boost for north is a fairy tale, labour mp says",campaign,2004-09-21,2
'forget robin hood. remember brian clough. he gave us a name',house,2004-09-21,2
rate rises scare off house buyers,democrat,2004-09-21,1
rate rises scare off house buyers,house,2004-09-21,1
nationwide renews campaign against atm charges,campaign,2004-09-21,2
man about the house,house,2004-09-22,2
houses of horror,house,2004-09-22,2
campaign comes full circle as challenger changes tack on iraq,campaign,2004-09-22,2
voters not amused by palace and commons protests,protest,2004-09-22,1
global initiative aims to protect war zone journalists,protest,2004-09-22,2
glimmer of hope for briton but second us hostage is killed,house,2004-09-22,1
only europe can safeguard our social democratic future,democrat,2004-09-22,2
public supports union fight with blair,republican,2004-09-22,2
private lives,rallies,2004-09-23,2
can you get stung by capital gains tax on a second house?,house,2004-09-23,2
cat stevens 'victimised' over us deportation,house,2004-09-23,2
"cashpoints: house price crash 'cannot be ruled out', says imf",house,2004-09-23,1
kennedy rallies party for election countdown,rallies,2004-09-23,2
imf warns of 'sharp fall' in house prices,house,2004-09-23,3
council tenants launch protest over rent changes,protest,2004-09-23,2
guns blaze as hms blunkett steams towards brighton - and general election campaign,campaign,2004-09-23,2
how winston jr waged a 25-year campaign to sell papers,campaign,2004-09-23,2
moore lines up health insurers for a lashing,rallies,2004-09-23,2
centuries in the house of wisdom,house,2004-09-23,2
'nipplegate' fails to rouse us parents,house,2004-09-24,1
hartlepool is his test,protest,2004-09-24,2
safe as houses,house,2004-09-24,2
ruined by r ratings,democrat,2004-09-24,2
ruined by r ratings,republican,2004-09-24,2
ruined by r ratings,super,2004-09-24,2
ruined by r ratings,rallies,2004-09-24,2
ruined by r ratings,protest,2004-09-24,2
campaign from heart ignored whitehall,campaign,2004-09-24,2
straw criticises us for putting yusuf islam on no-fly list,house,2004-09-24,2
kinnock joins europe campaign,campaign,2004-09-24,2
can john elway win the us election for bush?,house,2004-09-24,2
"rhinefield house hotel, new forest",house,2004-09-25,2
opera's new pavarotti soars to top c celebrity,democrat,2004-09-25,3
opera's new pavarotti soars to top c celebrity,republican,2004-09-25,3
opera's new pavarotti soars to top c celebrity,campaign,2004-09-25,3
opera's new pavarotti soars to top c celebrity,pac,2004-09-25,3
top us officials clash over need to limit iraq poll,house,2004-09-25,3
the four-car families that are putting us all in a jam,house,2004-09-25,3
my work space,pac,2004-09-25,2
final test for sport's forgotten winners,protest,2004-09-25,1
short breakers fail insurance test,protest,2004-09-26,1
yellow lines are not lines of revenue,rallies,2004-09-26,1
yellow lines are not lines of revenue,rallies,2004-09-26,1
campaign for home abortions,campaign,2004-09-26,2
cook says strong eu is the way to resist 'missionary' us,house,2004-09-26,3
democracy cannot be good in parts,democrat,2004-09-27,1
republican stealth weapon targets women,republican,2004-09-27,1
recycling campaign launched,campaign,2004-09-27,2
bridge murder trial exposes risks of backpacker trips,pac,2004-09-27,1
government launches major recycling campaign,campaign,2004-09-27,2
assault on 'cuddly' lib dem image ahead of hartlepool byelection,democrat,2004-09-27,1
greenpeace steps up 'forest friendly' campaign,campaign,2004-09-28,1
hunt protesters dump carcasses in brighton,protest,2004-09-28,2
iranian blog protest: an update,protest,2004-09-28,2
judge orders public hearing on right-to-life case,republican,2004-09-28,3
some of us are trying to work in here,house,2004-09-29,2
stop press: little timmy ate his lunch,senate,2004-09-29,3
getting the lie of the land in a suitably circumlocutory manner of speaking,rallies,2004-09-29,2
artist brings sinister installation to east end,protest,2004-09-29,2
iomo heads to the pub again,republican,2004-09-29,2
nhs cleaning brought in-house amid mrsa fears,house,2004-09-29,2
blair rallies support for 2012,rallies,2004-09-29,2
"student debt levels exaggerated, says us expert",house,2004-09-30,1
iraq insurgency outpaces coalition attempts to restore peace,pac,2004-09-30,2
protest or power?,protest,2004-09-30,2
ofcom proposes new public service tv channel to rival bbc,republican,2004-09-30,2
us firm gets results for nhs - but soft sell masks an expensive truth,house,2004-09-30,2
global breast cancer campaign aims to increase survival rates,campaign,2004-09-30,1
house prices continue to slow,house,2004-09-30,2
sky revamps brand with high-profile ad campaign,campaign,2004-09-30,2
barclaycard's £25m offer lures house of fraser,house,2004-09-30,2
warning of big fall in house prices,house,2004-09-30,2
bonds in drug test shock - so what?,protest,2004-09-30,2
consumer confidence dives as interest rate rises bite,democrat,2004-09-30,3
etherington wins campaign for equality,campaign,2004-09-30,2
campaign ends as it started - in chaos,campaign,2004-10-01,2
my work space,pac,2004-10-01,2
criminal inquiry into us loan firm,house,2004-10-01,1
vanunu supporters in embassy protest,protest,2004-10-01,2
beijing ups the ante in war of words with taipei,senate,2004-10-01,2
private lives,rallies,2004-10-01,2
ican canned,republican,2004-10-01,2
joey settles in for long haul on us tv,house,2004-10-01,2
house painters star in tate show,house,2004-10-01,2
'safe' seats can't deter the lib dem foot soldiers,democrat,2004-10-01,3
bskyb campaign targets pay-tv sceptics,campaign,2004-10-01,1
a waste of spacey,pac,2004-10-02,1
a shot in the arm for public tv,republican,2004-10-02,2
bank fear on house prices,house,2004-10-02,2
drats. mp falls foul of facts,campaign,2004-10-02,2
schwarzer faces tough test against new united front,protest,2004-10-02,2
secrets and lies,rallies,2004-10-02,2
from cheshire to the east coast,protest,2004-10-02,2
why hang on to a house when you could fund your retirement?,house,2004-10-02,2
us forces battle for iraqi rebel city,house,2004-10-02,2
agency predicts 20% drop in house prices,house,2004-10-02,2
more a dead house than a home,house,2004-10-02,1
east and west,protest,2004-10-02,2
why nader could be the nail in democrats' coffin,democrat,2004-10-03,2
guardian weekly relaunched in the us,house,2004-10-04,2
two held in french anti-nuclear protest,protest,2004-10-04,2
tenants target prescott in council house protest,house,2004-10-04,2
tenants target prescott in council house protest,protest,2004-10-04,2
60 million watch us election debate,house,2004-10-04,2
kingsmill enlists elvis for new campaign,campaign,2004-10-04,2
protesters stage rally outside prison,protest,2004-10-04,2
campaign begins to promote flu jab,campaign,2004-10-04,2
bush allies admit war blunders,rallies,2004-10-05,2
republican grip starts to loosen in little havana,republican,2004-10-05,2
