headlines,terms,dates,scores
gherkin owners in a pickle over empty space,pac,2004-10-05,1
oxford resumes fight against animal rights protesters,protest,2004-10-05,2
terror laws 'violate democracy',democrat,2004-10-05,2
boeing battle is mandelson's first test,protest,2004-10-06,2
shelter criticised over 'drink for homeless' campaign,campaign,2004-10-06,2
shelter criticised over 'drink for homeless' campaign,campaign,2004-10-06,2
show to unveil vision for northern 'supercity',super,2004-10-06,2
super-trams win support from prescott,super,2004-10-06,2
men about the house,house,2004-10-06,2
air partner benefits from us election campaign,house,2004-10-06,2
air partner benefits from us election campaign,campaign,2004-10-06,2
"tube lines boss's £100,000 bonus",rallies,2004-10-06,2
pakistan set to ban religious rallies after bombs kill 40,rallies,2004-10-07,1
from the lighthouse,house,2004-10-07,2
private lives,rallies,2004-10-07,2
sign up for our free us election briefing,house,2004-10-07,2
st andrews launches online poetry guide,protest,2004-10-07,2
exxon admits greenhouse gas increase,house,2004-10-07,2
halifax puzzles city with house price rise,house,2004-10-07,2
direct action plan splits runway protest,protest,2004-10-08,2
'our alliance with the us remains pivotal',house,2004-10-08,2
rivals dig in for legal war over us poll,house,2004-10-08,2
council accused of dirty tricks campaign,campaign,2004-10-08,2
block contestants bid to sell house on ebay,house,2004-10-08,2
afghan warlord hits the presidential campaign trail on horseback,campaign,2004-10-08,2
'mother of all bubbles' warning on house prices,house,2004-10-08,2
knives out at the house of lazard,house,2004-10-09,2
use it or lose it,house,2004-10-09,2
"r l burnside, a bothered mind",democrat,2004-10-10,2
"r l burnside, a bothered mind",republican,2004-10-10,2
"r l burnside, a bothered mind",super,2004-10-10,2
"r l burnside, a bothered mind",rallies,2004-10-10,2
"r l burnside, a bothered mind",protest,2004-10-10,2
"r l burnside, a bothered mind",republican,2004-10-10,2
"r l burnside, a bothered mind",rallies,2004-10-10,2
us gets out begging bowl for iraq reconstruction,house,2004-10-10,1
problems mount for white house winner,house,2004-10-10,2
the guardian announces public services awards shortlist,republican,2004-10-11,2
boots' cholesterol ad misled public,republican,2004-10-11,2
house prices show august fall,house,2004-10-11,2
campaign to save britain's heritage trees,campaign,2004-10-11,2
superman actor reeve dies,super,2004-10-11,1
protest and survive,protest,2004-10-11,2
'it is easy to see the parallels with blair',rallies,2004-10-12,3
us exit poll gives karzai victory,house,2004-10-12,2
house prices may fall 20% over the next three years,house,2004-10-12,2
£78m tourism plan for indian mangroves mired in protests,protest,2004-10-12,2
the extraordinary campaigner,campaign,2004-10-12,3
state of the day: nevada used,house,2004-10-13,2
"dear clark county voter, give us back the america we loved. yours sincerely, john le carré",house,2004-10-13,3
burns protests at use of parliament act,protest,2004-10-13,1
burns protests at use of parliament act,house,2004-10-13,1
ainslie proves a class act,protest,2004-10-13,3
private lives,rallies,2004-10-14,2
lib dem leader expecting first child,democrat,2004-10-14,2
lib dem lord russell dies aged 67,democrat,2004-10-14,2
"parliament must reconnect with public, warns harman",republican,2004-10-14,2
txt msg rippd u off? we cn hlp,republican,2004-10-15,2
txt msg rippd u off? we cn hlp,house,2004-10-15,2
txt msg rippd u off? we cn hlp,super,2004-10-15,2
lib dem peer conrad russell dies,democrat,2004-10-15,2
lib dem peer conrad russell dies,super,2004-10-15,2
overstretched us puts nato under pressure,house,2004-10-15,2
liberal democrat leader's wife expecting in april,democrat,2004-10-15,2
my work space,pac,2004-10-16,2
eu trio seeks us backing for iran nuclear deal,house,2004-10-16,2
doubts about us morale in iraq as troops refuse 'suicide mission',house,2004-10-16,1
perk experience,super,2004-10-17,2
pr,protest,2004-10-17,2
separate lives under one roof,rallies,2004-10-17,2
how great is your new house?,house,2004-10-17,3
mass observation of everday lives,rallies,2004-10-17,2
blood lines,rallies,2004-10-18,2
'democratic forces cannot sleep easily',democrat,2004-10-18,1
senate race both parties must win,senate,2004-10-18,2
uk troops will help us avoid the draft,house,2004-10-18,2
'when we came back they had destroyed all the houses',house,2004-10-18,2
hoon: us troop request 'not political',house,2004-10-18,2
veteran campaigner to step down,campaign,2004-10-18,1
esf closes with mass protest,protest,2004-10-18,2
angry protests halt esf iraq debate,protest,2004-10-18,1
us troop request received warily,house,2004-10-18,2
demand to give up zarqawi as us pounds city,house,2004-10-18,2
us wealth gap grows for ethnic minorities,house,2004-10-19,3
conservative peers lambast home information packs,pac,2004-10-19,2
spread of racism 'could kill french democracy',democrat,2004-10-20,1
esf protest was not racist,protest,2004-10-20,2
giggs - the household name for neighbours to welcome,house,2004-10-20,3
rival campaigns target government homes plan,campaign,2004-10-20,2
fathers protester on assault charge,protest,2004-10-20,1
mps demand vote on us troop request,house,2004-10-20,2
labour's throw of the dice could protect punters - or fuel addiction,protest,2004-10-20,1
plea by victim's mother in anti-gun campaign,campaign,2004-10-20,2
new chief nursing officer to lead superbug fight,super,2004-10-20,2
annan urges us forces to show restraint,house,2004-10-20,2
britain agrees to us troops request,house,2004-10-21,2
"cashpoints: minister calls women's pensions a 'national scandal', while house prices continue to fall",house,2004-10-21,1
how can we protect ourselves from the harmful effects of aerosols?,protest,2004-10-21,2
financier may enter anti-glazer campaign,campaign,2004-10-21,2
"america, let us love you again ...",house,2004-10-21,3
campaign calls for water sprinklers in schools,campaign,2004-10-21,2
doctor in the house,house,2004-10-21,2
kissing stops as us poll draws in wives,house,2004-10-21,3
democrats pinpoint new voters as key to victory in ohio,democrat,2004-10-21,2
clinton will rise from sick bed to join campaign,campaign,2004-10-21,2
republicans caught out in flu jab row,republican,2004-10-22,2
russian vote revives climate pact,pac,2004-10-22,2
mother held for jail protest,protest,2004-10-22,2
walkers lines up 'child-friendly' crisps,rallies,2004-10-22,3
space oddity,pac,2004-10-22,2
uk's costliest mp says she is worth every penny,campaign,2004-10-22,3
career doing a u-turn? pack a basic repair kit then sit tight and enjoy the open road,pac,2004-10-23,2
the game that ate itself,senate,2004-10-23,2
"burrastow house, shetland",house,2004-10-23,2
bush sets wolves on kerry campaign,campaign,2004-10-23,2
how to buy a house,house,2004-10-23,2
lifelong loan that seemed like a life sentence,senate,2004-10-23,2
city bonuses and russians push up £1m-plus house sales,house,2004-10-23,2
mp calls crisis meetings over bond mis-selling,campaign,2004-10-23,2
people who stand up to yobs to get protection,protest,2004-10-24,2
where bauhaus meets flat-pack,pac,2004-10-24,1
what rick stein has done for us,house,2004-10-24,2
luxury beckons for east end's house of history,protest,2004-10-24,2
luxury beckons for east end's house of history,house,2004-10-24,2
seriously superficial,super,2004-10-24,2
abortion crusade turns republican women off bush,republican,2004-10-24,2
clinton rises from sick bed to boost kerry campaign,campaign,2004-10-25,2
new homes may make the east no eden,protest,2004-10-25,2
online risks for us web users,house,2004-10-25,2
go green and save £200 on household bills,house,2004-10-25,2
"try boxing test, says lady amos",protest,2004-10-26,2
'he gave us the soundtrack to our lives',house,2004-10-26,2
'he gave us the soundtrack to our lives',house,2004-10-26,2
lifestyle mots fail the test,protest,2004-10-26,2
very superstitious,super,2004-10-26,2
bbc promises moore for us question time,house,2004-10-26,2
space invader,pac,2004-10-26,2
"thinner and frailer, the comeback kid puts heart into kerry's campaign",campaign,2004-10-26,2
a testing time for democracy,democrat,2004-10-27,2
local vote campaign kicks off,campaign,2004-10-27,3
st john armitage,protest,2004-10-28,2
lighthouse keeping,house,2004-10-28,2
"'war raised iraqi death rate by 100,000'",democrat,2004-10-28,2
thais to explain protesters' deaths,protest,2004-10-28,2
take two for democracy,democrat,2004-10-28,2
blair 'used intelligence as pr tool',protest,2004-10-28,2
public affairs,republican,2004-10-28,2
"cashpoints: house prices fall, while new parents may get more leave",house,2004-10-28,2
democracy starts here,democrat,2004-10-28,2
school meals fail salt and fat tests,protest,2004-10-28,1
"house prices falling, says nationwide",house,2004-10-28,2
germany's bild goes republican,republican,2004-10-28,2
dozens of newspapers shift allegiance to democrat camp,democrat,2004-10-28,2
dozens of newspapers shift allegiance to democrat camp,campaign,2004-10-28,2
public domain,republican,2004-10-28,2
sleeper in the white house,house,2004-10-29,2
oil prices blight us growth hopes,house,2004-10-29,3
mp gives 'cast iron' promise on devolution vote,campaign,2004-10-29,3
[ot] the magic house that penn built,house,2004-10-29,2
middle east sees benefits of bush,protest,2004-10-29,2
hamiltons to buy £1m house,house,2004-10-29,2
kennedy rules out labour pact,pac,2004-10-29,2
fears growing for big drops in house prices,house,2004-10-29,2
pricewatch south east,protest,2004-10-30,2
us threat increases tension in ukraine poll,house,2004-10-30,2
mourinho says the blame lies with mutu,rallies,2004-10-30,2
"democracy must triumph, not fear",democrat,2004-10-31,3
the winner is... us conservatism,house,2004-10-31,3
why polls are bad for us,house,2004-10-31,1
mordant satires test the real state of the nation,protest,2004-10-31,2
city investors are urged to tone down protests,protest,2004-11-01,2
broken-glass republicans battle to the last,republican,2004-11-01,2
us election campaign 'most expensive ever',house,2004-11-01,3
us election campaign 'most expensive ever',campaign,2004-11-01,3
campaign trailers,campaign,2004-11-01,2
research lab fights back against protesters,protest,2004-11-01,2
the war on iraq has made moral cowards of us all,house,2004-11-01,2
us whistleblower urges civil servants to leak iraq secrets,house,2004-11-01,2
mpc rate rises seem to have done the job - but it's hard to say why,democrat,2004-11-01,2
gunmen seize us and arab hostages,house,2004-11-02,2
balfour builds super mall,super,2004-11-02,3
confusion over us soldier 'kidnapping',house,2004-11-02,2
"school for victoria campaign raises £50,000",campaign,2004-11-02,2
us soldier 'seized' in iraq,house,2004-11-02,2
reuters disputes us version of cameraman's death,house,2004-11-02,2
opposition to home sellers' packs over sales delays,pac,2004-11-02,2
"on election eve, fahrenheit 9/11 makes us pay-per-view",house,2004-11-02,2
police photo campaign shows ravages of addiction,campaign,2004-11-02,2
let the people decide - frantic finale to historic us election,house,2004-11-02,1
