headlines,terms,dates
concrete jungle: why brutalist architecture is back in style,background,2016-09-28
don’t tell dad i’m voting for hillary: young women on sexism in the family,shooting,2016-09-28
"rising number of guns being smuggled into uk, metropolitan police say",gun,2016-09-28
joe biden to appear on law & order: svu to talk rape kit backlog,law,2016-09-28
'vr isn't a thing you do it's a place you visit': readers review oculus rift,shooting,2016-09-28
woman wins right to review of northern ireland sex work law,law,2016-09-28
new mit app: check if your car meets climate targets,check,2016-09-28
the new politics isn’t just protest – it’s about change from the ground up,background,2016-09-28
the guardian view on low pay: rogue employers should face the law,law,2016-09-28
yosemite chief resigns as national parks embroiled in sexual harassment scandal,semi,2016-09-29
slaves: take control review – tunbridge wells' ironic punks lose their appeal,control,2016-09-29
wisconsin lawmakers urge investigation of scott walker after 'john doe' papers,law,2016-09-29
"suspected us drone strike targeting isis killed civilians in afghanistan, un says",gun,2016-09-29
"suspected us drone strike targeting isis killed civilians in afghanistan, un says",background,2016-09-29
snp mp chris law held over alleged financial irregularities,law,2016-09-29
bha gives up control of disciplinary panels under quinlan reforms,control,2016-09-29
the secret smartphone war over the struggle for control of the user,control,2016-09-29
shambolic child abuse inquiry is failing in its most important role,control,2016-09-29
fa unsteady and unprepared for role as guardian of the game’s standards,control,2016-09-29
suspension of child abuse inquiry lawyer a 'devastating blow',law,2016-09-29
"not on the high street co-founder: ‘i got an e in a-level business studies, ironically’",legislation,2016-09-29
"not on the high street co-founder: ‘i got an e in a-level business studies, ironically’",check,2016-09-29
"not on the high street co-founder: ‘i got an e in a-level business studies, ironically’",semi,2016-09-29
corbyn urges labour mps to end 'trench warfare' and back socialist vision for uk,background,2016-09-29
officer in fatal california shooting of black man sued for sexual harassment,shooting,2016-09-29
eu and us trade negotiators seek to get ttip talks back on track,background,2016-09-30
the paddleboarding powerhouse goes back on patrol,background,2016-09-30
unbalanced reporting on africa holds back progress,background,2016-09-30
mooncop by tom gauld review – graphic novel of a forgotten utopia,automatic,2016-09-30
‘we don’t have a choice’: young latinos on why they're voting for clinton,shooting,2016-09-30
more than 80% of un aid convoys in syria blocked or delayed,gun,2016-09-30
more than 80% of un aid convoys in syria blocked or delayed,background,2016-09-30
"met commissioner must have police background, federation says",background,2016-09-30
"a warning to corbyn: the centre ground hasn’t disappeared, it is being reshaped",background,2016-09-30
former new zealand pm helen clark expected to battle on for un top job,gun,2016-09-30
former new zealand pm helen clark expected to battle on for un top job,background,2016-09-30
how can we put the taste back into british food?,background,2016-10-01
eddie jones eyes maro itoje for no7 role in england’s autumn internationals,control,2016-10-01
video released of police fatally shooting unarmed alfred olango in san diego,shooting,2016-10-01
the observer view on russia’s actions in syria and the failure of international law,legislation,2016-10-01
the observer view on russia’s actions in syria and the failure of international law,law,2016-10-01
lead contamination in la housing project said to put 300 kids at risk,law,2016-10-01
lead contamination in la housing project said to put 300 kids at risk,legislation,2016-10-01
momentum co-founder warns against challenge to tom watson,automatic,2016-10-01
kenneth clark by james stourton review – mary beard on civilisation without women,legislation,2016-10-01
do a financial health check and midlife needn’t mean a crisis,check,2016-10-01
independent schools chief hits back at threat to charitable status,background,2016-10-02
rory stewart: global order out of control as russia 'swaggers',control,2016-10-02
"william h macy: 'it was 104 degrees and i had on thermals, shirt, hoodie, jacket and muffler'",check,2016-10-02
"william h macy: 'it was 104 degrees and i had on thermals, shirt, hoodie, jacket and muffler'",shooting,2016-10-02
david davis went to seminar that drew up hard brexit blueprint,semi,2016-10-02
'the happening': 10 years after the amish shooting,shooting,2016-10-02
darling days by io tillett wright review – the pains of a new york youth,legislation,2016-10-02
"officers tried to run over man before shooting him 14 times, video shows",shooting,2016-10-03
"rule of law declines for 70% of africans over past decade, warns ibrahim index",law,2016-10-03
women to go on strike in poland in protest at planned abortion law,law,2016-10-03
iphone 7 plus review: 2014 called – it wants its phablet back,background,2016-10-03
us to give up control of the internet's 'address book' after years of debate,control,2016-10-04
theresa may has shot herself in the foot with the brexit starting gun,gun,2016-10-04
tony abbott appointed director of new thinktank to promote western civilisation,legislation,2016-10-04
'no bling in the hood ...' does berlin's anti-gentrification law really work?,law,2016-10-04
kim kardashian gunpoint robbery sparks manhunt in paris,gun,2016-10-04
"school with guns, knives and fire on the timetable – and ofsted loves it",gun,2016-10-04
the guardian view on theresa may’s conference speech: actions not words will decide,legislation,2016-10-05
news corp faces lawsuits from 20 ‘fake sheikh’ targets in wake of conviction,law,2016-10-05
pm's speech to tory conference: 'we will take centre ground' - as it happened,background,2016-10-05
"healthcare in afghanistan: ‘doctors are threatened at gunpoint, even by civilians’",gun,2016-10-05
poland 'unlikely' to back donald tusk for second eu term,background,2016-10-05
‘we are building our way to hell’: tales of gentrification around the world,background,2016-10-05
new acland coalmine expansion: activists' lawyers stress water risk in final arguments,law,2016-10-05
kid cudi checks into rehab for 'depression and suicidal urges',check,2016-10-05
hollywood lawyer who fought gawker goes to bat for melania trump,law,2016-10-05
diane james resigns as ukip leader after only 18 days in  role,control,2016-10-05
vp debate fact-check: mike pence and tim kaine's claims reviewed,check,2016-10-05
joe cinque's consolation: toxic relationships and the mysteries around his killing,background,2016-10-05
future of 4chan uncertain as controversial site faces financial woes,control,2016-10-05
"police refused indigenous interpreter for witnesses to shooting, says legal service",shooting,2016-10-05
"the new cool: how kamasi, kendrick and co gave jazz a new groove",control,2016-10-06
"eastern aleppo could be destroyed by christmas, warns un syria envoy",gun,2016-10-06
"eastern aleppo could be destroyed by christmas, warns un syria envoy",background,2016-10-06
scotland bans controversial gas extraction technique,control,2016-10-06
"whistleblower refers email to watchdog, alleging unlawful approval of gas plants",law,2016-10-06
charity takes legal action against home office over child refugees,legislation,2016-10-07
south carolina to host march madness games relocated over anti-lgbt law,law,2016-10-07
trump website touts bipartisan support for gun policy he opposes,gun,2016-10-07
member's view:  'i wanted to ask what we can do about gun crime',gun,2016-10-07
saudi male-guardianship laws treat women as second-class citizens,law,2016-10-07
anti-rape activists hold silent vigil outside birth of a nation screenings,legislation,2016-10-07
un tells nauru to take urgent action to investigate abuse of refugee children,gun,2016-10-07
un tells nauru to take urgent action to investigate abuse of refugee children,background,2016-10-07
un tells nauru to take urgent action to investigate abuse of refugee children,legislation,2016-10-07
clinton gaining ground as obama's approval ratings go up  – as it happened,background,2016-10-07
"airstrikes on yemen funeral kill at least 140 people, un official says",gun,2016-10-08
"airstrikes on yemen funeral kill at least 140 people, un official says",background,2016-10-08
letters: political action is central to addressing mental health crisis,legislation,2016-10-08
gareth southgate baffled by england fans’ booing of wayne rooney,shooting,2016-10-08
the agenda: tiger woods returns to golf and sir chris hoy at le mans,legislation,2016-10-08
india grants divorce to man whose wife refused to live with in-laws,law,2016-10-08
"sexting between children not automatically a crime, says cps",automatic,2016-10-09
expat voting rights are useless if we lose our rights to live and work abroad,shooting,2016-10-09
britain to push post-brexit uk immigration controls back to irish border,control,2016-10-09
britain to push post-brexit uk immigration controls back to irish border,background,2016-10-09
post-brexit world could see ireland carrying out britain’s passport checks,check,2016-10-09
"tpp trade deal: plain packaging challenge triggered 'hysteria', lawyer tells mps",law,2016-10-09
two police officers dead and one injured in palm springs shooting,shooting,2016-10-09
two israelis dead after drive-by shooting at jerusalem tram stop,shooting,2016-10-09
tesla fights back as michigan goes to new lengths to shut company out,background,2016-10-09
thousands rally against lockout laws in sydney,law,2016-10-09
beware the pitfalls that could ground your airbnb rental plans,background,2016-10-09
discrimination law changes would entrench second-tier status for same-sex weddings,law,2016-10-10
ireland confirms talks under way over post-brexit border controls,control,2016-10-10
"desert trip review - mccartney, stones and co give oldchella a hint of rebellion",control,2016-10-10
controversial snooping technology 'used by at least seven police forces',control,2016-10-10
pound hovers around $1.240 as businesses fear 'hard brexit' – as it happened,background,2016-10-10
nobel economics prize winners' work unlocks issues around executive pay,background,2016-10-10
debate fact-check: hillary clinton and donald trump's claims reviewed,check,2016-10-10
rugby union: talking points from the premiership and pro12 action,legislation,2016-10-10
"after the army, i had post-traumatic stress disorder. now i run a cafe",automatic,2016-10-10
public humiliation: chechen leader's simple strategy to control social media,control,2016-10-10
eu citizens living in uk lobby for post-brexit residency law,law,2016-10-10
"marriage advice and bullet holes: lessons from my mother, the divorce lawyer",law,2016-10-10
gunmen kill 14 people in attack on shia muslim shrine in kabul,gun,2016-10-11
"british women, please rally to support decriminalisation of abortion",legislation,2016-10-11
ex-minister francis maude takes brexit advisory job at law firm,law,2016-10-11
un sets out position on israeli settlement football clubs in letter to fifa,gun,2016-10-11
un sets out position on israeli settlement football clubs in letter to fifa,background,2016-10-11
reading group: beryl bainbridge's the bottle factory outing is our october choice,shooting,2016-10-11
one nation senator calls for new abc channel for patriotic broadcasting – as it happened,legislation,2016-10-11
take back control? our border force is in no fit state to do its job,background,2016-10-11
take back control? our border force is in no fit state to do its job,control,2016-10-11
preserving historical buildings: the most sustainable thing is not to build new stuff,shooting,2016-10-12
pound falls back as davis says government cannot outline brexit aims in detail  – as it happened,background,2016-10-12
reality check: are us-led airstrikes on syrians as bad as russia's?,check,2016-10-12
ground down by savagery – the agony of aleppo,background,2016-10-12
"will you become a citizen of asgardia, the first nation state in space?",legislation,2016-10-12
xenophon calls for subcontractor protections and may back abcc,background,2016-10-12
google news introduces fact check feature – just in time for us election,check,2016-10-13
us denies seeking wider role in yemen war a day after firing missiles,control,2016-10-13
black films matter – how african american cinema fought back against hollywood,background,2016-10-13
mind-controlled robot arm gives back sense of touch to paralysed man,control,2016-10-13
mind-controlled robot arm gives back sense of touch to paralysed man,background,2016-10-13
falling water review – dream-controlling sci-fi thriller will send you to sleep,control,2016-10-13
man who rejected mi5 convicted of terror charge after semi-secret trial,semi,2016-10-13
annie mac: 'radio definitely isn't a thing of the past',shooting,2016-10-13
lawmakers join elizabeth warren's call for us to 'step in' on illegal airbnb hotels,law,2016-10-13
'no one in fashion really cares about a diverse world' – r j hernández,control,2016-10-13
'no one in fashion really cares about a diverse world' – r j hernández,background,2016-10-13
japanese woman forced to use married name at work under 19th century law,law,2016-10-13
"sandy hook families cannot hold gun company liable in massacre, judge rules",gun,2016-10-14
jermaine baker shooting: ipcc 'failed to hold met to account',shooting,2016-10-14
the guardian view on international law: we need enforcement and example,law,2016-10-14
haters back off review – youtube star makes hilarious transfer to netflix,background,2016-10-14
mark carney: bank of england will tolerate higher inflation – as it happened,legislation,2016-10-14
virginia makes progress in push to restore voting rights for ex-convicts,shooting,2016-10-14
"sky revolt, bbc hits back at mail, eamonn holmes",background,2016-10-14
clock turned back on rights for people with a learning disability,background,2016-10-14
top nt police officer to head government's new domestic violence arm,control,2016-10-14
after ched evans let’s lay down the law on casual sex,law,2016-10-15
offshore secrets of brexit backer arron banks revealed in panama papers,background,2016-10-15
real betis 1-6 real madrid: la liga – as it happened,law,2016-10-15
real betis 1-6 real madrid: la liga – as it happened,legislation,2016-10-15
trump looms large for pennsylvania republican tip-toeing around him,background,2016-10-15
margaret atwood: ‘all dystopias are telling you is to make sure you’ve got a lot of canned goods and a gun’,gun,2016-10-15
"a letter to … my brother-in-law’s ‘perfect’ wife, of whom i am jealous",law,2016-10-15
pauline hanson’s one nation triples support since election: newspoll,legislation,2016-10-16
josé mourinho: i am not to blame for confusion over wayne rooney’s role,control,2016-10-16
bha spot checks of trainers’ bags ruffles feathers on racing’s biggest day,check,2016-10-16
brexit will force britain and ireland to consider border controls,control,2016-10-16
10 tiny churches around the uk,background,2016-10-16
why all this monkeying around with my lost parcel?,background,2016-10-16
"yemen to start 72-hour ceasefire, says un special envoy",gun,2016-10-17
"yemen to start 72-hour ceasefire, says un special envoy",background,2016-10-17
head of police chief group regrets law enforcement's role in black oppression,law,2016-10-17
head of police chief group regrets law enforcement's role in black oppression,control,2016-10-17
cabinet tensions grow as ministers back hammond's warning over hard brexit,background,2016-10-17
the guardian view on ched evans: reconsider the law,law,2016-10-17
"theresa may 'obsessed' with immigration control, says vince cable",control,2016-10-17
fighting for every yard: on the ground with kurdish troops pushing into mosul,background,2016-10-17
hundreds of uk lawyers register in ireland in brexit insurance move,law,2016-10-17
"five myths about studying law, debunked",law,2016-10-17
"uk security agencies unlawfully collected data for 17 years, court rules",law,2016-10-17
european rugby champions cup: talking points from the weekend’s action,legislation,2016-10-17
"xenophon shoots down abbott's proposal on 18c with 'no, no and no' – as it happened",shooting,2016-10-17
get debate night reactions and fact-checks straight to your phone,check,2016-10-18
'toddlers kill': video speaks to absurdity of gun debate as it highlights a real issue,gun,2016-10-18
adler shotgun: new south wales deputy premier backs lifting ban on imports,gun,2016-10-18
melania trump was recruited to do donald's damage control. bad plan,control,2016-10-18
report calls on irish government to tackle denis o'brien's media control,control,2016-10-18
norway faces climate lawsuit over arctic oil exploration plans,law,2016-10-18
'it was a real gateway': readers defend a-level classical civilisation,legislation,2016-10-18
rising inflation is just the start: uk living standards will be squeezed,legislation,2016-10-18
why a porn star is fighting california's condom law: 'it's a women's rights issue',law,2016-10-18
senate negotiations: abbott and labor put gun control pressure on turnbull,gun,2016-10-18
senate negotiations: abbott and labor put gun control pressure on turnbull,control,2016-10-18
malcolm turnbull says there is 'no chance' of coalition watering down gun laws – politics live,gun,2016-10-18
malcolm turnbull says there is 'no chance' of coalition watering down gun laws – politics live,law,2016-10-18
"australia should urgently improve whistleblower protection, un expert says",gun,2016-10-18
"australia should urgently improve whistleblower protection, un expert says",background,2016-10-18
"parliament will adopt electronic voting in lower house, says coalition",shooting,2016-10-18
controversial republican mike roman to run donald trump's 'election protection',control,2016-10-18
tony abbott 'disturbed' by reports turnbull trading off adler gun laws for abcc vote,gun,2016-10-18
tony abbott 'disturbed' by reports turnbull trading off adler gun laws for abcc vote,law,2016-10-18
labor opens new front on constitutionality of proposed terrorism laws,law,2016-10-18
posthumous pardons law may see oscar wilde exonerated,law,2016-10-19
help the guardian keep reporting on gun violence in america,gun,2016-10-19
david leyonhjelm says onus is on government to justify adler gun ban,gun,2016-10-19
"samsung exploding phone issue extends past note 7, lawsuit says",law,2016-10-19
snowden: 'politics of fear' keep trudeau from repealing canada anti-terror law,law,2016-10-19
aclu takes on fisa court over secret decisions on surveillance laws,law,2016-10-19
the great british bake off 2016 semi-final – as it happened,semi,2016-10-19
"early voting lines are so long, people are fainting. that harms democracy",shooting,2016-10-19
"new push from nsw to change gun laws is a risk to community, port arthur charity says",gun,2016-10-19
"new push from nsw to change gun laws is a risk to community, port arthur charity says",law,2016-10-19
australia will not support negotiations to outlaw nuclear weapons,law,2016-10-19
as a nation would we ever sink so low as to check refugees’ teeth?,legislation,2016-10-19
as a nation would we ever sink so low as to check refugees’ teeth?,check,2016-10-19
nypd admits 'we failed' in police shooting of mentally ill bronx woman,shooting,2016-10-19
home office rules out 'unethical' dental checks for calais refugees,check,2016-10-19
bookies defend stringent identity checks over paying out winning punters,check,2016-10-19
back to the future: were newspaper publishers wrong to go digital?,background,2016-10-19
law may be needed to preserve the rights of irish in uk after brexit,law,2016-10-19
tony abbott: australia has avoided a massacre because it's hard to get guns,gun,2016-10-19
wa premier colin barnett does not support adler gun coming into his state – as it happened,gun,2016-10-19
ordinary lies review – can planting spy-cams around your house ever end well?,background,2016-10-19
may defends grammars and plans for universities' role in state schools,control,2016-10-19
hong kong lawmakers walk out to block swearing-in of democracy activists,law,2016-10-19
"'i am young, i am gay, i am black,' says chansey paech to nt parliament",control,2016-10-19
adler shotgun explainer: what's the big deal about lever-action firearms?,gun,2016-10-19
coalition splits over adler shotgun ban as one nation calls for 'softening' of firearm control,gun,2016-10-19
coalition splits over adler shotgun ban as one nation calls for 'softening' of firearm control,legislation,2016-10-19
coalition splits over adler shotgun ban as one nation calls for 'softening' of firearm control,control,2016-10-19
the gun control debate shows the coalition still hasn't worked out how to negotiate,gun,2016-10-19
the gun control debate shows the coalition still hasn't worked out how to negotiate,control,2016-10-19
we’ve reached the fork in the road on gun laws. which way will we go?,gun,2016-10-20
we’ve reached the fork in the road on gun laws. which way will we go?,law,2016-10-20
conservative mp backs tony abbott's account of adler shotgun deal row,gun,2016-10-20
man dies after shooting in west belfast,shooting,2016-10-20
eu seeks swift action on african migration deals to ease pressure on italy,legislation,2016-10-20
colorado poll workers trained to respond to mass shooting,shooting,2016-10-20
debate fact-check: hillary clinton and donald trump's claims reviewed,check,2016-10-20
gunslinger tony abbott tries another ambush but shoots himself in the foot,gun,2016-10-20
gunslinger tony abbott tries another ambush but shoots himself in the foot,shooting,2016-10-20
states to push for some restrictions on lever-action shotguns,gun,2016-10-20
"turnbull, dutton and keenan contradict abbott over gun deal with leyonhjelm",gun,2016-10-20
eu leaders at loggerheads over nature laws review,law,2016-10-20
turnbull and abbott trade barbs on guns-for-votes issue – as it happened,gun,2016-10-20
here's why gun control advocates want to restrict the adler shotgun,gun,2016-10-20
here's why gun control advocates want to restrict the adler shotgun,control,2016-10-20
here's why gun control advocates want to restrict the adler shotgun,gun,2016-10-20
lewis hamilton fastest in practice but nico rosberg stays in control,control,2016-10-21
conservative mp admits dental checks for refugees was not existing policy,check,2016-10-21
"heathrow expansion, nuclear fusion and tasmanian devils – green news roundup",background,2016-10-21
conservative minister obstructs progression of gay pardon law,law,2016-10-21
too much action: how kids' comic action drowned in its own ultraviolence,legislation,2016-10-21
too much action: how kids' comic action drowned in its own ultraviolence,legislation,2016-10-21
law to cut sex-selective abortions in armenia 'putting lives at risk',law,2016-10-21
the best recent thrillers – review roundup,background,2016-10-21
adler ban to remain after ministers fail to reach agreement on reclassifying shotgun,gun,2016-10-21
australia joins bid to outlaw large-scale commercial and 'scientific' whaling,law,2016-10-21
"britain must not abandon its role fighting terrorism in europe, says nick clegg",control,2016-10-22
malcolm roberts reveals one nation intends to support coalition's abcc bill,legislation,2016-10-22
national guard soldiers told to pay back bonuses years after enlisting,background,2016-10-22
attack on kirkuk and chemical fire push troops back from mosul frontline,background,2016-10-22
steven gerrard suggests he's finished with la galaxy,law,2016-10-22
steven gerrard suggests he's finished with la galaxy,legislation,2016-10-22
‘my sofa's named after anna chancellor’: theatre designer tom scutt’s london home,automatic,2016-10-22
beware the small print that could hike one-bed flat’s ground rent to £8m-a-year,background,2016-10-22
bill leak’s lawyers say triggs 'playing politics' with children’s welfare,law,2016-10-22
shark attack near byron bay leaves surfer with minor leg injuries,legislation,2016-10-23
irish women need british help to change our abortion laws,law,2016-10-23
"isis could refocus energy on west if it loses ground in mosul, warns minister",background,2016-10-23
rangers 0-1 celtic: scottish league cup semi-final – as it happened,semi,2016-10-23
tom ford: ‘i wore a suit on set. it's a uniform… i feel weak in trainers’,automatic,2016-10-23
gardens: so you think coffee grounds are good for plants,background,2016-10-23
"christopher pyne attacks gillian triggs' judgment, saying she has 'politicised' role",control,2016-10-23
letter signed by gun control advocates calls for 'unbiased' review of laws,gun,2016-10-24
letter signed by gun control advocates calls for 'unbiased' review of laws,control,2016-10-24
letter signed by gun control advocates calls for 'unbiased' review of laws,law,2016-10-24
michael keenan criticised for holding 'one-sided' meetings with gun lobby,gun,2016-10-24
met inspector prevented from retiring to avoid disciplinary action,legislation,2016-10-24
arsenal’s olivier giroud and reading’s yann kermorgant get an unlikely reunion,background,2016-10-24
la esperanza de la generación: las chicas desafiando la misoginia en el centro rural de paraguay,law,2016-10-24
la esperanza de la generación: las chicas desafiando la misoginia en el centro rural de paraguay,legislation,2016-10-24
la esperanza de la generación: las chicas desafiando la misoginia en el centro rural de paraguay,law,2016-10-24
la esperanza de la generación: las chicas desafiando la misoginia en el centro rural de paraguay,legislation,2016-10-24
