headlines,terms,dates
la esperanza de la generación: las chicas desafiando la misoginia en el centro rural de paraguay,law,2016-10-24
la esperanza de la generación: las chicas desafiando la misoginia en el centro rural de paraguay,legislation,2016-10-24
la esperanza de la generación: las chicas desafiando la misoginia en el centro rural de paraguay,control,2016-10-24
¿qué tiene que ver con el medio ambiente la paz en colombia?,control,2016-10-24
¿qué tiene que ver con el medio ambiente la paz en colombia?,law,2016-10-24
¿qué tiene que ver con el medio ambiente la paz en colombia?,legislation,2016-10-24
from the us army to al-shabaab: the man who wanted to live under sharia law,law,2016-10-24
"coalition can bring back green 'lawfare' bill if senate supports it, says turnbull",background,2016-10-24
"coalition can bring back green 'lawfare' bill if senate supports it, says turnbull",law,2016-10-24
petrol cars allowed to exceed pollution limits by 50% under draft eu laws,law,2016-10-24
early voting looking strong for clinton,shooting,2016-10-25
england should look at nathan hughes to take over maro itoje’s role,control,2016-10-25
justin timberlake could face jail time over voting booth selfie,shooting,2016-10-25
documents show at&t secretly sells customer data to law enforcement,law,2016-10-25
controversy over alleged fake financial document leaves watford frustrated,control,2016-10-25
un's own expert calls its actions over haiti cholera outbreak 'a disgrace',legislation,2016-10-25
scotland to pardon gay men convicted under outdated laws,law,2016-10-25
hammond says highly skilled will not face eu immigration controls,control,2016-10-25
the decision to back a third runway at heathrow is a grotesque folly,background,2016-10-25
"puffing pontiff: the young pope's oscar-winning director on jude law, sex and cigarettes",law,2016-10-25
child kept in isolation for whole term at ‘lunch row’ school,legislation,2016-10-25
"tighten up political system to stem birther controversies, aec veteran says",control,2016-10-25
use of restraint chairs on nt youths to be banned amid wider justice review,control,2016-10-25
us abstains from un vote to condemn cuba embargo for the first time,gun,2016-10-26
us abstains from un vote to condemn cuba embargo for the first time,background,2016-10-26
hillary clinton makes push for latino vote with univision appearance,legislation,2016-10-26
why gun rights advocates don't trust clinton on the second amendment,gun,2016-10-26
our society has lost control of housing – here's how to get it back,control,2016-10-26
our society has lost control of housing – here's how to get it back,background,2016-10-26
what to do in the garden when the clocks go back,background,2016-10-26
unesco adopts controversial resolution on jerusalem holy sites,control,2016-10-26
selling yoga back to its teachers is pure neocolonialism,background,2016-10-26
air of discontent around cerrejón mine deepens as colombians cry foul,background,2016-10-26
eu drops law to limit cancer-linked chemical in food after industry complaint,law,2016-10-26
canada urged to quell discrimination against women after fall in un ranking,gun,2016-10-26
canada urged to quell discrimination against women after fall in un ranking,background,2016-10-26
south africa: the art of a nation review – from the dawn of man to the violence of apartheid,legislation,2016-10-26
john clancy: brexit offers uk cities a bigger role on the world stage,control,2016-10-26
will the closure of india's sterilisation camps end botched operations?,legislation,2016-10-26
lawyers' alliance backs labor's call for george brandis to resign,law,2016-10-26
"pokies designed to deceive people, lawsuit against crown and aristocrat alleges",law,2016-10-26
labor opposed to turnbull's controversial 'green lawfare' changes,control,2016-10-26
labor opposed to turnbull's controversial 'green lawfare' changes,law,2016-10-26
pauline hanson tells government to back broadband cable for norfolk island,background,2016-10-27
jenny tonge quits lib dems after suspension for alleged antisemitic comments,semi,2016-10-27
"the rule of law must apply equally, even to terrorists",law,2016-10-27
press freedom danger if mps vote in section 40 by the back door,background,2016-10-27
battle for florida: trump and clinton home in on crucial state as voting begins,shooting,2016-10-27
law concerning use of sexual history in rape trials 'could be reformed',law,2016-10-27
how do we make care personalisation cost-efficient?,legislation,2016-10-27
poland's abortion laws: activists blame grip of 'hardline' church,law,2016-10-27
"less talk, more action: why victoria is the progress state",legislation,2016-10-28
virginia police shootings: ‘we missed an opportunity to stop him',shooting,2016-10-28
liberal democrat peer to attend controversial conference in syria,control,2016-10-28
"mass extinction, whaling and a new marine park – green news roundup",background,2016-10-28
islamic state using hostages as human shields in mosul - un,gun,2016-10-28
islamic state using hostages as human shields in mosul - un,background,2016-10-28
ba owner 'doubts' heathrow can build runway within budget,background,2016-10-28
north dakota pipeline: 141 arrests as protesters pushed back from site,background,2016-10-28
latest ukip leadership candidate can't help shooting from the hip,shooting,2016-10-28
the labour rebels who didn’t back the yemen vote have blood on their hands,background,2016-10-28
sandy hook film-makers join cinemark boycott over aurora shooting,shooting,2016-10-28
time is money: here's how to save some when the clocks go back this weekend,background,2016-10-28
the best recent science fiction and fantasy novels – reviews roundup,background,2016-10-28
guardian briefing: the key questions around aid in syria,background,2016-10-28
un hires assad's friends and relatives for syria relief operation,gun,2016-10-28
un hires assad's friends and relatives for syria relief operation,background,2016-10-28
denis o’brien wants us legal expert to give evidence on irish law,law,2016-10-28
ba owner cuts profit forecast after bumpy ride in third quarter,background,2016-10-28
malcolm turnbull puts family violence talks with states back on agenda,background,2016-10-28
grouse shooting estates shored up by millions in subsidies,shooting,2016-10-28
protesters pushed back after mass arrests at north dakota pipeline site – as it happened,background,2016-10-28
roberto firmino rounds off liverpool’s goal rush at crystal palace,background,2016-10-29
olivier giroud and alexis sánchez at the double as arsenal ease past sunderland,background,2016-10-29
"new asylum laws pave the way for third-country resettlement, peter dutton says",law,2016-10-30
andrew robb takes role with chinese company that operates darwin port,control,2016-10-30
the guardian view on the fbi’s clinton probe: exactly the wrong thing to do,shooting,2016-10-30
fired-up over grouse shooting and moorlands,shooting,2016-10-30
james comey: hillary clinton email inquiry is fbi chief's latest controversy,control,2016-10-30
how molenbeek fought back against isis – with football,background,2016-10-30
"‘a noun, a verb and donald trump’: rubio seeks to seize on murphy’s flaw",law,2016-10-30
"facebook fact-check: all the fake news, from the obamas to miracle cannabis",check,2016-10-30
password not accepted: are biometric checks the answer?,check,2016-10-30
dakota access pipeline protests: un group investigates human rights abuses,gun,2016-10-31
dakota access pipeline protests: un group investigates human rights abuses,background,2016-10-31
"jihadis planning paris-style gun attacks on british streets, police say",gun,2016-10-31
john oliver on the us election's latest low: 'please let this thing be over soon',shooting,2016-10-31
westworld recap: episode five – hold on to your hats! it's dolores the lawless,law,2016-10-31
the rspb is wrong not to back a ban on driven grouse shooting,background,2016-10-31
the rspb is wrong not to back a ban on driven grouse shooting,shooting,2016-10-31
clinton emails: fbi gets warrant as comey told he may have broken law,law,2016-10-31
"abcc must enshrine union members' rights,  says one nation senator",legislation,2016-10-31
andrew robb did not tell  prime minister about role with chinese company,control,2016-10-31
"tom wood: i did not have a tantrum, eddie jones just says it how it is",automatic,2016-11-01
manchester city manage the impossible and keep lionel messi in check,check,2016-11-01
"un failed to protect civilians in south sudan, report finds",gun,2016-11-01
"un failed to protect civilians in south sudan, report finds",background,2016-11-01
"hinkley point c will not cost taxpayers extra, says edf energy boss",control,2016-11-01
"hinkley point c will not cost taxpayers extra, says edf energy boss",background,2016-11-01
"hinkley point c will not cost taxpayers extra, says edf energy boss",check,2016-11-01
"hinkley point c will not cost taxpayers extra, says edf energy boss",automatic,2016-11-01
eagles' josh huff reportedly found with gun and marijuana after speeding arrest,gun,2016-11-01
the hillary clinton email controversy explained: what we know so far,control,2016-11-01
billy corgan loses lawsuit against tna wrestling,law,2016-11-01
dark angel review – grimy crimes are laid on thick in this halloween hoot,shooting,2016-11-01
a million people 'check in' at standing rock on facebook to support dakota pipeline protesters,check,2016-11-01
un official criticises australia's plan for lifetime ban on refugees who travel by sea,gun,2016-11-01
un official criticises australia's plan for lifetime ban on refugees who travel by sea,background,2016-11-01
cory bernardi warns one nation will rise if migration not halved,legislation,2016-11-02
lawyer rebuked for gloating at 'win' over parents seeking special needs support,law,2016-11-02
des moines police shooting: killed officers named after 'ambush',shooting,2016-11-02
sod it: californians turn back to grass lawns as drought shaming ebbs,background,2016-11-02
sod it: californians turn back to grass lawns as drought shaming ebbs,law,2016-11-02
uae launches new law to 'make reading a daily habit',law,2016-11-02
i hate the internet by jarett kobek review – the best ‘bad novel’ around,background,2016-11-02
mh370: data suggests plane was out of control as it plummeted into ocean,control,2016-11-02
northern ireland woman takes nhs to court over abortion law,law,2016-11-02
government challenges election of one nation senator rod culleton,legislation,2016-11-02
ba accused of downplaying health risks of 'fume events' on flights,background,2016-11-03
jews driven back to germany by brexit,background,2016-11-03
bank of england warns households to expect sharp rise in inflation next year,legislation,2016-11-03
uk households face squeeze as bank of england hikes inflation forecasts –as it happened,legislation,2016-11-03
never look back,background,2016-11-03
thank martin luther for exposing the church’s great salvation sell-off,legislation,2016-11-03
"only in america! uk tv's fascination with the us's gun-toting, conspiracy-loving side",gun,2016-11-03
dakota pipeline protesters say activist accused of shooting at police is a pacifist,shooting,2016-11-03
how to make the perfect cacio e pepe,legislation,2016-11-03
how to make the perfect cacio e pepe,check,2016-11-03
how to make the perfect cacio e pepe,semi,2016-11-03
thursday’s best tv: peter york’s hipster handbook; the gun shop; paranoid,gun,2016-11-03
rodney culleton to ask for advice about whether he can keep voting in senate,shooting,2016-11-03
"bring tony abbott back into cabinet to stop ‘circular firing squad’, shorten tells turnbull",background,2016-11-03
catholic church apologises for role in 'forced adoptions' over 30-year period,control,2016-11-03
"wearing lifejackets on trawlers should be law, marine investigators say",law,2016-11-03
#savepepe: cartoon frog's creator tries to take meme back from alt-right,background,2016-11-04
"wetherspoon boss tim martin: ‘the eu became a quasi-religion, and universities are the modern-day seminaries’",semi,2016-11-04
judges' actions around the world show they are no enemy of the people,legislation,2016-11-04
judges' actions around the world show they are no enemy of the people,background,2016-11-04
the best recent crime novels – review roundup,background,2016-11-04
'anti-white' graffiti in gentrifying la  neighborhood sparks hate crime debate,law,2016-11-04
'anti-white' graffiti in gentrifying la  neighborhood sparks hate crime debate,legislation,2016-11-04
south africa fight back on day two of the perth test – as it happened,background,2016-11-04
keep it in the ground: the paris climate agreement is now official,background,2016-11-04
"man secretly deported to nauru from melbourne detention centre, say lawyers",law,2016-11-04
we need to get back to basics in this election. who is the biggest fascist: hillary or donald?,background,2016-11-04
qut computer lab racial discrimination lawsuit thrown out,law,2016-11-04
"baby adoption practices of past demand inquiry, say law firms",law,2016-11-04
china could ban lawmakers from hong kong parliament as crisis escalates,law,2016-11-04
higher inflation and rising debt threaten millions in uk,legislation,2016-11-05
merstham 0-5 oxford united: fa cup first round – as it happened,background,2016-11-05
moroccan activists plan protests to coincide with un climate summit,gun,2016-11-05
moroccan activists plan protests to coincide with un climate summit,background,2016-11-05
the ground rent scandal that is engulfing new home buyers,background,2016-11-05
port macquarie police shooting: man had sent threatening messages to woman he stabbed,shooting,2016-11-05
senator al franken accuses donald trump of launching antisemitic tv ad,semi,2016-11-06
sevilla 1-2 barcelona: la liga – as it happened,law,2016-11-06
sevilla 1-2 barcelona: la liga – as it happened,legislation,2016-11-06
jack wilshere back in england squad to face scotland and spain,background,2016-11-06
donald trump jr's gun rights coalition includes olympian and beauty queen,gun,2016-11-06
invasion of the troll armies: from russian trump supporters to turkish state stooges,control,2016-11-06
nocturnal animals review – tom ford’s seductive cautionary tale,automatic,2016-11-06
brexit: lawyers confront liz truss over ‘dangerous’ abuse of judges,law,2016-11-06
riot of colour in a 1960s semi,semi,2016-11-06
"the rule of law, the power of parliament, and the will of the people",law,2016-11-07
how does donald trump lie? a fact checker's final guide,check,2016-11-07
premier league: 10 talking points from the weekend’s action,legislation,2016-11-07
lazarus review – michael c hall is a loving alien in spectacular bowie fantasy,control,2016-11-08
lazarus review – michael c hall is a loving alien in spectacular bowie fantasy,background,2016-11-08
lazarus review – michael c hall is a loving alien in spectacular bowie fantasy,check,2016-11-08
lazarus review – michael c hall is a loving alien in spectacular bowie fantasy,automatic,2016-11-08
man admits sending 'cowardly' shooting tweet about leanne wood,shooting,2016-11-08
"brexit may be final straw for some couples, say divorce lawyers",law,2016-11-08
theresa struggles to take back control – from her own maybot,background,2016-11-08
theresa struggles to take back control – from her own maybot,control,2016-11-08
who controls whom? the monarchy v the media,control,2016-11-08
hillary clinton and donald trump cast their ballots after record early voting,shooting,2016-11-08
voting day: america finally goes the polls,shooting,2016-11-08
damian green dismisses 'offensive' un report on uk disability rights,gun,2016-11-08
damian green dismisses 'offensive' un report on uk disability rights,background,2016-11-08
china passes law to ensure films 'serve the people and socialism',law,2016-11-08
hillary clinton buoyed by high latino turnout in final hours of election,legislation,2016-11-08
hong kong: lawyers and activists march against beijing 'meddling',law,2016-11-08
andrew lloyd webber almost quit tories after voting for osborne's cuts,shooting,2016-11-08
hong kong lawyers prepare protest march after china inflames political crisis,law,2016-11-08
"building regulator blocking deal on spurious 'productivity' grounds, union says",background,2016-11-08
