headlines,terms,dates
"'either you're pro-refugee, or against': bavarian town split after year of border controls",control,2016-09-01
australia to change law to allow strikes on more isis combatants,law,2016-09-01
novak djokovic into fourth round after mikhail youzhny retires – as it happened,background,2016-09-02
angela merkel and marine le pen: one of them will shape europe’s future,legislation,2016-09-02
watchdog threatens legal action against fox news after hacking allegations,legislation,2016-09-02
apple releases macos security update to fix flaw one week after ios patch,law,2016-09-02
"from phil collins to pussy riot, meet the man bringing banned songs back to life",background,2016-09-02
peter dutton: the man who caused mammary tromploeil iii to lose control of parliament,control,2016-09-02
andy murray beats paolo lorenzi: us open third round – as it happened,background,2016-09-03
sam allardyce should not hold back marcus rashford from england squad,background,2016-09-03
the young pope review: jude law's sleek pontiff shines in sorrentino's twin peaks,law,2016-09-03
daily mail lawsuit is a message from trump: stay away from my family,law,2016-09-03
johanna konta v anastasija sevastova: us open fourth round – as it happened,background,2016-09-04
police officer who killed zachary hammond fired a year after shooting,shooting,2016-09-04
the miss usa hopeful sued by trump: 'there are ways to stand your ground',background,2016-09-04
"gun violence, unsolved murders put chicago on course to set grim record",gun,2016-09-04
malcolm turnbull pushes back on foreign investment after xi meeting,background,2016-09-04
manchester derby: how united and city match up from back to front,background,2016-09-04
arrest made in connection with dublin gang hotel shooting,shooting,2016-09-05
juan martín del potro back in us open quarter-finals after dominic thiem quits,background,2016-09-05
"can't face the queue at the bar? don't worry, the next round's on orderella",background,2016-09-05
victoria leads way in piecemeal approach to outlawing revenge porn,law,2016-09-05
one in four supermarket chicken samples contain antibiotic-resistant e coli,legislation,2016-09-05
one in four supermarket chicken samples contain antibiotic-resistant e coli,check,2016-09-05
one in four supermarket chicken samples contain antibiotic-resistant e coli,semi,2016-09-05
"armed anarchists rally at brock turner's home: 'try this again, we'll shoot you'",shooting,2016-09-06
pope should know that resisting birth control is bad for the environment,control,2016-09-06
samia shahid's father allegedly hoped to use blood money laws to get away with murder,law,2016-09-06
extradition hearing  in belfast for  man accused of   boxing weigh-in shooting,shooting,2016-09-06
talking right: i lost my appalachian accent to fit in. now i want it back,background,2016-09-06
"the archers trial: verdicts from the counsellor, the lawyer and the prison expert",law,2016-09-06
"car bombs, corruption and illegal betting – how football in cyprus spiralled out of control",control,2016-09-06
"secret aid worker: some human rights lawyers are in it for vanity, not victims",law,2016-09-06
un human rights chief  zeid ra'ad al hussein calls for world to reject populist bigots - in full,gun,2016-09-06
un human rights chief  zeid ra'ad al hussein calls for world to reject populist bigots - in full,background,2016-09-06
the girl with the lower back tattoo by amy schumer – review,background,2016-09-06
mick gooda dismisses challenge to role in youth detention royal commission,control,2016-09-06
hillsborough law launched to ensure officials act with 'candour',law,2016-09-07
"britain's weirdest laws: carpet beating, mps in armour and carrying ladders",law,2016-09-07
us open: jamie murray and bruno soares grind out place in semi-finals,semi,2016-09-07
looking for ground where the left can win,background,2016-09-07
"losing ground, fighters and morale – is it all over for isis?",background,2016-09-07
sterling k brown: 'i allow myself to think about winning an emmy',background,2016-09-07
sterling k brown: 'i allow myself to think about winning an emmy',check,2016-09-07
"napoleon bonaparte, failed novelist: manuscript goes to auction",legislation,2016-09-07
reality check: are right-to-buy homes being replaced as promised?,check,2016-09-07
the joint enterprise law has changed. yet still we must fight to free our sons,law,2016-09-07
trump's donation to florida's attorney general: the controversy explained,control,2016-09-07
top 10 dodgy lawyers in literature,law,2016-09-07
mps to debate ban on grouse shooting,shooting,2016-09-07
take back control? it’s now clear the brexiteers have no clue on immigration,background,2016-09-07
take back control? it’s now clear the brexiteers have no clue on immigration,control,2016-09-07
novak djokovic beats jo-wilfried tsonga to reach us open semis – as it happened,semi,2016-09-07
john renbourn and wizz jones: joint control review – delight of a folk guitar hero's final bow,control,2016-09-08
police release cctv footage of shotgun attack in brixton,gun,2016-09-08
bridgegate trial and chris christie's role could mean more trouble for trump,control,2016-09-08
louisiana public defenders: a lawyer with a pulse will do,law,2016-09-08
how to blog without breaking the law,law,2016-09-08
the pigeon tunnel by john le carré review – what made him write a memoir?,legislation,2016-09-08
"the kingdom of speech by tom wolfe – a bonfire of facts, reeking of vanity",automatic,2016-09-08
"don't wait for the perfect job, tailor your role to build on your skills",control,2016-09-08
"facebook fact-check: from hillary's health to 9/11, the latest lies we read",check,2016-09-09
serena williams’ defeat gives angelique kerber chance to take control,control,2016-09-09
does it matter if your in-laws hate you? catch up on our live look at the week,law,2016-09-09
"deport failed asylum seekers back to war zones, says bavaria minister",background,2016-09-09
the realisation that facebook can censor comes too late to publishers,legislation,2016-09-09
isis is as much an offshoot of our global civilisation as google,legislation,2016-09-09
former nt chief minister adam giles loses seat in final election count,control,2016-09-09
the girl with the lower back tattoo by amy schumer review – the problem with ‘femoirs’,background,2016-09-09
kim jong-un’s growing nuclear arsenal could force us back to negotiating table,background,2016-09-09
"‘water is peace, life, dignity': why the un deputy chief has a thirst for saving lives",gun,2016-09-09
"‘water is peace, life, dignity': why the un deputy chief has a thirst for saving lives",background,2016-09-09
tony abbott says turnbull 'panicked' in calling nt abuse royal commission,control,2016-09-09
baby among 10 people found in back of lorry,background,2016-09-09
police stir controversy with viral photo of heroin overdose victims in ohio,control,2016-09-10
eimear mcbride: how i wrote a girl is a half-formed thing,shooting,2016-09-10
nt aboriginal corporation appeals court decision in mining royalty case,control,2016-09-10
pep guardiola embraces lack of control during a very english derby,control,2016-09-11
quade cooper dials back funky stuff with more measured results for wallabies,background,2016-09-11
adani's carmichael coalmine proves environment laws 'too weak' – report,law,2016-09-11
patriots and chief raise fists around anthem as arian foster kneels in seattle,background,2016-09-11
travellers face £5 charge to get through passport control faster,control,2016-09-11
"florida black man killed by police was 'executed' in his back yard, relatives say",background,2016-09-12
bring back childhood’s wild side,background,2016-09-12
religion’s role in the global population crisis,control,2016-09-12
lifesaving un aid regularly fails to reach besieged syrians,gun,2016-09-12
lifesaving un aid regularly fails to reach besieged syrians,background,2016-09-12
"update 'archaic' laws to protect used car buyers, says law commission",law,2016-09-12
"update 'archaic' laws to protect used car buyers, says law commission",law,2016-09-12
premier league: 10 talking points from the weekend’s action,legislation,2016-09-12
'she seemed shy. then suddenly this wild beast came out' – my 10 years shooting kate bush,shooting,2016-09-12
"syrian regime is blocking aid from entering eastern aleppo, claims un",gun,2016-09-13
"syrian regime is blocking aid from entering eastern aleppo, claims un",background,2016-09-13
pro-gun group sues katie couric for defamation in under the gun film,gun,2016-09-13
pro-gun group sues katie couric for defamation in under the gun film,gun,2016-09-13
indigenous activist leads class action to recover wages 'stolen' by state,legislation,2016-09-13
greens push to outlaw all mining in great australian bight,law,2016-09-13
"uk inflation stays at 0.6%, but import prices rise sharply -as it happened",legislation,2016-09-13
un and turkey seek security guarantees before aid enters aleppo,gun,2016-09-13
un and turkey seek security guarantees before aid enters aleppo,background,2016-09-13
'unelected swill': one nation senator malcolm roberts calls for australia to leave un,legislation,2016-09-13
'unelected swill': one nation senator malcolm roberts calls for australia to leave un,gun,2016-09-13
'unelected swill': one nation senator malcolm roberts calls for australia to leave un,background,2016-09-13
"sydney's lockout laws could be relaxed to 2am, independent review finds",law,2016-09-13
‘businesses should look at how they bring women back into the workforce’,background,2016-09-13
"the left’s jewish problem: jeremy corbyn, israel and anti‑semitism – review",semi,2016-09-13
is employment law fit for the gig economy?,law,2016-09-13
frankie dettori all smiles after so mi dar wins on comeback at yarmouth,semi,2016-09-14
shakin' stevens: 'i'm like a skittle. if i get knocked down i get back up again',background,2016-09-14
"murder law will not be reformed, justice minister tells mps",law,2016-09-14
amazon launches echo voice-controlled speaker and alexa assistant in the uk,control,2016-09-14
detroit civil rights lawsuit attempts to assert a constitutional right to literacy,law,2016-09-14
strange weather review –  holly hunter takes classic american indie back on the road,background,2016-09-14
pauline hanson calls for immigration ban: 'go back to where you came from',background,2016-09-14
marriage equality: law would protect ‘conscientious objectors’ who reject same-sex weddings,law,2016-09-14
illegal gun amnesty and smuggling penalties unveiled after crimewave,gun,2016-09-14
consumer groups urge change to lease laws after hidden costs target the poor,law,2016-09-14
councils seek new powers to check on home-schooled children,check,2016-09-15
virginia city to pay $1m to avert lawsuit in william chapman police shooting,law,2016-09-15
virginia city to pay $1m to avert lawsuit in william chapman police shooting,shooting,2016-09-15
sean rigg: cps rules out charges against police over station death,legislation,2016-09-15
east finchley shooting: man and woman killed in north london,shooting,2016-09-15
missouri legislators expand gun rights in defiance of concerns from police,legislation,2016-09-15
missouri legislators expand gun rights in defiance of concerns from police,gun,2016-09-15
columbus police fatally shoot 13-year-old boy carrying bb gun,shooting,2016-09-15
columbus police fatally shoot 13-year-old boy carrying bb gun,gun,2016-09-15
sandra bland's family settles wrongful death lawsuit against texas for $1.9m,law,2016-09-15
denzel washington on diversity western the magnificent seven: ‘audiences like to know who they’re rooting for’,shooting,2016-09-15
hinkley point c nuclear power station gets government green light,control,2016-09-15
hinkley point c nuclear power station gets government green light,background,2016-09-15
hinkley point c nuclear power station gets government green light,check,2016-09-15
hinkley point c nuclear power station gets government green light,automatic,2016-09-15
hinkley point c nuclear power station gets government green light,legislation,2016-09-15
stevenson: piano music vol 1 cd review – precise control never compromises brilliance,control,2016-09-15
28 years a smeghead: back in deep space with the red dwarf crew,background,2016-09-15
west australian laws aim to cut number of indigenous people jailed for unpaid fines,law,2016-09-15
breaking the law: punish football teams for negative play,law,2016-09-15
details emerge on columbus police shooting of teen carrying bb gun,shooting,2016-09-16
details emerge on columbus police shooting of teen carrying bb gun,gun,2016-09-16
gun nation: inside the us's deadly obsession,gun,2016-09-16
experience: i flew solo around the world in a hot-air balloon,background,2016-09-16
grammar schools might be a leg up for working-class children,legislation,2016-09-16
what made you change your mind about guns?,gun,2016-09-16
baclofen: the controversial pill that could 'cure' alcoholism,control,2016-09-16
john le carré and i worked for years on his biography. why is he telling his own story 12 months later?,legislation,2016-09-16
calls to halt nt light festival over fears for vulnerable rock wallaby,control,2016-09-16
chinese actor xu ting dies after choosing traditional medicine over chemotherapy,shooting,2016-09-16
friday’s best tv: hooten & the lady; american horror story,shooting,2016-09-16
uber and little cab's battle to control the streets of nairobi,control,2016-09-16
"voluntary euthanasia support grows in victoria, but turnbull won't back it",background,2016-09-16
"derryn hinch, the human headline, might turn out to be the voice of reason – except for one thing",shooting,2016-09-16
"sex, sovereignty and sausages: tv writer traces prejudice against germans back  to victoria’s time",background,2016-09-17
buzzards back in hunters’ crosshairs over threat to uk pheasant shoots,background,2016-09-17
buzzards back in hunters’ crosshairs over threat to uk pheasant shoots,shooting,2016-09-17
trump tells controversial group clinton immigration plan will 'abolish borders',control,2016-09-17
un and white house summits could offer a ray of hope to those stuck in camps,gun,2016-09-17
un and white house summits could offer a ray of hope to those stuck in camps,background,2016-09-17
leganés 1-5 barcelona: la liga – as it happened,law,2016-09-17
leganés 1-5 barcelona: la liga – as it happened,legislation,2016-09-17
sydney swans vs adelaide crows: afl semi-final – as it happened,semi,2016-09-17
beauty: hot and bothered? skin control products to keep you cool,control,2016-09-17
"weekend reading: grammar schools, gun control and red dwarf's return",gun,2016-09-17
"weekend reading: grammar schools, gun control and red dwarf's return",control,2016-09-17
"weekend reading: grammar schools, gun control and red dwarf's return",gun,2016-09-17
"weekend reading: grammar schools, gun control and red dwarf's return",control,2016-09-17
stephen conroy informed bill shorten about resignation by text message,control,2016-09-17
theresa may to warn  un of dangers of uncontrolled mass migration,gun,2016-09-18
theresa may to warn  un of dangers of uncontrolled mass migration,background,2016-09-18
theresa may to warn  un of dangers of uncontrolled mass migration,control,2016-09-18
two arrested in connection with east finchley shootings,shooting,2016-09-18
'the nation state is back': front national's marine le pen rides on global mood,legislation,2016-09-18
'the nation state is back': front national's marine le pen rides on global mood,legislation,2016-09-18
thousands protest against proposed stricter abortion law in poland,law,2016-09-18
us newspapers hit back as huffpo and co run out of steam,background,2016-09-18
us newspapers hit back as huffpo and co run out of steam,control,2016-09-18
q&a: magda szubanski rounds on turnbull over same-sex marriage plebiscite,background,2016-09-19
gun inequality: us study charts rise of hardcore super owners,gun,2016-09-19
justin trudeau’s lofty rhetoric on first nations a cheap simulation of justice,legislation,2016-09-19
the good thing about being hit by an suv?  it freed me from debt,shooting,2016-09-19
premier league: 10 talking points from the weekend’s action,legislation,2016-09-19
stephen conroy says sorry for catching colleagues by surprise with resignation,control,2016-09-20
"australia will take refugees from costa rica camps, turnbull tells un",gun,2016-09-20
"australia will take refugees from costa rica camps, turnbull tells un",background,2016-09-20
theresa may gives debut address to un general assembly – as it happened,gun,2016-09-20
theresa may gives debut address to un general assembly – as it happened,background,2016-09-20
vancouver class action lawsuit seeks to halt tax on foreign property purchases,legislation,2016-09-20
vancouver class action lawsuit seeks to halt tax on foreign property purchases,law,2016-09-20
team of hackers take remote control of tesla model s from 12 miles away,control,2016-09-20
"what it’s like to be called isis: ‘people ask, where’s your machine gun?’",gun,2016-09-20
'our kids can’t play with toy guns': tyre king police shooting a painful reminder,gun,2016-09-20
'our kids can’t play with toy guns': tyre king police shooting a painful reminder,shooting,2016-09-20
meet america's gun super-owners – with an average of 17 firearms each,gun,2016-09-20
us blames russia after un aid convoy in syria targeted by air attack,gun,2016-09-20
us blames russia after un aid convoy in syria targeted by air attack,background,2016-09-20
"pro-brexit newspapers, ed snowden and right to be forgotten laws",law,2016-09-20
theresa may calls on un to meet challenges of globalisation,gun,2016-09-20
theresa may calls on un to meet challenges of globalisation,background,2016-09-20
"fbi should reveal who hacked the san bernardino iphone, lawsuit claims",law,2016-09-20
barcelona 1-1 atlético madrid: la liga – as it happened!,law,2016-09-21
barcelona 1-1 atlético madrid: la liga – as it happened!,legislation,2016-09-21
durham’s ben stokes scores half-century but hampshire stay in control,control,2016-09-21
activists channel anger after latest tulsa police shooting of unarmed black man,shooting,2016-09-21
ec wants to axe mobile phone roaming charges next year,check,2016-09-21
un report accuses burundi government of human rights abuses,gun,2016-09-21
un report accuses burundi government of human rights abuses,background,2016-09-21
protests erupt in charlotte after fatal police shooting,shooting,2016-09-21
protesters clash with police in charlotte after fatal shooting of keith scott,shooting,2016-09-21
"aberthaw power station breached emissions limit, rules eu court",legislation,2016-09-21
scottish labour calls on conference  to back bid for more autonomy,background,2016-09-21
why more urban women own guns: self-defense and the second amendment,gun,2016-09-21
"russian planes dropped bombs that destroyed un aid convoy, us officials say",gun,2016-09-21
"russian planes dropped bombs that destroyed un aid convoy, us officials say",background,2016-09-21
"don dale guards' use of teargas may have broken weapons act, say lawyers",law,2016-09-21
ecuador's foreign minister steps up campaign for un tax body,gun,2016-09-21
ecuador's foreign minister steps up campaign for un tax body,background,2016-09-21
un meeting tackles the 'fundamental threat' of antibiotic-resistant superbugs,gun,2016-09-21
un meeting tackles the 'fundamental threat' of antibiotic-resistant superbugs,background,2016-09-21
china's tiangong-1 space station 'out of control' and will crash to earth,legislation,2016-09-21
china's tiangong-1 space station 'out of control' and will crash to earth,control,2016-09-21
women gain ground in jordan election despite yawning gender gap,background,2016-09-22
code of race ethics proposed for parliament to counter rise of one nation,legislation,2016-09-22
terence crutcher and keith scott shootings demonstrate value of video evidence,shooting,2016-09-22
families take legal action over stalled troubles inquests,legislation,2016-09-22
virginia review:  narrative flaws overshadow admirable goals,law,2016-09-22
¿qué está haciendo tu ciudad para resistirse a la gentrificación?,law,2016-09-22
¿qué está haciendo tu ciudad para resistirse a la gentrificación?,legislation,2016-09-22
"when i was scared, my gun-owning neighbors helped me feel safe",gun,2016-09-22
marion cotillard issues statement denying role in brad pitt and angelina jolie divorce,control,2016-09-22
china: lawyer for ai weiwei jailed for 12 years in 'severe retaliation',law,2016-09-22
keith scott protests: civilian in north carolina shooting 'critical' but not dead – as it happened,shooting,2016-09-22
bomb threat against lgbti radio station joy 94.9fm condemned by police,legislation,2016-09-22
turnbull tells un secure borders essential for managing global migration flow,gun,2016-09-22
turnbull tells un secure borders essential for managing global migration flow,background,2016-09-22
farrell scandal puts catholic church's attitude to australian law under the microscope,law,2016-09-23
sunderland: david moyes urges patrick van aanholt to behave like role model,control,2016-09-23
"tulsa police officer released on $50,000 bail in terence crutcher shooting",shooting,2016-09-23
fact check: are older americans really more likely to vote republican?,check,2016-09-23
viagogo faces legal action for advertising tickets not yet on sale,legislation,2016-09-23
‘we had a riotous time’: hugo spowers with nigella lawson at an oxford university party,law,2016-09-23
the best recent crime novels – review roundup,background,2016-09-23
keith scott family: shooting video leaves 'more questions than answers',shooting,2016-09-23
tom wood: ‘if i play for england i want to play on merit in a quality team’,automatic,2016-09-23
from gun nation to desert fire – welcome to guardian documentaries,gun,2016-09-23
from gun nation to desert fire – welcome to guardian documentaries,legislation,2016-09-23
trump blames clinton for giving 'nod' to unrest in wake of fatal police shootings,shooting,2016-09-23
uk accused of blocking un inquiry into claim of war crimes in yemen,gun,2016-09-24
uk accused of blocking un inquiry into claim of war crimes in yemen,background,2016-09-24
police criticised as organised gangs gain control of sex industry,control,2016-09-24
from catwalk to checkout: how burberry is trying to reinvent retail,check,2016-09-24
canadian town steams over nestlé bid to control local spring water well,control,2016-09-24
where will the out-of-control chinese space station land?,control,2016-09-24
where will the out-of-control chinese space station land?,legislation,2016-09-24
clive james: ‘the australian sun  reaches around the world to roast me on my balcony’,background,2016-09-24
"george christensen on poverty, priesthood and a flirtation with one nation",legislation,2016-09-25
may's allies reject claim about her  role in eu referendum campaign,control,2016-09-25
atlético madrid v deportivo: la liga – as it happened,law,2016-09-25
atlético madrid v deportivo: la liga – as it happened,legislation,2016-09-25
charlotte police release footage of fatal keith scott shooting,shooting,2016-09-25
france’s arc hopes dealt a blow by injury to la cressonniere,law,2016-09-25
france’s arc hopes dealt a blow by injury to la cressonniere,legislation,2016-09-25
leganés 1-2 valencia: la liga – as it happened,law,2016-09-25
leganés 1-2 valencia: la liga – as it happened,legislation,2016-09-25
che guevara era closes as latin america's  oldest guerrilla army calls it a day,check,2016-09-25
washington state mall shooting suspect was under 'no firearm' order,shooting,2016-09-25
un security council to meet on syria as assad’s troops tighten grip on aleppo,gun,2016-09-25
un security council to meet on syria as assad’s troops tighten grip on aleppo,background,2016-09-25
climate chief: uk must not use brexit to water down environment laws,law,2016-09-26
the guardian view on cycle helmets: head cases make bad law,law,2016-09-26
houston shooting: gunman dead after injuring nine people at strip mall,shooting,2016-09-26
houston shooting: gunman dead after injuring nine people at strip mall,gun,2016-09-26
"in any normal debate we wouldn't need fact-checking. tonight, it's vital",check,2016-09-26
law passed enabling actors to remove age from imdb,law,2016-09-26
athletic bilbao’s mikel balenziaga the surprise star on la liga’s weird weekend,law,2016-09-26
athletic bilbao’s mikel balenziaga the surprise star on la liga’s weird weekend,legislation,2016-09-26
uk supports call for independent un human rights mission to yemen,gun,2016-09-26
uk supports call for independent un human rights mission to yemen,background,2016-09-26
lester holt: presidential debate moderator and proven fact-checker,check,2016-09-26
deal-making and dirty tricks: inside the race for un secretary general,gun,2016-09-26
deal-making and dirty tricks: inside the race for un secretary general,background,2016-09-26
labour conference: tom watson says capitalism is not the enemy - as it happened,automatic,2016-09-27
"tristan und isolde review – musical marvel in a grim, cynical cloak",background,2016-09-27
"mining in malawi brings forced evictions and ruined crops, report says",law,2016-09-27
annabel abbs: 'ulysses and finnegans wake followed me round the house like hungry dogs',background,2016-09-27
disabled air travellers warned of long distances from check-in to gate,check,2016-09-27
presidential debate fact-check: trump and clinton's claims reviewed,check,2016-09-27
"don dale detainee 'unfairly punished' with teargas for actions of others, court told",legislation,2016-09-27
trump camp struggles for post-debate footing,shooting,2016-09-28
