headlines,terms,dates
'we’re watching them die': can right whales pull back from the brink?,background,2020-04-17
earth and blood review – heavy artillery action flick runs out of ammo,legislation,2020-04-17
helter-skelter plans for restart leave nrl's apollo project at risk of remaining grounded,background,2020-04-17
coronavirus us live: trump rails against media and gun control in combative briefing – as it happened,gun,2020-04-18
coronavirus us live: trump rails against media and gun control in combative briefing – as it happened,control,2020-04-18
the exit strategy: how countries around the world are preparing for life after covid-19,background,2020-04-18
how istanbul won back its crown as heart of the muslim world,background,2020-04-18
queen cancels birthday gun salutes amid coronavirus gloom,gun,2020-04-18
'it made me feel human again'': the tech easing inmates' isolation,legislation,2020-04-18
'i ain't voting till black lives matter': what does an activist's radical strategy mean for 2020?,shooting,2020-04-18
nobel laureates condemn 'judicial harassment' of environmental lawyer,law,2020-04-18
"swift action kept portugal's coronavirus crisis in check, says minister",legislation,2020-04-19
"swift action kept portugal's coronavirus crisis in check, says minister",check,2020-04-19
china 'bars lawyer from going home' after prison release,law,2020-04-19
living in our isolation bubbles can bring great rewards,legislation,2020-04-19
from travel to shopping to who pays for home working … what you are asking around lockdown,background,2020-04-19
nova scotia shooting: friends and family pay tribute to ‘beautiful souls’ lost in rampage,shooting,2020-04-20
'don't shoot him no more!' california police face backlash over killing of man in walmart,shooting,2020-04-20
germany takes tentative steps back to normality as lockdown eases,background,2020-04-20
nova scotia shooting  death toll rises as trudeau calls on canadians to stand united,shooting,2020-04-20
met to review role of school police officers after legal challenge,control,2020-04-20
us hospitals fall back on billionaires to make up for shortfall in protective equipment,background,2020-04-20
we have to wake up: factory farms are breeding grounds for pandemics,background,2020-04-20
nina simone: where to start in her back catalogue,background,2020-04-20
epa faces court over backing of monsanto's controversial crop system,control,2020-04-20
i've never seen ... back to the future,background,2020-04-20
government officials who allegedly distributed malcolm turnbull's book face legal action,legislation,2020-04-20
canada shooting: gunman kills 16 people after rampage in nova scotia,shooting,2020-04-20
canada shooting: gunman kills 16 people after rampage in nova scotia,gun,2020-04-20
monday briefing: un agency bosses in plea for covid-19 aid,gun,2020-04-20
monday briefing: un agency bosses in plea for covid-19 aid,background,2020-04-20
nova scotia shooting: shock and surprise at killings by denturist,shooting,2020-04-20
"italy 3-2 brazil: 1982 world cup, second round group c – as it happened",background,2020-04-21
"italy 3-2 brazil: 1982 world cup, second round group c – as it happened",control,2020-04-21
"italy 3-2 brazil: 1982 world cup, second round group c – as it happened",background,2020-04-21
"italy 3-2 brazil: 1982 world cup, second round group c – as it happened",check,2020-04-21
"italy 3-2 brazil: 1982 world cup, second round group c – as it happened",automatic,2020-04-21
nova scotia shooting: death toll rises to 22 as more victims identified,shooting,2020-04-21
bullfinches and robins take back control of our gardens,background,2020-04-21
bullfinches and robins take back control of our gardens,control,2020-04-21
campaigners take legal action over £27bn uk road-building scheme,legislation,2020-04-21
tom brady seen training in closed tampa park during covid-19 shutdown,automatic,2020-04-21
us urges china to let lawyer return home after 'unjust detention',law,2020-04-21
home office ergonomics: how to work from home without breaking your back,background,2020-04-22
uk firms plan legal action against hiscox over covid-19 insurance claims,legislation,2020-04-22
manchester arena bomb survivors denied central role in inquiry,control,2020-04-22
"'checking the evil': ways to halt the advance of a cholera  pandemic - archive, 1866",check,2020-04-22
rui pinto lawyer hopes football leaks founder will soon be free,law,2020-04-22
slayer: where to start in their back catalogue,background,2020-04-22
set the night on fire by mike davis and jon wiener review – the real la in the 1960s,law,2020-04-22
set the night on fire by mike davis and jon wiener review – the real la in the 1960s,legislation,2020-04-22
"pay £2,000 for a room you can't use - or break the law?",law,2020-04-22
'there’s enormous screenshotting going on': how covid-19 changed the way we gossip,shooting,2020-04-23
"from an italian hotel to a us state, coronavirus ‘lawfare’ takes off",law,2020-04-23
no-prorogation justice lady hale to publish memoir and guide to the law,law,2020-04-23
xcom: chimera squad review – human-alien hybrids lay down the law,law,2020-04-23
'we’re in a prison': singapore's migrant workers suffer as covid-19 surges back,background,2020-04-23
coalition is aiming to change australia's environment laws before review is finished,law,2020-04-23
harry and meghan's mistimed attempt to control the tabloids will backfire,control,2020-04-23
'can we do this without breaking the law?' inside the first lockdown tv drama,law,2020-04-23
nova scotia shooting: residents ask why authorities didn't send emergency alert,shooting,2020-04-23
fixing jobkeeper: why the banks are not to blame for flaws in the wage scheme,law,2020-04-24
nova scotia gunman used fake police cruiser to flag down victims,gun,2020-04-24
rachel riley wins first round of court case against corbyn aide,background,2020-04-24
twelve hours of terror: how the nova scotia shooting rampage unfolded,shooting,2020-04-24
a trip around the world through local radio stations,background,2020-04-24
nfl draft 2020: bengals take lsu's burrow as first round goes to form – as it happened,background,2020-04-24
"hong kong being watched 'closely' over activist arrests, says un",gun,2020-04-24
"hong kong being watched 'closely' over activist arrests, says un",background,2020-04-24
"once we have a vaccine, how will it be shared fairly around the world?",background,2020-04-25
"coronavirus uk: 'entire nation is grieving' says priti patel as death tolls passes 20,000 - as it happened",legislation,2020-04-25
man arrested after gun fired at manchester funeral,gun,2020-04-25
has the government broken the law by putting nhs staff in harm's way?,law,2020-04-25
online auction of record-breaking whisky collection hit by cyber-attack,legislation,2020-04-25
"the art of lockdown: musicians, comedians and more on their isolation culture picks",legislation,2020-04-25
"coronavirus has stopped trials by jury, and that's not necessarily a bad thing",shooting,2020-04-26
police in england warn rural vigilantes not to take law into own hands during lockdown,law,2020-04-26
the state we're in: will the pandemic revolutionise the role of government?,control,2020-04-26
for my next trick: dynamo's mission to bring back magic,background,2020-04-26
donald trump set to fall back on xenophobia with re-election plan in tatters,background,2020-04-26
"to tackle this virus, local public health teams need to take back control",background,2020-04-26
"to tackle this virus, local public health teams need to take back control",control,2020-04-26
"morning mail: controversial drug trials go ahead, trump back briefing, doctors pose naked",control,2020-04-27
"morning mail: controversial drug trials go ahead, trump back briefing, doctors pose naked",background,2020-04-27
ministers meet unions and business to plan getting uk back to work,background,2020-04-27
in these challenging times the nation begs for hope: thus i have written a book about myself,legislation,2020-04-27
rwandan police chief accused of sexual assault of child refugee at un centre,gun,2020-04-27
rwandan police chief accused of sexual assault of child refugee at un centre,background,2020-04-27
trainers' cabal which called for nick rust's head needs swift reality check,check,2020-04-27
why 'half-educated' laurence fox is back after his question time fiasco,background,2020-04-27
wiley: where to start in his back catalogue,background,2020-04-27
'confusing and stressful': the debate around children and coronavirus as australian schools reopen,background,2020-04-27
trevor phillips role ‘undermines covid-19 bame inquiry’,control,2020-04-28
france announces 'progressive and controlled' lockdown exit plan,control,2020-04-28
surge in us gun sales and online searches raises fears of rise in suicides,gun,2020-04-28
shot in their friend's car: survivors on learning how to live after a shooting,shooting,2020-04-28
coronavirus has revealed the eu's fatal flaw: the lack of solidarity,law,2020-04-28
'a lot of people have relapsed’: isolation has been a mixed blessing for drug addicts,legislation,2020-04-28
back to the future: are drive-in theaters the future of safe cinema trips?,background,2020-04-29
"whirlpool extends fire fault checks to 55,000 uk washing machines",check,2020-04-29
britney spears: where to start in her back catalogue,background,2020-04-29
when crises collide: gun violence activists confront the deadly challenge of bullets and covid,gun,2020-04-29
jay-z takes action against 'deepfakes' of him rapping hamlet and billy joel,legislation,2020-04-29
lockdown is distorting our memories – but there are ways to regain control,control,2020-04-29
coronavirus pandemic threatens controversial fracking project in argentina,control,2020-04-29
"myanmar military may be repeating crimes against humanity, un rapporteur warns",gun,2020-04-29
"myanmar military may be repeating crimes against humanity, un rapporteur warns",background,2020-04-29
claims of 445% rise in australian green tape based on 'lazy' and 'flawed' analysis,law,2020-04-30
the next wave of coronavirus disruption? automation,automatic,2020-04-30
fifa takes action after swiss authorities drop part of sepp blatter investigation,legislation,2020-04-30
kentucky governor ends beef with tupac shakur over unemployment check,check,2020-04-30
uk treasury rushes to finalise coronavirus bounce back loan scheme,background,2020-04-30
us lawmakers demand jeff bezos testify over amazon’s 'possibly criminally false' statements,law,2020-05-01
"foreign office obstructed search for truth, say harry dunn lawyers",law,2020-05-01
colbert: trump 'wants everything to go back to normal because he’s bored',background,2020-05-01
sudan to outlaw female genital mutilation,law,2020-05-01
jeremy bamber lawyers seek review of cps refusal to disclose evidence,law,2020-05-01
iphone se review: apple's cut-price smartphone king,semi,2020-05-01
british lawyer sues eu over her removal from its court due to brexit,law,2020-05-01
data protection laws are great. shame they are not being enforced,law,2020-05-02
uk commuters may be asked to check temperature before travelling,check,2020-05-02
brassic: joe gilgun’s drama is ocean’s eleven by way of emmerdale – only better,gun,2020-05-02
is the gravity-defying manchester united brand facing a fall back to earth?,background,2020-05-02
covid-19 tracking app must satisfy human rights and data laws,law,2020-05-03
"parenting in a pandemic is hard, but the best thing about lockdown is looking after a baby",shooting,2020-05-03
women launch legal action to stop military courts trying uk rape cases,legislation,2020-05-03
show your mettle: victoria cross not made of captured russian guns after all,gun,2020-05-03
flight centre waives cancellation fees after consumer watchdog threatens legal action,legislation,2020-05-03
coronavirus news: malaysia rounds up migrants as un warns of crackdown on vulnerable – as it happened,background,2020-05-03
coronavirus news: malaysia rounds up migrants as un warns of crackdown on vulnerable – as it happened,gun,2020-05-03
coronavirus news: malaysia rounds up migrants as un warns of crackdown on vulnerable – as it happened,background,2020-05-03
isolation stories review – powerful snapshots of lockdown life,legislation,2020-05-04
the kinks: where to start in their back catalogue,background,2020-05-04
government releases draft legislation for covidsafe tracing app to allay privacy concerns,legislation,2020-05-04
government releases covid-19 app legislation – as it happened,legislation,2020-05-04
climate action under duress: how dutch were forced into emissions cuts,legislation,2020-05-04
football's future: 'pubs and clubs won't bounce back for many months',background,2020-05-05
greta thunberg and children's group hit back at attempt to throw out climate case,background,2020-05-05
essential poll: two-thirds of australians back aged-care homes on covid-19 visitor bans,background,2020-05-05
prisoner wins first round in challenge to terrorism law,background,2020-05-05
prisoner wins first round in challenge to terrorism law,law,2020-05-05
back to nature: 'secret garden' outings used to aid coronavirus recovery,background,2020-05-05
a bittersweet time travel back to edgbaston 2005: why not?,background,2020-05-05
conservation in crisis: why covid-19 could push mountain gorillas back to the brink,background,2020-05-05
"‘lager and fags were our main vices’: vic reeves on booze, guns and his rock’n’roll years",gun,2020-05-05
betsy devos rolls back obama-era guidance on campus sexual assault,background,2020-05-06
scott morrison wants australia to get back on the job. but what does a covid-safe workplace look like?,background,2020-05-06
eli manning predicts 'tough' start for tom brady with buccaneers,automatic,2020-05-06
'it's unnerving': lawrence wright on the eerie prescience of his pandemic novel,law,2020-05-06
laurie anderson: where to start in her back catalogue,background,2020-05-06
matt hancock says he backs any police action against neil ferguson,legislation,2020-05-06
america begins to reopen but businesses and customers in no rush to get back,background,2020-05-06
australian government stops listing major threats to species under environment laws,law,2020-05-07
no 10 battles to regain control of lockdown messaging amid fierce criticism,control,2020-05-07
"uk contact-tracing app could fall foul of privacy law, government told",law,2020-05-07
law council wants changes to secrecy laws invoked in ben roberts-smith defamation case,law,2020-05-07
law council wants changes to secrecy laws invoked in ben roberts-smith defamation case,law,2020-05-07
revealed: amazon told workers paid sick leave law doesn't cover warehouses,law,2020-05-07
nemanja matic: 'i've had my doubters. i knew i would prove them wrong',automatic,2020-05-07
'it's useful for viewers today': the film about a two-year voluntary isolation,legislation,2020-05-07
us government plans to urge states to resist 'high-risk' internet voting,shooting,2020-05-08
ve day 2020: 'never despair' - queen addresses nation on 75th anniversary — as it happened,legislation,2020-05-08
pandemic nesters: what it's like to move back with your parents during lockdown,background,2020-05-08
"shock, fear and unease loom over bame athletes before return to action",legislation,2020-05-08
lisa nandy: uk faces 'serious reckoning' about global role,control,2020-05-08
manchester police refer taser shooting of man with child to iopc,shooting,2020-05-08
"ease lockdown for angling, shooting and bowls, urge lobbyists",shooting,2020-05-08
once again a battle-scarred britain must find a new role in the world,control,2020-05-08
armed black citizens escort michigan lawmaker to capitol after volatile rightwing protest,law,2020-05-08
ahmaud arbery: former police officer and son charged in shooting of black jogger,shooting,2020-05-08
ahmaud arbery killing: man called 911 to report 'black male running' prior to shooting,shooting,2020-05-08
isolating but not isolated – a photo essay of lives in lockdown,legislation,2020-05-09
back to work: 'capacity of transport network will be down by 90%',background,2020-05-09
anti-racism group stage stretford protest over police stun gun shooting,gun,2020-05-09
anti-racism group stage stretford protest over police stun gun shooting,shooting,2020-05-09
in leaked conversation obama says us 'rule of law' at risk after flynn case dropped,law,2020-05-09
"uk coronavirus: 'this is not the time to end the lockdown,' says boris johnson in address to nation – as it happens",legislation,2020-05-10
police urged to justify use of stun guns against black men,gun,2020-05-10
outrage! turns 30: lgbt activists seek truth over police  role,control,2020-05-10
police watchdog investigates london stun gun shooting,gun,2020-05-10
police watchdog investigates london stun gun shooting,shooting,2020-05-10
premier league hopes to finish season at home grounds not neutral venues,background,2020-05-11
racing committed to june return after sport sent back to drawing board,background,2020-05-11
nova scotia shooting: police launch ‘psychological autopsy’ of gunman for clues,shooting,2020-05-11
nova scotia shooting: police launch ‘psychological autopsy’ of gunman for clues,gun,2020-05-11
grateful dead: where to start in their back catalogue,background,2020-05-11
we can't restart britain's economy until we get coronavirus under control,control,2020-05-11
i wish more people would read ... the diary of a provincial lady by em delafield,semi,2020-05-11
"tony slattery: 'this terrible thing still weighs on me. why, after all this time?'",shooting,2020-05-11
coronavirus us live: fauci testifies pandemic is not 'under control' in america – as it happened,control,2020-05-12
millions with health conditions at risk from covid-19 'if forced back to work',background,2020-05-12
reality check: fauci offers coded rebuke to trump’s rush to reopen,check,2020-05-12
supreme court grills trump lawyers over president's unreleased tax returns,law,2020-05-12
fauci says us reopening could trigger outbreak 'you might not be able to control',control,2020-05-12
"benefit claimants unlawfully short-changed, court rules",law,2020-05-12
covidsafe phone app legislation passes lower house – as it happened,legislation,2020-05-12
the green shoots of women's cricket are tougher than they look,shooting,2020-05-12
'we wrap services around women': brazil's innovative domestic violence centre,background,2020-05-12
tv tonight: checking in with india's top scottish football manager,check,2020-05-12
"government commits $150m to bushfire-affected wildlife but more action needed, conservationists say",legislation,2020-05-12
"brexit will mean checks on goods crossing irish sea, government admits",check,2020-05-13
'it’s a way of life' – relief and elation as golf and tennis resume across england,legislation,2020-05-13
nova scotia shooting: ex-neighbours say they warned police about gunman,shooting,2020-05-13
nova scotia shooting: ex-neighbours say they warned police about gunman,gun,2020-05-13
"falls in gun and knife crime a 'silver lining' to pandemic, says met chief",gun,2020-05-13
"troubles troops amnesty could break law, said northern irish watchdog",law,2020-05-13
"right now, the only thing staving off a collapse in the social order is the state",shooting,2020-05-13
hungary's coronavirus laws prompt new showdown with brussels,law,2020-05-13
'a bloody method of control': the struggle to take down europe's razor wire walls,control,2020-05-13
faithless electors: us supreme court to weigh role of electoral college members,control,2020-05-13
breonna taylor shooting: hunt for answers in case of black woman killed by police,shooting,2020-05-14
'it’s working fantastically': two parents on adjusting to their lockdown role of proxy teacher,control,2020-05-14
chinese threat prompts calls for uk to toughen company takeover laws,law,2020-05-14
questions remain over whether data collected by covidsafe app could be accessed by us law enforcement,law,2020-05-14
new zealand budget: $1bn for 'nature jobs' but dismay at lack of climate action,legislation,2020-05-14
lockdown bank statements: 'habits that helped control my spending went out the window',control,2020-05-15
"indefinite detention or family separation? us forced immigrants to choose, lawyers say",law,2020-05-15
uk coronavirus live: matt hancock defends easing lockdown as r number shown to be close to 1  - as it happened,control,2020-05-15
uk coronavirus live: matt hancock defends easing lockdown as r number shown to be close to 1  - as it happened,background,2020-05-15
"rushed uk coronavirus laws led to wrongful convictions, say police",law,2020-05-15
"mothers in labour, pregnant women and babies were kabul gunmen's target  - msf",gun,2020-05-15
met police officer investigated after man shot with taser stun gun is left paralysed,gun,2020-05-15
is there such a thing as bad wine?,shooting,2020-05-15
westpac admits it broke law over customers' transactions allegedly linked to child exploitation,law,2020-05-15
meet the gun safety instructor holding 'office hours' on zoom,gun,2020-05-15
country diary: nature is taking back control of the golf course,background,2020-05-15
country diary: nature is taking back control of the golf course,control,2020-05-15
amal clooney urges australia to pass magnitsky law to help protect global human rights,law,2020-05-15
"jobkeeper payment: check your eligibility, how much it's worth and when it should start getting paid",check,2020-05-15
"rough sleepers must not be put back on streets after lockdown, says top tory",background,2020-05-16
government faces legal action over refusal to publish sage minutes,legislation,2020-05-16
phil may of the pretty things: agent of chaos who fought the laws of pop,law,2020-05-16
house to allow remote voting for first time in 231-year history – as it happened,shooting,2020-05-16
pelosi: trump firing of steve linick could be ‘unlawful if it's retaliation',law,2020-05-17
"britons back at work could be using unsafe ppe, experts warn",background,2020-05-17
robodebt: centrelink to issue hundreds of thousands of class action notices for trial,legislation,2020-05-17
allow dentists to go back to work now,background,2020-05-17
'like losing control': fears eating disorders on rise amid lockdown,control,2020-05-17
ahmaud arbery: new focus on district attorney’s flawed prosecutions of black women,law,2020-05-17
my self-control has gone. i'll take anything that's delivered to my door,control,2020-05-17
from colditz to silverstone: the incredible tale of tony rolt,control,2020-05-17
"as lockdown consensus unravels, boris johnson divides nation and party",legislation,2020-05-17
"hs2’s costs and potential delays are running out of control, warn mps",control,2020-05-17
premier league will be allowed to ride shotgun into unknown frontier,gun,2020-05-18
"we should be overhauling the school system, not rushing to send children back",background,2020-05-18
man shot with stun gun by manchester police to sue chief constable,gun,2020-05-18
hong kong activists back in court amid more legislative chaos,background,2020-05-18
hong kong activists back in court amid more legislative chaos,legislation,2020-05-18
"‘they don’t give him enough credit’: the voters who back trump, even through the pandemic",background,2020-05-18
queensland criticised for holding back rapid covid-19 testing in remote aboriginal communities,background,2020-05-18
unconvicted terrorism suspects face indefinite controls under uk bill,control,2020-05-19
nova scotia police under scrutiny as new details of shooting response revealed,shooting,2020-05-19
"man killed by hitmen in mistaken identity shooting, met police say",shooting,2020-05-19
'criminalization of blackness': arbery lawyer weighs in on 2017 taser incident,law,2020-05-19
member states back who after renewed donald trump attack,background,2020-05-19
republican attorneys general back barr's bid to drop case against flynn,background,2020-05-19
david squires on … biosecurity and the bundesliga: fussball is back,background,2020-05-19
"millions of us farm animals to be culled by suffocation, drowning and shooting",shooting,2020-05-19
"to prevent a second coronavirus wave, we need to look beyond the r number",control,2020-05-19
"to prevent a second coronavirus wave, we need to look beyond the r number",background,2020-05-19
exclusive: 12 die as malta uses private ships to push migrants back to libya,background,2020-05-19
australia hits back at 'provocative' and 'cheap' chinese embassy comments on covid-19 inquiry,background,2020-05-19
what checks will there be on goods crossing irish sea?,check,2020-05-20
wednesday briefing: track and trace put back to june,background,2020-05-20
"lights, camera, no action: thai films banned from shooting love scenes during covid-19",legislation,2020-05-20
"lights, camera, no action: thai films banned from shooting love scenes during covid-19",shooting,2020-05-20
apple whistleblower goes public over 'lack of action',legislation,2020-05-20
trump to pull us out of third arms control deal,control,2020-05-21
'this is the end of hong kong': china pushes controversial security laws,control,2020-05-21
'this is the end of hong kong': china pushes controversial security laws,law,2020-05-21
hong kong’s security laws: what are they and why are they so controversial?,law,2020-05-21
hong kong’s security laws: what are they and why are they so controversial?,control,2020-05-21
uk economy set for slow rebound from 'unprecedented slump',background,2020-05-21
lana del rey hits back at critics who say she 'glamorises abuse',background,2020-05-21
"siege mentality: gangs of london episode five is a televisual, action feast",legislation,2020-05-21
suriname election: can pandemic help outlaw leader get away with murder?,law,2020-05-21
