headlines,terms,dates
boris johnson forced to reduce huawei’s role in uk’s 5g networks,control,2020-05-22
joe biden accuser tara reade let go by lawyer,law,2020-05-22
chinese security forces could be deployed in hong kong under new law,law,2020-05-22
chris woakes says england players would welcome back alex hales,background,2020-05-22
global markets fall as china moves to tighten control over hong kong,control,2020-05-22
china is foisting an anti-sedition law on hong kong that will change it for ever,law,2020-05-22
"khashoggi sons' pardon is step towards killers' release, says un investigator",gun,2020-05-22
"khashoggi sons' pardon is step towards killers' release, says un investigator",background,2020-05-22
uk approval for biggest gas power station in europe ruled legal,legislation,2020-05-22
frustrated contracts: the law is on your side over holiday refunds,law,2020-05-22
fear and fighting spirit in hong kong as china 'rams through' security law,law,2020-05-22
hong kong crisis: china presents security laws banning subversion and separatism,law,2020-05-22
global outrage erupts over china's ‘draconian' security law for hong kong,law,2020-05-23
jeff sessions snaps back after trump tells alabama not to trust him,background,2020-05-23
"‘it was our life, but larger than life’: how la haine lit a fire under french society",law,2020-05-23
"‘it was our life, but larger than life’: how la haine lit a fire under french society",legislation,2020-05-23
chris patten: china's security laws a betrayal of hong kong people,law,2020-05-23
"australia’s ‘failing’ environmental laws will fuel further public health crises, nobel laureate warns",law,2020-05-24
climate change critical issue in eden-monaro byelection as six in 10 voters say more action needed by government,legislation,2020-05-24
"one law for dominic cummings, another for the rest of us",law,2020-05-24
eureka moment?  law firms report rush to patent ideas amid uk lockdown,law,2020-05-24
did dominic cummings break the law on lockdown rules?,law,2020-05-24
fumbling the nuclear football: is trump blundering to arms control chaos?,control,2020-05-24
beijing to impose hong kong security laws 'without delay',law,2020-05-24
islamic state is back and this time the west is ill-prepared to take it on,background,2020-05-24
"alan ayckbourn: 'people went back to theatres after the plague, but they didn't have netflix then, did they?'",background,2020-05-24
"butter, pasta, massage guns… the strange world of lockdown essentials",gun,2020-05-24
"lockdown playlists for every mood, part one: chosen by jarvis cocker, haim and lianne la havas",law,2020-05-24
"lockdown playlists for every mood, part one: chosen by jarvis cocker, haim and lianne la havas",legislation,2020-05-24
hong kong protests: police fire teargas as thousands rally against beijing's national security law,law,2020-05-24
"with restaurant doors still shut, there’s only one thing to be done: order a takeaway",shooting,2020-05-24
cancelled weddings – refusal to issue refund may be breach of law,law,2020-05-25
"fbi investigating ahmaud arbery shooting as possible hate crime, lawyer says",shooting,2020-05-25
"fbi investigating ahmaud arbery shooting as possible hate crime, lawyer says",law,2020-05-25
johnson and cummings have revealed their flawed view of what strong leadership is,law,2020-05-25
"cummings' actions show government cannot be trusted, says adviser",legislation,2020-05-25
sonic youth: where to start in their back catalogue,background,2020-05-25
rolf hochhuth obituary,control,2020-05-25
"frydenberg’s changes to shareholder class actions smack of ‘cronyism’, lawyers say",legislation,2020-05-25
"frydenberg’s changes to shareholder class actions smack of ‘cronyism’, lawyers say",law,2020-05-25
‘turn back this wave of hate’: 100 writers call for an end to anti-asian hostility,background,2020-05-25
auto windscreens owner imposes pay cut on staff  unilaterally,automatic,2020-05-25
snowpiercer review – steampunk law & order is a trashy treat,law,2020-05-25
the match: tiger woods & peyton manning beat phil mickelson & tom brady – as it happened,automatic,2020-05-25
coronavirus cases and deaths over time: how countries compare around the world,background,2020-05-26
"morning mail: malka leifer ruling, strip-search class action, new jk rowling book",legislation,2020-05-26
serial rapist breaks back in corfu cliff fall on run from police,background,2020-05-26
anger over dominic cummings’ actions has ‘encouraged lockdown rule-breaking’,legislation,2020-05-26
hungarian government to end orbán's rule-by-decree legislation,legislation,2020-05-26
law firms look to launch landmark strip-search class action against nsw police,law,2020-05-26
law firms look to launch landmark strip-search class action against nsw police,legislation,2020-05-26
bame people fined more than white population under coronavirus laws,law,2020-05-26
first-time conservative voters react to cummings controversy,control,2020-05-26
'a lot of benign neglect’: how ghana’s social changes are isolating older people,legislation,2020-05-26
working from home has a long history – be careful what you wish for not wanting to go back to the office,background,2020-05-26
mcmillions review – a rip-roaring romp around the mcdonald's monopoly scandal,background,2020-05-27
"sally challen can inherit controlling husband's estate, rules judge",control,2020-05-27
boral hit by shareholder class action despite law change only days ago,legislation,2020-05-27
boral hit by shareholder class action despite law change only days ago,law,2020-05-27
"law student shot dead in crossfire of business dispute, court told",law,2020-05-27
wu-tang clan: where to start in their group and solo back catalogues,background,2020-05-27
"with an ally in control of the party machine, keir starmer’s victory is complete",control,2020-05-27
my favourite game: tom watson tames birkdale to win his fifth open,automatic,2020-05-27
first thing: twitter has started fact-checking trump's tweets,check,2020-05-27
how south africa’s action on covid-19 contrasts sharply with its response to aids,legislation,2020-05-27
austerity and victim blaming: scott morrison goes back to the old politics,background,2020-05-27
"vicforests breached threatened species laws with central highlands logging, court rules",law,2020-05-27
rúben neves: 'it’s good to have back the sensations of football',background,2020-05-28
uk says it will extend hongkongers' visa rights if china pursues security laws,law,2020-05-28
premiership will not adopt world rugby’s law trials to reduce virus risk,law,2020-05-28
chinese parliament approves controversial hong kong security law,control,2020-05-28
chinese parliament approves controversial hong kong security law,law,2020-05-28
hong kong: what are the implications of china's anti-sedition laws?,law,2020-05-28
why the officers fired for the george floyd killing could ultimately get their jobs back,background,2020-05-28
donald trump's move against twitter factchecking could backfire,check,2020-05-28
'trump knows nothing of minneapolis': mayor hits back at president's tweets,background,2020-05-29
coronavirus australia news: stuart robert defends actions as minister and ongoing centrelink debt recovery – as it happened,legislation,2020-05-29
the chaser goes viral with provocative post mocking zuckerberg’s position on facebook factchecking,check,2020-05-29
trevor phillips has played no role in bame covid-19 deaths review,control,2020-05-29
anger in china at law ordering 'cooling-off' period before divorce,law,2020-05-29
country diary: an unpopular pest that plays a vital role,control,2020-05-29
todd muller’s beige persona might not be a bad thing in the battle against jacinda ardern,shooting,2020-05-29
robodebt scandal: leak reveals unlawful debts predate 2015 but government has no plans to pay back money,law,2020-05-30
robodebt scandal: leak reveals unlawful debts predate 2015 but government has no plans to pay back money,background,2020-05-30
australia's national environment laws 'actually allow extinction to happen',law,2020-05-30
letters: dominic cummings’ actions damage public trust,legislation,2020-05-30
deadly shooting outside oakland courthouse as protests rage,shooting,2020-05-30
policing in the us is not about enforcing law. it’s about enforcing white supremacy,law,2020-05-30
us gun owners aim firearms at their genitals to settle feud within community,gun,2020-05-30
"england to limit students going to wales, scotland and n ireland",gun,2020-05-30
"england to limit students going to wales, scotland and n ireland",control,2020-05-30
"england to limit students going to wales, scotland and n ireland",legislation,2020-05-30
"england to limit students going to wales, scotland and n ireland",background,2020-05-30
"england to limit students going to wales, scotland and n ireland",shooting,2020-05-30
juukan gorge: rio tinto blasting of aboriginal site prompts calls to change antiquated laws,law,2020-05-30
facebook declines to take action against trump statements,legislation,2020-05-30
youtube star jake paul denies looting arizona mall during george floyd protests,shooting,2020-05-31
spacex dragon crew capsule docks at international space station,legislation,2020-05-31
lawyers' poems deal with trials of delivering lockdown justice,law,2020-05-31
"in a polarised world, even checking facts on twitter becomes politicised",check,2020-05-31
pest control for indoor plants,control,2020-05-31
premiership's return to action will give clubs plenty of food for thought,legislation,2020-05-31
critics round on no 10 over 'ridiculous' rules for 14-day quarantine,background,2020-06-01
coalition won’t rule out passing new laws to reboot robodebt scheme,law,2020-06-01
‘rotten racism’: newspapers around the world react to george floyd protests,background,2020-06-01
bob dylan: where to start in his back catalogue,background,2020-06-01
"boxer sam cox: 'i've delivered around 15,000 nhs meals personally'",background,2020-06-01
k number: what is the coronavirus metric that could be crucial as lockdown eases?,background,2020-06-01
k number: what is the coronavirus metric that could be crucial as lockdown eases?,check,2020-06-01
george floyd: protests take place in cities around the world,background,2020-06-01
‘it could have a chilling effect’: why trump is ramping up attacks on mail-in voting,shooting,2020-06-01
mps join 90-minute-long queue to vote to end virtual voting,shooting,2020-06-02
trump and biden offer starkly different visions with nation at a crossroads,legislation,2020-06-02
the guardian view on bame britain and covid-19: action not words required,legislation,2020-06-02
forcing mps back to westminster reveals the government's real view of parliament,background,2020-06-02
anthony grainger: police misconduct case over shooting collapses,shooting,2020-06-02
george floyd protests around the us: what is happening?,background,2020-06-02
raab calls for alliance to force china to step back over hong kong,background,2020-06-02
looting and violence continues in new york city despite unprecedented curfew,shooting,2020-06-02
smoking gun review – week-long interactive whistleblower thriller,gun,2020-06-02
'it is much worse': veterans of hong kong's 2003 protests fear new law,law,2020-06-02
tiger king's carole baskin handed control of joe exotic's zoo,control,2020-06-02
saudi arabia to co-host un fundraising summit for yemen,gun,2020-06-02
saudi arabia to co-host un fundraising summit for yemen,background,2020-06-02
"us may take in hongkongers ahead of china security laws, pompeo suggests",law,2020-06-02
kentucky police chief fired after shooting kills barbecue restaurant owner,shooting,2020-06-02
"morning mail: george floyd charges, flawed coronavirus study, madeline mccann suspect",law,2020-06-03
calls for review of forestry exemption laws after vicforests conservation breaches,law,2020-06-03
nsw race hate laws not used in two years since introduction,law,2020-06-03
"my lockdown fantasy: i wish i was back in the bustling, mind-blowing beauty of phnom penh",background,2020-06-03
"majority of australians believe class action lawsuits a good thing, essential poll finds",legislation,2020-06-03
"majority of australians believe class action lawsuits a good thing, essential poll finds",law,2020-06-03
anson dorrance: 'we raise young women to not be competitive. what the heck is going on?',check,2020-06-03
beijing draws up plans to outlaw criticism of traditional chinese medicine,law,2020-06-03
nsw police commissioner says officer who slammed indigenous teen to ground ‘had a bad day’,background,2020-06-03
hong kong protesters hold banned tiananmen vigil as anthem law is passed,law,2020-06-04
spain says british tourists welcome back once uk clarifies policy,background,2020-06-04
jessie ware: what's your pleasure? review – dancefloor diva back where she belongs,background,2020-06-04
un experts condemn modern-day ‘racial terror’ lynchings in us,gun,2020-06-05
un experts condemn modern-day ‘racial terror’ lynchings in us,background,2020-06-05
global report: eu pledges to lift internal border controls by end of month,control,2020-06-05
malawi factories ordered to close after ignoring plastics ban,law,2020-06-05
covid-19: r value in england rises to between 0.7 and 1.0,control,2020-06-05
covid-19: r value in england rises to between 0.7 and 1.0,background,2020-06-05
"vitamin k found in some cheeses could help fight covid-19, study suggests",background,2020-06-05
"vitamin k found in some cheeses could help fight covid-19, study suggests",check,2020-06-05
will tim davie protect bbc's role as britain's public broadcaster?,control,2020-06-05
british airways considers legal action over uk quarantine,legislation,2020-06-05
'show respect and listen': scenes from australia’s first indigenous-run police station,legislation,2020-06-05
england could suspend sunday trading laws in push to boost economy,law,2020-06-06
beijing’s lessons and laws: why hong kong families are looking to britain,law,2020-06-07
"after sally challen, we now have a chance to tackle coercive control",control,2020-06-07
trump's use of the military backfired – but will it back him if he refuses to go?,background,2020-06-07
"anti-buyout law would hit uk recovery, say business groups",law,2020-06-08
parents back call by uk teacher to help end 'white supremacy',background,2020-06-08
'we're not doing guns': elmer fudd loses his wight to bear arms,gun,2020-06-08
man drives car into seattle protest crowd and shoots demonstrator,shooting,2020-06-08
first arrivals under uk quarantine rules: 'they didn't even check my temperature',check,2020-06-08
'i can't breathe': why george floyd's words reverberate around the world,background,2020-06-08
minneapolis lawmakers vow to disband police department in historic move,law,2020-06-08
uk extremists ‘exploiting gaps in law to push their agenda’,law,2020-06-09
neville lawrence: black people still second-class citizens in britain,law,2020-06-09
"world faces worst food crisis for at least 50 years, un warns",gun,2020-06-09
"world faces worst food crisis for at least 50 years, un warns",background,2020-06-09
"prince andrew charity broke law by paying trustee £350,000",law,2020-06-09
"in case you missed it, trump's former lawyer compared protesters to terrorists",law,2020-06-09
protesters across us attacked by cars driven into crowds and men with guns,gun,2020-06-09
woman stripped of australian citizenship over alleged isis role launches bid to overturn law,control,2020-06-09
woman stripped of australian citizenship over alleged isis role launches bid to overturn law,law,2020-06-09
hundreds of ex-us officials urge review of barr's role in protest crackdown,control,2020-06-10
director of public prosecutions threatened with legal action over failure to investigate dominic cummings,legislation,2020-06-10
"uk coronavirus border controls more effective if done earlier, mps told",control,2020-06-10
patti smith: where to start in her back catalogue,background,2020-06-10
french government to launch legal action against bear killers,legislation,2020-06-10
london sisters found dead were daughters of c of e’s first female bame archdeacon,control,2020-06-10
london sisters found dead were daughters of c of e’s first female bame archdeacon,background,2020-06-10
london sisters found dead were daughters of c of e’s first female bame archdeacon,check,2020-06-10
london sisters found dead were daughters of c of e’s first female bame archdeacon,automatic,2020-06-10
"yg, che lingo, kendrick lamar: the protest songs of black lives matter 2020",check,2020-06-10
universities hit back at china's 'unjustified' warning to students that australia is unsafe,background,2020-06-10
mark duggan shooting: can forensic tech cast doubt on official report?,shooting,2020-06-10
sevilla 2-0 real betis: la liga resumes after shutdown - as it happened!,law,2020-06-11
sevilla 2-0 real betis: la liga resumes after shutdown - as it happened!,legislation,2020-06-11
northern ireland police identify gun used in lyra mckee's murder,gun,2020-06-11
irish government contacts uae over crime boss role in fury-joshua bout,control,2020-06-11
probation services to return to public control after grayling disasters,control,2020-06-11
afl 2020 season restart: collingwood and richmond draw in first game back – as it happened,background,2020-06-11
hong kong to establish new police unit to enforce new security laws,law,2020-06-11
backlash grows over greek energy deregulation law,law,2020-06-11
uk coronavirus: grant shapps denies chief nurse dropped from no 10 briefing ‘after refusing to back dominic cummings’ — as it happened,background,2020-06-12
brexit: full controls on goods entering uk will not apply until july 2021,control,2020-06-12
afl 2020 season restart: geelong beat hawthorn in round 2 – as it happened,background,2020-06-12
"the best recent science fiction, fantasy and horror – review roundup",background,2020-06-12
‘long overdue’: lawmakers declare racism a public health emergency,law,2020-06-12
matt hancock faces legal action from daughter of covid-19 care home victim,legislation,2020-06-12
