headlines,terms,dates
"march madness canceled over coronavirus as mlb, mls and nhl suspend action",legislation,2020-03-12
doing the properest thing of all in football,shooting,2020-03-12
scott morrison addresses the nation about covid-19 response – as it happened,legislation,2020-03-12
"tom hanks and rita wilson's travels: selfies, shows and beachside strolls before coronavirus diagnosis",automatic,2020-03-12
tom hanks and wife rita wilson test positive for coronavirus in australia,automatic,2020-03-12
bridget mckenzie warned by legal expert 'ignorance of the law is no excuse',law,2020-03-12
'potentially dangerous': one nation's tactics at family law inquiry concern women's advocates,law,2020-03-13
revolutionary guards to enforce coronavirus controls in iran,control,2020-03-13
tom hanks on coronavirus isolation: 'we are taking it one day at a time',automatic,2020-03-13
tom hanks on coronavirus isolation: 'we are taking it one day at a time',legislation,2020-03-13
the best recent science fiction and fantasy – review roundup,background,2020-03-13
splendid isolation: what will you learn?,legislation,2020-03-13
is my dark vanessa the most controversial novel of the year? author kate elizabeth russell speaks out,control,2020-03-13
"new york woman was shackled to bed during childbirth, lawsuit says",law,2020-03-14
children and family law: 'how can you share parenting with an abusive parent?',law,2020-03-14
"on stage and screen, artists back a cause: black hair matters",background,2020-03-14
'i can't get above water': how america's chicken giant perdue controls farmers,control,2020-03-14
"write a diary, take action: hubei residents on fighting coronavirus anxiety",legislation,2020-03-15
"the doors have closed on la liga, just like front doors all over spain",law,2020-03-16
"the doors have closed on la liga, just like front doors all over spain",legislation,2020-03-16
us sales of guns and ammunition soar amid coronavirus panic buying,gun,2020-03-16
good news for a nation that loves bickering: coronavirus is the new brexit,legislation,2020-03-16
"if coronavirus scares you, read this to take control over your health anxiety",control,2020-03-16
why australia is not shutting schools to help control the spread of coronavirus,control,2020-03-16
law council wants family law inquiry discontinued after one nation live broadcast hearings,law,2020-03-17
law council wants family law inquiry discontinued after one nation live broadcast hearings,law,2020-03-17
law council wants family law inquiry discontinued after one nation live broadcast hearings,legislation,2020-03-17
from aphex twin to al green: the most soothing songs to self-isolate with,shooting,2020-03-17
"tom brady's next move: hollywood, tampa bay or the las vegas strip?",automatic,2020-03-17
"how to survive isolation with your roommates, your partner, your kids – and yourself",legislation,2020-03-17
migration: un agency decries return of boat with 49 people to libya,gun,2020-03-17
migration: un agency decries return of boat with 49 people to libya,background,2020-03-17
metro bank hit with fresh lawsuit by iranian customers,law,2020-03-17
"'come back monday, ok?' hundreds of prisoners escape in brazil amid covid-19 anger",background,2020-03-17
"online political ads should be labelled, says law commission",law,2020-03-17
jenrick announces coronavirus law to ban eviction of tenants,law,2020-03-18
what coronavirus lockdowns have meant around the world,background,2020-03-18
"tom brady will have more fun in tampa, but will he win?",automatic,2020-03-18
labour mps alarmed at covid-19 laws being passed without vote,law,2020-03-18
pandemic primary: why i volunteered at a polling station despite coronavirus,legislation,2020-03-18
new zealand passes landmark law to decriminalise abortion,law,2020-03-18
billion-dollar wildlife industry in vietnam under assault as law drafted to halt trading,law,2020-03-18
"i'm a teacher in italian quarantine, and e-learning is no substitute for the real thing",shooting,2020-03-18
new zealand police to carry out spot checks to ensure tourists self-isolate amid covid-19,check,2020-03-18
'focus only on what you can control': a solo round-the-world sailor on isolation,control,2020-03-19
'focus only on what you can control': a solo round-the-world sailor on isolation,legislation,2020-03-19
'suddenly i have no paycheck': layoffs and cuts for workers rocked by coronavirus,check,2020-03-19
"australia's overcrowded prisons could struggle to control coronavirus, expert says",control,2020-03-19
incontinence: how women are regaining bladder control,control,2020-03-20
the best recent crime novels – review roundup,background,2020-03-20
'nature is taking back venice': wildlife returns to tourist-free city,background,2020-03-20
tom hanks 'not great … but feeling better every day' after coronavirus diagnosis,automatic,2020-03-20
'i'm praying we'll be back to work:' what it's like to lose your job in a pandemic,background,2020-03-20
"buy plays, donate tickets, protect workers: an action plan for theatre during covid-19",legislation,2020-03-20
us coronavirus: democrats block bill over lack of worker aid as trump briefs nation – as it happened,legislation,2020-03-22
afl goes into damage control in face of serious threat,control,2020-03-22
mark wahlberg: 'i was a little rough around the edges',background,2020-03-22
emergency coronavirus legislation passed by mps without opposition,legislation,2020-03-23
'everyone will be contaminated': prisons face strict coronavirus controls,control,2020-03-23
kraftwerk: where to start in their back catalogue,background,2020-03-23
gangs of new zealand: explosion of violence prompts fears police have lost control,control,2020-03-23
england v germany: euro 96 semi-final – as it happened,semi,2020-03-24
uk abortion law briefly changes during covid-19 outbreak,law,2020-03-24
rihanna: where to start in her back catalogue,background,2020-03-24
hinkley point c work to carry on but hs2 could be paused,control,2020-03-24
hinkley point c work to carry on but hs2 could be paused,background,2020-03-24
hinkley point c work to carry on but hs2 could be paused,check,2020-03-24
hinkley point c work to carry on but hs2 could be paused,automatic,2020-03-24
stuart robert’s incompetence on mygov should accelerate his own social isolation,legislation,2020-03-24
christchurch gunman pleads guilty to new zealand mosque attacks that killed 51,gun,2020-03-25
hitmen review – mel and sue swap glazed buns for silenced guns,gun,2020-03-25
ai program could check blood for signs of lung cancer,check,2020-03-25
'you don’t want people judging your decor': hosting tv news at home,shooting,2020-03-25
uk cooperation with us over two alleged isis killers ruled unlawful,law,2020-03-25
domains review – eerie echoes of a world in isolation,legislation,2020-03-25
covid-19: call for fast-track registration of refugee doctors in uk,legislation,2020-03-25
the fall: where to start in their back catalogue,background,2020-03-25
"schengen: how passport controls vanished in europe - archive, 1995",control,2020-03-25
"coronavirus: 'nature is sending us a message’, says un environment chief",gun,2020-03-25
"coronavirus: 'nature is sending us a message’, says un environment chief",background,2020-03-25
"urgent action needed as rise in porn site traffic raises abuse fears, say mps",legislation,2020-03-25
covid-19 is nature's wake-up call to complacent civilisation,legislation,2020-03-25
border force blames nsw health for letting ruby princess dock without coronavirus checks,check,2020-03-25
mps no longer to get automatic vote on constituency boundary plans,automatic,2020-03-26
covid-19 checkpoints a possibility as ecb considers staging internationals,check,2020-03-26
alice coltrane: where to start in her back catalogue,background,2020-03-26
the 25 best tom hanks films – ranked!,automatic,2020-03-26
us gun industry groups urge lawmakers to keep gun shops open,gun,2020-03-26
us gun industry groups urge lawmakers to keep gun shops open,law,2020-03-26
us gun industry groups urge lawmakers to keep gun shops open,gun,2020-03-26
"a hit, a writ: why music is the food of plagiarism lawsuits",law,2020-03-26
nsw port authority warned in january of ‘gaping hole’ in coronavirus biosecurity checks,check,2020-03-26
"'my heartthrob days are over': joe wicks on health, happiness – and training the nation",legislation,2020-03-26
sydney airport chaos after nsw brings in coronavirus temperature checks for all arrivals,check,2020-03-26
"$1,200 stimulus checks for all? what to know about the us coronavirus bailout",check,2020-03-26
australia’s civil liberties under coronavirus: advocates warn laws must be temporary,law,2020-03-26
trump signs $2.2tn coronavirus stimulus package into law,law,2020-03-27
richard parks: from record-breaking solitude in antarctica to flat isolation,legislation,2020-03-27
libya fighting intensifies as rival forces defy un call for global ceasefire,gun,2020-03-27
libya fighting intensifies as rival forces defy un call for global ceasefire,background,2020-03-27
"we ran and we ran, and now we’ve found ourselves back in 1978",background,2020-03-27
trump administration allows companies to break pollution laws during coronavirus pandemic,law,2020-03-27
james bond gun collection stolen in london raid,gun,2020-03-27
"back poor countries fighting covid-19 with trillions or face disaster, g20 told",background,2020-03-27
fiona apple: where to start in her back catalogue,background,2020-03-27
'stranded at sea': cruise ships around the world are adrift as ports turn them away,background,2020-03-27
isolation will fuel gambling addiction. we must protect those at risk,legislation,2020-03-27
we must take drastic action but let’s not turn into a nation of little tyrants,legislation,2020-03-28
we must take drastic action but let’s not turn into a nation of little tyrants,legislation,2020-03-28
"checkpoints, fines and online shaming: police struggle to enforce tough new rules",check,2020-03-28
frederick barclay threatens legal action as ritz hotel is sold,legislation,2020-03-28
'focus on the things you can control': how to cope with radical uncertainty,control,2020-03-28
shaved eyebrows and isolation nudes: how rappers are surviving quarantine,legislation,2020-03-28
children’s books roundup – the best new picture books and novels,background,2020-03-28
trump invokes defense production act law to compel gm to supply ventilators,law,2020-03-28
skirting round the blackout blinds,background,2020-03-29
the guardian view on hungary's coronavirus law: orbán's power grab,law,2020-03-29
spain calls for action from europe as daily death toll rises again,legislation,2020-03-29
australian authorities to check every proposed foreign investment during coronavirus crisis,check,2020-03-29
state control over women's bodies is an unforeseen outcome of the coronavirus crisis,control,2020-03-29
"out with pub bores, back in with the experts",background,2020-03-29
met to face judicial review over role of school police officers,control,2020-03-30
fact check: will covid-19 fade in the summer – then return later like the flu?,check,2020-03-30
hungary passes law that will let orbán rule by decree,law,2020-03-30
curtis mayfield: where to start in his back catalogue,background,2020-03-30
"spirit journey: one man's role in a 6,000-mile run through north america",control,2020-03-30
"as the west is in lockdown, china is slowly getting back to business",background,2020-03-30
juventus 2-3 manchester united: 1999 champions league semi-final – as it happened,semi,2020-03-31
rio tinto accused of violating human rights in bougainville for not cleaning up panguna mine,gun,2020-03-31
can people of colour trust the uk covid-19 laws with the police's track record?,law,2020-03-31
scottish lawyers call plan to suspend jury trials 'kneejerk reaction',law,2020-03-31
"hungary's emergency law 'incompatible with being in eu', say meps group",law,2020-03-31
is this the future of film? how to finish a shoot when the coronavirus strikes,shooting,2020-03-31
sleater-kinney: where to start in their back catalogue,background,2020-03-31
‘we can’t go back to normal’: how will coronavirus change the world?,background,2020-03-31
tougher new zealand rules on covid-19 could set it apart as 'normal' nation after lockdown,legislation,2020-03-31
ugandan police accused of abusing lockdown laws after lgbt arrests,law,2020-04-01
'start a daily routine – and make the weekends different': the isolation experts' guide to lockdown living,legislation,2020-04-01
landmarks in law: the controversial 80s play that defied gay censorship,law,2020-04-01
landmarks in law: the controversial 80s play that defied gay censorship,control,2020-04-01
strained hospitals and isolation: how coronavirus made giving birth even harder,legislation,2020-04-01
ravi shankar: where to start in his back catalogue,background,2020-04-01
coronavirus threatens the safety net i've built around my at-risk parents,background,2020-04-01
afghanistan braces for coronavirus surge as migrants pour back from iran,background,2020-04-01
"teargas, beatings and bleach: the most extreme covid-19 lockdown controls around the world",control,2020-04-01
"teargas, beatings and bleach: the most extreme covid-19 lockdown controls around the world",background,2020-04-01
man eating kebab on bench among 50 people fined in nsw and victoria for violating coronavirus laws,law,2020-04-02
"arron banks fails in effort to use european laws to avoid £162,000 tax bill",law,2020-04-02
us coronavirus stimulus checks: are you eligible and how much will you get?,check,2020-04-02
un secretary general: recovery from the coronavirus crisis must lead to a better world,gun,2020-04-02
un secretary general: recovery from the coronavirus crisis must lead to a better world,background,2020-04-02
"second-tier sport video games, toilet roll skills and scotland v netherlands",control,2020-04-02
vive la différence: french rugby union tome still resonates 60 years on,law,2020-04-02
vive la différence: french rugby union tome still resonates 60 years on,legislation,2020-04-02
pj harvey: where to start in her back catalogue,background,2020-04-02
how the la rams' new logo managed to anger an entire fanbase,law,2020-04-02
how the la rams' new logo managed to anger an entire fanbase,legislation,2020-04-02
little women scene stolen by water bottles spotted in background,background,2020-04-02
the 90-day lockdown: nsw police to enforce home isolation until at least end of june,legislation,2020-04-02
americans purchasing record-breaking numbers of guns amid coronavirus,gun,2020-04-02
almost half of all shareholders at santos agm back stronger emissions target,background,2020-04-03
uk doctors' coronavirus deaths highlight crucial role of bame medics,control,2020-04-03
focus turns to us as coronavirus continues to spread around world,background,2020-04-03
wales to introduce 2-metre coronavirus law to protect workers,law,2020-04-03
how will law exams be affected by coronavirus?,law,2020-04-03
film and tv shoots resume in china as corona restrictions ease,shooting,2020-04-03
'i'm hooping my way through the lockdown': how readers are keeping fit,shooting,2020-04-03
hong kong official reprimands tv station over who interview that mentioned taiwan,legislation,2020-04-03
week three of isolation with my kids – and order is unravelling,legislation,2020-04-03
queensland bolsters border closure with barriers and checkpoints to keep coronavirus at bay,check,2020-04-03
hungarian journalists fear coronavirus law may be used to jail them,law,2020-04-03
belfast shooting: three men arrested,shooting,2020-04-04
"the english game's few charms lie in the background, not centre stage",background,2020-04-04
grouse shoots scrapped as heather burning is banned on moors,shooting,2020-04-04
keir starmer elected labour leader with 56% of vote on first round — as it happened,background,2020-04-04
tiger king reflects our world back to us – one run by megalomaniacs and amateurs,background,2020-04-04
after coronavirus: 'we can't go back to business as usual',background,2020-04-04
‘i live alone at sea. here's how to be happy in isolation’,legislation,2020-04-04
‘i cultivated a joy in little things ’ - coping with isolation in the wild,legislation,2020-04-04
factcheck: what are uk's new monthly coronavirus testing goals?,check,2020-04-05
retired judge and cummings' uncle sir john laws dies after contracting covid-19,law,2020-04-05
jared kushner and his shadow corona unit: what  is trump's son-in-law up to?,law,2020-04-05
own-goals all round as overpaid footballers get their usual kicking,background,2020-04-05
'shameless': anger as china quarantines freed human rights lawyer 400km from home,law,2020-04-05
"party factions, antisemitism … and a global pandemic: keir starmer's in-tray",semi,2020-04-05
wisconsin primary: state supreme court orders voting to move ahead,shooting,2020-04-06
drinking in coronavirus isolation: experts warn australians to monitor their intake,legislation,2020-04-06
uk councils face lawsuits over access to education in lockdown,law,2020-04-06
stevie wonder: where to start in his back catalogue,background,2020-04-06
how the jerry springer show splashed around in humanity’s worst excesses,background,2020-04-06
lawsuit raises questions about source of jeff bezos's affair revelation,law,2020-04-06
calls to legislate covid-19 eviction moratoriums as act accused of pursuing social housing tenants,legislation,2020-04-06
i spent two weeks in quarantine with my in-laws in a house full of puppets,law,2020-04-06
'a reality check on the math': what's ahead for california and covid-19,check,2020-04-07
make a masterpiece at home – with yoko ono and a tin of tuna,shooting,2020-04-07
uk lawyers inundated by divorced parents arguing over lockdown custody,law,2020-04-07
björk: where to start in her back catalogue,background,2020-04-07
england's coronavirus lockdown is lawful. heavy-handed police enforcement isn't,law,2020-04-07
cancelling student debt was always the right thing to do. now it's imperative,shooting,2020-04-07
lockdown watch: back to the future writer bob gale on the lure of the past,background,2020-04-07
controversial drug hydroxychloroquine to be given to coronavirus patients in australia,control,2020-04-07
"kirstie allsopp on life in lockdown: 'people think i’m a robust, gung-ho person. i’m not'",gun,2020-04-07
trump scapegoating of who obscures its key role in tackling pandemic,control,2020-04-08
trump urges republicans to 'fight very hard' against voting by mail,shooting,2020-04-08
crystal palace 4-3 liverpool: 1990 fa cup semi-final – as it happened,semi,2020-04-08
how to meditate when it feels like everything is out of control,control,2020-04-08
the artist with the remote-controlled robotic body: 'i’ve made a career out of being a failure',control,2020-04-08
condemned to read big papers and the back of cereal packets,background,2020-04-09
"climate crisis: in coronavirus lockdown, nature bounces back – but for how long?",background,2020-04-09
la originals: a netflix documentary about an influential hip-hop duo,law,2020-04-09
la originals: a netflix documentary about an influential hip-hop duo,legislation,2020-04-09
this isn't the first time no 10 has managed the message around a sick pm,background,2020-04-09
bamboo rats left in limbo as breeders push back against china wildlife ban,background,2020-04-09
"yes, wisconsin republicans used the pandemic to stop people from voting",shooting,2020-04-09
'people did wrong': canadian soccer whistleblower rues lack of action,legislation,2020-04-09
2pac: where to start in his back catalogue,background,2020-04-09
kumanjayi walker: court postpones case of nt police officer charged with murder,control,2020-04-09
from blocked-off beaches to bench bans: easter lockdowns around the world,background,2020-04-09
"rihanna, cardi b and taylor swift donate to fans and charities in need amid coronavirus",background,2020-04-10
airlines are breaking the law on refunds. should we be sympathetic?,law,2020-04-10
"if something’s out of your control, should you still worry about it?",control,2020-04-10
new order: where to start in their back catalogue,background,2020-04-10
my favourite book as a kid – tintin: the shooting star by hergé,shooting,2020-04-10
"nrl 'not a law unto themselves', says australia's deputy chief medical officer",law,2020-04-10
from withnail to marvel: the late blooming of richard e grant,legislation,2020-04-11
from withnail to marvel: the late blooming of richard e grant,check,2020-04-11
from withnail to marvel: the late blooming of richard e grant,semi,2020-04-11
'there are two pandemics': chicago's gun violence persists amid lockdown,gun,2020-04-11
h is for free houseplants: an a-z of transforming your space in lockdown,check,2020-04-11
h is for free houseplants: an a-z of transforming your space in lockdown,shooting,2020-04-11
‘i gulp back feelings of regret’: how i found my long-lost sibling,background,2020-04-11
'what it means to be an american': abraham lincoln and a nation divided,legislation,2020-04-11
"how do you become, formally, not-a-catholic? you take the law into your own hands",law,2020-04-11
tear up your term deposit? asic fights to control 'misleading' websites touting riskier products,control,2020-04-12
uk insurers face legal action from small firms over covid-19 claims,legislation,2020-04-12
working from home has a troubled history. coronavirus is exposing its flaws again,law,2020-04-12
"easter is a time to connect. so even in isolation, let's cherish the ties that bind",legislation,2020-04-12
yearning for obama? ex-president could soon be back to bat for biden,background,2020-04-12
the observer view on the smoking gun that should force assad to face justice,gun,2020-04-12
how scottish football's voting farce led to open warfare breaking out,shooting,2020-04-13
keir starmer orders urgent review into leaked antisemitism report,semi,2020-04-13
"westworld recap: season 3, episode 5 – panic on the streets of la",law,2020-04-13
"westworld recap: season 3, episode 5 – panic on the streets of la",legislation,2020-04-13
grace jones: where to start in her back catalogue,background,2020-04-13
i was in prison for two decades – here's what i learned about isolation,legislation,2020-04-13
libya says migrants stopped at sea will not be let back in,background,2020-04-14
concerns over polish government tightening abortion laws during covid-19 crisis,law,2020-04-14
exeter to repatriate blackfoot regalia to siksika nation,legislation,2020-04-14
"man wrongly convicted under coronavirus law, met police admit",law,2020-04-14
trump can't cancel the election – but he will try to stop people voting,shooting,2020-04-14
"nsw rent relief laws must address power imbalance between owners and tenants, union says",law,2020-04-14
i am extremely attracted to my brother-in-law - and now we're locked down together,law,2020-04-14
"growth in surveillance may be hard to scale back after pandemic, experts say",background,2020-04-14
labour’s iain mcnicol steps down from lords role after report leak,control,2020-04-15
macron calls for clinical trials of controversial coronavirus 'cure',control,2020-04-15
environment groups ask government to delay review of australia's conservation laws,law,2020-04-15
‘calling her lifts my spirits’: three parents on isolation away from their children,legislation,2020-04-15
'i didn't buy new clothes for a year and it was the best thing to happen to my wardrobe',shooting,2020-04-15
bruce springsteen: where to start in his back catalogue,background,2020-04-15
china’s top official in hong kong pushes for national security law,law,2020-04-15
"forget drones, let a remote control person guide you round the faroe islands",control,2020-04-15
"forget drones, let a remote control person guide you round the faroe islands",background,2020-04-15
australian government settles cruise ship lawsuit fighting coronavirus order,law,2020-04-15
the eu was created to keep nationalism in check. coronavirus is a dangerous test,check,2020-04-15
weekly round of applause for nhs staff – as it happened,background,2020-04-16
i thought i was coping in isolation but this week something in me snapped,legislation,2020-04-16
"spend, save or donate? ideas for where to put your stimulus check",check,2020-04-16
mps call for action over expected rise in child sexual abuse during pandemic,legislation,2020-04-16
angela merkel draws on science background in covid-19 explainer,background,2020-04-16
victoria brushes aside pm's calls to send children back to school for term two,background,2020-04-16
miami's rich-poor divide is exposed by flawed covid-19 testing,law,2020-04-16
i've never seen … top gun,gun,2020-04-16
if you need to go for a walk … why not wander around a video game?,background,2020-04-16
‘scott is a control freak’: what malcolm turnbull’s new book tells us about his relationship with morrison,control,2020-04-16
labor warns australia cannot afford to turn its back on global bodies like the world health organization,background,2020-04-17
"us using coronavirus pandemic to unlawfully expel asylum seekers, says un",law,2020-04-17
"us using coronavirus pandemic to unlawfully expel asylum seekers, says un",gun,2020-04-17
"us using coronavirus pandemic to unlawfully expel asylum seekers, says un",background,2020-04-17
"coronavirus 'under control' in germany, as some countries plan to relax lockdowns",control,2020-04-17
10 of the best music radio stations around the world,background,2020-04-17
no spare time in lockdown? that's not such a bad thing,shooting,2020-04-17
rights groups quit police body over stun gun use against bame people,gun,2020-04-17
johnny depp and jeff beck announce album with cover of john lennon's isolation,legislation,2020-04-17
