headlines,terms,dates,scores
impresario's highland cottage burns down after hate campaign,campaign,2000-11-05,1
west end looks to east for next hit,protest,2000-11-05,2
floods set to sink price of houses,house,2000-11-05,2
net pornographers face harsher sentences,senate,2000-11-06,2
us presidential race too close to call,house,2000-11-06,2
campaign media business round-up,campaign,2000-11-06,2
bluewater unveils christmas ad campaign,campaign,2000-11-06,2
"it's politainment, with george 'n' al",rallies,2000-11-06,2
shelter attacks anti-begging campaign,campaign,2000-11-06,2
victory is in the blood for 'aristocratic' republican,republican,2000-11-06,1
republican website hacked as us voters go to polls,republican,2000-11-07,2
republican website hacked as us voters go to polls,house,2000-11-07,2
a true blue-blooded republican,republican,2000-11-07,3
saatchi's uses livingtone's bust for museum ads,house,2000-11-07,1
public backs away from fuel tax protests,republican,2000-11-07,2
public backs away from fuel tax protests,protest,2000-11-07,2
protesters' split deepens amid blockade retreat,protest,2000-11-07,2
from senate to school board - america goes to the polls,senate,2000-11-07,2
bin laden quits base to dodge us reprisal,house,2000-11-07,1
front-line ouse battlers braced again,house,2000-11-07,2
audience stages protest drama,protest,2000-11-07,2
