headlines,terms,dates
turnbull tells un secure borders essential for managing global migration flow,immigration,2016-09-22
turnbull tells un secure borders essential for managing global migration flow,migrant,2016-09-22
south australia introduces bill to recognise same-sex marriages,south,2016-09-22
"muslim immigration poll result due to poor leadership, says tanya plibersek",immigration,2016-09-22
"muslim immigration poll result due to poor leadership, says tanya plibersek",migrant,2016-09-22
the human toll of austerity: a nation of unhappy homes,immigration,2016-09-23
death toll in migrant shipwreck off egypt rises to 300,immigration,2016-09-23
death toll in migrant shipwreck off egypt rises to 300,migrant,2016-09-23
"el santo, legendary mexican wrestler, commemorated in google doodle",mexico,2016-09-23
the week at guardian conference: from immigration to brangelina,immigration,2016-09-23
the week at guardian conference: from immigration to brangelina,migrant,2016-09-23
"ivory crackdown, greenland ice loss and asian hornets – green news roundup",green,2016-09-23
"ivory crackdown, greenland ice loss and asian hornets – green news roundup",green,2016-09-23
"bystanders need training to tackle hate crime, says report",deport,2016-09-23
terns follow record warm temperatures in 'shock' migration to north of alaska,immigration,2016-09-23
terns follow record warm temperatures in 'shock' migration to north of alaska,migrant,2016-09-23
i grew up in the world's biggest refugee camp – what happens when it closes?,refugee,2016-09-23
"when it comes to immigration, it helps if you’re white",immigration,2016-09-23
"when it comes to immigration, it helps if you’re white",migrant,2016-09-23
"new fears for 1,000 lone children in calais refugee camp",refugee,2016-09-24
panic sweeps calais camp as refugees await the bulldozers,refugee,2016-09-24
"football clockwatch: swansea v man city, middlesbrough v spurs – as they happened",visa,2016-09-24
"football clockwatch: swansea v man city, middlesbrough v spurs – as they happened",visa,2016-09-24
france 'to move calais refugees to reception centres within weeks',refugee,2016-09-24
ed miliband: labour should not be preserve solely of remain voters,undocumented,2016-09-25
"george christensen on poverty, priesthood and a flirtation with one nation",immigration,2016-09-25
dolce & gabbana makes a tilt at generation z,immigration,2016-09-25
west ham united v southampton: premier league – as it happened,visa,2016-09-25
west ham united v southampton: premier league – as it happened,south,2016-09-25
"immigrants must not lead 'parallel lives' in uk, says chuka umunna",migrant,2016-09-25
gennifer flowers 'will attend' trump v clinton debate,visa,2016-09-25
syrian refugees in canada hope british royals will advocate for 'people in need',refugee,2016-09-26
antónio guterres takes step closer to becoming un secretary general,undocumented,2016-09-26
"in new york debate lead-up, hofstra university students argue clinton v trump",visa,2016-09-26
donald trump links mexico border wall plan to israel's 'successful' separation barrier,mexico,2016-09-26
donald trump links mexico border wall plan to israel's 'successful' separation barrier,border,2016-09-26
theresa may allies publish letters to cameron calling for immigration brake,immigration,2016-09-26
theresa may allies publish letters to cameron calling for immigration brake,migrant,2016-09-26
communications 'chaos' alleged before asylum seeker boat sank off christmas island,asylum,2016-09-26
premier league: 10 talking points from the weekend’s action,immigration,2016-09-26
greenland's receding icecap to expose top-secret us nuclear project,green,2016-09-27
theresa may accused of trying to alter immigration report before brexit vote,immigration,2016-09-27
theresa may accused of trying to alter immigration report before brexit vote,migrant,2016-09-27
theresa may accused of trying to alter immigration report before brexit vote,deport,2016-09-27
akram khan's refugee giselle: 'a real woman in a catastrophic situation',refugee,2016-09-27
"first the uk deports people, then it denies them justice",deport,2016-09-27
'like watching a shark fight a guinea pig in water': readers on trump v clinton,visa,2016-09-27
canadians are embracing syrian refugees. why can't we?,refugee,2016-09-27
bp and shell investors urged to reward bosses for backing green energy,green,2016-09-28
labour can win on immigration – but not by channelling enoch powell,immigration,2016-09-28
labour can win on immigration – but not by channelling enoch powell,migrant,2016-09-28
"'it’s simply coercion': manus island, immigration policy and the men with no future",immigration,2016-09-28
"'it’s simply coercion': manus island, immigration policy and the men with no future",migrant,2016-09-28
"'it’s simply coercion': manus island, immigration policy and the men with no future",undocumented,2016-09-28
schisms on immigration policy threaten the future of the labour party,immigration,2016-09-28
schisms on immigration policy threaten the future of the labour party,migrant,2016-09-28
labour conference: shadow cabinet split over immigration,immigration,2016-09-28
labour conference: shadow cabinet split over immigration,migrant,2016-09-28
pakistan humiliated by south asian countries' boycott of summit,south,2016-09-28
"eu's secret ultimatum to afghanistan: accept 80,000 deportees or lose aid",deport,2016-09-28
why jeremy corbyn is right not to promise deep cuts in immigration,immigration,2016-09-28
why jeremy corbyn is right not to promise deep cuts in immigration,migrant,2016-09-28
gene clark – 10 of the best,refugee,2016-09-28
corbyn's defence of immigration splits shadow cabinet,immigration,2016-09-28
corbyn's defence of immigration splits shadow cabinet,migrant,2016-09-28
amnesty calls off launch of thai torture report after police warning,deport,2016-09-28
jeremy corbyn rules out pledge to cut immigration,immigration,2016-09-28
jeremy corbyn rules out pledge to cut immigration,migrant,2016-09-28
jeremy corbyn urged to back urgent child refugee policy,refugee,2016-09-28
siev 221 tragedy: class action adjourned as asylum seeker boat survivors seek documents,immigration,2016-09-28
siev 221 tragedy: class action adjourned as asylum seeker boat survivors seek documents,asylum,2016-09-28
siev 221 tragedy: class action adjourned as asylum seeker boat survivors seek documents,undocumented,2016-09-28
scottish visa dispute threatens to separate mother from children,visa,2016-09-29
asylum seekers in scotland at risk of being moved to england,asylum,2016-09-29
india says troops cross kashmir border to attack as crisis escalates,border,2016-09-29
southside with you review – likable account of the obamas' first date,south,2016-09-29
syrian refugee comes to the rescue of canadian bride's wedding dress,refugee,2016-09-29
mystery zika case in utah may have been spread via tears or sweat,south,2016-09-29
asylum seekers in uk 'face longest wait for work permit in europe',asylum,2016-09-29
'narcos alone rule': mexico shaken after three priests killed within a week,mexico,2016-09-29
ryder cup 2016: usa 5-3 europe after day one – as it happened,border,2016-09-30
texas pulls out of federal refugee resettlement program,refugee,2016-09-30
trump says mexico 'rapist' comments were planned in deposition video,mexico,2016-09-30
"northern powerhouse at risk from south-east bias, says airport boss",south,2016-09-30
gringos for trump: an unlikely cohort of american expats fuel support in mexico,mexico,2016-09-30
plans to repatriate 3 million afghan refugees are dangerous and misguided,refugee,2016-09-30
scott morrison warns resentment to free trade and immigration threatens economy,immigration,2016-09-30
scott morrison warns resentment to free trade and immigration threatens economy,migrant,2016-09-30
"trump foundation lacks certification for charities that solicit money, report says – as it happened",deport,2016-09-30
archbishop of york says eu countries are 'shunting migrants' towards uk,migrant,2016-09-30
hungarian referendum decides whether to slam the door on migrants,migrant,2016-10-01
child refugees at calais plunged into despair by plan to close camp,refugee,2016-10-01
"jeremy corbyn could heal labour’s immigration divide. sadly, he’s doing the opposite",immigration,2016-10-01
"jeremy corbyn could heal labour’s immigration divide. sadly, he’s doing the opposite",migrant,2016-10-01
hungary's refugee referendum not valid after voters stay away,refugee,2016-10-02
ed balls should take a quickstep off strictly come dancing,undocumented,2016-10-02
brexit: theresa may prioritises immigration curbs over single market,immigration,2016-10-02
brexit: theresa may prioritises immigration curbs over single market,migrant,2016-10-02
hidden faultline: how trump v clinton is laying bare america's class divide,visa,2016-10-02
court rejects pence's efforts to deter refugees as 'nightmare speculation',refugee,2016-10-03
the search for the girl in the picture: who is this refugee child?,refugee,2016-10-03
eu signs deal to deport unlimited numbers of afghan asylum seekers,deport,2016-10-03
eu signs deal to deport unlimited numbers of afghan asylum seekers,asylum,2016-10-03
"black immigrants much more likely to be deported over criminal offenses, data shows",migrant,2016-10-03
"black immigrants much more likely to be deported over criminal offenses, data shows",deport,2016-10-03
how do you feel about hungary's refugee referendum?,refugee,2016-10-03
tory mps urge amber rudd to do more to help child refugees in calais,refugee,2016-10-03
"sky launches 360-videos vr app with beckham, star wars and refugees",refugee,2016-10-03
usa regain ryder cup trophy from europe – as it happened,border,2016-10-03
vulnerable refugees to be moved from 'squalid' camps on greek islands,refugee,2016-10-03
"for refugees kidnapped and exiled to the manus prison, hope is our secret weapon",refugee,2016-10-03
liam fox: eu nationals in uk one of 'main cards' in brexit negotiations,card,2016-10-04
amber rudd pledges to prevent migrants 'taking jobs british people could do' - politics live,migrant,2016-10-04
edward conteh was convicted of a murder he didn’t even see. he deserves justice,green,2016-10-04
amber rudd announces crackdown on overseas students and work visas,visa,2016-10-04
'the question was stupid': hungarians on the refugee referendum,refugee,2016-10-04
i'm an iraqi refugee living in america. some wish me dead – all i want is a 'hello',refugee,2016-10-04
danish nationalists with ‘refugee spray’? so the battle of cable street isn’t over,refugee,2016-10-04
papua new guinea asks australia for help resettling refugees from manus island,refugee,2016-10-04
film about abuse in australia's refugee camps screened on london embassy,refugee,2016-10-05
the guardian view on theresa may’s conference speech: actions not words will decide,immigration,2016-10-05
"young uk women with children less likely to find work, report says",deport,2016-10-05
the message of brexit was mixed. now we are told it was simply a referendum on immigration,immigration,2016-10-05
the message of brexit was mixed. now we are told it was simply a referendum on immigration,migrant,2016-10-05
antónio guterres to be next un secretary general,undocumented,2016-10-05
'that mexican thing': mike pence's defense of trump's rhetoric goes viral,mexico,2016-10-05
"as an australian, i’m a privileged migrant. but amber rudd’s speech scared me",migrant,2016-10-05
may promises her 'party of workers' will govern for whole nation,immigration,2016-10-05
"more than 10,000 refugees rescued in two days in mediterranean",refugee,2016-10-05
'it wasn’t a pretty night for tim kaine': reaction to the vice-presidential debate,immigration,2016-10-05
hong kong activist joshua wong detained in thailand 'at china's request' – reports,deport,2016-10-05
"immigration crackdown could lead to staff shortages, say recruiters",immigration,2016-10-06
"immigration crackdown could lead to staff shortages, say recruiters",migrant,2016-10-06
abc viewers go dark on chris uhlmann after south australian blackout 'heresy',south,2016-10-06
alain de botton and katie price’s meeting of minds – and sharp tongues,border,2016-10-06
alain de botton and katie price’s meeting of minds – and sharp tongues,deport,2016-10-06
uk theatres call for urgent help for child refugees in calais,refugee,2016-10-06
golden goal: gary mcallister for liverpool v everton (2001),visa,2016-10-06
"senna v prost at suzuka, an emotional home run and injury-time drama",visa,2016-10-06
manus island staff told deportations will begin this month,deport,2016-10-06
charity takes legal action against home office over child refugees,immigration,2016-10-07
charity takes legal action against home office over child refugees,refugee,2016-10-07
i'm a pro-democracy activist. is that why thailand chose to deport me?,deport,2016-10-07
new york city fc head to mexico for 'really special' date with necaxa,mexico,2016-10-07
un tells nauru to take urgent action to investigate abuse of refugee children,undocumented,2016-10-07
un tells nauru to take urgent action to investigate abuse of refugee children,immigration,2016-10-07
un tells nauru to take urgent action to investigate abuse of refugee children,refugee,2016-10-07
friday’s best tv: unreported world; people’s history of pop; still game,deport,2016-10-07
britain ‘did not respond' to french pleas to take calais child refugees,refugee,2016-10-08
hurricane matthew hammers georgia and carolinas with floods as it departs,deport,2016-10-08
"accused nsa contractor was workaholic hoarder into computers, says ex-wife",border,2016-10-08
western sydney wanderers v sydney fc: a-league sydney derby - as it happened,visa,2016-10-08
mexican man accused of raping eight-year-old ordered to buy her father beer,mexico,2016-10-08
mexican man accused of raping eight-year-old ordered to buy her father beer,border,2016-10-08
britain to push post-brexit uk immigration controls back to irish border,immigration,2016-10-09
britain to push post-brexit uk immigration controls back to irish border,migrant,2016-10-09
britain to push post-brexit uk immigration controls back to irish border,border,2016-10-09
keir starmer calls for immigration to be reduced,immigration,2016-10-09
keir starmer calls for immigration to be reduced,migrant,2016-10-09
ireland confirms talks under way over post-brexit border controls,border,2016-10-10
q&a: border policy architect jim molan says nauru facilities 'extraordinary',border,2016-10-10
brexit statement: david davis rejects calls for mps to vote on negotiating terms  - politics live,visa,2016-10-10
migrants plan day of action to highlight contribution to britain,migrant,2016-10-10
migrants plan day of action to highlight contribution to britain,immigration,2016-10-10
"uk close to deal to transfer child refugees from calais, says rudd",refugee,2016-10-10
"desert trip review - mccartney, stones and co give oldchella a hint of rebellion",mexico,2016-10-10
irish republic signals support for uk plan to avoid post-brexit 'hard border',border,2016-10-10
better off with a lump of cheese,asylum,2016-10-10
my ‘insane’ uncle ed tried to kill queen victoria – he was treated with kindness,undocumented,2016-10-10
jordan to deliver aid by crane to syrian refugees trapped in no-man's land,refugee,2016-10-10
pope francis rejects rightwingers with us cardinals' appointment,card,2016-10-10
don’t let england be rebranded as a nation of bigots,immigration,2016-10-10
the brits helping refugees help britain,refugee,2016-10-10
france tells uk to speed up asylum applications of lone migrant children,asylum,2016-10-10
france tells uk to speed up asylum applications of lone migrant children,immigration,2016-10-10
france tells uk to speed up asylum applications of lone migrant children,migrant,2016-10-10
fifa faces legal challenge over qatar migrant workers,immigration,2016-10-10
fifa faces legal challenge over qatar migrant workers,migrant,2016-10-10
turnbull and shorten denounce ‘racial intolerance in any form’ in immigration policy,immigration,2016-10-10
turnbull and shorten denounce ‘racial intolerance in any form’ in immigration policy,migrant,2016-10-10
false perceptions: what lies behind our attitudes to muslim immigration,immigration,2016-10-11
false perceptions: what lies behind our attitudes to muslim immigration,migrant,2016-10-11
calais: doubts raised over accuracy of child refugee censuses,refugee,2016-10-11
can ed balls’s strictly stint reinvigorate new labour?,undocumented,2016-10-11
one nation senator calls for new abc channel for patriotic broadcasting – as it happened,immigration,2016-10-11
why the government should offer an amnesty to the uk's illegal immigrants,migrant,2016-10-11
take back control? our border force is in no fit state to do its job,border,2016-10-11
so what do australians really think about selecting migrants based on religion?,migrant,2016-10-12
pound falls back as davis says government cannot outline brexit aims in detail  – as it happened,visa,2016-10-12
pound drops further after davis hints uk could leave single market,visa,2016-10-12
individual children's details passed to home office for immigration purposes,immigration,2016-10-12
individual children's details passed to home office for immigration purposes,migrant,2016-10-12
klinsmann says julian green 'back in the picture' for usa after scoring again,green,2016-10-12
infantino’s jetsetting contrasts grimly with migrant worker’s fifa case,immigration,2016-10-12
infantino’s jetsetting contrasts grimly with migrant worker’s fifa case,migrant,2016-10-12
labour shouldn’t risk damaging the uk’s economy over immigration fears   ,immigration,2016-10-12
labour shouldn’t risk damaging the uk’s economy over immigration fears   ,migrant,2016-10-12
paul verhoeven and pedro almodóvar among record 85 foreign language oscar entrants,card,2016-10-12
malcolm turnbull consulted his department on solicitor general dispute – as it happened,deport,2016-10-12
"tesco v unilever is merely a negotiation, and self-interest will prevail",visa,2016-10-13
"uk's anti-immigration stance is bonkers, says restaurant group owner",immigration,2016-10-13
"uk's anti-immigration stance is bonkers, says restaurant group owner",migrant,2016-10-13
immigration fears make the eu prepared to do business with murderers,immigration,2016-10-13
immigration fears make the eu prepared to do business with murderers,migrant,2016-10-13
driving licences wrongly revoked under may's immigration measures,immigration,2016-10-13
driving licences wrongly revoked under may's immigration measures,migrant,2016-10-13
long-term immigrants call on universities to help them with access,migrant,2016-10-13
syrian's conviction for using false passport in asylum claim quashed,asylum,2016-10-13
central america's rampant violence fuels an invisible refugee crisis,refugee,2016-10-13
"george saunders's funny, sad stories from a divided nation",immigration,2016-10-13
trump v beyoncé: the moral majority's attempt to defend the indefensible,visa,2016-10-14
before the flood: leonardo dicaprio hopes his new film will inspire climate action,immigration,2016-10-14
schalk burger: ‘south africa’s future looks quite bleak’,south,2016-10-14
a man of good hope review – exhilarating musical tale of a somali refugee,refugee,2016-10-14
climate scientists published a paper debunking ted cruz,undocumented,2016-10-14
black actors are too often overlooked. it’s even worse for other ethnic minorities,green,2016-10-14
home office faces court action over failure to protect calais child refugees,immigration,2016-10-15
home office faces court action over failure to protect calais child refugees,refugee,2016-10-15
syrian refugee children could be resettled in britain in days,refugee,2016-10-15
trump blames media after more sexual misconduct accusations reported,deport,2016-10-15
three nauru refugees volunteer to be resettled in cambodia,refugee,2016-10-15
"even after brexit, hard borders won’t be returning to ireland",green,2016-10-16
"even after brexit, hard borders won’t be returning to ireland",border,2016-10-16
uk to take small group of children from calais refugee camp,refugee,2016-10-16
salvador dalí's lobster telephone and mae west lips sofa to be sold at auction,immigration,2016-10-16
kansas men face life in prison for alleged terrorist plot against somali immigrants,undocumented,2016-10-17
kansas men face life in prison for alleged terrorist plot against somali immigrants,migrant,2016-10-17
the guardian view on child refugees: who is a brother’s keeper?,refugee,2016-10-17
first group of refugee children arrives in britain from calais,refugee,2016-10-17
"theresa may 'obsessed' with immigration control, says vince cable",immigration,2016-10-17
"theresa may 'obsessed' with immigration control, says vince cable",migrant,2016-10-17
rowan williams: government is 'foot-dragging' over calais child refugees,refugee,2016-10-17
how chatbots are trying to help refugees navigate a new life,refugee,2016-10-17
how will new fighting in iraq affect trump v clinton? probably not much,visa,2016-10-17
attack on aid workers in south sudan: 'there was incredible naivety',south,2016-10-17
surely even jerry jones knows not to ruin a winning cowboys formula,green,2016-10-17
"australian immigration regime on nauru an 'open-air prison' and akin to torture, says amnesty",immigration,2016-10-17
"australian immigration regime on nauru an 'open-air prison' and akin to torture, says amnesty",migrant,2016-10-17
brexit border headache: what can other eu frontiers teach britain and ireland?,border,2016-10-17
leicester city v fc copenhagen: champions league – as it happened,visa,2016-10-18
six kidnapped people in mexico found with hands cut off,mexico,2016-10-18
"syria's first lady, asma al-assad, says she rejected offers of asylum",asylum,2016-10-18
"lgbt people face discrimination over domestic violence claims, report finds",deport,2016-10-18
government can 'unilaterally' grant eu citizens right to remain after brexit,migrant,2016-10-18
will theresa may's fight against slavery inform her trade and migration policies?,immigration,2016-10-18
will theresa may's fight against slavery inform her trade and migration policies?,migrant,2016-10-18
mexican brands mock trump: 'there's a common sense he's our enemy',mexico,2016-10-18
australia's refugee policy is one of deliberate harm. and there's no claiming 'we didn’t know',refugee,2016-10-18
what society lets families fear deportation for sending children to school?,deport,2016-10-18
survey finds 70% of migrants arriving in europe by boat trafficked or exploited,migrant,2016-10-18
"australia should urgently improve whistleblower protection, un expert says",undocumented,2016-10-18
is the fourth industrial revolution bad news for migrants and refugees?,migrant,2016-10-19
is the fourth industrial revolution bad news for migrants and refugees?,refugee,2016-10-19
home office expected to speed up rescue of migrant children from calais,immigration,2016-10-19
home office expected to speed up rescue of migrant children from calais,migrant,2016-10-19
rightwing tabloids pour scorn on appearance of child refugees,refugee,2016-10-19
as a nation would we ever sink so low as to check refugees’ teeth?,immigration,2016-10-19
as a nation would we ever sink so low as to check refugees’ teeth?,refugee,2016-10-19
the calais child refugees need help – not trial by press in row over ages,refugee,2016-10-19
"dvla failings keeping vulnerable motorists off the road, says report",deport,2016-10-19
"how-old.net no real indicator of age, says microsoft amid child refugee row",refugee,2016-10-19
calais camp charity threatens uk with legal action over vulnerable children,immigration,2016-10-19
robert plant lampedusa tour review – tenderly rocking for refugees,refugee,2016-10-19
ex-mexico state governor javier duarte missing amid corruption investigations,mexico,2016-10-19
home office rules out 'unethical' dental checks for calais refugees,refugee,2016-10-19
people who welcome refugees are the true british patriots,refugee,2016-10-19
gary lineker hits back at online abuse over criticism of calais refugee coverage,refugee,2016-10-19
the real refugee scandal is that the uk has been locking up children,refugee,2016-10-19
judges deem eritrea unsafe for migrants' return as home office advice rebutted,migrant,2016-10-19
children     don't come date-stamped – and that includes refugees,refugee,2016-10-19
top 10 books about borders,border,2016-10-19
"give child refugees   dental tests to verify age, says david davies",refugee,2016-10-19
alianza de futbol: the program giving young latinos a shot at soccer stardom,border,2016-10-19
alianza de futbol: the program giving young latinos a shot at soccer stardom,deport,2016-10-19
coalition splits over adler shotgun ban as one nation calls for 'softening' of firearm control,immigration,2016-10-19
manchester united v fenerbahce: europa league – as it happened,visa,2016-10-20
alain juppé calls for uk border to move from calais to kent,border,2016-10-20
sonita review – a refugee's dreams of superstardom,refugee,2016-10-20
uk policy to deport refugees for 'extremist behaviour' criticised,deport,2016-10-20
uk policy to deport refugees for 'extremist behaviour' criticised,refugee,2016-10-20
greens are fighting for civil liberties too,green,2016-10-20
no 10 rejects idea that foreign students should not count as immigrants,migrant,2016-10-20
hepworth sculpture prize review – a brilliant beginning,deport,2016-10-20
corbyn attacks may over delay in bringing lone child refugees to uk,refugee,2016-10-20
refugees and cindy crawford’s daughter: an age-old problem for the tabloids,refugee,2016-10-20
bad hombre v bad ombré: trump's debate vow ignites storm of hair memes,visa,2016-10-20
