headlines,terms,dates
fbi releases documents in clinton email investigation – as it happened,undocumented,2016-09-02
caroline lucas and jonathan bartley elected green party co-leaders – as it happened,green,2016-09-02
trump and syrian refugees in the us: separating the facts from fiction,refugee,2016-09-02
"'if i can help, i must': meet the volunteers working with refugees",refugee,2016-09-02
punjabi-style mustard greens and charred corn rotis recipe,green,2016-09-02
'the service is completely useless': commuters react to southern rail profit hike - as it happened,south,2016-09-02
the lies trump told this week: who's paying for the wall to immigration costs,immigration,2016-09-02
the lies trump told this week: who's paying for the wall to immigration costs,migrant,2016-09-02
calais refugee camp running out of food amid donor fatigue,refugee,2016-09-02
france vows to dismantle 'jungle' refugee camp in calais,refugee,2016-09-02
"a year on from alan kurdi, we still have a moral case to help child refugees",refugee,2016-09-02
"the death of alan kurdi: one year on, compassion towards refugees fades",refugee,2016-09-02
‘madness’ of £10m english lessons for syrian refugees,refugee,2016-09-03
libyan naval attack on charity ship adds new danger to migrant rescue,immigration,2016-09-03
libyan naval attack on charity ship adds new danger to migrant rescue,migrant,2016-09-03
'a place to sleep is luxury to us': how scotland welcomes refugees,refugee,2016-09-03
"meet generation m: the young, affluent muslims changing the world",immigration,2016-09-03
"time to shut nauru and manus camps, says government's refugee policy guru",refugee,2016-09-03
some blunt truths and a ray of hope for the refugee justice movement,refugee,2016-09-03
we can resettle refugees in australia and it's not just wishful thinking. this is how,refugee,2016-09-04
trump’s fluctuating immigration stance worsens republican tensions,immigration,2016-09-04
trump’s fluctuating immigration stance worsens republican tensions,migrant,2016-09-04
epidemic warning over 'ghost' refugees stuck at jordan-syria border,refugee,2016-09-04
epidemic warning over 'ghost' refugees stuck at jordan-syria border,border,2016-09-04
can we all agree to stop instagramming our cocktails?,green,2016-09-04
malcolm turnbull pushes back on foreign investment after xi meeting,mexico,2016-09-04
protesters close calais over refugee crisis: 'we are not racist but we see no solution',refugee,2016-09-05
the guardian view on eu migration after brexit: may must tell us what she wants,immigration,2016-09-05
the guardian view on eu migration after brexit: may must tell us what she wants,migrant,2016-09-05
david davis accused of having no plan for brexit,visa,2016-09-05
greens cannot afford to ignore economics,green,2016-09-05
‘it is a disgrace to europe’: former child refugee lord dubs on the calais camp,refugee,2016-09-05
david davis - backed by boris johnson and liam fox - sets out brexit plans - as it happened,visa,2016-09-05
newspapers publish anti-immigration stories - but what is to be done?,immigration,2016-09-05
newspapers publish anti-immigration stories - but what is to be done?,migrant,2016-09-05
no 10 rules out points-based immigration system for britain,immigration,2016-09-05
no 10 rules out points-based immigration system for britain,migrant,2016-09-05
uk immigration: what are the alternatives to a point-based system?,immigration,2016-09-05
uk immigration: what are the alternatives to a point-based system?,migrant,2016-09-05
mexicans gave donald trump the hostile welcome he deserved,mexico,2016-09-05
theresa may refuses to commit to brexit pledges on immigration and nhs,immigration,2016-09-05
theresa may refuses to commit to brexit pledges on immigration and nhs,migrant,2016-09-05
the untamed review - freaky goings-on and body horror in backwoods mexico,mexico,2016-09-05
australia's offshore refugee processing is no inspiration. it deserves condemnation,refugee,2016-09-06
"former el salvador president granted asylum in nicaragua, government says",asylum,2016-09-06
ireland confident eu will keep northern irish border open post-brexit,border,2016-09-06
protest at jamaican embassy in london against deportation flight,deport,2016-09-06
"may plans to open new grammar schools, confidential document reveals - as it happened",undocumented,2016-09-06
passage through mexico: the global migration to the us,mexico,2016-09-06
passage through mexico: the global migration to the us,immigration,2016-09-06
passage through mexico: the global migration to the us,migrant,2016-09-06
eurozone consumer spending slows but exports rise,deport,2016-09-06
‘the human heart is surviving’: the woman giving sanctuary to refugees in lesbos,refugee,2016-09-06
do you help or work with refugees? share your stories,refugee,2016-09-06
'prisoners of europe': the everyday humiliation of refugees stuck in greece,refugee,2016-09-06
'what keith does is for keith': theresa may speaks out over vaz reports,deport,2016-09-06
un human rights chief  zeid ra'ad al hussein calls for world to reject populist bigots - in full,undocumented,2016-09-06
"new zealand needs migrants as some kiwis are lazy and on drugs, says pm",migrant,2016-09-06
mp andrew wilkie says nauru visa denial proves australia 'has much to hide',visa,2016-09-06
trump blurs the ins and outs of his immigration stance in ohio,immigration,2016-09-06
trump blurs the ins and outs of his immigration stance in ohio,migrant,2016-09-06
hong kong refugees helped hide edward snowden after nsa leak,refugee,2016-09-07
mexican heritage textbook for texas schools full of 'offensive stereotypes',mexico,2016-09-07
angela merkel defends immigration policy after election blow,immigration,2016-09-07
angela merkel defends immigration policy after election blow,migrant,2016-09-07
uk immigration minister confirms work to start on £1.9m calais wall,immigration,2016-09-07
uk immigration minister confirms work to start on £1.9m calais wall,migrant,2016-09-07
chris bowen warns against populist stances on immigration and trade,immigration,2016-09-07
chris bowen warns against populist stances on immigration and trade,migrant,2016-09-07
take back control? it’s now clear the brexiteers have no clue on immigration,immigration,2016-09-07
take back control? it’s now clear the brexiteers have no clue on immigration,migrant,2016-09-07
"nearly half of all refugees are children, says unicef",refugee,2016-09-07
corbyn v smith on bbc question time's labour leadership hustings - as it happened,visa,2016-09-08
"'two-tier' nt detention royal commission could be australia-wide, say greens",undocumented,2016-09-08
"'two-tier' nt detention royal commission could be australia-wide, say greens",migrant,2016-09-08
"'two-tier' nt detention royal commission could be australia-wide, say greens",green,2016-09-08
corbyn v smith on question time: labour's the loser,visa,2016-09-08
angelina jolie says un undermined by sexual abuse by peacekeepers,undocumented,2016-09-08
undocumented crews catch us's fancy fish from hawaii for 70 cents per hour,undocumented,2016-09-08
justine greening responds to urgent commons question on grammar schools - politics live,green,2016-09-08
"dungavel immigration detention centre will close, says minister",immigration,2016-09-08
"dungavel immigration detention centre will close, says minister",migrant,2016-09-08
how can 50 people be snatched from their families and deported to jamaica?,deport,2016-09-08
somali refugee fadumo dayib runs for president 26 years after fleeing civil war,refugee,2016-09-08
"australia criticised over 'hollow' promise to resettle 12,000 syrian and iraqi refugees",refugee,2016-09-08
"australia should use chinese online media to exert 'soft power', report says",deport,2016-09-08
"deport failed asylum seekers back to war zones, says bavaria minister",deport,2016-09-09
"deport failed asylum seekers back to war zones, says bavaria minister",asylum,2016-09-09
small acts of kindness ... but it's not enough for women in refugee camps,refugee,2016-09-09
we need to be careful about demanding migrants speak english,migrant,2016-09-09
peter dutton swipes at canada as he defends australia's slow response to refugee crisis,refugee,2016-09-09
"conditions for greece's migrant children shocking, says human rights watch",immigration,2016-09-09
"conditions for greece's migrant children shocking, says human rights watch",migrant,2016-09-09
"it is immigration, above all else, that has united the right and divided the left",immigration,2016-09-10
"it is immigration, above all else, that has united the right and divided the left",migrant,2016-09-10
forgotten inside greece’s notorious camp for child refugees,refugee,2016-09-10
hillary clinton calls half of trump supporters bigoted 'deplorables',deport,2016-09-10
"arsenal 2-1 southampton, stoke city 0-4 tottenham – football clockwatch live!",south,2016-09-10
sunny autumn beach breaks in southern europe,south,2016-09-10
liberal mp says australia's refugee program one of the world's best,refugee,2016-09-10
"'my story is now  1,100 pages long': manus refugees speak about their plight",refugee,2016-09-10
selling free trade is a tall order. but chris bowen is doing better than scott morrison,border,2016-09-10
rowan williams and 200 faith leaders call for revised refugee policy,refugee,2016-09-11
new immigration detention policy for ‘adults at risk’ needs urgent review,immigration,2016-09-11
new immigration detention policy for ‘adults at risk’ needs urgent review,migrant,2016-09-11
hillary clinton regrets 'basket of deplorables' remark as trump attacks,deport,2016-09-11
‘kindertransport’ britons help today’s child refugees in calais,refugee,2016-09-11
lack of schools and homes threatens syrian refugee uk resettlement,refugee,2016-09-12
"australia has spent $9.6bn on asylum seeker policy in four years, says report",asylum,2016-09-12
"australia has spent $9.6bn on asylum seeker policy in four years, says report",deport,2016-09-12
"migrants are creating jobs, not taking them, says report",migrant,2016-09-12
"migrants are creating jobs, not taking them, says report",deport,2016-09-12
reformed greek appeals panel upholds syrian refugee's deportation,refugee,2016-09-12
reformed greek appeals panel upholds syrian refugee's deportation,deport,2016-09-12
the south sudanese student who spent her summer saving refugees,south,2016-09-12
the south sudanese student who spent her summer saving refugees,refugee,2016-09-12
mexico investigates role of federal police in case of 43 missing students,mexico,2016-09-13
julissa arce: undocumented at goldman sachs and breaking a stereotype,undocumented,2016-09-13
greens push to outlaw all mining in great australian bight,green,2016-09-13
men sentenced over illegal supply of migrant workers in east anglia,undocumented,2016-09-13
men sentenced over illegal supply of migrant workers in east anglia,immigration,2016-09-13
men sentenced over illegal supply of migrant workers in east anglia,migrant,2016-09-13
three suspected isis operatives arrested at german refugee shelters,refugee,2016-09-13
"why does resettling a refugee cost £17,000 in the us – but £85,000 in britain?",refugee,2016-09-13
i was a well-paid european expat in the us. now i am undocumented,undocumented,2016-09-13
how coventry city council is providing shelter for refugees,refugee,2016-09-13
"uk can decide whether to deport abu hamza relative, eu court says",deport,2016-09-13
"expel hungary from eu for hostility to refugees, says luxembourg",refugee,2016-09-13
immigration detention cost blowout blamed on procurement failures,immigration,2016-09-13
immigration detention cost blowout blamed on procurement failures,migrant,2016-09-13
un to question nauru over abuse of children in australian-run detention,undocumented,2016-09-13
a street fighter in manila: how esports is kicking off in the philippines,deport,2016-09-13
cate blanchett leads celebrities in un video poem for refugees,undocumented,2016-09-13
cate blanchett leads celebrities in un video poem for refugees,refugee,2016-09-13
hong kong student fears uk visa may be denied over protest conviction,visa,2016-09-14
angela merkel to challenge bosses over failure to employ refugees,refugee,2016-09-14
"uk not doing enough for refugees, say charities and aid agencies",refugee,2016-09-14
"las pozas, mexico, the folly and fantasy of a british eccentric",mexico,2016-09-14
pauline hanson calls for immigration ban: 'go back to where you came from',immigration,2016-09-14
pauline hanson calls for immigration ban: 'go back to where you came from',migrant,2016-09-14
pauline hanson calls for a total halt to immigration – as it happened,immigration,2016-09-14
pauline hanson calls for a total halt to immigration – as it happened,migrant,2016-09-14
david simmonds: who’s going to pay to help child refugees?,refugee,2016-09-14
airports brace for week of delays as union announces border force strikes,border,2016-09-14
miloš zeman: the hardline czech leader fanning hostility to refugees,refugee,2016-09-14
australia's refugee impasse: rights commission suggests ways forward,refugee,2016-09-14
deepwater horizon review – mark wahlberg v bp in angry disaster movie,visa,2016-09-14
"two-thirds of australians want nauru and manus refugees to be resettled, poll shows",refugee,2016-09-14
brexit was a revolt against liberalism. we’ve entered a new political era,undocumented,2016-09-15
uk immigration and asylum tribunal fees to rise by 500%,immigration,2016-09-15
uk immigration and asylum tribunal fees to rise by 500%,migrant,2016-09-15
uk immigration and asylum tribunal fees to rise by 500%,asylum,2016-09-15
fear forces refugees in world’s largest camp to return to conflict zones,refugee,2016-09-15
eu leaders seek unity at bratislava summit amid east-west migration split,immigration,2016-09-15
eu leaders seek unity at bratislava summit amid east-west migration split,migrant,2016-09-15
central american migrants desperate to reach us risk new dangers at sea,migrant,2016-09-15
"asylum-seeker processing at nauru will 'continue for decades', says dutton",asylum,2016-09-15
peter dutton open to refugees on nauru being resettled in new zealand,refugee,2016-09-15
"n for northampton: alan moore celebrates his hometown with a 1,200-page fantasy",immigration,2016-09-15
"n for northampton: alan moore celebrates his hometown with a 1,200-page fantasy",undocumented,2016-09-15
"n for northampton: alan moore celebrates his hometown with a 1,200-page fantasy",migrant,2016-09-15
"n for northampton: alan moore celebrates his hometown with a 1,200-page fantasy",green,2016-09-15
in the footholds of dorothy pilley: how my great-great aunt became a climbing inspiration,migrant,2016-09-15
ford to move all small-car production to mexico as profits set to fall,card,2016-09-15
ford to move all small-car production to mexico as profits set to fall,mexico,2016-09-15
un human rights office calls on australia to end offshore detention,undocumented,2016-09-16
ricardo pierdant - apology,card,2016-09-16
"marine life, nuclear power and clever crows – green news roundup",green,2016-09-16
"gentrification, boundary changes and euro visas – catch up on our live look at the week",visa,2016-09-16
"ignore the naysayers. america can handle 110,000 more refugees",refugee,2016-09-16
discover toronto's style vibe: 'a peaceful city with a side order of busy',border,2016-09-16
"refugee stories: 'we don't just need help, we can give valuable help too'",refugee,2016-09-16
the lies trump told this week: from 'deplorables' to his interrupted speech,deport,2016-09-16
stardust nation by deborah levy review – an unsettling exploration of memory and identity,immigration,2016-09-16
the new european on the 'brainwashing of britain over immigration',immigration,2016-09-16
the new european on the 'brainwashing of britain over immigration',migrant,2016-09-16
reports of the death of liberal centrism are greatly exaggerated,deport,2016-09-17
backing every protest without question harms progressive collective action,immigration,2016-09-17
un security council to hold emergency meeting on us air strikes in syria,undocumented,2016-09-17
trump tells controversial group clinton immigration plan will 'abolish borders',immigration,2016-09-17
trump tells controversial group clinton immigration plan will 'abolish borders',migrant,2016-09-17
trump tells controversial group clinton immigration plan will 'abolish borders',border,2016-09-17
un and white house summits could offer a ray of hope to those stuck in camps,undocumented,2016-09-17
‘they’ve brought evil out’: hungary’s poll on migration divides a nation,immigration,2016-09-17
‘they’ve brought evil out’: hungary’s poll on migration divides a nation,migrant,2016-09-17
‘they’ve brought evil out’: hungary’s poll on migration divides a nation,immigration,2016-09-17
"migrant death toll expected to exceed 10,000 in 2016",immigration,2016-09-17
"migrant death toll expected to exceed 10,000 in 2016",migrant,2016-09-17
why won’t the world tackle the refugee crisis?,refugee,2016-09-17
thousands march in london during pro-refugee demonstration,refugee,2016-09-17
"it's race and immigration, stupid",immigration,2016-09-17
"it's race and immigration, stupid",migrant,2016-09-17
pauline hanson’s one nation party  hires former adviser to donald trump,immigration,2016-09-17
theresa may to warn  un of dangers of uncontrolled mass migration,undocumented,2016-09-18
theresa may to warn  un of dangers of uncontrolled mass migration,immigration,2016-09-18
theresa may to warn  un of dangers of uncontrolled mass migration,migrant,2016-09-18
tony abbott says europe is facing 'peaceful invasion' of asylum seekers,asylum,2016-09-18
angela merkel’s refugee policy must succeed – for europe’s sake,refugee,2016-09-18
'the nation state is back': front national's marine le pen rides on global mood,immigration,2016-09-18
'we have a moral obligation': advocates look to obama as refugee crisis wears on,refugee,2016-09-18
everybody wants some!!; green room; author: the jt leroy story; whiskey tango foxtrot and  more – review,green,2016-09-18
nauru refugee denied emergency evacuation after suspected heart attack,refugee,2016-09-18
malcolm turnbull tells world leaders to follow australia's asylum policies,asylum,2016-09-19
theresa may isn’t interested in refugees’ welfare. she just wants fewer of them in britain,refugee,2016-09-19
tortured syrian refugees need specialist help,refugee,2016-09-19
angela merkel admits mistakes over asylum seekers after disastrous election,asylum,2016-09-19
theresa may resists calls for uk to accept more syrian refugees,refugee,2016-09-19
'we all come from the same place': gustavo aceves unveils migration crisis artwork in rome,immigration,2016-09-19
'we all come from the same place': gustavo aceves unveils migration crisis artwork in rome,migrant,2016-09-19
"raped, imprisoned, beaten: migrants reveal their perilous journeys to europe",migrant,2016-09-19
washington post says obama should not pardon whistleblower ed snowden,undocumented,2016-09-19
theresa may's quasi-darwinian fight to dilute right to claim asylum,asylum,2016-09-19
labour urged to make immigration controls a key brexit demand,immigration,2016-09-19
labour urged to make immigration controls a key brexit demand,migrant,2016-09-19
"british conservationist takes to the skies for 4,500-mile migration with swans",immigration,2016-09-19
"british conservationist takes to the skies for 4,500-mile migration with swans",migrant,2016-09-19
turkey blocks syrian refugees from resettlement in the us – for having degrees,refugee,2016-09-19
'i want to be south sudan's first female neurosurgeon' – the struggle for refugee education,south,2016-09-19
'i want to be south sudan's first female neurosurgeon' – the struggle for refugee education,refugee,2016-09-19
swift response to refugee crisis rests on obama summit after un talks fail,refugee,2016-09-19
swift response to refugee crisis rests on obama summit after un talks fail,undocumented,2016-09-19
the refugee crisis is a feminist issue. we can’t just sit by and watch,refugee,2016-09-19
thai police find 41 men crammed inside 16-seater minivan,undocumented,2016-09-19
my cure for a divided britain? a programme of managed immigration,immigration,2016-09-19
my cure for a divided britain? a programme of managed immigration,migrant,2016-09-19
bedlam: the asylum and beyond review – missed opportunity to truly explore mental health,asylum,2016-09-19
speaking out by ed balls; the long and winding road by alan johnson – review,undocumented,2016-09-19
liberal mp says turnbull can't possibly claim world's best border protection policy,border,2016-09-19
europe can learn from australia's border policy. but not by listening to abbott,border,2016-09-19
emmy awards 2016: people v oj and game of thrones win big – as it happened,visa,2016-09-19
"if australia had its current refugee policy in 1939, we wouldn't be alive today",refugee,2016-09-19
newly leaked nauru reports detail harrowing accounts of sexual abuse and self-harm,deport,2016-09-19
minnesota's somali leaders condemn stabbing as report identifies suspect,deport,2016-09-19
"australia will take refugees from costa rica camps, turnbull tells un",refugee,2016-09-20
"australia will take refugees from costa rica camps, turnbull tells un",undocumented,2016-09-20
us-led coalition to double refugee resettlement places and expand aid,refugee,2016-09-20
theresa may gives debut address to un general assembly – as it happened,undocumented,2016-09-20
calling syrian refugees like me skittles would be funny if it weren't so cruel,refugee,2016-09-20
£100m of uk aid budget to be spent controlling  immigration from africa,immigration,2016-09-20
£100m of uk aid budget to be spent controlling  immigration from africa,migrant,2016-09-20
plan aims to save us-born children in mexico from legal limbo,mexico,2016-09-20
work begins on calais wall to stop refugees trying to board lorries to uk,refugee,2016-09-20
average uk car insurance bill rose by 13% over past year,card,2016-09-20
"migrants' perilous journeys, and the women who helped convict habré",migrant,2016-09-20
how skittles became a bizarre metaphor for immigration,immigration,2016-09-20
how skittles became a bizarre metaphor for immigration,migrant,2016-09-20
no desks but lots of enthusiasm: what it's like to teach in a refugee camp,refugee,2016-09-20
us blames russia after un aid convoy in syria targeted by air attack,undocumented,2016-09-20
british activist found guilty in thailand over report alleging labour abuses,deport,2016-09-20
man v rat: could the long war soon be over?,visa,2016-09-20
greenland's huge annual ice loss is even worse than thought,green,2016-09-21
greenland's huge annual ice loss is even worse than thought,green,2016-09-21
"uk failing on many human rights measures, report claims",deport,2016-09-21
nauru refugee who set herself alight 'denied basic social support' in brisbane hospital,refugee,2016-09-21
"trump says syrian refugees aren't just a terrorist threat, they'd hurt quality of life",refugee,2016-09-21
misunderstandings and mistakes on immigration to britain,immigration,2016-09-21
misunderstandings and mistakes on immigration to britain,migrant,2016-09-21
gerry adams considers legal action over claims he sanctioned killing,immigration,2016-09-21
where theresa may’s stance on refugees takes us,refugee,2016-09-21
migrant boat capsizes off egyptian coast,immigration,2016-09-21
migrant boat capsizes off egyptian coast,migrant,2016-09-21
labour ex-minister chris mullin backs electoral pact with lib dems and greens - politics live,green,2016-09-21
founder of a mexican news magazine shot dead,mexico,2016-09-21
trump and brexit add yet more spice to ryder cup’s theatres of cultural war,border,2016-09-21
"brangelina is over: can we kill team jolie v team jen feud, too?",visa,2016-09-21
refugees condemn malcolm turnbull’s promotion of australia’s asylum policy,refugee,2016-09-21
refugees condemn malcolm turnbull’s promotion of australia’s asylum policy,asylum,2016-09-21
iranian asylum seeker mojgan shamsalipoor freed after almost two years in detention,asylum,2016-09-21
trump reportedly used charity money to settle legal claims – as it happened,deport,2016-09-21
code of race ethics proposed for parliament to counter rise of one nation,immigration,2016-09-22
crewmembers arrested after at least 50 migrants die when boat capsizes,migrant,2016-09-22
obama cites letter from child offering home to young syrian refugee,refugee,2016-09-22
"canada detains hundreds of children for immigration violations, report finds",immigration,2016-09-22
"canada detains hundreds of children for immigration violations, report finds",migrant,2016-09-22
"canada detains hundreds of children for immigration violations, report finds",deport,2016-09-22
calais refugee children abandoning plans to reach uk,refugee,2016-09-22
nicolas sarkozy’s bigotry cannot define our worth as children of immigrants,migrant,2016-09-22
call for calais child refugees to be given uk safeguarding protection,refugee,2016-09-22
pauline hanson says 49% support for ban on muslim immigration is too low,immigration,2016-09-22
pauline hanson says 49% support for ban on muslim immigration is too low,migrant,2016-09-22
female rappers take a stand in mexico's capital of violence against women,mexico,2016-09-22
the good immigrant review – an unflinching dialogue about race and racism in the uk,immigration,2016-09-22
the good immigrant review – an unflinching dialogue about race and racism in the uk,migrant,2016-09-22
turnbull tells un secure borders essential for managing global migration flow,undocumented,2016-09-22
turnbull tells un secure borders essential for managing global migration flow,border,2016-09-22
