headlines,terms,dates
george rr martin's wild cards tv show is a safe bet for success,card,2016-08-08
"border patrol still have orders allowing boat turnbacks in foreign waters, tribunal reveals",border,2016-08-08
"border patrol still have orders allowing boat turnbacks in foreign waters, tribunal reveals",border,2016-08-08
beware copycat websites overcharging for esta and ehic documents,undocumented,2016-08-08
documents immigration is fighting to keep secret accidentally released,undocumented,2016-08-08
documents immigration is fighting to keep secret accidentally released,immigration,2016-08-08
documents immigration is fighting to keep secret accidentally released,migrant,2016-08-08
"a short history of nauru, australia’s dumping ground for refugees",refugee,2016-08-09
how to contact the nauru files reporters securely and confidentially,deport,2016-08-09
‘i want death’: nauru files chronicle despair of asylum seeker children,asylum,2016-08-09
the nauru files: the lives of asylum seekers in detention detailed in a unique database – interactive,asylum,2016-08-09
syrian refugee rami anis belatedly brings a smile to rio’s swimming pool,refugee,2016-08-09
affluent southerners who voted for brexit,south,2016-08-09
mexico miss world pageant director shot dead in targeted attack,mexico,2016-08-09
cctv shows men suspected of releasing insects in byron restaurants,undocumented,2016-08-09
'untold devastation' in south sudan triggers grave humanitarian crisis,south,2016-08-09
i'm a hispanic immigrant. but to the world i am a lily-white wasp,migrant,2016-08-09
the alt city guide to cardiff,card,2016-08-09
sovereign borders chief argues hiding asylum seeker boat turnbacks essential for security,border,2016-08-09
sovereign borders chief argues hiding asylum seeker boat turnbacks essential for security,asylum,2016-08-09
prisons inspector praises immigration centre for families set for closure,immigration,2016-08-10
prisons inspector praises immigration centre for families set for closure,migrant,2016-08-10
refugee judoka popole misenga out of olympics but thrilled all the same,refugee,2016-08-10
rising avocado prices fuelling illegal deforestation in mexico,mexico,2016-08-10
nauru files: widespread condemnation of australian government by un and others,undocumented,2016-08-10
threat of marriage hangs over young malian refugee girls in mauritania,refugee,2016-08-10
"the nauru files: cache of 2,000 leaked reports reveal scale of abuse of children in australian offshore detention",deport,2016-08-10
"un, human rights groups and refugee groups demand solutions following nauru data leak – as it happened",refugee,2016-08-10
"olympics 2016 daily briefing: green pool, blue journalists, silver brits and golden phelps",green,2016-08-10
millions of britons paying ‘ethnic minority penalty’ for car insurance,card,2016-08-10
opinion pollsters mistaken for thieves abducted and beaten by mexican mob,mexico,2016-08-10
labor's plan to strengthen rules on reporting abuse of children seeking asylum could pass senate,deport,2016-08-11
labor's plan to strengthen rules on reporting abuse of children seeking asylum could pass senate,asylum,2016-08-11
nauru files show wilson security staff regularly downgraded reports of abuse,deport,2016-08-11
german proposals could see refugees' phones searched by police,refugee,2016-08-11
"comparing nauru to guantánamo bay is ridiculous, says australian immigration minister",immigration,2016-08-11
"comparing nauru to guantánamo bay is ridiculous, says australian immigration minister",migrant,2016-08-11
watch adverts celebrating refugees competing at rio 2016,refugee,2016-08-11
half of immigrants held in us 'priority' program have no criminal conviction,migrant,2016-08-11
balkan wildlife faces extinction threat from border fence to control migrants,border,2016-08-11
balkan wildlife faces extinction threat from border fence to control migrants,migrant,2016-08-11
"if you value guardian australia’s coverage of immigration and detention, please help fund it",immigration,2016-08-11
"if you value guardian australia’s coverage of immigration and detention, please help fund it",migrant,2016-08-11
'people have self-immolated to get to australia' – immigration minister's response to nauru files,immigration,2016-08-11
'people have self-immolated to get to australia' – immigration minister's response to nauru files,migrant,2016-08-11
‘they don’t care’: a refugee’s story of reporting sexual assault on nauru,refugee,2016-08-12
‘they don’t care’: a refugee’s story of reporting sexual assault on nauru,deport,2016-08-12
"immigration stalled on requests for rape victim’s family to join her, nauru files show",immigration,2016-08-12
"immigration stalled on requests for rape victim’s family to join her, nauru files show",migrant,2016-08-12
australia shamed by its immigration policy,immigration,2016-08-12
australia shamed by its immigration policy,migrant,2016-08-12
"england v pakistan: fourth test, day two – as it happened",visa,2016-08-12
french court rejects bid to demolish shops at jungle refugee camp,refugee,2016-08-12
"government cuts will enfeeble italy's fight against sex trafficking, says un",undocumented,2016-08-12
"young, rich and entitled: mexicans grow weary of their politicians' spoiled kids",mexico,2016-08-12
fact check: immigration minister peter dutton's claims against nauru files,immigration,2016-08-12
fact check: immigration minister peter dutton's claims against nauru files,migrant,2016-08-12
reports of family violence widespread amid despair of nauru detention,deport,2016-08-12
peter dutton v the nauru files: how do official statements compare with leaked reports?,visa,2016-08-12
peter dutton v the nauru files: how do official statements compare with leaked reports?,deport,2016-08-12
dark past: so little has changed in australia's posture towards asylum seekers,asylum,2016-08-12
manus island: photos show aftermath of violent attack on afghan refugees,refugee,2016-08-13
‘sexual assaults on children’ at greek refugee camps,refugee,2016-08-13
dear jeremy – your work problems solved,border,2016-08-13
child refugees in limbo in calais 'because of home office delays',refugee,2016-08-14
not like in the movies: syrian refugee trapped in turkish airport limbo,refugee,2016-08-14
who the duke of westminster cares about … in descending order,border,2016-08-14
nauru inquiry should look at whether abuse reports were investigated – labor,deport,2016-08-14
eye in the sky; louder than bombs; men & chicken; the huntsman: winter’s war and others – review,undocumented,2016-08-14
up to 16 people abducted from mexican beach resort restaurant,mexico,2016-08-15
trump outlines revised immigration proposal – as it happened,immigration,2016-08-15
trump outlines revised immigration proposal – as it happened,migrant,2016-08-15
"the guardian view on the uk labour market: farewell, lithuanian car valets",card,2016-08-15
mothers at us immigration center on hunger strike to protest year in custody,immigration,2016-08-15
mothers at us immigration center on hunger strike to protest year in custody,migrant,2016-08-15
'it feels like a gift': mobile phone co-op transforms rural mexican community,mexico,2016-08-15
child abuse royal commission investigating immigration department,immigration,2016-08-15
child abuse royal commission investigating immigration department,migrant,2016-08-15
child abuse royal commission investigating immigration department,deport,2016-08-15
great australian bight oil rigs would significantly increase spill risk – report,deport,2016-08-15
can the law come to the rescue of abused asylum seekers and refugees?,asylum,2016-08-15
can the law come to the rescue of abused asylum seekers and refugees?,refugee,2016-08-15
manus refugee says he thought he would die after being attacked by locals,refugee,2016-08-15
mccarthyism redux: the long view of trump's immigration plan,immigration,2016-08-16
mccarthyism redux: the long view of trump's immigration plan,migrant,2016-08-16
german asylum seeker hostels lose contracts after execution jokes,asylum,2016-08-16
trump proposes 'extreme vetting' for immigrants who may support isis,migrant,2016-08-16
nauru says refugee claims fabricated and being used to suit 'political agendas',refugee,2016-08-16
please free my friend from the perpetual limbo of a temporary protection visa,visa,2016-08-16
airport bureaux de change offering less than a euro for a pound,border,2016-08-17
airport bureaux de change offering less than a euro for a pound,deport,2016-08-17
trump's 'deeply un-american' stance on immigration prompts legal concerns,immigration,2016-08-17
trump's 'deeply un-american' stance on immigration prompts legal concerns,migrant,2016-08-17
the deep ocean: plunging to new depths to discover the largest migration on earth,immigration,2016-08-17
the deep ocean: plunging to new depths to discover the largest migration on earth,migrant,2016-08-17
australia confirms manus island immigration detention centre will close,immigration,2016-08-17
australia confirms manus island immigration detention centre will close,migrant,2016-08-17
nauru's president says abuse reports 'cooked up' by detention centre workers,deport,2016-08-17
refugees claim abuse by soldiers as mali's conflict spreads,refugee,2016-08-17
refugee protesters disrupt malcolm turnbull speech: 'close the bloody camps',refugee,2016-08-17
"on corporate human rights, australia's actions speak louder than words",immigration,2016-08-17
"jobs the key to doubling refugee intake, says resettlement chief",refugee,2016-08-18
oxfam calls for australia to triple humanitarian migration intake,immigration,2016-08-18
oxfam calls for australia to triple humanitarian migration intake,migrant,2016-08-18
images from us border patrol facility reveal harsh conditions for immigrants,border,2016-08-18
images from us border patrol facility reveal harsh conditions for immigrants,migrant,2016-08-18
us justice department announces it will end use of private prisons,deport,2016-08-18
call to bring child refugees in calais under uk safeguarding rules,refugee,2016-08-18
peter dutton attacks guardian and abc over reporting of nauru files,deport,2016-08-18
"conditions for unaccompanied children in calais camp worsening, says report",deport,2016-08-18
rumours and lies: 'the refugee crisis is an information crisis',refugee,2016-08-18
"wa premier says children in detention 'unacceptable', welcomes refugee families",refugee,2016-08-18
pauline hanson can't be dismissed this time. one nation is bigger than it looks,immigration,2016-08-18
the child refugees i help in calais remind me of the boy rescued in aleppo,refugee,2016-08-19
refugees in greek camps targeted by mafia gangs,refugee,2016-08-20
green party candidate jill stein calls for climate state of emergency,green,2016-08-20
kanye west v morrissey: battle of the fashion pop up shops,visa,2016-08-20
is uganda the best place to be a refugee?,refugee,2016-08-20
"um mundo novo? the olympic rings leave rio, rustier but brighter",undocumented,2016-08-21
"um mundo novo? the olympic rings leave rio, rustier but brighter",asylum,2016-08-21
hidden codex may reveal secrets of life in mexico before spanish conquest,mexico,2016-08-21
latino immigrants are unnoticed casualties of us 'war on terror' – study,migrant,2016-08-21
no economy is even close to achieving its personal best,green,2016-08-21
"olympics alternative review: glory, gaffes and bright green water",green,2016-08-21
"british want eu migrants to stay after brexit, says poll",migrant,2016-08-21
a smell of burning: the story of epilepsy by colin grant – review,migrant,2016-08-21
ethiopian olympic medallist seeks asylum after marathon protest,asylum,2016-08-22
mexican journalist flees veracruz after campaign of intimidation,mexico,2016-08-22
historical documents reveal arctic sea ice is disappearing at record speed,undocumented,2016-08-22
case of the three dead rabbits highlights absurdity of mexican justice system,mexico,2016-08-22
want proof that britain can thrive after brexit? look at south korea,south,2016-08-22
donald trump's undocumented deportation pledge called into question,undocumented,2016-08-22
donald trump's undocumented deportation pledge called into question,deport,2016-08-22
labor mp to renew cross-party push for a more humane asylum seeker policy,asylum,2016-08-22
rescuing refugees: 'you never get used to it – and that's a good thing',refugee,2016-08-22
the claim that locking asylum seekers up in nauru and png saves lives is bogus,asylum,2016-08-22
brexit sparks rush for new zealand as emigration inquiries hit record high,immigration,2016-08-22
brexit sparks rush for new zealand as emigration inquiries hit record high,migrant,2016-08-22
judge throws cold water on lawsuit over starbucks' ice-to-coffee ratio,immigration,2016-08-23
swiss watch exports to uk rise as tourists make most of fall in sterling,deport,2016-08-23
"african migrants in australia report worst discrimination, diversity study reveals",migrant,2016-08-23
"african migrants in australia report worst discrimination, diversity study reveals",deport,2016-08-23
"australia broadly tolerant but pockets of intense prejudice remain, report shows",deport,2016-08-23
"malian refugees in mauritania, and india's all-woman newspaper",refugee,2016-08-23
eu states are denying child migrants essential services,migrant,2016-08-23
trump: 'i'm not flip-flopping' on immigration plan – as it happened,immigration,2016-08-23
trump: 'i'm not flip-flopping' on immigration plan – as it happened,migrant,2016-08-23
discovery of potentially earth-like planet proxima b raises hopes for life,border,2016-08-24
virgin v jeremy corbyn: what rail passengers think of traingate – as it happened,visa,2016-08-24
migrant mothers at pennsylvania center suspend hunger strike ‘due to threats’,immigration,2016-08-24
migrant mothers at pennsylvania center suspend hunger strike ‘due to threats’,migrant,2016-08-24
the story of mohammad and his dog is a modern parable about borders,border,2016-08-24
bill shorten says labor 'open' to resettling refugees in new zealand,refugee,2016-08-24
mexican journalist wounded in mystery shooting by masked man,mexico,2016-08-24
greens say they won't back 'watered-down' superannuation changes,green,2016-08-25
the alt right is old racism for the tech-savvy generation,immigration,2016-08-25
gcse success stories: from the refugee to the piano prodigy,refugee,2016-08-25
'we just want to live' – on the road with south sudan's refugees,south,2016-08-25
'we just want to live' – on the road with south sudan's refugees,refugee,2016-08-25
eu and turkey restart talks over migrant pact,immigration,2016-08-25
eu and turkey restart talks over migrant pact,migrant,2016-08-25
"bk gulf dragged its heels over qatar labour abuses, claim migrant workers",immigration,2016-08-25
"bk gulf dragged its heels over qatar labour abuses, claim migrant workers",migrant,2016-08-25
"global warming is melting the greenland ice sheet, fast",green,2016-08-25
iranian students put life on hold due to extensive delays in us visa processing,visa,2016-08-25
"donald trump in favor of immigration reform, softening stance on his signature issue",immigration,2016-08-25
"donald trump in favor of immigration reform, softening stance on his signature issue",migrant,2016-08-25
sarah hanson-young 'will keep fighting' for asylum seekers despite losing portfolio,asylum,2016-08-25
'what am i waiting for?': child refugees trapped in calais appeal to mps,refugee,2016-08-25
trump now in favor of immigration reform – as it happened,immigration,2016-08-25
trump now in favor of immigration reform – as it happened,migrant,2016-08-25
the guardian view on europe and migration: the year of living damagingly,immigration,2016-08-26
the guardian view on europe and migration: the year of living damagingly,migrant,2016-08-26
"politicians fuelled rise in hate crimes after brexit vote, says un body",undocumented,2016-08-26
"us national parks, badger cull and microplastics – green news roundup",green,2016-08-26
a journey to soweto reveals south africa's past and present,south,2016-08-26
the lies trump told this week: from immigration to the safety of inner cities,immigration,2016-08-26
the lies trump told this week: from immigration to the safety of inner cities,migrant,2016-08-26
nauru asylum seeker protest targets australia house in london,asylum,2016-08-26
turning the tables: the ping pong sanctuary for young refugees,refugee,2016-08-26
"trump's campaign ceo once charged with domestic violence, reports say – as it happened",deport,2016-08-26
trump spells out immigration policy but leaves deportation question open,immigration,2016-08-27
trump spells out immigration policy but leaves deportation question open,migrant,2016-08-27
trump spells out immigration policy but leaves deportation question open,deport,2016-08-27
england v pakistan: second odi – as it happened,visa,2016-08-27
experts search for explanation as two reports signal maternity crisis in texas,deport,2016-08-27
nauru files: leaked reports read aloud in 10-hour vigil outside australia house in london,deport,2016-08-27
readers’ recipe swap: mexican,mexico,2016-08-27
refugee artist detained on manus island wins international cartooning award,refugee,2016-08-27
ed balls reminds us that labour once mattered,undocumented,2016-08-28
trump surrogates: republican's position on immigration has not changed,immigration,2016-08-28
trump surrogates: republican's position on immigration has not changed,migrant,2016-08-28
theresa may calls brexit meeting amid reports of single market split,deport,2016-08-28
us considers ending use of private immigration detention facilities,immigration,2016-08-29
us considers ending use of private immigration detention facilities,migrant,2016-08-29
the facebook campaign funding phone credit for refugees,refugee,2016-08-29
will a 'deportation force' remain in trump immigration policy?,deport,2016-08-29
will a 'deportation force' remain in trump immigration policy?,immigration,2016-08-29
will a 'deportation force' remain in trump immigration policy?,migrant,2016-08-29
the anthropocene epoch could inaugurate even more marvellous eras of evolution,green,2016-08-29
ed balls: labour did not deserve to win election,undocumented,2016-08-29
trump's slump in nascar country deepens republican fears of defeat,card,2016-08-29
juan gabriel fans mourn an icon: 'he wrote what every mexican could feel',mexico,2016-08-30
tens of thousands migrate through balkans since route declared shut,immigration,2016-08-30
tens of thousands migrate through balkans since route declared shut,migrant,2016-08-30
uk and france restate commitment to border treaty after calais talks,border,2016-08-30
our nauru vigil highlighted the abuse asylum seekers also face in the uk,asylum,2016-08-30
calais asylum hotspot proposal: the main questions answered,asylum,2016-08-30
dover mp warns against 'tit-for-tat' battles with france over border security,border,2016-08-30
meet the refugee campaigning against trump: 'this is what america looks like',refugee,2016-08-30
danish delegation planning visit to nauru detention centre refused visas,visa,2016-08-30
dramatic photos show refugees fleeing libya being rescued at sea,refugee,2016-08-30
home secretary stands firm as row over calais border deal intensifies,border,2016-08-30
"one nation rise could cost queensland $300m in foreign student slump, labor warns",immigration,2016-08-30
trump: 'impenetrable physical' border wall in immigration plan – as it happened,border,2016-08-30
trump: 'impenetrable physical' border wall in immigration plan – as it happened,immigration,2016-08-30
trump: 'impenetrable physical' border wall in immigration plan – as it happened,migrant,2016-08-30
mexican president contradicts trump's account of border wall discussion,mexico,2016-08-31
mexican president contradicts trump's account of border wall discussion,border,2016-08-31
"'cállate, imbécil': the best mexican responses to donald trump's visit",mexico,2016-08-31
woman sues albuquerque for seizing car despite ban on civil asset forfeiture,card,2016-08-31
donald trump goes to mexico,mexico,2016-08-31
trump habla en méxico después de una 'conversación constructiva' con peña nieto - en vivo,undocumented,2016-08-31
trump habla en méxico después de una 'conversación constructiva' con peña nieto - en vivo,green,2016-08-31
trump habla en méxico después de una 'conversación constructiva' con peña nieto - en vivo,mexico,2016-08-31
trump habla en méxico después de una 'conversación constructiva' con peña nieto - en vivo,border,2016-08-31
trump habla en méxico después de una 'conversación constructiva' con peña nieto - en vivo,deport,2016-08-31
trump habla en méxico después de una 'conversación constructiva' con peña nieto - en vivo,undocumented,2016-08-31
trump habla en méxico después de una 'conversación constructiva' con peña nieto - en vivo,green,2016-08-31
"retired judge, 88, offers 'body swap' with a refugee on manus or nauru",refugee,2016-08-31
"fall arts preview: mexican modernism, monet, and a new smithsonian museum",mexico,2016-08-31
hillary clinton derides donald trump's mexico trip: 'that's not how it works',mexico,2016-08-31
'i wanted to be willy wonka': how gene wilder inspired future pastry chefs,refugee,2016-08-31
trump's visit to mexico may underscore a 'softening' of immigration message,mexico,2016-08-31
trump's visit to mexico may underscore a 'softening' of immigration message,immigration,2016-08-31
trump's visit to mexico may underscore a 'softening' of immigration message,migrant,2016-08-31
"restricting immigration will be at heart of brexit deal, theresa may says",immigration,2016-08-31
"restricting immigration will be at heart of brexit deal, theresa may says",migrant,2016-08-31
are you helping in the refugee crisis? share your experiences,refugee,2016-08-31
peña nieto's making a dangerous gamble with trump's mexico visit,mexico,2016-08-31
a car made from tequila? ford motor co says it's good for the planet,card,2016-08-31
a car made from tequila? ford motor co says it's good for the planet,mexico,2016-08-31
cabinet signals controlling migration to take precedence over single market access in brexit talks - politics live,immigration,2016-08-31
cabinet signals controlling migration to take precedence over single market access in brexit talks - politics live,migrant,2016-08-31
turkish police withdrawal from greece stalls eu migration pact,immigration,2016-08-31
turkish police withdrawal from greece stalls eu migration pact,migrant,2016-08-31
donald trump's visit to mexico is greeted with hostility,mexico,2016-08-31
education is essential for giving refugee children hope for the future,refugee,2016-08-31
donald trump heads to mexico,mexico,2016-08-31
trump's balancing act: what to expect from his immigration speech,immigration,2016-08-31
trump's balancing act: what to expect from his immigration speech,migrant,2016-08-31
trump announces trip to mexico for talks with president peña nieto,mexico,2016-08-31
another big predator in southeast asia faces extinction,south,2016-08-31
england is the dream for many migrants trapped on the italian riviera,migrant,2016-08-31
maritime workers say high court win on foreign visas will protect local jobs,visa,2016-08-31
trump said to be considering last-minute mexico trip ahead of immigration speech - as it happened,mexico,2016-08-31
trump said to be considering last-minute mexico trip ahead of immigration speech - as it happened,immigration,2016-08-31
trump said to be considering last-minute mexico trip ahead of immigration speech - as it happened,migrant,2016-08-31
woman who protested against asylum seeker's deportation on qantas flight to plead not guilty,asylum,2016-09-01
woman who protested against asylum seeker's deportation on qantas flight to plead not guilty,deport,2016-09-01
home secretary urged to act over refugee children stuck in calais,refugee,2016-09-01
trump's immigration code-switching wasn't skillful – it was disingenuous,immigration,2016-09-01
trump's immigration code-switching wasn't skillful – it was disingenuous,migrant,2016-09-01
australia resettles only a sixth of promised syrian refugee intake,refugee,2016-09-01
"trump echoes mexican president, says lax us gun laws help arm drug cartels",mexico,2016-09-01
mark cuban trolls donald trump for details on border wall with mexico,border,2016-09-01
mark cuban trolls donald trump for details on border wall with mexico,mexico,2016-09-01
"scotland welcomes 1,000th syrian refugee",refugee,2016-09-01
teenage refugee to join family in london after months in calais camp,refugee,2016-09-01
"we can’t abandon refugee children – and that includes us, the politicians",refugee,2016-09-01
home office prepares for rise in residency applications from eu migrants,migrant,2016-09-01
donald trump not backing down from border wall plan,border,2016-09-01
what we left behind: north korean refugee drawings lit up on the thames,refugee,2016-09-01
"tough guy in arizona, meek in mexico: trump's latest reversal",mexico,2016-09-01
excess credit card surcharges banned for large companies,card,2016-09-01
'no amnesty': trump vows to deport millions during 'first hour in office',deport,2016-09-01
donald trump promises 'no amnesty' in aggressive immigration speech – as it happened,immigration,2016-09-01
donald trump promises 'no amnesty' in aggressive immigration speech – as it happened,migrant,2016-09-01
"'either you're pro-refugee, or against': bavarian town split after year of border controls",refugee,2016-09-01
"'either you're pro-refugee, or against': bavarian town split after year of border controls",border,2016-09-01
green party's jill stein lands in wrong ohio city for campaign event,green,2016-09-02
