headlines,terms,dates
calais child refugees cover their faces as they arrive in the uk,refugee,2016-10-20
eu seeks swift action on african migration deals to ease pressure on italy,immigration,2016-10-20
eu seeks swift action on african migration deals to ease pressure on italy,immigration,2016-10-20
eu seeks swift action on african migration deals to ease pressure on italy,migrant,2016-10-20
"guinness may be good for you but borders are bad, says ireland drinks chief",border,2016-10-20
city of london weighs up regional visa system to avoid post-brexit staff gaps,visa,2016-10-20
most families facing deportation from us do not have an immigration lawyer,deport,2016-10-20
most families facing deportation from us do not have an immigration lawyer,immigration,2016-10-20
most families facing deportation from us do not have an immigration lawyer,migrant,2016-10-20
"refugee coverage, kelvin mackenzie, bake off's selasi",refugee,2016-10-20
argentina's women joined across south america in marches against violence,south,2016-10-20
facebook staff reportedly pushed to delete trump's 'hate speech' posts – as it happened,deport,2016-10-21
woman granted uk visa to donate bone marrow to sister in u-turn by home office,visa,2016-10-21
conservative mp admits dental checks for refugees was not existing policy,refugee,2016-10-21
home office yet to accept single child refugees from calais,refugee,2016-10-21
no 10 rejects alain juppé's threats to push uk border from calais to kent,border,2016-10-21
"bangladesh v england: first test, day two – as it happened",visa,2016-10-21
"child refugees will have ages verified if necessary, minister says",refugee,2016-10-21
top iranian students risk losing funding over us and canadian visa delays,visa,2016-10-21
central american migrants showing record levels of mental health problems,migrant,2016-10-21
the refugee crisis fills us with despair but it can be a chance for hope and kindness,refugee,2016-10-21
haters back off: it's napoleon dynamite for the youtube generation,immigration,2016-10-21
refugee children arriving in the uk need warm support – not cold bureaucracy,refugee,2016-10-21
how argentina’s gravel-voiced crooner put the soul back into tango for the  rap generation,immigration,2016-10-22
"saracens v scarlets, munster win, northampton lose: champions cup – as it happened",visa,2016-10-22
gary lineker defends twitter views as the sun gives him red card,card,2016-10-22
when are the refugees of calais too old for kindness?,refugee,2016-10-22
french politicians under pressure to push border checks across channel,border,2016-10-23
more refugee children arrive in uk as calais camp faces demolition,refugee,2016-10-23
manchester city 1-1 southampton: premier league – as it happened,south,2016-10-23
said & done: fifa 2.0; peddling migrant lies; and dive of the week,immigration,2016-10-23
said & done: fifa 2.0; peddling migrant lies; and dive of the week,migrant,2016-10-23
how migration has enriched the uk’s booming food culture,immigration,2016-10-23
how migration has enriched the uk’s booming food culture,migrant,2016-10-23
why is it vulgar to speak up for migrants?,migrant,2016-10-23
more than 50 child refugees arrive in britain as calais camp faces destruction,refugee,2016-10-23
guardian australia wins three un awards for the nauru files,undocumented,2016-10-24
"uk takes nearly 200 child refugees from calais camp, rudd says – as it happened",refugee,2016-10-24
"postcards from the edge of hard brexit, outlining other possibilities",card,2016-10-24
'i will close my eyes and put my finger on the map': calais refugees move on,refugee,2016-10-24
hungary’s anti-refugee rhetoric dishonours its history – my grandmother could tell you,refugee,2016-10-24
daily mail and sun face complaint from green party over calais refugee images,green,2016-10-24
daily mail and sun face complaint from green party over calais refugee images,refugee,2016-10-24
hundreds leave calais by bus on first day of operation to clear refugee camp,refugee,2016-10-24
transfer of refugee children to the uk on hold as calais is cleared,refugee,2016-10-24
french election and brexit loom over closure of calais refugee camp,refugee,2016-10-24
la esperanza de la generación: las chicas desafiando la misoginia en el centro rural de paraguay,border,2016-10-24
la esperanza de la generación: las chicas desafiando la misoginia en el centro rural de paraguay,deport,2016-10-24
la esperanza de la generación: las chicas desafiando la misoginia en el centro rural de paraguay,undocumented,2016-10-24
la esperanza de la generación: las chicas desafiando la misoginia en el centro rural de paraguay,green,2016-10-24
la esperanza de la generación: las chicas desafiando la misoginia en el centro rural de paraguay,border,2016-10-24
la esperanza de la generación: las chicas desafiando la misoginia en el centro rural de paraguay,deport,2016-10-24
q&a: what happens now to the calais refugees?,refugee,2016-10-24
premier league: 10 talking points from the weekend's action,immigration,2016-10-24
what does the closure of the calais camp mean for the refugees? our panel discuss,refugee,2016-10-24
"nauru, detention, the abc and us: putting misconceptions about australia and refugees to rest",refugee,2016-10-24
world cup final 1970: brazil v italy – as it happened,visa,2016-10-25
hammond says highly skilled will not face eu immigration controls,immigration,2016-10-25
hammond says highly skilled will not face eu immigration controls,migrant,2016-10-25
"for calais refugees, this is the bulldozing of hope as well as home",refugee,2016-10-25
"calais camp scuffles break out as 2,000 refugees prepare to leave",refugee,2016-10-25
the history of 'rigged' us elections: from bush v gore to trump v clinton,visa,2016-10-25
the history of 'rigged' us elections: from bush v gore to trump v clinton,visa,2016-10-25
'my ex is proven wrong!': readers on the everyday advice to ignore,mexico,2016-10-25
¿acabará con la crisis de agua del perú la gran visión del nuevo presidente?,border,2016-10-25
¿acabará con la crisis de agua del perú la gran visión del nuevo presidente?,deport,2016-10-25
¿acabará con la crisis de agua del perú la gran visión del nuevo presidente?,migrant,2016-10-25
julian green becomes first american player to score for bayern munich,green,2016-10-26
ngos censure eu countries for spending foreign aid on asylum costs,asylum,2016-10-26
mexican grand prix fans and passion lay foundations for long f1 future,mexico,2016-10-26
south africa: the art of a nation review – from the dawn of man to the violence of apartheid,south,2016-10-26
south africa: the art of a nation review – from the dawn of man to the violence of apartheid,immigration,2016-10-26
broadspectrum reported to be taking over refugee welfare services on nauru,deport,2016-10-26
broadspectrum reported to be taking over refugee welfare services on nauru,refugee,2016-10-26
boyz n the hood review – a blistering humanitarian classic that has not dated,immigration,2016-10-27
boyz n the hood review – a blistering humanitarian classic that has not dated,undocumented,2016-10-27
boyz n the hood review – a blistering humanitarian classic that has not dated,migrant,2016-10-27
boyz n the hood review – a blistering humanitarian classic that has not dated,green,2016-10-27
eight london councils call for more help to care for refugee children,refugee,2016-10-27
"the guardian view on child refugees: too little, too late",refugee,2016-10-27
calais's refugee children are sleeping rough because of tory policy,refugee,2016-10-27
the real crisis for refugees isn’t in calais. it’s westminster’s failure to act,refugee,2016-10-27
my mother medea review – child refugees given a voice in twist on classic myth,refugee,2016-10-27
calais: refugee children 'sleeping rough' after camp demolition,refugee,2016-10-27
'offers of help flooded in': the councils that are helping refugees,refugee,2016-10-27
roe ethridge's best photograph: his car being pulled from a florida canal,card,2016-10-27
we damage britain by denying its migrant past,immigration,2016-10-27
we damage britain by denying its migrant past,migrant,2016-10-27
"less talk, more action: why victoria is the progress state",immigration,2016-10-28
revealed: the systemic exploitation of migrant workers in australia,immigration,2016-10-28
revealed: the systemic exploitation of migrant workers in australia,migrant,2016-10-28
"calais: france says britain must take in more than 1,000 refugee children",refugee,2016-10-28
calais: concerns grow for refugee children who missed uk-bound buses,refugee,2016-10-28
nico rosberg holds aces over lewis hamilton ahead of mexican grand prix,mexico,2016-10-28
i was a medic in the calais refugee camp. good riddance to it,refugee,2016-10-28
the weekend cook: thomasina miers' recipes for halloween and mexico’s day of the dead,mexico,2016-10-28
lily allen says black-cab driver told her: 'find an immigrant to drive you',immigration,2016-10-28
lily allen says black-cab driver told her: 'find an immigrant to drive you',migrant,2016-10-28
"after 37 years in us, korean adoptee speaks out about imminent deportation",deport,2016-10-28
un hires assad's friends and relatives for syria relief operation,undocumented,2016-10-28
fear and loathing on the streets: the soldiers of odin and the rise of anti-refugee vigilantes,refugee,2016-10-28
lewis hamilton claims pole at mexican gp ahead of team-mate nico rosberg,mexico,2016-10-29
"bangladesh v england: second test, day two – as it happened",visa,2016-10-29
when new york city fc went to mexico – players' pictures,mexico,2016-10-29
kindertransport hero’s daughter urges uk to welcome calais refugees,refugee,2016-10-29
refugees exchange squalor of calais for vineyards of burgundy,refugee,2016-10-29
as an asylum seeker i have permission to work … but cannot open a bank account,asylum,2016-10-29
possessions they can carry – but the soul of the refugee is left behind,refugee,2016-10-29
"new asylum laws pave the way for third-country resettlement, peter dutton says",asylum,2016-10-30
f1: lewis hamilton wins mexican grand prix – as it happened,mexico,2016-10-30
nauru police charge person with indecent assault of six-year-old asylum seeker,asylum,2016-10-30
may declines to make extra commitments to take more calais child refugees,refugee,2016-10-30
kellyanne conway: trump fan yelling ‘jew-s-a’ behaved in ‘deplorable’ way,deport,2016-10-30
revealed: nauru prosecutors under fire from judiciary in asylum-seeker cases,asylum,2016-10-30
asylum seekers face lifetime ban from entering australia if they arrive by boat,asylum,2016-10-30
coalition mps can't agree on which refugees australia's lifetime ban will affect,green,2016-10-31
coalition mps can't agree on which refugees australia's lifetime ban will affect,refugee,2016-10-31
anger as paris police launch surprise migrant camp clearance,immigration,2016-10-31
anger as paris police launch surprise migrant camp clearance,migrant,2016-10-31
strictly's fright night: ed balls is a hit with his mad scientist bit,undocumented,2016-10-31
could a mild outbreak of humanity be behind the coalition's cynical new asylum politics?,asylum,2016-10-31
refugees aren’t the problem. europe’s identity crisis is,refugee,2016-10-31
bill shorten calls refugee ban 'ridiculous' as coalition attacks labor for indecision,refugee,2016-10-31
lewis hamilton vows to keep fighting after winning mexican grand prix,mexico,2016-10-31
ludogorets v arsenal: champions league – as it happened,visa,2016-11-01
chasing asylum: inside australia’s detention camps review – a portrait of hell,asylum,2016-11-01
ukip leadership favourite: farage's anti-migrant poster 'correct',migrant,2016-11-01
ministers to review treatment of child refugees by may 2017,refugee,2016-11-01
calais camp hit by riots as remaining refugees prepare to be removed,refugee,2016-11-01
"un failed to protect civilians in south sudan, report finds",undocumented,2016-11-01
"un failed to protect civilians in south sudan, report finds",south,2016-11-01
"un failed to protect civilians in south sudan, report finds",deport,2016-11-01
"rise in maternal deaths likely in haiti, and un expert speaks out on cholera",undocumented,2016-11-01
syrian refugees: we were tricked into returning to turkey,refugee,2016-11-01
calais camp's remaining child refugees to leave on wednesday – officials,refugee,2016-11-01
"eu deportation of migrants ‘adds to afghanistan's instability’, says un",deport,2016-11-01
"eu deportation of migrants ‘adds to afghanistan's instability’, says un",migrant,2016-11-01
"eu deportation of migrants ‘adds to afghanistan's instability’, says un",undocumented,2016-11-01
venezuela's crisis brings economic boom but social tensions to brazil border town,border,2016-11-01
man's death hints at wretched medical care in private immigration prisons,immigration,2016-11-01
man's death hints at wretched medical care in private immigration prisons,migrant,2016-11-01
is it too dangerous for aid workers to be in south sudan?,south,2016-11-01
tuesday’s best tv: arctic live; chasing asylum; me and my mental illness,asylum,2016-11-01
report: trump used 'legally dubious' tax avoidance maneuver in 1990s – as it happened,deport,2016-11-01
qpr gives fleet of coaches to bring child refugees from calais,refugee,2016-11-01
un official criticises australia's plan for lifetime ban on refugees who travel by sea,undocumented,2016-11-01
un official criticises australia's plan for lifetime ban on refugees who travel by sea,refugee,2016-11-01
cory bernardi warns one nation will rise if migration not halved,immigration,2016-11-02
cory bernardi warns one nation will rise if migration not halved,immigration,2016-11-02
cory bernardi warns one nation will rise if migration not halved,migrant,2016-11-02
breaking down barriers: how a syrian refugee turned his good luck into jobs for others,refugee,2016-11-02
australia could double annual migration by 2054 and boost economy – report,immigration,2016-11-02
australia could double annual migration by 2054 and boost economy – report,migrant,2016-11-02
australia could double annual migration by 2054 and boost economy – report,deport,2016-11-02
ofsted head praises england's schools for immigrant integration,immigration,2016-11-02
ofsted head praises england's schools for immigrant integration,migrant,2016-11-02
wole soyinka says he will tear up his green card if trump wins,green,2016-11-02
wole soyinka says he will tear up his green card if trump wins,card,2016-11-02
german comedy tackles refugee crisis – but reviews are mixed,refugee,2016-11-02
moody's warns of uk credit rating downgrade,immigration,2016-11-02
mexican activists demand soap operas about drugs be banned before midnight,mexico,2016-11-02
last of calais refugee children evacuated as camp clearance ends,refugee,2016-11-02
"building code in abcc bill would decrease apprentices and increase strikes, report says",deport,2016-11-02
peter dutton says refugee crackdown meant to stop 'sham relationship' visas,refugee,2016-11-02
peter dutton says refugee crackdown meant to stop 'sham relationship' visas,visa,2016-11-02
immigration official says department is 'freezing' release of documents about nauru,immigration,2016-11-02
immigration official says department is 'freezing' release of documents about nauru,migrant,2016-11-02
immigration official says department is 'freezing' release of documents about nauru,deport,2016-11-02
immigration official says department is 'freezing' release of documents about nauru,undocumented,2016-11-02
southampton 2-1 internazionale: europa league – as it happened,south,2016-11-03
the white knights review – a shrewd look at the refugee crisis,refugee,2016-11-03
"after her arrest, the ‘afghan girl’ is once again a symbol of refugees’ plight",refugee,2016-11-03
asma has been a refugee for 36 years; now a fashion startup has offered a lifeline,refugee,2016-11-03
alfonso cuarón film crew 'attacked and robbed' in mexico city,mexico,2016-11-03
peter dutton's 'sham relationships' claim questioned by migration experts,immigration,2016-11-03
peter dutton's 'sham relationships' claim questioned by migration experts,migrant,2016-11-03
"eu policy leading to abuse of migrants in italy, claims amnesty",migrant,2016-11-03
"paris agreement, air pollution and your carbon footprint – green news roundup",green,2016-11-04
"french police move 4,000 people out of paris migrant camp",immigration,2016-11-04
"french police move 4,000 people out of paris migrant camp",migrant,2016-11-04
"refuge by volta, manchester: ‘it’s a glamourpuss’ – restaurant review",refugee,2016-11-04
south africa fight back on day two of the perth test – as it happened,south,2016-11-04
"man secretly deported to nauru from melbourne detention centre, say lawyers",deport,2016-11-04
ama says attempts to help asylum seekers on nauru frustrated by immigration department,asylum,2016-11-04
ama says attempts to help asylum seekers on nauru frustrated by immigration department,immigration,2016-11-04
ama says attempts to help asylum seekers on nauru frustrated by immigration department,migrant,2016-11-04
ama says attempts to help asylum seekers on nauru frustrated by immigration department,deport,2016-11-04
'groove therapy': how hip-hop dance classes are helping refugees find their feet,refugee,2016-11-04
big pink: mexican architects imagine trump's wall as luis barragán homage,mexico,2016-11-05
michigan residents deplore plan to let nestlé pump water for next to nothing,deport,2016-11-05
refugees take to hiding in northern france after calais camp demolished,refugee,2016-11-05
how to safari in south africa on a budget,south,2016-11-05
saturday's best tv: china: between clouds and dreams; the x factor; atlanta,mexico,2016-11-05
victorian anti-refugee rally: counter-protesters turn up in strength,refugee,2016-11-05
trump campaign hit with restraining order over voter intimidation fears – as it happened,border,2016-11-05
the poison that has entered british political discourse is a threat to sense and reason,undocumented,2016-11-06
the young refugee girls who are being pushed into marriage and violent relationships,refugee,2016-11-06
south africa win day four honours in first test against australia – as it happened,south,2016-11-06
the dark circle by linda grant review – insurrection in the sanatorium,migrant,2016-11-06
manny pacquiao v jessie vargas: wbo welterweight championship – as it happened,visa,2016-11-06
shorten says proposed lifetime ban on asylum seekers is to appease right wing,asylum,2016-11-06
india warns uk immigration policy could wreck trade deal,immigration,2016-11-06
india warns uk immigration policy could wreck trade deal,migrant,2016-11-06
zadie smith: the smart and spiky recorder of a london state of mind,border,2016-11-06
"trump v clinton is ugly, but it’s not the dirtiest us election ever",visa,2016-11-06
david davis hits out at mps wanting to 'wreck brexit negotiation' – politics live,visa,2016-11-07
"southern hemisphere faster to recover after killer asteroid, study suggests",south,2016-11-07
uk visa policy for india could gamble away much-needed goodwill,visa,2016-11-07
glossary of graft lays bare mexico's lexicon of corruption,mexico,2016-11-07
glossary of graft lays bare mexico's lexicon of corruption,mexico,2016-11-07
president trump would make america deplorable again,deport,2016-11-07
"somali migrants are 'disaster' for minnesota, says donald trump",migrant,2016-11-07
theresa may says uk will not raise visa quota for indian nationals,visa,2016-11-07
"if you want to support refugee women on nauru, let us speak",refugee,2016-11-07
wall street closes higher and mexican peso hits two-month high ahead of election results – as it happened,mexico,2016-11-08
plan for immigration removal centre near glasgow airport rejected,immigration,2016-11-08
plan for immigration removal centre near glasgow airport rejected,migrant,2016-11-08
"global 'greening' has slowed rise of co2 in the atmosphere, study finds",green,2016-11-08
'afghan girl' rejects offer to suspend deportation from pakistan,deport,2016-11-08
syrian held on nauru lands in cambodia as sixth refugee to take up resettlement offer,refugee,2016-11-08
refugee deported to nauru had arrived in australia on cruise thinking he had valid visa,refugee,2016-11-08
refugee deported to nauru had arrived in australia on cruise thinking he had valid visa,deport,2016-11-08
refugee deported to nauru had arrived in australia on cruise thinking he had valid visa,visa,2016-11-08
labor rejects government's proposed lifetime refugee travel ban,refugee,2016-11-08
